Title,Authors,Avg Ratings,Rating,first_published,Description,Total_Pages,Genre,author_followers,no_of_reviews,no_book_by_author,one_star_ratings,two_star_ratings,three_star_ratings,four_star_ratings,five_star_ratings
Virals,Kathy Reichs,"39,104","ratings3,090","November 2, 2010","Tory Brennan, niece of acclaimed forensic anthropologist Temperance Brennan (of the Bones novels and hit TV show), is the leader of a ragtag band of teenage ""sci-philes"" who live on a secluded island off the coast of South Carolina. When the group rescues a dog caged for medical testing on a nearby island, they are exposed to an experimental strain of canine parvovirus that changes their lives forever.As the friends discover their heightened senses and animal-quick reflexes, they must combine their scientific curiosity with their newfound physical gifts to solve a cold-case murder that has suddenly become very hot--if they can stay alive long enough to catch the killer's scent.Fortunately, they are now more than friends--they're a pack. They are Virals.","454 pages, Hardcover",Young Adult,16k follower,"3,090 reviews",159,923 (2%),"2,427 (6%)","8,500 (21%)","13,288 (33%)","13,966 (35%)"
Wintergirls,Laurie Halse Anderson,"120,265","ratings10,105","March 19, 2009","Lia and Cassie are best friends, wintergirls frozen in fragile bodies, competitors in a deadly contest to see who can be the thinnest. But then Cassie suffers the ultimate loss—her life—and Lia is left behind, haunted by her friend's memory, and feeling guilty for not being able to help save her.In her most powerfully moving novel since Speak, award-winning author, Laurie Halse Anderson explores Lia's struggle, her painful path to recovery, and her desperate attempts to hold on to the most important thing of all—hope.","278 pages, Hardcover",Young Adult,16.9k follower,"10,105 reviews",84,"3,234 (2%)","7,612 (6%)","24,739 (20%)","39,586 (32%)","45,094 (37%)"
Darkness Calls,Marjorie M. Liu,"2,893",ratings132,"May 4, 2009","View our feature on Marjorie Liu’s Darkness Calls.Demon hunter Maxine Kiss, inked with living tattoos, is on a mission to rescue the man she loves from a bloodthirsty army. To save him, Maxine has only one choice: to lose control—and release her own powers of darkness.","303 pages, Paperback",Urban Fantasy,"4,074 follower",132 reviews,240,38 (1%),135 (4%),722 (24%),"1,083 (37%)",915 (31%)
1633,Eric Flint,"6,404",ratings246,"August 1, 2002","AMERICAN FREEDOM AND JUSTICE VS. SEVENTEENTH CENTURY TYRANNY The new Confederated Principalities of Europe-an alliance between Gustavus,king of Sweden, and the West Virginia town, led by Mike Stearns, which was hurled back through time to the thirty years war - has big problems. As the greatest naval war in European history erupts, Cardinal Richelieu has created an alliance to destroy the CPE, and only American technology can save Gustavus from ruin. Meanwhile Mike's wife Rebecca is trapped in war-torn Amsterdam, and his sister Rita is imprisoned in the tower of London. And much as Mike wants to reform tyrannical 17th-century Europe by Sweet Reason, he finds comfort in the fact that Julie, who trained as an Olympic marksman, still has her rifle....","673 pages, Mass Market Paperback",Alternate History,844 follower,246 reviews,291,63 (<1%),212 (3%),"1,330 (20%)","2,597 (40%)","2,202 (34%)"
Telegraph Avenue,Michael Chabon,"21,246","ratings3,259","September 11, 2012","As the summer of 2004 draws to a close, Archy Stallings and Nat Jaffe are still hanging in there - longtime friends, bandmates, and co-regents of Brokeland Records, a kingdom of used vinyl located in the borderlands of Berkeley and Oakland. Their wives, Gwen Shanks and Aviva Roth-Jaffe, are the Berkeley Birth Partners, two semi-legendary midwives who have welcomed more than a thousand newly minted citizens into the dented utopia at whose heart - half tavern, half temple - stands Brokeland. When ex–NFL quarterback Gibson Goode, the fifth-richest black man in America, announces plans to build his latest Dogpile megastore on a nearby stretch of Telegraph Avenue, Nat and Archy fear it means certain doom for their vulnerable little enterprise. Meanwhile, Aviva and Gwen also find themselves caught up in a battle for their professional existence, one that tests the limits of their friendship. Adding another layer of complication to the couples' already tangled lives is the surprise appearance of Titus Joyner, the teenage son Archy has never acknowledged and the love of fifteen-year-old Julius Jaffe's life. An intimate epic, a NorCal Middlemarch set to the funky beat of classic vinyl soul-jazz and pulsing with a virtuosic, pyrotechnical style all its own, Telegraph Avenue is the great American novel we've been waiting for. Generous, imaginative, funny, moving, thrilling, humane, triumphant, it is Michael Chabon's most dazzling book yet.","465 pages, Hardcover",Fiction,"8,316 follower","3,259 reviews",145,"1,121 (5%)","2,849 (13%)","6,978 (32%)","7,187 (33%)","3,111 (14%)"
Her Double Delight,Dixie Lynn Dwyer,566,ratings26,"November 16, 2012","Seven single, Southern women, all friends, all with troubled pasts, begin a new life in Delite, Texas, running a club and dance hall called Dixie Chix. Susanna Cooperton is in charge. Her four friends help around their club, but she’s waiting for her two cousins to arrive. They’re on the run, and trouble’s coming.Sheriff B.J. Parker and his brother Monte, an ex-military man, have their eyes set on the hottest item in town, the owner of Dixie Chix. They can’t seem to get her off their minds, and as soon as they reveal their intentions, Susanna’s fighting their every move.Worst of all, the man who hurt her is on the hunt for her.Susanna must save her cousins and protect her other friends at Dixie Chix, but she needs some help from the two men that love her.Note: There is no sexual relationship or touching for titillation between or among siblings.",ebook,Menage,687 follower,26 reviews,282,18 (3%),29 (5%),141 (24%),179 (31%),199 (35%)
The Lake House,James Patterson,"38,353","ratings1,429","June 9, 2003","The memorable story begun in When the Wind Blows continues in this thrilling novel, and it's one that really soars! Frannie O'Neil, a Colorado veterinarian, knows a terrible secret that will change the history of the world. Kit Harrison, an FBI agent under suspension has seen things that no one in his right mind would believe. A twelve-year-old girl named Max and five other incredible children have powers we can only dream of. These children can fly. And the only place they will be safe is the Lake House. Or so they believe...","384 pages, Paperback",Fiction,345k follower,"1,429 reviews","1,573","1,128 (2%)","2,938 (7%)","9,883 (25%)","12,966 (33%)","11,438 (29%)"
Rush Home Road,Lori Lansens,"10,793",ratings959,"January 1, 2002","Sharla Cody is only five, but has already lived a troubled life -- only to find herself dumped on an elderly neighbor's doorstep when her mother takes off for the summer. Although Sharla is not the angelic child Addy Shadd had pictured when she agreed to look after her, the two soon forge a deep bond. To Addy's surprise, Sharla's presence brings back memories of her own childhood in Rusholme, a town settled by fugitive slaves in the mid-1800s. She reminisces about her family, her first love, and the painful experience that drove her away from home. Brilliantly structured -- and achingly lyrical, this is a story about the redeeming power of love and memory, and about two unlikely people who transform each other's lives forever.","387 pages, Hardcover",Fiction,"1,193 follower",959 reviews,18,106 (<1%),279 (2%),"1,620 (15%)","4,629 (42%)","4,159 (38%)"
"An Illustrated Life: Drawing Inspiration from the Private Sketchbooks of Artists, Illustrators and Designers",Danny Gregory,"25,452",ratings178,"December 8, 2008","Find Insight and Inspiration for Your Creative LifeAn artist's journal is packed with sketches and captions; some rough, some polished. The margins sometimes spill over with hurriedly scrawled shopping lists and phone numbers. The cover may be travel-worn and the pages warped from watercolors. Open the book, and raw creativity seeps from each color and line. The intimacy and freedom on its pages are almost like being inside the artist's You get a direct window into risks, lessons, mistakes, and dreams.The private worlds of these visual journals are exactly what you'll find inside An Illustrated Life . This book offers a sneak peak into the wildly creative imaginations of 50 top illustrators, designers and artists. Included are sketchbook pages from R. Crumb, Chris Ware, James Jean, James Kochalka, and many others. In addition, author Danny Gregory has interviewed each artist and shares their thoughts on living the artistic life through journaling.Watch artists—through words and images—record the world they see and craft the world as they want it to be. The pages of An Illustrated Life are sometimes startling, sometimes endearing, but always inspiring. Whether you're an illustrator, designer, or simply someone searching for inspiration, these pages will open a whole new world to you.","266 pages, Paperback",Art,448 follower,178 reviews,23,"2,328 (9%)","2,419 (9%)","5,036 (19%)","6,125 (24%)","9,544 (37%)"
Side Jobs,Jim Butcher,"54,279","ratings2,392","October 26, 2010","Here, together for the first time, are the shorter tales from Jim Butcher's DRESDEN FILES series — a compendium of cases that Harry and his cadre of allies managed to close in record time. The tales range from the deadly serious to the absurdly hilarious. Also included is a new, never-before-published novella that takes place after the cliff-hanger ending of the new April 2010 hardcover, Changes.Contains:+ ""Restoration of Faith""+ ""Vignette""+ ""Something Borrowed"" -- from 
My Big Fat Supernatural Wedding
+ ""It's My Birthday Too"" -- from 
Many Bloody Returns
+ ""Heorot"" -- from 
My Big Fat Supernatural Honeymoon
+ ""Day Off"" -- from 
Blood Lite
+ ""Backup"" -- novelette from Thomas' point of view, originally published by Subterranean Press+ ""The Warrior"" -- novelette from 
Mean Streets
+ ""Last Call"" -- from 
Strange Brew
+ ""Love Hurts"" -- from 
Songs of Love and Death
+ Aftermath -- all-new novella from Murphy's point of view, set forty-five minutes after the end of 
Changes","418 pages, Hardcover",Fantasy,48.5k follower,"2,392 reviews",287,115 (<1%),679 (1%),"7,968 (14%)","21,984 (40%)","23,533 (43%)"
Catalyst,Lydia Kang,"1,035",ratings124,"March 24, 2015","In the past year Zel lost her father, the boy she loves, her safety, and any future she might have imagined for herself. Now she, her sister, and the band of genetic outcasts they've come to call their family are forced on the run when their safe house is attacked by men with neural guns. But on the way to a rumored haven in Chicago, Zel hears something--a whisper from Cy, the boy who traded himself for her sister's safety. And when she veers off plan in order to search for him, what she finds is not what she expected. There's more to their genetic mutations than they ever imagined...aspects that make them wonder if they might be accepted by the outside world after all.","400 pages, Kindle Edition",Young Adult,"2,197 follower",124 reviews,26,11 (1%),61 (5%),243 (23%),395 (38%),325 (31%)
The Examined Life,Stephen Grosz,"15,879","ratings1,468","December 20, 2012","The world bedevils us. To make sense of it, we tell ourselves stories. In a series of short, vivid, dramatic tales, using psychoanalytic insight without psychoanalytic jargon, The Examined Life tracks the collaborative journey of therapist and patient as they uncover the hidden feelings behind apparently ordinary behaviour patterns.Written with precision and insight, these case studies are all based on actual people. While factually true, they demonstrate a novelist's sense of an ending and empathetic understanding of the subterfuges of the human mind.In his work as a practising psychoanalyst, Stephen Grosz has spent the last twenty-five years uncovering the hidden feelings behind our most baffling behaviour. The Examined Life distils over 50,000 hours of conversation into pure psychological insight, without the jargon.This extraordinary book is about one ordinary process: talking, listening and understanding. Its aphoristic and elegant stories teach us a new kind of attentiveness. They also unveil a delicate self-portrait of the analyst at work, and show how lessons learned in the consulting room can reveal as much to him as to the patient.","225 pages, Hardcover",Nonfiction,181 follower,"1,468 reviews",8,209 (1%),846 (5%),"3,594 (22%)","6,251 (39%)","4,979 (31%)"
Dragonology: The Complete Book of Dragons,Ernest Drake,"9,280",ratings323,"October 1, 2003","For true believers only, a lavishly illustrated reproduction of a legendary volume by the world's most distinguished dragonologist. Don't let it fall into the wrong hands!Do you believe in dragons? Now, for the first time, the long-lost research of renowned nineteenth century dragonologist Dr. Ernest Drake is presented in all its eccentric glory, happily bridging the gap between dragon legend and fact. The meticulous Dr. Drake assigns Latin names to various dragon species, ruminates on why dragons are able to speak, speculates on how they could fly, and explains the true purpose of their notorious hoarding habits. Here are just a few of DRAGONOLOGY'S fascinating features:-- Novelty item on every spread, including tactile samples of dragon wings, dragon scales, and dragon skin -- Booklet of dragon riddles (indispensable to the burgeoning dragonologist) -- Sealed envelope containing a powerful dragon-calling spell -- Embossed faux leather cover with silver foil, encrusted with three dragon gemsIn his afterword, Dr. Drake reveals that one of the crucial goals of dragonologists is to preserve the magnificent creatures of their study wherever possible - a goal this tongue-in-cheek volume most affectionately achieves. An incomparable gift for secret dragonologists everywhere!","32 pages, Hardcover",Fantasy,30 follower,323 reviews,23,90 (<1%),377 (4%),"1,786 (19%)","2,677 (28%)","4,350 (46%)"
"Cooking in Other Women's Kitchens: Domestic Workers in the South, 1865-1960",Rebecca Sharpless,92,ratings13,"October 11, 2010","As African American women left slavery and the plantation economy behind, many entered domestic service in southern cities and towns. Cooking was one of the primary jobs they performed in white employers' homes, feeding generations of white families and, in the process, profoundly shaping southern foodways and culture. Rebecca Sharpless argues that, in the face of discrimination, long workdays, and low wages, African American cooks worked to assert measures of control over their own lives and to maintain spaces for their own families despite the demands of employers and the restrictions of segregation. Sharpless also shows how these women's employment served as a bridge from old labor arrangements to new ones. As opportunities expanded in the twentieth century, most African American women chose to leave cooking for more lucrative and less oppressive manufacturing, clerical, or professional positions. Through letters, autobiography, and oral history, this book evokes Afr","304 pages, Hardcover",History,5 follower,13 reviews,20,0 (0%),3 (3%),18 (19%),44 (47%),27 (29%)
Waterfall,Lisa Tawn Bergren,"22,028","ratings2,350","February 1, 2011","What do you do when your knight in shining armor lives, literally, in a different world?Most American teenagers want a vacation in Italy, but the Betarrini sisters have spent every summer of their lives among the romantic hills with their archaelogist parents. Stuck among the rubble of the medieval castles in rural Tuscany, on yet another hot, dusty archaeological site, Gabi and Lia are bored out of their minds...until Gabi places her hand atop a handprint in an ancient tomb and finds herself in fourteenth-century Italy. And worse yet, in the middle of a fierce battle between knights of two opposing forces.Suddenly Gabi's summer in Italy is much, much more interesting.","369 pages, Paperback",Time Travel,"3,636 follower","2,350 reviews",136,809 (3%),"1,256 (5%)","3,931 (17%)","6,668 (30%)","9,364 (42%)"
"Harry Potter And The Philosopher´s Stone (Film): Fantasy, Adventure, Harry Potter And The Philosopher´s Stone, J. K. Rowling, Chris Columbus (Filmmaker), ... Series), Harry Potter (Character), Hogwarts",Frederic P.  Miller,556,ratings38,"November 24, 2009","Please note that the content of this book primarily consists of articles available from Wikipedia or other free sources online. Harry Potter and the Philosopher's Stone (released in the United States and India as Harry Potter and the Sorcerer's Stone) is a 2001 fantasy/adventure film based on the novel of the same name by J. K. Rowling. Directed by Chris Columbus, it is the first in the popular Harry Potter films series. The story follows Harry Potter, a boy who discovers on his eleventh birthday that he is a wizard, and is sent to Hogwarts School of Witchcraft and Wizardry to begin his magical education. The film stars Daniel Radcliffe as Harry Potter, alongside Rupert Grint and Emma Watson as Harry's best friends Ron Weasley and Hermione Granger. The adult cast features Richard Harris, Maggie Smith, Robbie Coltrane, Alan Rickman and Ian Hart. Warner Bros. bought the film rights to the book in 1999. Production began in 2000, with Columbus being chosen from a short list of directors to create the film. Rowling insisted that the entire cast be British or Irish, in keeping with the cultural integrity of the book and the film. Rowling also approved the screenplay, written by Steve Kloves.","192 pages, Paperback",Fantasy,149 follower,38 reviews,"2,491",15 (2%),16 (2%),50 (8%),137 (24%),338 (60%)
Sleuteloog,Hella S. Haasse,"1,089",ratings71,"January 1, 2002","Een journalist benadert de kunsthistorica Herma Warner met de vraag of zij hem informatie kan verschaffen over Mila Wychinska. Hij is die naam tegengekomen in een dossier over mensenrechtenactivisme in Zuidoost-Azië.Het verzoek dwingt Herma zich te verdiepen in het verleden dat zij dacht voorgoed achter zich te hebben gelaten. Zij kende Mila vanaf haar jeugd als Dee Mijers, haar schoolvriendin in die tijd. Zij probeert de feiten omtrent het leven van Dee Mijers alias Mila Wychinska te reconstrueren, en wordt overspoeld door een golf van herinneringen aan haar jeugd in Nederlands-Indië en de jaren daarna. Ingeslapen en verdrongen emoties komen weer aan de oppervlakte. Zij wordt zich opnieuw bewust van de duistere kanten van haar vriendschap met Dee, haar bijna mystieke band met Non, Dees tante, haar fascinatie voor de oude Indo-Europese familie van landeigenaren waartoe Non en Dee behoorden, en bovenal van haar verhouding tot Taco Adema, met wie zij sinds hun middelbare-schooltijd in Batavia een paar heeft gevormd. Er blijft veel raadselachtig. Welke omstandigheden hebben haar huwelijksleven met Taco zo diepgaand beïnvloed en beschadigd? Wat er met Dee is gebeurd, nadat zij elkaar uit het oog hadden verloren, weet zij voor een deel uit mededelingen van Non, maar die geven niet op alles antwoord. Ook over de plotselinge verdwijning van Non tast zij in het duister.","196 pages, Paperback",Fiction,155 follower,71 reviews,110,31 (2%),130 (11%),422 (38%),390 (35%),116 (10%)
The Interestings,Meg Wolitzer,"118,069","ratings11,754","April 9, 2013","The Interestings explores the meaning of talent; the nature of envy; the roles of class, art, money, and power; and how all of it can shift and tilt precipitously over the course of a friendship and a life.The summer that Nixon resigns, six teenagers at a summer camp for the arts become inseparable. Decades later the bond remains powerful, but so much else has changed. In The Interestings, Wolitzer follows these characters from the height of youth through middle age, as their talents, fortunes, and degrees of satisfaction diverge. The kind of creativity that is rewarded at age fifteen is not always enough to propel someone through life at age thirty; not everyone can sustain, in adulthood, what seemed so special in adolescence. Jules Jacobson, an aspiring comic actress, eventually resigns herself to a more practical occupation and lifestyle. Her friend Jonah, a gifted musician, stops playing the guitar and becomes an engineer. But Ethan and Ash, Jules's now-married best friends, become shockingly successful—true to their initial artistic dreams, with the wealth and access that allow those dreams to keep expanding. The friendships endure and even prosper, but also underscore the differences in their fates, in what their talents have become and the shapes their lives have taken. Wide in scope, ambitious, and populated by complex characters who come together and apart in a changing New York City, The Interestings explores the meaning of talent; the nature of envy; the roles of class, art, money, and power; and how all of it can shift and tilt precipitously over the course of a friendship and a life.","468 pages, Hardcover",Fiction,"2,858 follower","11,754 reviews",41,"4,358 (3%)","12,149 (10%)","34,350 (29%)","43,701 (37%)","23,511 (19%)"
The Other Life,Susanne Winnacker,"3,085",ratings458,"February 1, 2012","3 years, 1 month, 1 week and 6 days since I’d seen daylight. One-fifth of my life. 98,409,602 seconds since the heavy, steel door had fallen shut and sealed us off from the world.Sherry has lived with her family in a sealed bunker since things went wrong up above. But when they run out of food, Sherry and her dad must venture outside. There they find a world of devastation, desolation...and the Weepers: savage, mutant killers.When Sherry's dad is snatched, she joins forces with gorgeous but troubled Joshua - an Avenger, determined to destroy the Weepers.But can Sherry keep her family and Joshua safe, when his desire for vengeance threatens them all?","315 pages, Paperback",Young Adult,542 follower,458 reviews,5,137 (4%),321 (10%),828 (26%),927 (30%),872 (28%)
Wrack and Ruin,Don  Lee,373,ratings83,"April 17, 2008","Lyndon Song, a renowned sculptor, has fled New York City to become a Brussels sprouts farmer in the small California town of Rosarita Bay. Lyndon has a brother, Woody, an indicted financier turned movie producer, and Woody has a plan, involving a golf-course resort on Lyndon's land and an aging kung-fu diva from Hong Kong with a mean kick and a meaner drinking problem.A dreadlocked buddy with an artificial leg, a small plot of exceptionally lush marijuana, two field biologists studying western snowy plovers, a disgraced museum curator, and Lyndon's great love, the impulsive mayor of Rosarita Bay-these are only some of the complications in Lyndon and Woody's lives over one madcap Labor Day weekend.Hilarious and philosophical, this many-hued novel about the landscape of contemporary ""multicultural"" America is critically acclaimed Don Lee's best book yet.","336 pages, Hardcover",Fiction,81 follower,83 reviews,17,6 (1%),36 (9%),145 (38%),135 (36%),51 (13%)
The Paradox of Vertical Flight,Emil Ostrovski,737,ratings189,"January 1, 2013","What happens when you put a suicidal eighteen-year-old philosophy student, his ex-girlfriend, his best friend, and his newborn baby in a truck and send them to Grandma's house? This debut novel by Emil Ostrovski will appeal to fans of John Green, Chris Crutcher, and Jay Asher.On the morning of his eighteenth birthday, philosophy student and high school senior Jack Polovsky is somewhat seriously thinking of suicide when his cell phone rings. Jack's ex-girlfriend, Jess, has given birth, and Jack is the father. Jack hasn't spoken with Jess in about nine months—and she wants him to see the baby before he is adopted. The new teenage father kidnaps the baby, names him Socrates, stocks up on baby supplies at Wal-Mart, and hits the road with his best friend, Tommy, and the ex-girlfriend. As they head to Grandma's house (eluding the police at every turn), Jack tells baby Socrates about Homer, Troy, Aristotle, the real Socrates, and the Greek myths—because all stories spring from those stories, really. Even this one. Funny, heart-wrenching, and wholly original, this debut novel by Emil Ostrovski explores the nature of family, love, friendship, fate, fatherhood, and myth.","260 pages, Hardcover",Young Adult,92 follower,189 reviews,5,27 (3%),75 (10%),194 (26%),255 (34%),186 (25%)
More Than This,Patrick Ness,"65,572","ratings8,514","September 1, 2013","A boy drowns, desperate and alone in his final moments. He dies. Then he wakes, naked and bruised and thirsty, but alive. How can this be? And what is this strange deserted place?As he struggles to understand what is happening, the boy dares to hope. Might this not be the end? Might there be more to this life, or perhaps this afterlife?From multi-award-winning Patrick Ness comes one of the most provocative and moving novels of our time.","480 pages, Paperback",Young Adult,18.3k follower,"8,514 reviews",42,"1,482 (2%)","3,882 (5%)","13,074 (19%)","25,082 (38%)","22,052 (33%)"
