Title,Authors,Avg Ratings,Rating,first_published,Description,Total_Pages,Genre,author_followers,no_of_reviews,no_book_by_author,one_star_ratings,two_star_ratings,three_star_ratings,four_star_ratings,five_star_ratings
The Girls,Lori Lansens,"21,663","ratings2,402","First published January 1, 2005","Meet Rose and Ruby: sisters, best friends, confidantes, and conjoined twins. Since their birth, Rose and Ruby Darlen have been known simply as ""the girls."" They make friends, fall in love, have jobs, love their parents, and follow their dreams. But the Darlens are special. Now nearing their 30th birthday, they are history's oldest craniopagus twins, joined at the head by a spot the size of a bread plate. When Rose, the bookish sister, sets out to write her autobiography, it inevitably becomes the story of her short but extraordinary life with Ruby, the beautiful one. From their awkward first steps--Ruby's arm curled around Rose's neck, her foreshortened legs wrapped around Rose's hips-- to the friendships they gradually build for themselves in the small town of Leaford, this is the profoundly affecting chronicle of an incomparable life journey.As Rose and Ruby's story builds to an unforgettable conclusion, Lansens aims at the heart of human experience--the hardship of loss and struggles for independence, and the fundamental joy of simply living a life. This is a breath taking novel, one that no reader will soon forget, a heartrending story of love between sisters.","346 pages, Paperback",Fiction,"1,193 followers","2,402 reviews","18 books1,193 followers",443 (2%),"1,391 (6%)","5,568 (25%)","8,971 (41%)","5,290 (24%)"
Effectuators: Horrors of the Night,Paul Kidd,14,ratings1,"First published November 21, 2011","Effectuators!Being in the main the adventures of Brilliana Stetham, “Paranormal Investigator, and Resolver of all Problems Supernatural” – her trials and adventures.Rip roaring Victoriana paranormal adventures, in the Year of Our Lord 1869!""Brilliana was the sort of woman who could certainly cut cards with the Devil. After cucumber sandwiches, of course!""No matter how haunted your house – no matter how grey the grey lady, or black the dread black hound, your dangers can be eliminated, your fears assuaged. For there is an ‘expert’ who lends her psychic powers and mystic skills to those in need.- For a price!Brilliana Stetham is a delicious charlatan. She dresses the part of the elegant mystic, and woman of dark, dire learning. She accepts commissions to ‘sense presences’ in houses of the wealthy, whereupon she researches, presents her findings about the local ghosts, and performs appropriate ceremonies to placate the ghosts and ensure the safety of the residents of the house. It is all done with great thoroughness, in deadly seriousness…… and it is all a magnificent scam.She is managing it all perfectly well – until one day, a haunting she is investigating turns out to be real.Contractually obligated to rid her client's building of monsters, Brillana is trapped into battling powers she cannot fully understand. An entirely new science must be developed to battle the unknown. With science in her heart and a top hat set squarely on her head, Brill storms forward to become a ghost hunter - a monster fighter.- She becomes an ""effectuator""...Excelsior!For Brill, it is the start of a radical new life: As a real solver of things supernatural. As a battler of monsters and remover of curses. She becomes a “Paranormal Effectuator”.","457 pages, Kindle Edition",history,55 followers,1 review,73 books55 followers,0 (0%),2 (14%),0 (0%),4 (28%),8 (57%)
Pure,Andrew  Miller,"10,016","ratings1,218","First published January 1, 2011","Deep in the heart of Paris, its oldest cemetery is, by 1785, overflowing, tainting the very breath of those who live nearby. Into their midst comes Jean-Baptiste Baratte, a young, provincial engineer charged by the king with demolishing it.At first Baratte sees this as a chance to clear the burden of history, a fitting task for a modern man of reason. But before long, he begins to suspect that the destruction of the cemetery might be a prelude to his own.","346 pages, Hardcover",Historical Fiction,329 followers,"1,218 reviews",15 books329 followers,248 (2%),932 (9%),"3,175 (31%)","3,950 (39%)","1,711 (17%)"
La Vérité sur l'Affaire Harry Quebert,Joël Dicker,"167,246","ratings16,542","First published September 19, 2012","À New York, au printemps 2008, alors que l’Amérique bruisse des prémices de l’élection présidentielle, Marcus Goldman, jeune écrivain à succès, est dans la tourmente : il est incapable d’écrire le nouveau roman qu’il doit remettre à son éditeur d’ici quelques mois. Le délai est près d’expirer quand soudain tout bascule pour lui : son ami et ancien professeur d’université, Harry Quebert, l’un des écrivains les plus respectés du pays, est rattrapé par son passé et se retrouve accusé d’avoir assassiné, en 1975, Nola Kellergan, une jeune fille de 15 ans, avec qui il aurait eu une liaison. Convaincu de l’innocence de Harry, Marcus abandonne tout pour se rendre dans le New Hampshire et mener son enquête. Il est rapidement dépassé par les événements : l’enquête s’enfonce et il fait l’objet de menaces. Pour innocenter Harry et sauver sa carrière d’écrivain, il doit absolument répondre à trois questions : Qui a tué Nola Kellergan? Que s’est-il passé dans le New Hampshire à l’été 1975? Et comment écrit-on un roman à succès?","670 pages, Paperback",Thriller,"7,757 followers","16,542 reviews","18 books7,757 followers","4,181 (2%)","7,644 (4%)","22,112 (13%)","53,545 (32%)","79,764 (47%)"
Marte Jacobs,Tim Krabbé,610,ratings30,"First published October 1, 2007","'Er was een moment waarop ze allebei alleen aan de kant zaten en elkaars blik opvingen. Ze knikten en lachten even. Maar Emile ging niet naar haar toe. Haar rol in het toneelstuk was te klein geweest om haar ermee te kunnen complimenteren, en hij kon ook niet met haar gaan dansen. Een zesdeklasser met een eersteklasser - zoiets bestond niet. De hele school zou gonzen van de vraag wat dat te betekenen had.''Met vaardig, onsentimenteel proza schrijft Krabbé een verhaal van ingehouden elegantie.' - The New York Times Book Review","166 pages, Hardcover",School,103 followers,30 reviews,39 books103 followers,9 (1%),62 (10%),207 (33%),238 (39%),94 (15%)
Raze,Tillie Cole,"25,693","ratings2,801","First published December 29, 2014","To take back life, one must first face death...One man stripped of his freedom, his morals...his life.Conditioned in captivity to maim, to kill and to slaughter, prisoner 818 becomes an unremorseful, unrivaled and unstoppable fighter in the ring. Violence is all he knows. Death and brutality are the masters of his fate.After years of incarceration in an underground hell, only one thought occupies his mind: revenge...bloody, slow and violent revenge.Revenge on the man who lied.Revenge on the man who wronged him.Revenge on the man who condemned him and turned him into this: a rage-fueled killing machine. A monster void of humanity; a monster filled with hate.And no one will stand in the way of getting what he wants.One woman stripped of her freedom, her morals...her life.Kisa Volkova is the only daughter of Kirill ‘The Silencer’ Volkov, head of the infamous ‘Triad’ bosses of New York's Russian Bratva. Her life is protected. In reality, it’s a virtual prison. Her father’s savage treatment of his rivals and his lucrative and coveted underground gambling ring—The Dungeon—ensures too many enemies lurk at their door. She dreams to be set free.Kisa has known only cruelty and loss in her short life. As manager of her father’s death match enterprise, only grief and pain fill her days. Her mafia boss father, in her world, rules absolute. And her fiancé, Alik Durov, is no better; the Dungeon’s five-time champion, a stone-cold killer, the treasured son of her father’s best friend, and her very own—and much resented—personal guard. Unrivaled in both strength and social standing, Alik controls every facet of Kisa’s life, dominates her every move; keeps her subdued and dead inside...then one night changes everything. While working for her church—the only reprieve in her constant surveillance—Kisa stumbles across a tattooed, scarred, but stunningly beautiful homeless man on the streets. Something about him stirs feelings deep within her; familiar yet impossibly forbidden desires. He doesn’t talk. Doesn’t communicate with anyone. He’s a man beyond saving, and a man she must quickly forget...for both their sakes. But when weeks later, out of the blue and to her complete surprise, he’s announced as the replacement fighter in The Dungeon, Kisa knows she’s in a whole lot of trouble. He’s built, ripped and lethally unforgiving to his opponents, leaving fear in his wake and the look of death in his eyes. Kisa becomes obsessed with him. Yearns for him. Craves his touch. Needs to possess this mysterious man...this man they call Raze.Dark Contemporary Romance. Contains explicit sexual situations, excessive violence, disturbingly sensitive and taboo subjects, offensive language and mature topics. Recommended for age 18 years and up.","256 pages, ebook",Dark,22.4k followers,"2,801 reviews",45 books22.4k followers,633 (2%),"1,396 (5%)","4,140 (16%)","7,969 (31%)","11,555 (44%)"
Sandstorm,James Rollins,"50,919","ratings2,381","First published June 29, 2004","An inexplicable explosion rocks the antiquities collection of a London museum, setting off alarms in clandestine organizations around the world. And now the search for answers is leading Lady Kara Kensington; her friend Safia al-Maaz, the gallery's brilliant and beautiful curator; and their guide, the international adventurer Omaha Dunn, into a world they never dreamed existed: a lost city buried beneath the Arabian desert. But others are being drawn there as well, some with dark and sinister purposes. And the many perils of a death-defying trek deep into the savage heart of the Arabian Peninsula pale before the nightmare waiting to be unearthed at journey's end: an ageless and awesome power that could create a utopia... or destroy everything humankind has built over countless millennia.","608 pages, Mass Market Paperback",Thriller,13.2k followers,"2,381 reviews",175 books13.2k followers,836 (1%),"2,500 (4%)","11,374 (22%)","19,431 (38%)","16,778 (32%)"
SIMPLE TRIPLE STANDARD,Ray Palla,1,rating1,"First published August 1, 2015","The Real Official, Almost True Backstory for Modern Commercial Radio SIMPLE TRIPLE STANDARD is Historical Fiction gnawing the gut of local radio news reporter Bryant L Herman in a close-knit community rife with extrapolated double standards that garner deadly impact. If you’ve ever lived in a small town, you know about double standards... How much more complicated can a triple standard be, right? World famous Austin music celebrities, and behind the scenes radio personalities embody Bryant's descriptive of this genuine 1970s Texas style nostalgic romp which also includes love, passion, and an unexpected lethal twist. Notable Reviews:""Writer to watch in 2015"" —Marsha Wright, BBC""Personalities rise up from the page"" —Derrill Holly, Texas Radio Hall of Fame Inductee and Washington, D.C. JournalistRay Palla's SIMPLE TRIPLE STANDARD is about radio, Texas, the music scene, and a city called Austin that's as famous for bringing out the craziness of all three as it is for being a stomping ground for colorful politicians. SIMPLE TRIPLE STANDARD is more than just another ""See what happened was"" story about rednecks, long necks and college interns. It's a tale spun from the heart that brings it all together and makes the personalities rise up from the page.""A brimming time capsule of '70s Austin, TX nostalgia"" —Jay Levine (Former KOKE-FM DJ - ""Country Jay""), Emmy Winning Hollywood Sound EditorAustin is a liberal jewel in a conservative state, and great place to live, then and now. Ray has captured the essence, sounds, and personalities of radio wars, music, & people of the '70s that put Austin on the path to become a world-class hub of culture. I was lucky enough to be a deejay on KOKE-FM, 'Super Roper Radio,' from 1973-76. Palla tells it like it was when Austin's unique culture first began to bloom.""A fascinating, humble player on a huge stage"" —Wes Chick, PlaywrightFollowing Bryant L Herman through the world of radio so many years ago grabbed my attention and was truly fascinating. I highly recommend SIMPLE TRIPLE STANDARD.","264 pages, Paperback",author,9 followers,1 review,3 books9 followers,0 (0%),0 (0%),0 (0%),0 (0%),1 (100%)
Take the Body And Give Me The Rest,Julius Schenk,342,ratings14,"First published May 31, 2015","Seth stood and watched the nightmare creature as it tore its past master into bloody shreds and tried not to let the gripping fear show on his face. He could feels the man's life force, his memories, his talents and hard won skills filling his own mind and body and turning him into something much more than the lowly soldier he'd been just mere moments before.","246 pages, Kindle Edition",Fantasy,38 followers,14 reviews,25 books38 followers,17 (4%),27 (7%),91 (26%),120 (35%),87 (25%)
The Habitation of the Blessed,Catherynne M. Valente,"1,042",ratings171,"First published March 1, 2010","This is the story of a place that never was: the kingdom of Prester John, the utopia described by an anonymous, twelfth-century document which captured the imagination of the medieval world and drove hundreds of lost souls to seek out its secrets, inspiring explorers, missionaries, and kings for centuries. But what if it were all true? What if there was such a place, and a poor, broken priest once stumbled past its borders, discovering, not a Christian paradise, but a country where everything is possible, immortality is easily had, and the Western world is nothing but a dim and distant dream?Brother Hiob of Luzerne, on missionary work in the Himalayan wilderness on the eve of the eighteenth century, discovers a village guarding a miraculous tree whose branches sprout books instead of fruit. These strange books chronicle the history of the kingdom of Prester John, and Hiob becomes obsessed with the tales they tell. The Habitation of the Blessed recounts the fragmented narratives found within these living volumes, revealing the life of a priest named John, and his rise to power in this country of impossible richness. John's tale weaves together with the confessions of his wife Hagia, a blemmye--a headless creature who carried her face on her chest--as well as the tender, jeweled nursery stories of Imtithal, nanny to the royal family.","269 pages, Paperback",Fantasy,"7,456 followers",171 reviews,"246 books7,456 followers",55 (5%),75 (7%),168 (16%),345 (33%),399 (38%)
Jack Glass,Adam Roberts,"2,483",ratings349,"First published July 26, 2012","Golden Age SF meets Golden Age Crime in this British Science Fiction Award winner for best novel, from the author of Swiftly, New Model Army, and Yellow Blue TibiaJack Glass is the murderer—we know this from the start. Yet as this extraordinary novel unfolds, readers will be astonished to discover how he committed the murders and by the end of the book, their sympathies for the killer will be fully engaged. Riffing on the tropes of crime fiction (the country house murder, the locked room mystery) and imbued with the feel of golden age SF, this is another bravura performance from Roberts. Whatever games he plays with the genre, whatever questions he asks of the reader, Roberts never loses sight of the need to entertain. Filled with wonderfully gruesome moments and liberal doses of sly humor, this novel is built around three gripping HowDunnits that challenge notions of crime, punishment, power, and freedom.","373 pages, Hardcover",Science Fiction,481 followers,349 reviews,217 books481 followers,56 (2%),199 (8%),687 (27%),"1,026 (41%)",515 (20%)
Bane of the Innocent,Oliver Phipps,135,ratings48,"First published June 9, 2014","""There's no reason for them to shoot us; we ain't anyone"" - Sammy, Bane of the Innocent.  Two young boys become unlikely companions during the fall of Atlanta. Sammy and Ben somehow find themselves, and each other, in the rapidly changing and chaotic environment of the war torn Georgia City.  As the siege ends and the fall begins in late August and early September of 1864, the Confederate troops begin to move out and Union forces cautiously move into the city. Ben and Sammy simply struggle to survive, but in the process they develop a friendship that will prove more important than either one could imagine.","67 pages, Kindle Edition",Historical Fiction,"1,376 followers",48 reviews,"18 books1,376 followers",1 (<1%),5 (3%),10 (7%),19 (14%),100 (74%)
The Good Shepherd,Hugh  Greene,46,ratings23,"First published February 21, 2015","The Good Shepherd is a tense psychological thriller. This is the third novel in the Dr Power and Superintendent Lynch series. Dr Power, a consultant psychiatrist is asked to report to the Coroner on the life and death of Dr McAdams, whose body has been founded drifting in the Sea. Power comes under pressure to label the death as suicide, but suspects that the dead scientist was trying to protect the most important secret. As Power tries to uncover the secret he realises his own life and the lives of many people across the world are in the greatest danger.","238 pages, Paperback",Fiction,91 followers,23 reviews,8 books91 followers,0 (0%),2 (4%),10 (21%),13 (28%),21 (45%)
The Universe Versus Alex Woods,Gavin Extence,"23,399","ratings2,643","First published May 21, 2013","A rare meteorite struck Alex Woods when he was ten years old, leaving scars and marking him for an extraordinary future. The son of a fortune teller, bookish, and an easy target for bullies, Alex hasn't had the easiest childhood.But when he meets curmudgeonly widower Mr. Peterson, he finds an unlikely friend. Someone who teaches him that you only get one shot at life. That you have to make it count.So when, aged seventeen, Alex is stopped at customs with 113 grams of marijuana, an urn full of ashes on the front seat, and an entire nation in uproar, he's fairly sure he's done the right thing ...Introducing a bright young voice destined to charm the world, The Universe Versus Alex Woods is a celebration of curious incidents, astronomy and astrology, the works of Kurt Vonnegut and the unexpected connections that form our world.","407 pages, Hardcover",Fiction,399 followers,"2,643 reviews",7 books399 followers,244 (1%),796 (3%),"4,000 (17%)","9,752 (41%)","8,607 (36%)"
Generic Vampire Novel 937 Part One - American Sexy,C.Z. Hazard,22,ratings11,"First published October 31, 2014","When cult science fiction novelist Shamus Ohio wrote his latest book, Horrorcaust, he expected it to appease his publishers and earn him a small paycheck. Instead, it re-defined the public perception of the ""vampyre"" for an entire generation. With mainstream success, Shamus comes face to face with the real blood-sucking parasite: the media. Everyone wants a piece of Shamus, as the mass hysteria surrounding his novel and the fight for control of his intellectual property threaten to tear his mind and conscience apart. When fact starts mirroring fiction with deadly results, can the writer be held responsible? Can anyone achieve mainstream popularity without selling their soul? Can any piece of fiction make the leap from one medium to another with its core intact? What exactly is Parma ham, and why do people insist on serving it with rocket? All of these questions and more will be asked, if not answered. The first of a two-part satirical vampire novel, for people who may already dislike vampire fiction, new-media, the film industry, hyperbole, social media, the 24-hour news culture and other day-to-day trappings of post-millennial life. Edited by Nico Reznick, with a cover by Jay Heath.","210 pages, Kindle Edition",read-in-2016,13 followers,11 reviews,6 books13 followers,0 (0%),1 (4%),1 (4%),6 (27%),14 (63%)
The Trip to Echo Spring,Olivia Laing,"3,316",ratings507,"First published August 1, 2013","Why is it that some of the greatest works of literature have been produced by writers in the grip of alcoholism, an addiction that cost them personal happiness and caused harm to those who loved them? In The Trip to Echo Spring, Olivia Laing examines the link between creativity and alcohol through the work and lives of six extraordinary men: F. Scott Fitzgerald, Ernest Hemingway, Tennessee Williams, John Berryman, John Cheever, and Raymond Carver. All six of these writers were alcoholics, and the subject of drinking surfaces in some of their finest work, from Cat on a Hot Tin Roof to A Moveable Feast. Often they did their drinking together—Hemingway and Fitzgerald ricocheting through the cafés of 1920s Paris; Carver and Cheever speeding to the liquor store in Iowa in the icy winter of 1973.Olivia Laing grew up in an alcoholic family herself. One spring, wanting to make sense of this ferocious, entangling disease, she took a journey across America that plunged her into the heart of these overlapping lives. As she travels from Cheever's New York to Williams' New Orleans, from Hemingway's Key West to Carver's Port Angeles, she pieces together a topographical map of alcoholism, from the horrors of addiction to the miraculous possibilities of recovery. Beautiful, captivating and original, The Trip to Echo Spring strips away the myth of the alcoholic writer to reveal the terrible price creativity can exert.","340 pages, Hardcover",Nonfiction,"2,319 followers",507 reviews,"22 books2,319 followers",70 (2%),255 (7%),906 (27%),"1,333 (40%)",752 (22%)
Andrew Carnegie,David Nasaw,"5,388",ratings305,"First published October 24, 2006","A National Book Critics Circle Award-nominated biographer chronicles the life of the iconic business titan from his modest upbringing in mid-1800s Scotland through his rise to one of the world's richest men, offering insight into his work as a peace advocate and his motivations for giving away most of his fortune. 120,000 first printing.","896 pages, Hardcover",Biography,123 followers,305 reviews,15 books123 followers,242 (4%),373 (6%),"1,109 (20%)","1,940 (36%)","1,724 (31%)"
Seveneves,Neal Stephenson,"114,898","ratings11,948","First published May 19, 2015","What would happen if the world were ending?A catastrophic event renders the earth a ticking time bomb. In a feverish race against the inevitable, nations around the globe band together to devise an ambitious plan to ensure the survival of humanity far beyond our atmosphere, in outer space.But the complexities and unpredictability of human nature coupled with unforeseen challenges and dangers threaten the intrepid pioneers, until only a handful of survivors remain . . .Five thousand years later, their progeny—seven distinct races now three billion strong—embark on yet another audacious journey into the unknown . . . to an alien world utterly transformed by cataclysm and time: Earth.A writer of dazzling genius and imaginative vision, Neal Stephenson combines science, philosophy, technology, psychology, and literature in a magnificent work of speculative fiction that offers a portrait of a future that is both extraordinary and eerily recognizable. As he did in Anathem, Cryptonomicon, the Baroque Cycle, and Reamde, Stephenson explores some of our biggest ideas and perplexing challenges in a breathtaking saga that is daring, engrossing, and altogether brilliant.","872 pages, Kindle Edition",Science Fiction,26.2k followers,"11,948 reviews",149 books26.2k followers,"2,293 (1%)","6,469 (5%)","21,220 (18%)","43,882 (38%)","41,034 (35%)"
Homer & Langley,E.L. Doctorow,"11,008","ratings1,899","First published September 1, 2009","From Ragtime and Billy Bathgate to The Book of Daniel, World’s Fair, and The March, the novels of E. L. Doctorow comprise one of the most substantive achievements of modern American fiction. Now, with Homer & Langley, this master novelist has once again created an unforgettable work.Homer and Langley Collyer are brothers – the one blind and deeply intuitive, the other damaged into madness, or perhaps greatness, by mustard gas in the Great War. They live as recluses in their once grand Fifth Avenue mansion, scavenging the city streets for things they think they can use, hoarding the daily newspapers as research for Langley’s proposed dateless newspaper whose reportage will be as prophecy. Yet the epic events of the century play out in the lives of the two brothers – wars, political movements, technological advances – and even though they want nothing more than to shut out the world, history seems to pass through their cluttered house in the persons of immigrants, prostitutes, society women, government agents, gangsters, jazz musicians... and their housebound lives are fraught with odyssean peril as they struggle to survive and create meaning for themselves. Brilliantly conceived, gorgeously written, this mesmerizing narrative, a free imaginative rendering of the lives of New York’s fabled Collyer brothers, is a family story with the resonance of myth, an astonishing masterwork unlike any that have come before from this great writer.","208 pages, Hardcover",Fiction,"1,058 followers","1,899 reviews","96 books1,058 followers",217 (1%),966 (8%),"3,458 (31%)","4,377 (39%)","1,990 (18%)"
