Title,Authors,Avg Ratings,Rating,first_published,Description,Total_Pages,Genre,author_followers,no_of_reviews,no_book_by_author,one_star_ratings,two_star_ratings,three_star_ratings,four_star_ratings,five_star_ratings
The Art of Fart: The Joy of Flatulence!,Dougie Brimson,12,ratings2,"88 pages, Kindle Edition","It is the most natural of bodily functions. In some countries it is considered a social faux pas whilst in others it is regarded as a sign of gratitude. For most men, the very act brings a sense of self-worth whilst as a comedy tool it is virtually unrivalled. Yet the majority of women regard it with disgust and despise the fact that we men laugh at it (even though they do it just as much as we do). It is, of course, farting. In The Art of Fart, bestselling author and the nation’s most eminent Fartologist, Dougie Brimson, explores the issue of flatulence in its varied and pungent detail. From the simple basic science of why we do it at all right through to the issue of ‘stealth farting’ and all points in between, no gruff related subject remains unexplored in what is quite possibly the most politically incorrect book ever!","88 pages, Kindle Edition",wrote,78 follower,2 reviews,26,1 (8%),0 (0%),0 (0%),3 (25%),8 (66%)
Los enamoramientos,Javier Marías,"12,070","ratings1,570","January 1, 2011","«La última vez que vi a Miguel Desvern o Deverne fue también la última que lo vio su mujer, Luisa, lo cual no dejó de ser extraño y quizá injusto, ya que ella era eso, su mujer, y yo era en cambio una desconocida...»Así comienza Los enamoramientos, la nueva novela de Javier Marías, consagrado como uno de los mejores novelistas contemporáneos. María Dolz, la narradora y protagonista, sólo supo su nombre «cuando apareció su foto en el periódico, apuñalado y medio descamisado y a punto de convertirse en un muerto: lo último de lo que se debió de dar cuenta fue de que lo acuchillaban por confusión y sin causa».Con una prosa profunda y cautivadora, esta novela reflexiona sobre el estado de enamoramiento, considerado casi universalmente como algo positivo e incluso redentor a veces, tanto que parece justificar casi todas las cosas: las acciones nobles y desinteresadas, pero también los mayores desmanes y ruindades.Los enamoramientos es también un libro sobre la impunidad y sobre la horrible fuerza de los hechos; sobre la inconveniencia de que los muertos pudieran volver, por mucho que se los haya llorado y que en apariencia nada se deseara tanto como su regreso, o al menos que siguieran vivos; también sobre la imposibilidad de saber nunca la verdad cabalmente, ni siquiera la de nuestro pensamiento, oscilante y variable siempre.","401 pages, Paperback",Fiction,"2,177 follower","1,570 reviews",128,502 (4%),"1,416 (11%)","3,506 (29%)","4,258 (35%)","2,388 (19%)"
The Dragon Head of Hong Kong,Ian  Hamilton,744,ratings73,"December 1, 2013","The prequel to the wildly popular Ava Lee series.Young Ava Lee is a forensic accounting who has just opened her own private firm. One of her clients, Hedrick Lo, has been swindled of more than a million dollars by a Chinese importer named Johnny Kung. Desperate, Lo persuades Ava to find and retrieve the monies owed. Ava goes to Hong Kong, where she plunges into the dangerous underground collection business and meets a man who will forever change her life...","166 pages, ebook",Mystery,340 follower,73 reviews,27,3 (<1%),25 (3%),170 (22%),333 (44%),213 (28%)
How I Killed Pluto and Why It Had It Coming,Mike Brown,"9,245","ratings1,311","December 7, 2010","The solar system most of us grew up with included nine planets, with Mercury closest to the sun and Pluto at the outer edge. Then, in 2005, astronomer Mike Brown made the discovery of a a tenth planet, Eris, slightly bigger than Pluto. But instead of its resulting in one more planet being added to our solar system, Brown’s find ignited a firestorm of controversy that riled the usually sedate world of astronomy and launched him into the public eye. The debate culminated in the demotion of Pluto from real planet to the newly coined category of “dwarf” planet. Suddenly Brown was receiving hate mail from schoolchildren and being bombarded by TV reporters—all because of the discovery he had spent years searching for and a lifetime dreaming about.Filled with both humor and drama, How I Killed Pluto and Why It Had It Coming is Mike Brown’s engaging first-person account of the most tumultuous year in modern astronomy—which he inadvertently caused. As it guides readers through important scientific concepts and inspires us to think more deeply about our place in the cosmos, it is also an entertaining and enlightening personal While Brown sought to expand our understanding of the vast nature of space, his own life was changed in the most immediate, human ways by love, birth, and death. A heartfelt and personal perspective on the demotion of everyone’s favorite farflung planet, How I Killed Pluto and Why It Had It Coming is the book for anyone, young or old, who has ever dreamed of exploring the universe—and who among us hasn’t?","267 pages, Hardcover",Science,60 follower,"1,311 reviews",240,175 (1%),386 (4%),"1,651 (17%)","3,711 (40%)","3,322 (35%)"
Medicine Walk,Richard Wagamese,"11,178","ratings1,470","March 4, 2014","Franklin Starlight is called to visit his father, Eldon. He's sixteen years old and has had the most fleeting of relationships with the man. The rare moments they've shared haunt and trouble Frank, but he answers the call, a son's duty to a father. He finds Eldon decimated after years of drinking, dying of liver failure in a small town flophouse. Eldon asks his son to take him into the mountains, so he may be buried in the traditional Ojibway manner.     What ensues is a journey through the rugged and beautiful backcountry, and a journey into the past, as the two men push forward to Eldon's end. From a poverty-stricken childhood, to the Korean War, and later the derelict houses of mill towns, Eldon relates both the desolate moments of his life and a time of redemption and love and in doing so offers Frank a history he has never known, the father he has never had, and a connection to himself he never expected.    A novel about love, friendship, courage, and the idea that the land has within it powers of healing, Medicine Walk reveals the ultimate goodness of its characters and offers a deeply moving and redemptive conclusion. Wagamese's writing soars and his insight and compassion are matched by his gift of communicating these to the reader.","245 pages, Hardcover",Fiction,"1,364 follower","1,470 reviews",21,53 (<1%),193 (1%),"1,325 (11%)","4,320 (38%)","5,287 (47%)"
The Furthest Station,Ben Aaronovitch,"18,681","ratings1,462","June 30, 2017","There have been ghosts on the London Underground, sad, harmless spectres whose presence does little more than give a frisson to travelling and boost tourism. But now there's a rash of sightings on the Metropolitan Line and these ghosts are frightening, aggressive and seem to be looking for something.Enter PC Peter Grant junior member of the Metropolitan Police's Special Assessment unit AKA The Folly AKA the only police officers whose official duties include ghost hunting. Together with Jaget Kumar, his counterpart at the British Transport Police, he must brave the terrifying the crush of London's rush hour to find the source of the ghosts.Joined by Peter's wannabe wizard cousin, a preschool river god and Toby the ghost hunting dog their investigation takes a darker tone as they realise that a real person's life might just be on the line.And time is running out to save them.With this new novella, bestselling author Ben Aaronovitch has crafted yet another wickedly funny and surprisingly affecting chapter in his beloved Rivers of London series.","144 pages, Hardcover",Fantasy,12.2k follower,"1,462 reviews",156,71 (<1%),387 (2%),"3,387 (18%)","8,596 (46%)","6,240 (33%)"
The Hypnotist's Love Story,Liane Moriarty,"144,915","ratings9,595","January 1, 2011","Ellen O'Farrell is a professional hypnotherapist who works out of the eccentric beachfront home she inherited from her grandparents. It's a nice life, except for her tumultuous relationship history. She's stoic about it, but at this point, Ellen wouldn't mind something long-term. When she meets Patrick, she's optimistic. He's attractive, single, employed, and best of all, he seems to like her back. Then comes that dreaded moment: ""He thinks they should have a talk.""Braced for the worst, Ellen is pleasantly surprised. It turns out that Patrick's ex-girlfriend is stalking him. Ellen thinks, ""Actually, that's kind of interesting."" She's dating someone worth stalking. She's intrigued by the woman's motives. In fact, she'd even love to meet her.Ellen doesn't know it, but she already has.","446 pages, Paperback",Fiction,64.6k follower,"9,595 reviews",36,"1,605 (1%)","9,301 (6%)","46,828 (32%)","59,585 (41%)","27,596 (19%)"
The Maleficent Seven,Derek Landy,"7,177",ratings353,"March 28, 2013","From the World of Skulduggery PleasantA brilliant, hilarious one-off novella in the Skulduggery Pleasant universe, from number-one-bestselling author Derek LandyThis time, the bad guys take the stage.Tanith Low, now possessed by a remnant, recruits a gang of villains – many of whom will be familiar from previous Skulduggery adventures – in order to track down and steal the four God-Killer level weapons that could hurt Darquesse when she eventually emerges. Also on the trail of the weapons is a secret group of Sanctuary sorcerers, and doing his best to keep up and keep Tanith alive is one Mister Ghastly Bespoke.When the villains around her are lying and scheming and plotting, Tanith needs to stay two steps ahead of her teammates and her enemies. After all, she's got her own double-crosses to plan – and she’s a villain herself…","288 pages, ebook",Fantasy,"4,976 follower",353 reviews,182,21 (<1%),125 (1%),982 (13%),"2,393 (33%)","3,656 (50%)"
Richard Nixon: The Life,John A. Farrell,"2,814",ratings404,"March 28, 2017","PULITZER PRIZE FINALIST • From a prize-winning biographer comes the defining portrait of a man who led America in a time of turmoil and left us a darker age. We live today, John A. Farrell shows, in a world Richard Nixon made.   At the end of WWII, navy lieutenant “Nick” Nixon returned from the Pacific and set his cap at Congress, an idealistic dreamer seeking to build a better world. Yet amid the turns of that now-legendary 1946 campaign, Nixon’s finer attributes gave way to unapologetic ruthlessness. The story of that transformation is the stunning overture to John A. Farrell’s magisterial biography of the president who came to embody postwar American resentment and division.     Within four years of his first victory, Nixon was a U.S. senator; in six, the vice president of the United States of America. “Few came so far, so fast, and so alone,” Farrell writes. Nixon’s sins as a candidate were legion; and in one unlawful secret plot, as Farrell reveals here, Nixon acted to prolong the Vietnam War for his own political purposes. Finally elected president in 1969, Nixon packed his staff with bright young men who devised forward-thinking reforms addressing health care, welfare, civil rights, and protection of the environment. It was a fine legacy, but Nixon cared little for it. He aspired to make his mark on the world stage instead, and his 1972 opening to China was the first great crack in the Cold War.     Nixon had another legacy, an America divided and polarized. He was elected to end the war in Vietnam, but his bombing of Cambodia and Laos enraged the antiwar movement. It was Nixon who launched the McCarthy era, who played white against black with a “southern strategy,” and spurred the Silent Majority to despise and distrust the country’s elites. Ever insecure and increasingly paranoid, he persuaded Americans to gnaw, as he did, on grievances—and to look at one another as enemies. Finally, in August 1974, after two years of the mesmerizing intrigue and scandal of Watergate, Nixon became the only president to resign in disgrace.    Richard Nixon is a gripping and unsparing portrayal of our darkest president. Meticulously researched, brilliantly crafted, and offering fresh revelations, it will be hailed as a master work.","703 pages, Kindle Edition",Biography,149 follower,404 reviews,6,13 (<1%),31 (1%),255 (9%),"1,108 (39%)","1,407 (50%)"
Who Owns the Future?,Jaron Lanier,"3,557",ratings369,"March 7, 2013","The “brilliant” and “daringly original” (The New York Times) critique of digital networks from the “David Foster Wallace of tech” (London Evening Standard)—asserting that to fix our economy, we must fix our information economy.Jaron Lanier is the father of virtual reality and one of the world’s most brilliant thinkers. Who Owns the Future? is his visionary reckoning with the most urgent economic and social trend of our age: the poisonous concentration of money and power in our digital networks.Lanier has predicted how technology will transform our humanity for decades, and his insight has never been more urgently needed. He shows how Siren Servers, which exploit big data and the free sharing of information, led our economy into recession, imperiled personal privacy, and hollowed out the middle class. The networks that define our world—including social media, financial institutions, and intelligence agencies—now threaten to destroy it.But there is an alternative. In this provocative, poetic, and deeply humane book, Lanier charts a path toward a brighter future: an information economy that rewards ordinary people for what they do and share on the web.","367 pages, Hardcover",Nonfiction,"1,336 follower",369 reviews,16,97 (2%),254 (7%),921 (25%),"1,361 (38%)",924 (25%)
Sita: An Illustrated Retelling of the Ramayana,Devdutt Pattanaik,"7,696",ratings575,"October 1, 2013","SITA : AN ILLUSTRATED RETELLING OF THE RAMAYANAIt is significant that the only character in Hindu mythology, a king at that, to be given the title of ekam-patni-vrata, devoted to a single wife, is associated with the most unjust act of abandoning her in the forest to protect family reputation. This seems a deliberate souring of an uplifting narrative. Rams refusal to remarry to produce a royal heir adds to the complexity. The intention seems to be to provoke thought on notions of fidelity, property and self-image.And so the mythologist and illustrator Devdutt Pattanaik retells the Ramayana, drawing attention to the many oral, visual and written retellings composed in different times, in different places, by different poets, each one trying to solve the puzzle in its own unique way. This book approaches Ram by speculating on Sita: her childhood with her father, Janaka, who hosted sages mentioned in the Upanishads; her stay in the forest with her husband, who had to be a celibate ascetic while she was in the prime of her youth; her interactions with the women of Lanka, recipes she exchanged, emotions they shared; her connection with the earth, her mother, and with the trees, her sisters; her role as the Goddess, the untamed Kali as well as the demure Gauri, in transforming the stoic prince of Ayodhya into God.","328 pages, Paperback",Mythology,"3,068 follower",575 reviews,208,99 (1%),248 (3%),"1,356 (17%)","3,167 (41%)","2,826 (36%)"
My Name Is Memory,Ann Brashares,"33,217","ratings5,410","June 1, 2010","Daniel has spent centuries falling in love with the same girl. Life after life, crossing continents and dynasties, he and Sophia (despite her changing name and form) have been drawn together-and he remembers it all. Daniel has ""the memory"", the ability to recall past lives and recognize souls of those he's previously known. It is a gift and a curse. For all the times that he and Sophia have been drawn together throughout history, they have also been torn painfully, fatally, apart. A love always too short.Interwoven through Sophia and Daniel's unfolding present day relationship are glimpses of their expansive history together. From 552 Asia Minor to 1918 England and 1972 Virginia, the two souls share a long and sometimes torturous path of seeking each other time and time again. But just when young Sophia (now ""Lucy"" in the present) finally begins to awaken to the secret of their shared past, to understand the true reason for the strength of their attraction, the mysterious force that has always torn them apart reappears. Ultimately, they must come to understand what stands in the way of their love if they are ever to spend a lifetime together.","324 pages, Hardcover",Romance,"4,831 follower","5,410 reviews",81,"1,023 (3%)","3,149 (9%)","8,817 (26%)","11,476 (34%)","8,752 (26%)"
"The Royal Nonesuch: Or, What Will I Do When I Grow Up?",W. Glasgow Phillips,76,ratings15,"February 21, 2007","Glasgow Phillips published his debut novel Tuscaloosa at the tender age of twenty-four. The results were disastrous: encouraging reviews, translations, a paperback sale, a film option, and a Stegner Fellowship at Stanford. But over the next two years, as Phillips’s second novel unraveled and freelance journalism assignments ended in humiliation, a horrible, secret thought took hold in him: perhaps, just possibly, whatever talent he had was of the kind that would never be more than promise.Washed up as a “real” writer before he was thirty, Phillips went to Los Angeles and formed a company with his best childhood friend Jason McHugh, independent producer of Cannibal! The Musical and Orgazmo. The Royal Nonesuch is the story of Phillips’s rollercoaster ride through the twisted world of underground Hollywood and the funhouse of the Internet during the boom. Phillips builds a hilarious and poignant memoir, in the tradition of Augusten Burroughs and Sean Wilsey, from tales of promise and failure, family and madness, friendship and redemption, fame and infamy, and good old-fashioned hustling. It is a remarkable book; a brilliant portrait of a generation in all its foolish glory.","384 pages, Paperback",Nonfiction,3 follower,15 reviews,4,4 (5%),20 (26%),21 (27%),24 (31%),7 (9%)
Yellow Crocus,Laila Ibrahim,"78,172","ratings6,729","December 17, 2010","Moments after Lisbeth is born, she’s taken from her mother and handed over to an enslaved wet nurse, Mattie, a young mother separated from her own infant son in order to care for her tiny charge. Thus begins an intense relationship that will shape both of their lives for decades to come. Though Lisbeth leads a life of privilege, she finds nothing but loneliness in the company of her overwhelmed mother and her distant, slave-owning father. As she grows older, Mattie becomes more like family to Lisbeth than her own kin and the girl’s visits to the slaves’ quarters—and their lively and loving community—bring them closer together than ever. But can two women in such disparate circumstances form a bond like theirs without consequence? This deeply moving tale of unlikely love traces the journey of these very different women as each searches for freedom and dignity.Revised This edition of Yellow Crocus includes editorial revisions.","253 pages, Kindle Edition",Historical Fiction,"1,992 follower","6,729 reviews",11,684 (<1%),"1,689 (2%)","8,652 (11%)","27,596 (35%)","39,551 (50%)"
Dreams in a Time of War,Ngũgĩ wa Thiong'o,"1,582",ratings191,"January 1, 2005","By the world-renowned novelist, playwright, critic, and author of Wizard of the Crow, an evocative and affecting memoir of childhood. Ngugi wa Thiong’o was born in 1938 in rural Kenya to a father whose four wives bore him more than a score of children. The man who would become one of Africa’s leading writers was the fifth child of the third wife. Even as World War II affected the lives of Africans under British colonial rule in particularly unexpected ways, Ngugi spent his childhood as very much the apple of his mother’s eye before attending school to slake what was then considered a bizarre thirst for learning. In Dreams in a Time of War , Ngugi deftly etches a bygone era, capturing the landscape, the people, and their culture; the social and political vicissitudes of life under colonialism and war; and the troubled relationship between an emerging Christianized middle class and the rural poor. And he shows how the Mau Mau armed struggle for Kenya’s independence against the British informed not only his own life but also the lives of those closest to him. Dreams in a Time of War speaks to the human right to dream even in the worst of times. It abounds in delicate and powerful subtleties and complexities that are movingly told.","272 pages, Hardcover",Africa,"1,698 follower",191 reviews,83,13 (<1%),65 (4%),405 (25%),663 (41%),436 (27%)
Midnight,Derek Landy,"5,356",ratings369,"May 31, 2018","Skulduggery Pleasant and Valkyrie Cain are back in their most gripping story yet, as book 11, Midnight, picks up where Resurrection left off – and runs.For years, Valkyrie Cain has struggled to keep her loved ones safe from harm, plunging into battle – time and time again – by Skulduggery Pleasant’s side, and always emerging triumphant.But now the very thing that Valkyrie fights for is in danger, as a ruthless killer snatches her little sister in order to lure Valkyrie into a final confrontation. With Skulduggery racing to catch up and young sorcerer Omen scrambling along behind, Valkyrie only has twelve hours to find Alice before it’s too late. The clock is ticking…","432 pages, ebook",Fantasy,"4,976 follower",369 reviews,182,49 (<1%),167 (3%),813 (15%),"1,779 (33%)","2,548 (47%)"
Scorpia,Anthony Horowitz,"58,655","ratings1,584","April 1, 2004","Alex Rider, teen spy, has always been told he is the spitting image of the father he never knew. But when Alex learns that his father may have been an assassin for the most lethal and powerful terrorist organization in the world, Scorpia, his world shatters. Now Scorpia wants Alex on their side, and Alex no longer has the strength to fight them. That is, until he learns of Scorpia’s latest plot: an operation known only as “Invisible Sword” that will result in the death of thousands of people. Can Alex prevent the slaughter, or will Scorpia prove once and for all that the terror will not be stopped?","388 pages, Paperback",Young Adult,17.2k follower,"1,584 reviews",428,389 (<1%),"1,848 (3%)","10,113 (17%)","20,545 (35%)","25,760 (43%)"
Each Kindness,Jacqueline Woodson,"7,390","ratings1,622","October 2, 2012","Each kindness makes the world a little betterChloe doesn't really know why she turns away from the new girl, Maya, when Maya tries to befriend her. And every time Maya asks if she can play with Chloe and the other girls, the answer is always no. So Maya ends up playing alone. And then one day she's gone.When Chloe's teacher gives a lesson about how even small acts of kindness can change the world, Chloe is stung by the opportunity that's been lost. How much better could it have been if she'd just shown Maya a little kindness and opened her heart to friendship?Newbery Honor-winning author Jacqueline Woodson and Caldecott Honor-winning illustrator E. B. Lewis have created a beautiful, poignant picture book with a powerful message that will stay with readers long after they've put it down.","32 pages, Hardcover",Picture Books,"8,728 follower","1,622 reviews",75,94 (1%),149 (2%),730 (9%),"1,957 (26%)","4,460 (60%)"
Spring,Ali Smith,"13,890","ratings1,832","March 28, 2019","Spring will come. The leaves on its trees will open after blossom. Before it arrives, a hundred years of empire-making. The dawn breaks cold and still but, deep in the earth, things are growing.","336 pages, Paperback",Fiction,"4,593 follower","1,832 reviews",148,125 (<1%),513 (3%),"2,429 (17%)","5,728 (41%)","5,095 (36%)"
Evil Has a Name: The Untold Story of the Golden State Killer Investigation,Paul Holes,"7,945",ratings781,"November 15, 2018","The Golden State Killer. The East Area Rapist. The Original Night Stalker. The Visalia Ransacker.The monster who preyed on Californians from 1976 to 1986 was known by many aliases. And while numerous police sketches tried to capture his often-masked visage, the Golden State Killer spent more than 40 years not only faceless, but nameless.For his victims, for their families and for the investigators tasked with finding him, the senselessness and brutality of the Golden State Killer's acts were matched only by the powerlessness they felt at failing to uncover his identity. To be sure, the chances of obtaining closure—or any form of justice—after so many years were slim to none, at best.Then, on April 24, 2018, authorities arrested 72-year-old Joseph James DeAngelo at his home in Citrus Heights, Calif., based on DNA evidence linked to the crimes. After a decades-long hunt, a suspect was behind bars. Could it be that evil finally had a name?Delivering all-new details about the investigation and a stunning final act to the events of Michelle McNamara's haunting bestseller, I'll Be Gone in the Dark, this is the true story of how the suspected Golden State Killer was captured, as told, first-hand, by those closest to the case:Paul Holes—the forensic criminologist and retired Costa County detective who spent 20 years trying to crack the Golden State Killer case, and finally did.Jim Clemente (Host)—a retired FBI profiler and former New York City prosecutor who has investigated some of the highest profile criminal cases in U.S. history, including the Unabomber.Please note: This work contains descriptions of violent crime and sexual assault and may not be suitable for all listeners.","6 pages, Audible Audio",True Crime,710 follower,781 reviews,4,25 (<1%),83 (1%),699 (8%),"2,676 (33%)","4,462 (56%)"
