Title,Authors,Avg Ratings,Rating,first_published,Description,Total_Pages,Genre,author_followers,no_of_reviews,no_book_by_author,one_star_ratings,two_star_ratings,three_star_ratings,four_star_ratings,five_star_ratings
Justice,Laurann Dohner,"20,629",ratings931,"First published November 1, 2011","Justice North is the face of New Species. Seeing him up close makes Jessie's heart race. He's the ultimate alpha male-big, muscular, exotically beautiful...and dangerous. Of course he's off limits. But then the sexy man purrs and all bets are off.Jessie Dupree is a mouthy, fiery human female who brings out the animal in Justice. She wants to show him how to relax, and he's all for anything she wants to do, but Justice has sworn to protect his people and to take a Species mate. He's torn between the woman he wants and the oath he's taken. Jessie knows a relationship between them probably won't end well; heartbreak is inevitable. But that won't stop her from freeing the wildness inside Justice and spending every moment she can steal wrapped around his hot body, making him roar with passion.Reader Advisory: Each New Species book may be read as a standalone, but we suggest reading them in order to get the most enjoyment from the series.","222 pages, ebook",Paranormal,"8,408 followers",931 reviews,"101 books8,408 followers",144 (<1%),499 (2%),"3,055 (14%)","6,776 (32%)","10,155 (49%)"
Mithras Court,David A. Page,43,ratings1,"First published November 4, 2008","When you've lost what you love most, a life in hell comes easy...Lewis Beckford's wife was murdered on a London subway car; now Lewis spends his night searching the underbelly of London looking for the man with the snake tattoo. A year after her death, he finds Richard Baxter, but his attempt to bring the man to summary justice for his crime goes horribly awry when the train finds its way to Mithras Court Station, a place not on any mortal map of London. The only key Lewis finds is a name - Sir Lucius Knight. But Knight seeks only his own empire to rule, and in Mithras Court, he has that. Lewis cannot buy his assistance easily, but Knight offers a deal: Lewis' aid in Knight's plan to expand his kingdom in exchange for Lewis' freedom.An action-packed story of love, revenge, and the horror that waits for all people, Mithras Court will be a key book for fans of horror and gothic romance alike.","352 pages, Mass Market Paperback",Fantasy,9 followers,1 review,15 books9 followers,1 (2%),6 (13%),15 (34%),9 (20%),12 (27%)
"The Josephine Bonaparte Collection: The Many Lives and Secret Sorrows of Josephine B., Tales of Passion, Tales of Woe, and the Last Great Dance on Earth",Sandra Gulland,"3,841",ratings456,"First published January 1, 2002","Just in time for the holidays, here are Sandra Gulland's three gripping, historical novels based on the epic life of Josephine Bonaparte in one gorgeous package. All are works of historical fiction on a grand scale that recount a stirring, unforgettable love story. The Many Lives & Secret Sorrows of Josephine B. traces Josephine's early years as she leaves the exotic, lush, and remote Martinico for the heart of European society. There she meets Napoleon, whose destiny will prove to be irrevocably intertwined with hers. Tales of Passion, Tales of Woe continues the saga as Josephine awakens to her new life as Mrs. Napoleon Bonaparte and we witness the political intrigues and personal betrayals that result in death, ruin, and victory for those closest to Josephine. The Last Great Dance on Earth is the triumphant final volume that opens four years into the passionate yet troubled union of Josephine and Napoleon. The tumultuous times will, ultimately, drive them apart, culminating in Josephine's greatest her divorce from Napoleon and his exile to Elba.","1216 pages, Paperback",Historical Fiction,834 followers,456 reviews,28 books834 followers,18 (<1%),49 (1%),306 (7%),"1,231 (32%)","2,237 (58%)"
Lord Loss,Darren Shan,"23,284","ratings1,575","First published January 1, 2005","The first novel in a chilling new series by Darren Shan, author of the New York Times bestselling Cirque Du Freak series, will keep readers turning page after horrifying page.Grubbs Grady has stiff red hair and is a little big for his age, which means he can get into R-rated movies. He hates history and loves bacon, rats, and playing tricks on his squeamish older sister. When he opts out of a family weekend trip, he never guesses that he is about to take a terrifying journey into darkness. Hungry demons and howling werewolves haunt his waking nightmares... and threaten his life.","224 pages, Paperback",Horror,"7,758 followers","1,575 reviews","253 books7,758 followers",268 (1%),789 (3%),"3,404 (14%)","7,393 (31%)","11,430 (49%)"
The Cost of Courage,Joseph Cordaro,28,ratings14,"First published March 25, 2011","Emily Courtland is a strong and determined woman. But, she will need all of her strength and courage when her husband returns from war. Naval hero, Lieutenant Commander Charles Courtland, is tormented by terrifying memories of battle and is being destroyed by the severe psychological aftereffects of battle.  The ugly wounds to his body are healing. But the uglier scars on his mind are forcing him to fight the nightmarish demons he cannot speak of.  Emily sees her family being crushed by her husband's erratic and delusional behavior. Most especially, and mysteriously, it is their young son Brent who bears the brunt of his father’s irrational treatment. For the boy it has reached the point of physical abuse.  Emily is forced to choose between standing by the ill husband she loves, and protecting their child from him. To read the first two chapters go to www.josephcordaro.com","336 pages, Paperback",Fiction,7 followers,14 reviews,2 books7 followers,1 (3%),1 (3%),2 (7%),3 (10%),21 (75%)
Twistir,Pierce Minor,32,ratings5,"First published February 20, 2013","Three teenagers discover the truth about their identitywhile struggling to control their new gifts.Ennis Taylor lives a normal small-town life with his father for nearly sixteen years, until the nightmares begin. When they do, he’s faced with calling them what they must be – freaky dreams – or self-diagnosing himself as a teenage schizophrenic. What else do you call a boy who swears to flying around his room at night when no one else is there to witness?To make matters worse, at school Ennis hears the voice of not one, but two of his classmates – Edward, the superstar athlete, and Elias, the local menace. This would be tolerable if they were, in the slightest, friends, and if the voices weren’t seemingly inside his head.","430 pages, Paperback",Young Adult,21 followers,5 reviews,5 books21 followers,1 (3%),0 (0%),7 (21%),10 (31%),14 (43%)
Small Wonder,Barbara Kingsolver,"10,748",ratings901,"First published January 1, 2002","Sometimes grave, occasionally hilarious, and ultimately persuasive, Small Wonder is a hopeful examination of the people we seem to be, and what we might yet make of ourselves.In her new essay collection, the beloved author of High Tide in Tucson brings to us, out of one of history's darker moments, an extended love song to the world we still have. Whether she is contemplating the Grand Canyon, her vegetable garden, motherhood, genetic engineering, or the future of a nation founded on the best of all human impulses, these essays are grounded in the author's belief that our largest problems have grown from the earth's remotest corners as well as our own backyards, and that answers may lie in both those places.Sometimes grave, occasionally hilarious, and ultimately persuasive, Small Wonder is a hopeful examination of the people we seem to be, and what we might yet make of ourselves.","264 pages, Paperback",Nonfiction,21.5k followers,901 reviews,76 books21.5k followers,159 (1%),432 (4%),"2,124 (19%)","4,276 (39%)","3,757 (34%)"
Charlie Bone and the Red Knight,Jenny Nimmo,"9,579",ratings411,"First published September 7, 2009","Dark forces are gathering at Bloor's Academy as the Bloors search for a lost box containing a hidden will- a will that reveals the true destiny of the Red King's heirs. And the Bloors are determined to keep Charlie Bone from finding it first. But Charlie is also facing the lord of the sea, who is trying to drown his parents, and a deadly expert swordsman from another century. The Red Knight might be the only hope. But who is the mysterious Red Kinight? And can he help Charlie and his friends defeat the evil magic for good?","423 pages, Hardcover",Fantasy,927 followers,411 reviews,161 books927 followers,113 (1%),362 (3%),"1,829 (19%)","3,176 (33%)","4,099 (42%)"
The Signal and the Noise: Why So Many Predictions Fail—But Some Don't,Nate Silver,"49,870","ratings3,357","First published September 27, 2012","Nate Silver built an innovative system for predicting baseball performance, predicted the 2008 election within a hair's breadth. He solidified his standing as the nation's foremost political forecaster with his near perfect prediction of the 2012 election. Silver is the founder and editor in chief of FiveThirtyEight.com. Drawing on his own groundbreaking work, Silver examines the world of prediction, investigating how we can distinguish a true signal from a universe of noisy data. Most predictions fail, often at great cost to society, because most of us have a poor understanding of probability and uncertainty. Both experts and laypeople mistake more confident predictions for more accurate ones. But overconfidence is often the reason for failure. If our appreciation of uncertainty improves, our predictions can get better too. This is the ""prediction paradox"": The more humility we have about our ability to make predictions, the more successful we can be in planning for the future.In keeping with his own aim to seek truth from data, Silver visits the most successful forecasters in a range of areas, from hurricanes to baseball, from the poker table to the stock market, from Capitol Hill to the NBA. He explains and evaluates how these forecasters think and what bonds they share. What lies behind their success? Are they good-or just lucky? What patterns have they unraveled? And are their forecasts really right? He explores unanticipated commonalities and exposes unexpected juxtapositions. And sometimes, it is not so much how good a prediction is in an absolute sense that matters but how good it is relative to the competition. In other cases, prediction is still a very rudimentary-and dangerous-science.Silver observes that the most accurate forecasters tend to have a superior command of probability, and they tend to be both humble and hardworking. They distinguish the predictable from the unpredictable, and they notice a thousand little details that lead them closer to the truth. Because of their appreciation of probability, they can distinguish the signal from the noise.","544 pages, Hardcover",Nonfiction,514 followers,"3,357 reviews",12 books514 followers,806 (1%),"2,278 (4%)","10,021 (20%)","21,134 (42%)","15,631 (31%)"
The Enchantress,Michael Scott,"45,267","ratings2,580","First published May 22, 2012","The two that are one must become the one that is all. One to save the world, one to destroy it.San Francisco:Nicholas and Perenelle Flamel have one day left to live, and one job left to do. They must defend San Francisco. The monsters gathered on Alcatraz Island have been released and are heading toward the city. If they are not stopped, they will destroy everyone and everything in their path.But even with the help of two of the greatest warriors from history and myth, will the Sorceress and the legendary Alchemyst be able to defend the city? Or is it the beginning of the end of the human race?Danu Talis:Sophie and Josh Newman traveled ten thousand years into the past to Danu Talis when they followed Dr. John Dee and Virginia Dare. And it’s on this legendary island that the battle for the world begins and ends.Scathach, Prometheus, Palamedes, Shakespeare, Saint-Germain, and Joan of Arc are also on the island. And no one is sure what—or who—the twins will be fighting for.Today the battle for Danu Talis will be won or lost.But will the twins of legend stand together?Or will they stand apart—one to save the world and one to destroy it?","513 pages, Hardcover",Fantasy,"6,666 followers","2,580 reviews","314 books6,666 followers",435 (<1%),"1,507 (3%)","6,676 (14%)","14,581 (32%)","22,068 (48%)"
Ashfall,Mike Mullin,"25,229","ratings3,096","First published October 14, 2011","Under the bubbling hot springs and geysers of Yellowstone National Park is a supervolcano. Most people don't know it's there. The caldera is so large that it can only be seen from a plane or satellite. It just could be overdue for an eruption, which would change the landscape and climate of our planet.For Alex, being left alone for the weekend means having the freedom to play computer games and hang out with his friends without hassle from his mother. Then the Yellowstone supervolcano erupts, plunging his hometown into a nightmare of darkness, ash, and violence. Alex begins a harrowing trek to search for his family and finds help in Darla, a travel partner he meets along the way. Together they must find the strength and skills to survive and outlast an epic disaster.","466 pages, Hardcover",Young Adult,"1,652 followers","3,096 reviews","14 books1,652 followers",631 (2%),"1,284 (5%)","5,017 (19%)","9,228 (36%)","9,069 (35%)"
The Boy on the Porch,Sharon Creech,"5,903",ratings960,"First published September 3, 2013","From Newbery Medal winner Sharon Creech comes a singular story that reminds us of the surprising connections that bloom when unconditional love and generosity prevail. For when a young couple finds a boy asleep on their porch, their lives take an unexpectedly joyous turn.When John and Marta found the boy on the porch, they were curious, naturally, as to why he was there-and they didn't expect him to stay, not at first, but he did stay, day after day, until it seemed as if he belonged, running and smiling and laughing his silent laugh, tapping and patting on every surface as he made his music, and painting-with water, with paint, with mud-those swirly swirls and swings and trees.One day a young couple wakes to find a boy asleep on their porch. Unable to speak, the boy cannot explain his history. What kind of person would leave their child with strangers? All they know is that they have been chosen to care for this boy. And as their connection to him grows, they embrace his exuberant spirit and talents. The three of them blossom into an unlikely family, and John and Marta and the boy begin to see the world in brand-new ways. Newbery Medal winner Sharon Creech delivers a poignant story of finding family when you least expect it.","160 pages, Hardcover",Middle Grade,"2,922 followers",960 reviews,"81 books2,922 followers",109 (1%),370 (6%),"1,336 (22%)","2,151 (36%)","1,937 (32%)"
A Real Basket Case,Beth Groundwater,366,ratings88,"First published March 21, 2007","Feeling neglected by her workaholic husband, forty-something gift basket maker Claire Hanover joins an aerobics class. In a moment of weakness, Claire agrees to let charming aerobics instructor Enrique come to her house to give her a massage. She realizes she has made a deadly mistake when Enrique is shot and killed in her bedroom and her husband Roger is arrested for the murder. Determined to clear Roger's name and save her marriage, Claire sets out to find the real killer, encountering drug dealers, jealous ex-girlfriends, and angry cops along the way.","312 pages, Paperback",Mystery,589 followers,88 reviews,10 books589 followers,23 (6%),42 (11%),111 (30%),117 (31%),73 (19%)
Pivot,L.C. Barlow,768,ratings226,"First published October 15, 2019","For some, the Devil introduces himself as an average man. For others, he crushes their souls and makes them bleed. For Jack Harper, the Devil renders himself a savior. But things are changing.Once a loyal follower of Cyrus and an accomplished killer, Jack Harper now begins to question everything. There are new, strange forces at work that are intruding on Jack's kills, abilities, and very being. Maybe, though, deep down Jack has been waiting for this intrusion, and maybe Cyrus is not as powerful as he seems.","270 pages, Paperback",Horror,218 followers,226 reviews,6 books218 followers,48 (6%),68 (8%),169 (22%),248 (32%),235 (30%)
Hawk Quest,Robert Lyndon,"1,416",ratings239,"First published January 1, 2012","The year is 1072.The Normans have captured England. The Turks have captured a Norman knight. And in order to free him, a soldier named Vallon must capture four rare hawks.On a heart-stopping journey to the far ends of the earth, braving Arctic seas, Viking warlords, and the blood-drenched battlefields, Vallon and his comrades must track down their quarry one by one in a relentless race against time.The scale is huge. The journey is incredible. The history is real. This is Hawk Quest.","672 pages, Hardcover",Historical Fiction,83 followers,239 reviews,7 books83 followers,31 (2%),83 (5%),264 (18%),530 (37%),508 (35%)
Torn From The Inside Out,Sara Niles,37,ratings6,"First published February 1, 2004","This 2004 edition is obsolete and out of printNarrative Memoir In 1987 Sara Niles was forced to flee for her life with five small children, during a cold February thunderstorm. ""In the process of my evolution, I became a victim of domestic war, an emotional casualty for a major portion of my life, entwined, entrapped and emotionally involved, until I learned how to become free. Freedom has never been easily gained and has often come at high cost throughout history, but one thing I will always know is freedom is worth every fight, and all pain"" Sara NilesIn every life there is a timeless and unforgettable minute or day that will be forever etched into our mind’s memory. I have unforgettable memories that are so vivid that I see them in Technicolor, and I hear them with surround sound. Long after I am dead, I believe, I will remember. Two of those memories were the days of my escape to freedom...twice.","354 pages, Paperback",Nonfiction,56 followers,6 reviews,38 books56 followers,0 (0%),3 (8%),6 (16%),6 (16%),22 (59%)
The Exodus Towers,Jason M. Hough,"2,303",ratings191,"First published August 27, 2013","The Exodus Towers features all the high-octane action and richly imagined characters of The Darwin Elevator—but the stakes have never been higher.  The sudden appearance of a second space elevator in Brazil only deepens the mystery about the aliens who provided it: the Builders. Scavenger crew captain Skyler Luiken and brilliant scientist Dr. Tania Sharma have formed a colony around the new Elevator’s base, utilizing mobile towers to protect humans from the Builders’ plague. But they are soon under attack from a roving band of plague-immune soldiers. Cut off from the colony, Skyler must wage a one-man war against the new threat as well as murderous subhumans and thugs from Darwin—all while trying to solve the puzzle of the Builders’ master plan . . . before it’s too late for the last vestiges of humanity.","544 pages, Mass Market Paperback",Science Fiction,560 followers,191 reviews,23 books560 followers,26 (1%),116 (5%),605 (26%),"1,056 (45%)",500 (21%)
Revenge,O.L. Ramos,191,ratings32,"First published August 25, 2013","If the world you lived in was someday revealed to be nothing but a lie, would you really want the truth? Elizabeth McBeth did, and she's paid the price for it...After almost 10 years since Liz's mother was taken from her, Liz finally found her mother, Mary. But Mary has been forever changed, something that Liz will have to accept. The beginning of happier times, one would think...The conspiracy has been exposed; Liz, Vincent, Mary and Michael had all thought that the vampire plot had been destroyed. They should have never underestimated Klein. Klein has reinforced his armies, splitting the entire vampire species with the question... is Klein the vampiric messiah? Unfortunately for the heroes and the world itself, Klein has set in motion a plan that will destroy the world and recreate it in his own image.Will the group be able to defeat Klein and restore the balance to nature? Or are they already doomed?","325 pages, Kindle Edition",Young Adult,72 followers,32 reviews,7 books72 followers,2 (1%),11 (5%),23 (12%),50 (26%),105 (54%)
100 XIV,Jerry Seguin,2,ratings1,"First published December 14, 2013","Jerry Seguin is an artist and designer residing in the Bay Area of California. The book is a culmination of work, most of it recent, but going back as far as fourteen years. The works are mixed media, mostly of objects and found images restructured. Things often discarded are given a new life and context. He’s interested in the chemistry that happens when found images are altered or combined with other materials.As a collection, 100 XIV becomes a reflection of our own lives as much as it represents the artist’s experience. With the turn of each page you’re confronted with a face, a situation, an object reinterpreted. Past becomes just as relevant as present, the future is yesterday. You are now, and so is the book in your hands. We are all tied to our memories.","104 pages, Paperback",Art,1 follower,1 review,4 books1 follower,0 (0%),0 (0%),0 (0%),0 (0%),2 (100%)
Archangel's Legion,Nalini Singh,"25,934","ratings1,521","First published October 29, 2013","Nalini Singh, the New York Times bestselling “alpha author of paranormal romance” (Booklist) returns to an immortal world of violent passion and lethal power…on the brink of a deadly archangelic war.Angels are falling from the sky in New York, struck down by a vicious, unknown force.Vampires are dying impossibly of disease.Guild hunter Elena Deveraux and the Archangel Raphael must discover the source of the wave of death before it engulfs their city and their people, leaving New York a ruin and Raphael’s Tower under siege by enemy archangels.Yet even as they fight desperately to save the city, an even darker force is stirring, its chill eyes trained on New York…and on Raphael. Rivers of crimson and nightmares given flesh, the world will never again be the same…","374 pages, Mass Market Paperback",Urban Fantasy,25.5k followers,"1,521 reviews",255 books25.5k followers,215 (<1%),446 (1%),"2,605 (10%)","8,279 (31%)","14,389 (55%)"
Loving a Lost Lord,Mary Jo Putney,"6,546",ratings548,"First published July 1, 2009","In the first of a dazzling series, Mary Jo Putney introduces the Lost Lords—maverick childhood friends with a flair for defying convention. Each is about to discover the woman who is his perfect match—but perfection doesn’t come easily, even for the noble Duke of Ashton . . .Battered by the sea, Adam remembers nothing of his past, his ducal rank, nor of the shipwreck that almost claimed his life. However, he’s delighted to hear that the golden-haired vision tending his wounds is his wife. Mariah’s name and face may not be familiar, but her touch, her warmth, feel deliciously right . . .When Mariah Clarke prayed for a way to deter a bullying suitor, she didn’t imagine she’d find the answer washed ashore on a desolate beach. Convincing Adam that he is her husband is surprisingly easy. Resisting the temptation to act his wife, in every way, will prove anything but. And now a passion begun in fantasy has become dangerously real—and completely irresistible . . .","350 pages, Kindle Edition",Romance,"2,191 followers",548 reviews,"130 books2,191 followers",116 (1%),465 (7%),"1,805 (27%)","2,399 (36%)","1,761 (26%)"
Rise of Empire,Michael J. Sullivan,"50,779","ratings2,273","First published April 8, 2010","A PUPPET IS CROWNED. THE TRUE HEIR REMAINS HIDDEN. A ROGUE'S SECRET COULD CHANGE EVERYTHING.War has come to Melengar and once more Royce and Hadrian are hired to make a desperate gamble and form an alliance with the Nationalists whom are fighting the Imperialists in the south. As the power of the Nyphron Empire grows, so does Royce's suspicion that the wizard Esrahaddon is using the thieves as pawns in his own grab for power. To find the truth, he must unravel the secret of Hadrian's past--what he discovers may end their friendship and break Riyria in two.","786 pages, Paperback",Fantasy,94.1k followers,"2,273 reviews",96 books94.1k followers,160 (<1%),647 (1%),"5,126 (10%)","19,469 (38%)","25,377 (49%)"
