Title,Authors,Avg Ratings,Rating,first_published,Description,Total_Pages,Genre,author_followers,no_of_reviews,no_book_by_author,one_star_ratings,two_star_ratings,three_star_ratings,four_star_ratings,five_star_ratings
The Good People,Hannah Kent,"20,672","ratings2,587","September 27, 2016","Based on true events and set in a lost world bound by its own laws, The Good People is Hannah Kent's startling novel about absolute belief and devoted love. Terrifying, thrilling and moving in equal measure, this long-awaited follow-up to Burial Rites shows an author at the height of her powers.County Kerry, Ireland, 1825.Nóra, bereft after the sudden death of her beloved husband, finds herself alone and caring for her young grandson Micheál. Micheál cannot speak and cannot walk and Nóra is desperate to know what is wrong with him. What happened to the healthy, happy grandson she met when her daughter was still alive?Mary arrives in the valley to help Nóra just as the whispers are spreading: the stories of unexplained misfortunes, of illnesses, and the rumours that Micheál is a changeling child who is bringing bad luck to the valley.Nance's knowledge keeps her apart. To the new priest, she is a threat, but to the valley people she is a wanderer, a healer. Nance knows how to use the plants and berries of the woodland; she understands the magic in the old ways. And she might be able to help Micheál.As these three women are drawn together in the hope of restoring Micheál, their world of folklore and belief, of ritual and stories, tightens around them. It will lead them down a dangerous path, and force them to question everything they have ever known.","380 pages, Paperback",Historical Fiction,"3,963 follower","2,587 reviews",13,317 (1%),"1,233 (5%)","5,417 (26%)","8,739 (42%)","4,966 (24%)"
"The Art of Asking; or, How I Learned to Stop Worrying and Let People Help",Amanda Palmer,"36,118","ratings3,404","November 11, 2014","Rock star, crowdfunding pioneer, and TED speaker Amanda Palmer knows all about asking. Performing as a living statue in a wedding dress, she wordlessly asked thousands of passersby for their dollars. When she became a singer, songwriter, and musician, she was not afraid to ask her audience to support her as she surfed the crowd (and slept on their couches while touring). And when she left her record label to strike out on her own, she asked her fans to support her in making an album, leading to the world's most successful music Kickstarter.Even while Amanda is both celebrated and attacked for her fearlessness in asking for help, she finds that there are important things she cannot ask for-as a musician, as a friend, and as a wife. She learns that she isn't alone in this, that so many people are afraid to ask for help, and it paralyzes their lives and relationships. In this groundbreaking book, she explores these barriers in her own life and in the lives of those around her, and discovers the emotional, philosophical, and practical aspects of The Art Of Asking.Part manifesto, part revelation, this is the story of an artist struggling with the new rules of exchange in the twenty-first century, both on and off the Internet. The Art Of Asking will inspire readers to rethink their own ideas about asking, giving, art, and love.","339 pages, Hardcover",Nonfiction,"1,919 follower","3,404 reviews",11,"1,732 (4%)","2,456 (6%)","6,505 (18%)","11,425 (31%)","14,000 (38%)"
I Lived on Butterfly Hill,Marjorie Agosín,"2,068",ratings390,"March 4, 2014","An eleven-year-old’s world is upended by political turmoil in this “lyrically ambitious tale of exile and reunification” ( Kirkus Reviews ) from an award-winning poet, based on true events in Chile.Celeste Marconi is a dreamer. She lives peacefully among friends and neighbors and family in the idyllic town of Valparaiso, Chile—until one day when warships are spotted in the harbor and schoolmates start disappearing from class without a word. Celeste doesn’t quite know what is happening, but one thing is no one is safe, not anymore.The country has been taken over by a government that declares artists, protestors, and anyone who helps the needy to be considered “subversive” and dangerous to Chile’s future. So Celeste’s parents—her educated, generous, kind parents—must go into hiding before they, too, “disappear.” Before they do, however, they send Celeste to America to protect her.As Celeste adapts to her new life in Maine, she never stops dreaming of Chile. But even after democracy is restored to her home country, questions Will her parents reemerge from hiding? Will she ever be truly safe again?Accented with interior artwork, steeped in the history of Pinochet’s catastrophic takeover of Chile, and based on many true events, this multicultural ode to the power of revolution, words, and love is both indelibly brave and heartwrenchingly graceful.","464 pages, Kindle Edition",Historical Fiction,70 follower,390 reviews,118,13 (<1%),54 (2%),312 (15%),770 (37%),919 (44%)
Ghouls Just Haunt to Have Fun,Victoria Laurie,"5,231",ratings259,"March 3, 2009","A demonic guest terrorizes a haunted hotel When ghost hunter and medium M.J. Holliday appears on a television show called Haunted Possessions, she encounters an evil knife that releases a demon. Now all hell has broken loose in the haunted hotel where M.J. is staying?and it?s up to her to give the uninvited guest an early checkout.","320 pages, Mass Market Paperback",Mystery,"3,016 follower",259 reviews,65,29 (<1%),143 (2%),"1,128 (21%)","2,081 (39%)","1,850 (35%)"
The Rest of Her Life,Laura Moriarty,"7,730",ratings919,"January 1, 2007","In The Rest of Her Life, Laura Moriarty delivers a luminous, compassionate, and provocative look at how mothers and daughters with the best intentions can be blind to the harm they do to one another.Leigh is the mother of high-achieving, popular high school senior Kara. Their relationship is already strained for reasons Leigh does not fully understand when, in a moment of carelessness, Kara makes a mistake that ends in tragedy -- the effects of which not only divide Leigh's family, but polarize the entire community. We see the story from Leigh's perspective, as she grapples with the hard reality of what her daughter has done and the devastating consequences her actions have on the family of another teenage girl in town, all while struggling to protect Kara in the face of rising public outcry.Like the best works of Jane Hamilton, Jodi Picoult, and Alice Sebold, Laura Moriarty's The Rest of Her Life is a novel of complex moral dilemma, filled with nuanced characters and a page-turning plot that makes readers ask themselves, ""What would I do""","320 pages, Hardcover",Fiction,845 follower,919 reviews,13,193 (2%),861 (11%),"3,131 (40%)","2,592 (33%)",953 (12%)
The Book of Bright Ideas,Sandra Kring,"6,910",ratings757,"January 1, 2006","Wisconsin, 1961. Evelyn “Button” Peters is nine the summer Winnalee and her fiery-spirited older sister, Freeda, blow into her small town–and from the moment she sees them, Button knows this will be a summer unlike any other.Much to her mother’s dismay, Button is fascinated by the Malone sisters, especially Winnalee, a feisty scrap of a thing who carries around a shiny silver urn containing her mother’s ashes and a tome she calls “The Book of Bright Ideas.” It is here, Winnalee tells Button, that she records everything she her answers to the mysteries of life. But sometimes those mysteries conceal a truth better left buried. And when a devastating secret is suddenly revealed, dividing loyalties and uprooting lives, no one–from Winnalee and her sister to Button and her family–will ever be the same.","309 pages, Paperback",Fiction,235 follower,757 reviews,6,63 (<1%),265 (3%),"1,516 (21%)","2,877 (41%)","2,189 (31%)"
Prince of Bryanae,Jeffrey Getzin,90,ratings31,"November 3, 2010","Elven soldier Willow serves the human Kingdom of Bryanae in a bid to overcome her traumatic past. Emotionally crippled and driven by her personal demons, she has buried that past so deeply that she has forgotten it altogether ... but it hasn't forgotten her. Paralyzed by an inexplicable terror, she watches helplessly as old enemies kidnap the Prince. Considered by most of Bryanae to be a coward and a traitor, Willow decides she must confront her past and plunge into the heart of the enemy empire to rescue the Prince. Aside from the steel blade she wields with lethal expertise, Willow has only dubious allies upon whom to rely-a headstrong private who's in love with her, an inscrutable winged mage with a hidden agenda, and a dashing but opportunistic captain whom she desires against her better judgment. An army of fanatical warriors stands in her way. Leading them is the mad and seemingly immortal Warlord who has a personal grudge to settle with Willow: one that spans centuries. Willow has devoted her life to discipline and now she must bring that discipline to bear. Pain will not stop her. Fear will not stop her. She will rescue the Prince or die trying. Willow has been honing her combat and weaponry skills for a very long time. It's time to put those skills to good use. PRINCE OF BRYANAE is an epic fantasy novel filled with intense battles, romance, betrayal, and redemption. ""Fresh and strong and full of energy!"" - New York Times Bestselling Author R. A. Salvatore ""Getzin makes you feel like a part of the intricate and fascinating world he's created. This is solid storytelling and spicy yarns. Once inside, you won't want to leave."" - Mike Freeman, author of The New York Times notable book Bloody Sundays ""This is a splendid book full of adventure and a sympathetic character in Willow. The story has heart and excitement. I'd recommend it to anyone who loves a rollicking good fantasy. Jeffrey Getzin is a writer to watch"" - Billie Sue Mosiman, author of Legions of the Dark ""I recommend [Prince of Bryanae] to anyone who enjoys a good story with nonstop action and suspense, combined with strong, memorable characters and an imaginative setting."" - Scotti Cohn, author of Liberty's Children","458 pages, Paperback",Fantasy,45 follower,31 reviews,8,5 (5%),9 (10%),21 (23%),29 (32%),26 (28%)
The Lone Samurai: The Life of Miyamoto Musashi,William Scott Wilson,"1,764",ratings95,"August 11, 2004","An expert on samurai history paints a vivid, multi-faceted portrait of feudal Japan and Miyamoto Musashi—the legendary swordsman who wrote the classic martial arts treatise, The Book of Five Rings Born in 1584, Miyamoto Musashi was the legendary samurai known throughout the world as a master swordsman, spiritual seeker, and author of the classic book on strategy, The Book of Five Rings . Over 350 years after his death, Musashi and his legacy still fascinate readers worldwide, inspiring artists, authors, and filmmakers. In The Lone Samurai , respected translator and expert on samurai culture William Scott Wilson presents both a vivid account of a fascinating period in feudal Japan and a portrait of the courageous, iconoclastic samurai who wrestled with philosophical and spiritual ideas that are as relevant today as they were in his time. For Musashi, the way of the martial arts was about mastery of the mind rather than simply technical prowess—and it is this path to mastery that is the core teaching in his Book of Five Rings . This special volume includes supplemental material on Musashi’s legacy as a martial arts icon, his impact on literature and film, and the influence of his Book of Five Rings .","287 pages, Hardcover",Biography,74 follower,95 reviews,44,20 (1%),44 (2%),331 (18%),676 (38%),693 (39%)
"Atlantic Fever: Lindbergh, His Competitors, and the Race to Cross the Atlantic",Joe      Jackson,110,ratings16,"May 1, 2012","For five weeks—from April 14 to May 21, 1927—the world held its breath while fourteen aviators took to the air to capture the $25,000 prize that Raymond Orteig offered to the first man to cross the Atlantic Ocean without stopping. Joe Jackson’s Atlantic Fever is about this race, a milestone in American history whose story has never been fully told. Delving into the lives of the big-name competitors—the polar explorer Richard Byrd, the French war hero René Fonck, the millionaire Charles Levine, and the race’s eventual winner, the enigmatic Charles Lindbergh—as well as those whose names have been forgotten by history (such as Bernt Balchen, Stanton Wooster, and Clarence Chamberlin), Jackson brings a completely fresh and original perspective to the race to conquer the Atlantic. Atlantic Fever opens for us one of those magical windows onto a moment when the nexus of technology, innovation, character, and spirit led so many contenders from different parts of the world to be on the cusp of the exact same achievement at the exact same time.","544 pages, Hardcover",History,11 follower,16 reviews,8,0 (0%),3 (2%),19 (17%),46 (41%),42 (38%)
The Seventh Daughter,Frewin Jones,"4,389",ratings158,"January 29, 2008","Tania has brought the long-lost Queen Titania back to Faerie from the Mortal World of modern London. But when they cross between the worlds, they find only devastation.The Sorcerer King of Lyonesse--ancient enemy of the Faerie Court--has been released from his amber prison. As the wicked sorcerer regains his power, King Oberon, Tania's father, is imprisoned and the Faerie Court is being destroyed.Tania and her true love, Edric, must travel the Realm to try to find and rescue King Oberon, who is their only hope for defeating the evil Sorcerer King. And Tania must prepare for battle . . . and to fight a war that she may not survive.","324 pages, Hardcover",Fantasy,2 follower,158 reviews,20,85 (1%),300 (6%),"1,176 (26%)","1,344 (30%)","1,484 (33%)"
"Power to the People: How the Coming Energy Revolution Will Transform an Industry, Change Our Lives, and Maybe Even Save the Planet",Vijay V. Vaitheeswaran,82,ratings10,"January 3, 2005","""By far the most helpful, entertaining, up-to-date and accessible treatment of the energy-economy-environment problematique available."" --John P. Holdren, Scientific American A fiercely independent and irresistibly entertaining look at the economic, political and technological forces that are reshaping the world's management of energy resources, Power to the People has been hailed as ""as good a manifesto for the new energy world as you will find."" (Fred Pearce, New Scientist). The Economist's Environment and Energy correspondent, Vijay V. Vaitheeswaran sees great opportunity in the energy realm today, and he documents an energy revolution already under way. From the corporate boardroom of a Texas oil titan who denies the reality of global warming, to a think tank nestled in the Rocky Mountains where a visionary named Amory Lovins is developing hydrogen fuel-cell technology that could make the internal combustion engine obsolete, Vaitheeswaran gamely pursues the people who hold the keys to our future. Avoiding the traditional divide that pits free markets against the wisdom of conservation and the need for clean energy, Power to the People debunks myths without debunking hope.","368 pages, Paperback",Nonfiction,8 follower,10 reviews,6,2 (2%),11 (13%),33 (40%),28 (34%),8 (9%)
A Bend in Time,Michelle  Miles,11,ratings3,"November 7, 2006","A girl...a hit man...and a time machine.When hitman Dane Fortune was hired to kill the beautiful and sassy Skye Ransom, he never counted on her leading him on a game of cat and mouse through time...or that he'd just as soon kiss her as kill her.When Skye Ransom finds her parents murdered, she learns a hit man is responsible and she's his next target. While trying to outrun her would-be murderer, she inadvertently transports herself back in time. Her biggest problem? Sexy Dane Fortune follows her to carry out his hit...or has he?","212 pages, Paperback",favorites,171 follower,3 reviews,46,0 (0%),0 (0%),2 (18%),4 (36%),5 (45%)
Earth (The Book): A Visitor's Guide to the Human Race,Jon   Stewart,"27,143","ratings1,232","September 1, 2010","The eagerly awaited new book from the Emmy-winning, Oscar-hosting, Daily Show- anchoring Jon Stewart--the man behind the megaseller America (The Book) .Where do we come from? Who created us? Why are we here? These questions have puzzled us since the dawn of time, but when it became apparent to Jon Stewart and the writers of The Daily Show that the world was about to end, they embarked on a massive mission to write a book that summed up the human race: What we looked like; what we accomplished; our achievements in society, government, religion, science and culture -- all in a tome of approximately 256 pages with lots of color photos, graphs and charts.After two weeks of hard work, they had their book. Earth (The Book) is the definitive guide to our species. With their trademark wit, irreverence, and intelligence, Stewart and his team will posthumously answer all of life's most hard-hitting questions, completely unburdened by objectivity, journalistic integrity, or even accuracy.","246 pages, Hardcover",Humor,"1,114 follower","1,232 reviews",10,648 (2%),"1,596 (5%)","6,310 (23%)","9,838 (36%)","8,751 (32%)"
Dogside Story,Patricia Grace,232,ratings29,"January 1, 2001","There is conflict in the whanau. The young man, Te Rua, holds a 'secret for life, the one to die with'. But he realises that if he is to acknowledge and claim his daughter, the secret will have to be told.'The Sisters' are threatening to drag the whanau through the courts. But why? What is really going on?This rich and dramatic novel, threaded with humour, by one of New Zealand's finest writers presents a powerful picture of Maori in modern times.","312 pages, Paperback",Fiction,145 follower,29 reviews,60,10 (4%),19 (8%),74 (31%),70 (30%),59 (25%)
The Sword Thief,Peter Lerangis,"50,535","ratings1,425","April 1, 2009","Amy and Dan Cahill have been located once again, this time in the company of the notoriously unreliable Alistair Oh. Could they have been foolish enough to make an alliance?Spies report that Amy and Dan seem to be tracking the life of one of the most powerful fighters the world has ever known. If this fearsome warrior was a Cahill, his secrets are sure to be well-guarded... and the price to uncover them just might be lethal.","156 pages, Hardcover",Mystery,776 follower,"1,425 reviews",141,"1,640 (3%)","3,198 (6%)","12,261 (24%)","15,154 (29%)","18,282 (36%)"
Khan: Empire of Silver,Conn Iggulden,"14,604",ratings522,"December 28, 2010","The Great Khan is dead. His vast empire hangs in the balance, an empire he forged with raw courage, guile, tactical brilliance, unswerving dedication to his people, and the force of his own indomitable will. Now the very qualities that united the fierce Mongol tribes threaten to tear them apart, as the heirs of Genghis maneuver for dominance. In the end, only one can command ... THE EMPIRE OF SILVER Conn Iggulden’s #1 internationally bestselling epics of historical fiction have enthralled millions of readers around the world. In his spectacular novels about the life and legacy of Genghis Khan, he has traced the path of the legendary conqueror from the harsh grasslands of his youth to the pinnacle of an unprecedented empire. Now, even as they struggle for supremacy among themselves, Genghis’s sons and grandsons extend the reach of his vision, taking their armies farther than ever before, into southern China and across the steppes and rugged mountains of Russia to the vulnerable heart of Europe, where they will face the most courageous warriors the West commands. Genghis’s tough and canny heir, Ogedai, is on the verge of being proclaimed the new Khan. But Ogedai has mysteriously delayed his coronation ceremony to complete a fantastic project many deem a folly: the building of Karakorum, a magnificent city amid the wild plains. His puzzling decision emboldens his arrogant brother Chagetai to violently challenge him, while their noble sibling Tolui and his beautiful, wily wife, Sorhatani, will be caught between the two.Chagetai’s attempt at rebellion reveals shocking truths about Ogedai’s health and imperiled future. As one brother awaits his fate, another awaits his moment to seize power, while spies and assassins play out the ambitions and destinies of their masters. With his celebrated synthesis of riveting storytelling and peerless historical detail, Conn Iggulden takes his saga of the great Mongol khans to unforgettable new heights, bringing these fabled conquerors and their singular people to vivid life for a new generation of readers.","387 pages, Hardcover",Historical Fiction,"5,342 follower",522 reviews,115,39 (<1%),177 (1%),"1,666 (11%)","5,622 (38%)","7,100 (48%)"
Odd Apocalypse,Dean Koontz,"28,688","ratings2,308","January 1, 2012","Once presided over by a Roaring ’20s Hollywood mogul, the magnificent West Coast estate known as Roseland now harbors a reclusive billionaire financier and his faithful servants — and their guests: Odd Thomas, the young fry cook who sees the dead and tries to help them, and Annamaria, his inscrutably charming traveling companion. Fresh from a harrowing clash with lethal adversaries, they welcome their host’s hospitality. But Odd’s extraordinary eye for the uncanny detects disturbing secrets that could make Roseland more hell than haven.Soon enough the house serves up a taste of its terrors, as Odd begins to unravel the darkest mystery of his curious career. What consequences await those who confront evil at its most profound? Odd only knows.","464 pages, Paperback",Horror,36.2k follower,"2,308 reviews",918,335 (1%),"1,439 (5%)","6,488 (22%)","10,455 (36%)","9,971 (34%)"
That Perfect Someone,Johanna Lindsey,"7,609",ratings385,"June 15, 2010","Returning to the world of her beloved Malory family, #1 New York Times bestselling author Johanna Lindsey sweeps readers away on a seductive adventure in which a detested marriage contract turns childhood enemies into passionate lovers.Nine years ago, Richard Allen fled England and his controlling father. Determined to live his own life, he took to the sea and settled in the Caribbean, joining a band of treasure-hunting pirates and adopting the persona of a carefree, seductive Frenchman named Jean Paul to guard the secrets of his past. When he slips back into England to carry out an urgent task, Richard becomes infatuated with a married woman, Georgina Malory. But his reckless attempt to woo Georgina at a masked ball turns out to be the worst mistake of his life because it brings him face to face with another beautiful woman.Thrilled that her solicitors have finally come up with a way to free her from her betrothal contract to the Earl of Manford’s son who abandoned her years ago, heiress Julia Miller is ready for the marriage mart and hopes to find that perfect someone at her friend Georgina’s ball. Charmed by a masked Frenchman who gives her her first kiss, she can’t help but pursue this mysterious man—until she makes a shocking discovery. Now, to avoid falling into a ruthless nobleman’s trap, Julia must enter a risky, intimate charade with a man she never believed she could love.","384 pages, Hardcover",Historical Romance,"6,880 follower",385 reviews,157,92 (1%),372 (4%),"1,741 (22%)","2,631 (34%)","2,773 (36%)"
Practicing New Historicism,Catherine Gallagher,129,ratings9,"June 15, 2000","For almost twenty years, new historicism has been a highly controversial and influential force in literary and cultural studies. In Practicing the New Historicism, two of its most distinguished practitioners reflect on its surprisingly disparate sources and far-reaching effects.In lucid and jargon-free prose, Catherine Gallagher and Stephen Greenblatt focus on five central aspects of new recurrent use of anecdotes, preoccupation with the nature of representations, fascination with the history of the body, sharp focus on neglected details, and skeptical analysis of ideology. Arguing that new historicism has always been more a passionately engaged practice of questioning and analysis than an abstract theory, Gallagher and Greenblatt demonstrate this practice in a series of characteristically dazzling readings of works ranging from paintings by Joos van Gent and Paolo Uccello to Hamlet and Great Expectations.By juxtaposing analyses of Renaissance and nineteenth-century topics, the authors uncover a number of unexpected contrasts and connections between the two periods. Are aspects of the dispute over the Roman Catholic doctrine of the Eucharist detectable in British political economists' hostility to the potato? How does Pip's isolation in Great Expectations shed light on Hamlet's doubt?Offering not only an insider's view of new historicism, but also a lively dialogue between a Renaissance scholar and a Victorianist, Practicing the New Historicism is an illuminating and unpredictable performance by two of America's most respected literary scholars.""Gallagher and Greenblatt offer a brilliant introduction to new historicism. In their hands, difficult ideas become coherent and accessible.""— Choice""A tour de force of new literary criticism. . . . Gallagher and Greenblatt's virtuoso readings of paintings, potatoes (yes, spuds), religious ritual, and novels—all 'texts'—as well as essays on criticism and the significance of anecdotes, are likely to take their place as model examples of the qualities of the new critical school that they lead. . . . A zesty work for those already initiated into the incestuous world of contemporary literary criticism-and for those who might like to see what all the fuss is about.""— Kirkus Reviews , starred review","259 pages, Paperback",Nonfiction,2 follower,9 reviews,17,6 (4%),8 (6%),41 (31%),51 (39%),23 (17%)
