Title,Authors,Avg Ratings,Rating,first_published,Description,Total_Pages,Genre,author_followers,no_of_reviews,no_book_by_author,one_star_ratings,two_star_ratings,three_star_ratings,four_star_ratings,five_star_ratings
Connect The Dots,Rashmi Bansal,"6,410",ratings267,"First published April 14, 2010","What ties the 20 true-life protagonists of the book together is that they are all entrepreneurs - but without the much coveted MBA degree. Written in conversational form, the book is divided into three sections - Jugaad, Junoon and Zubaan. The author speaks to people from different parts of the country who have carved a niche for themselves in different areas of business.Jugaad covers the stories of those who used grit and determination even as they observed and experimented to create a business on the road less travelled. The nine stories covered in this section give us a glimpse of the steely resolve of people who tried to do things differently from what others in their chosen industry normally do.The second section Junoon details the growth of seven entrepreneurs who were driven by a dream or a passion. They followed their interests, did not give up on their dreams and succeeded in creating ventures that were not only unique but which successfully tapped a market that nobody even knew existed.Zubaan gives us an insight into the mindset that allowed four extremely creative people who successfully channeled their immense talents to create a business platform for themselves. By tapping their talent successfully, these creative people become entrepreneurs in their own right.The book is inspirational as the readers are sure to get totally involved in the unique spirit that drove these people to the heights of success. The title of the book is inspired by Apple founder, Steve Jobs' commencement speech given at Stanford University in 2005. In his speech, Jobs said, 'You can't connect the dots by looking forward; you can only connect them looking backwards. So you have to trust in something...your gut, destiny, life, karma...'Connect the Dots tells us the story of people who trusted in themselves and grew to be truly inspirational success stories.About the AuthorRashmi Bansal is an Economics graduate from Mumbai's Sophia College. She also did her MBA from IIM Ahmad","305 pages, Paperback",Nonfiction,528 followers,267 reviews,41 books528 followers,92 (1%),367 (5%),"1,893 (29%)","2,662 (41%)","1,396 (21%)"
Diary,Chuck Palahniuk,"77,924","ratings2,804","First published August 26, 2003","Misty Wilmot has had it. Once a promising young artist, she’s now stuck on an island ruined by tourism, drinking too much and working as a waitress in a hotel. Her husband, a contractor, is in a coma after a suicide attempt, but that doesn’t stop his clients from threatening Misty with lawsuits over a series of vile messages they’ve found on the walls of houses he remodeled.Suddenly, though, Misty finds her artistic talent returning as she begins a period of compulsive painting. Inspired but confused by this burst of creativity, she soon finds herself a pawn in a larger conspiracy that threatens to cost hundreds of lives. What unfolds is a dark, hilarious story from America’s most inventive nihilist, and Palahniuk’s most impressive work to date.","262 pages, Paperback",Fiction,129k followers,"2,804 reviews",226 books129k followers,"2,102 (2%)","7,448 (9%)","24,038 (30%)","27,028 (34%)","17,308 (22%)"
Ashen Winter,Mike Mullin,"11,446","ratings1,132","First published October 16, 2012","It's been over six months since the eruption of the Yellowstone supervolcano. Alex and Darla have been staying with Alex’s relatives, trying to cope with the new reality of the primitive world so vividly portrayed in Ashfall, the first book in this series. It's also been six months of waiting for Alex's parents to return from Iowa. Alex and Darla decide they can wait no longer and must retrace their journey into Iowa to find and bring back Alex's parents to the tenuous safety of Illinois. But the landscape they cross is even more perilous than before, with life-and-death battles for food and power between the remaining communities. When the unthinkable happens, Alex must find new reserves of strength and determination to survive.","576 pages, Hardcover",Young Adult,"1,652 followers","1,132 reviews","14 books1,652 followers",161 (1%),481 (4%),"2,159 (18%)","4,141 (36%)","4,504 (39%)"
Put Them Through the Maze: The Secrets of How to Write the Ultimate Novel,T.D. McMichael,19,ratings0,"First published August 22, 2013","Takes the aspiring novelist directly into the writer's psyche...Put Them Through the Maze takes you down the rabbit hole, demystifying the process of writing by learning how to SAY IT.Put Them Through the Maze hands down the essential advice to first-time novelists, giving them a proven method to achieve success. Other writing programs put you through a battery of exercises, Put Them Through the Maze does not.In this standalone system, you will learn how to navigate the Maze and to avoid the pitfalls of other first-time novelists. You will learn how to think Story like a professional, destroy writer's block, and to craft outlines of amazing complexity—all without having to think!Told with wit and precision, Put Them Through the Maze is unlike any how-to book you will ever come across on the art and craft of How to Write Creative Fiction Well.","186 pages, Paperback",Writing,23 followers,0 reviews,10 books23 followers,2 (10%),3 (15%),2 (10%),4 (21%),8 (42%)
Foundling,D.M. Cornish,"8,041",ratings754,"First published May 18, 2006","Meet Rossamünd?a foundling, a boy with a girl?s name who is about to begin a dangerous life in the service of the Emperor of the Half-Continent. What starts as a simple journey becomes a dangerous and complicated set of battles and decisions. Humans, monsters, unearthly creatures . . . who among these can Rossamünd trust? D. M. Cornish has created an entirely original world, grounded in his own deft, classically influenced illustrations. Foundling is a magic-laced, Dickensian adventure that will transport the reader.","434 pages, Hardcover",Fantasy,675 followers,754 reviews,19 books675 followers,219 (2%),551 (6%),"1,720 (21%)","2,856 (35%)","2,695 (33%)"
The Sense of Touch,Ron  Parsons,267,ratings77,"First published April 30, 2013","Named to Kirkus Reviews Best Books of 2014Sprung from the variously lush, rugged, and frozen emotional landscapes of the north country, this luminous collection of stories captures the progress of a diverse ensemble of souls as they struggle to uncover themselves and negotiate a meaningful communion, of any kind, with the world around them. A brilliant but troubled Bangladeshi physics student searches for balance, acceptance, and his own extraordinary destiny after his father disappears. When a Halloween blizzard immobilizes Minneapolis, a young woman is forced to confront the snow-bound nature of her own relationships and emotions. During an excursion to an idyllic swimming hole hidden in the Black Hills, two old friends unexpectedly compete for the affections of an irresistible, though married, Lakota woman. Like a mythical expedition to reach the horizon or the quest to distill truth from the beauty around us, the revelation confirmed by these imaginative stories - elegant, sometimes jarring, always wonderfully absurd - is that the very act of reaching is itself a form of touch.“The quiet plains of the North Country serve as a perfect backdrop for Parsons’ moving debut, a collection of short stories whose characters often live deeply solitary, if not always lonely, lives.”-- Kirkus Reviews (starred review)“Eloquently written and replete with a continual stream of un-hackneyed twists and turns, Parsons’ collection is superbly crafted. Engaging, riveting, and at times, mind-boggling, The Sense of Touch is earmarked to become a literary classic.”-- San Francisco Book Review (five-star review)""Parsons has made himself a man to watch in the literary world. Each of these stories is as thrilling as the next."" -- Portland Book Review (five-star review)""Each story is honed with purpose and infused with subtle energies. He creates delicate lines between the frigid cosmos and the warmth that can be generated among people. Parsons' writing has a strong pulse. This debut assortment heralds his promising career."" -- The US Review of Books (Top-Rated Recommended Review)","251 pages, Paperback",Short Stories,157 followers,77 reviews,1 book157 followers,3 (1%),10 (3%),34 (12%),107 (40%),113 (42%)
"Love is the Cure: On Life, Loss, and the End of AIDS",Elton John,923,ratings154,"First published January 1, 2012","A deeply personal account of Elton John's life during the era of AIDS and an inspiring call to action.In the 1980s, Elton John saw friend after friend, loved one after loved one, perish needlessly from AIDS. He befriended Ryan White, a young Indiana boy ostracized because of his HIV infection. Ryan's inspiring life and devastating death led Elton to two realizations: His own life was a mess. And he had to do something to help stop the AIDS crisis.Since then, Elton has dedicated himself to overcoming the plague and the stigma of AIDS. The Elton John AIDS Foundation has raised and donated $275 million to date to fighting the disease worldwide. Love Is the Cure includes stories of Elton's close friendships with Ryan White, Freddie Mercury, Princess Diana, Elizabeth Taylor, and others, and the story of the Elton John AIDS Foundation. Sales of Love Is the Cure benefit the Elton John AIDS Foundation.","259 pages, Hardcover",Nonfiction,574 followers,154 reviews,350 books574 followers,20 (2%),54 (5%),223 (24%),327 (35%),299 (32%)
Hiking to Siberia: Curious Tales of Travel and Travelers,Lawrence Millman,28,ratings8,"First published October 1, 2012","Literary Nonfiction. Travel Writing. In HIKING IN SIBERIA, Lawrence Millman follows the trail of a woman who once tried to walk (and row) from New York City to Siberia. He also gets a ride from an apparent ghost in Iceland and attends a feast in Micronesia where the piece de resistance is fruit bat penis. This stylish, often very funny collection of essays affirms Millman's place among the very best living travel writers.","128 pages, Paperback",Travel,58 followers,8 reviews,49 books58 followers,0 (0%),1 (3%),6 (21%),11 (39%),10 (35%)
Guests on Earth,Lee  Smith,"6,324",ratings957,"First published January 1, 2013","It’s 1936 when orphaned thirteen-year-old Evalina Toussaint is admitted to Highland Hospital, a mental institution in Asheville, North Carolina, known for its innovative treatments for nervous disorders and addictions. Taken under the wing of the hospital’s most notable patient, Zelda Fitzgerald, Evalina witnesses cascading events that lead up to the tragic fire of 1948 that killed nine women in a locked ward, Zelda among them. Author Lee Smith has created, through a seamless blending of fiction and fact, a mesmerizing novel about a world apart--in which art and madness are luminously intertwined.","326 pages, Hardcover",Historical Fiction,915 followers,957 reviews,42 books915 followers,117 (1%),569 (8%),"1,967 (31%)","2,532 (40%)","1,139 (18%)"
Hitch 22: A Memoir,Christopher Hitchens,"21,686","ratings1,476","First published January 1, 2010","Over the course of his 60 years, Christopher Hitchens has been a citizen of both the United States and the United Kingdom. He has been both a socialist opposed to the war in Vietnam and a supporter of the U.S. war against Islamic extremism in Iraq. He has been both a foreign correspondent in some of the world's most dangerous places and a legendary bon vivant with an unquenchable thirst for alcohol and literature. He is a fervent atheist, raised as a Christian, by a mother whose Jewish heritage was not revealed to him until her suicide.  In other words, Christopher Hitchens contains multitudes. He sees all sides of an argument. And he believes the personal is political. This is the story of his life, a life lived large.","435 pages, Hardcover",Nonfiction,"7,366 followers","1,476 reviews","162 books7,366 followers",555 (2%),945 (4%),"3,831 (17%)","8,484 (39%)","7,871 (36%)"
Archangel's Storm,Nalini Singh,"27,452","ratings1,571","First published September 4, 2012","With wings of midnight and an affinity for shadows, Jason courts darkness. But now, with the Archangel Neha’s consort lying murdered in the jewel-studded palace that was his prison and her rage threatening cataclysmic devastation, Jason steps into the light, knowing he must unearth the murderer before it is too late.Earning Neha’s trust comes at a price—Jason must tie himself to her bloodline through the Princess Mahiya, a woman with secrets so dangerous, she trusts no one. Least of all an enemy spymaster.With only their relentless hunt for a violent, intelligent killer to unite them, Jason and Mahiya embark on a quest that leads to a centuries-old nightmare… and to the dark storm of an unexpected passion that threatens to drench them both in blood.","337 pages, Paperback",Paranormal,25.5k followers,"1,571 reviews",255 books25.5k followers,176 (<1%),643 (2%),"3,806 (13%)","9,993 (36%)","12,834 (46%)"
Teach Us to Outgrow Our Madness: 4 Short Novels,Kenzaburō Ōe,"2,529",ratings232,"First published January 1, 1966","These four novels display Oe’s passionate and original vision. Oe was ten when American jeeps first drove into the mountain village where he lived, and his literary work reveals the tension and ambiguity forged by the collapse of values of his childhood on the one hand and the confrontation with American writers on the other. The earliest of his novels included here, Prize Stock, reveals the strange relationship between a Japanese boy and a captured black American pilot in a Japanese village. Teach Us to Outgrow Our Madness tells of the close relationship between an outlandishly fat father and his mentally defective son, Eeyore. Aghwee the Sky Monster is about a young man’s first job — chaperoning a banker’s son who is haunted by the ghost of a baby in a white nightgown. The Day He Himself Shall Wipe My Tears Away is the longest piece in this collection and Oe’s most disturbing work to date. The narrator lies in a hospital bed waiting to die of a liver cancer that he has probably imagined, wearing a pair of underwater goggles covered with dark cellophane.","228 pages, Kindle Edition",Fiction,"1,484 followers",232 reviews,"195 books1,484 followers",47 (1%),156 (6%),651 (25%),"1,008 (39%)",667 (26%)
This Dark Road to Mercy,Wiley Cash,"9,277","ratings1,437","First published January 14, 2014","The critically acclaimed author of the New York Times bestseller A Land More Kind Than Home—hailed as ""a powerfully moving debut that reads as if Cormac McCarthy decided to rewrite Harper Lee's To Kill a Mockingbird"" (Richmond Times Dispatch)—returns with a resonant novel of love and atonement, blood and vengeance, set in western North Carolina, involving two young sisters, a wayward father, and an enemy determined to see him pay for his sins.After their mother's unexpected death, twelve-year-old Easter and her six-year-old sister Ruby are adjusting to life in foster care when their errant father, Wade, suddenly appears. Since Wade signed away his legal rights, the only way he can get his daughters back is to steal them away in the night.Brady Weller, the girls' court-appointed guardian, begins looking for Wade, and he quickly turns up unsettling information linking Wade to a recent armored car heist, one with a whopping $14.5 million missing. But Brady Weller isn't the only one hunting the desperate father. Robert Pruitt, a shady and mercurial man nursing a years-old vendetta, is also determined to find Wade and claim his due.Narrated by a trio of alternating voices, This Dark Road to Mercy is a story about the indelible power of family and the primal desire to outrun a past that refuses to let go.","232 pages, Hardcover",Fiction,"1,512 followers","1,437 reviews","16 books1,512 followers",91 (<1%),453 (4%),"2,679 (28%)","4,180 (45%)","1,874 (20%)"
No Graves As Yet,Anne Perry,"4,090",ratings458,"First published January 1, 2003","Through Anne Perry’s magnificent Victorian novels, millions of readers have enjoyed the pleasures and intrigue of a bygone age. Now, with the debut of an extraordinary new series, this New York Times bestselling author sweeps us into the golden summer of 1914, a time of brief enchantment when English men and women basked in the security of wealth and power, even as the last weeks of their privileged world were swiftly passing. Theirs was a peace that led to war.On a sunny afternoon in late June, Cambridge professor Joseph Reavley is summoned from a student cricket match to learn that his parents have died in an automobile crash. Joseph’s brother, Matthew, as officer in the Intelligence Service, reveals that their father had been en route to London to turn over to him a mysterious secret document—allegedly with the power to disgrace England forever and destroy the civilized world. A paper so damning that Joseph and Matthew dared mention it only to their restless younger sister. Now it has vanished.What has happened to this explosive document, if indeed it ever existed? How had it fallen into the hands of their father, a quiet countryman? Not even Matthew, with his Intelligence connections, can answer these questions. And Joseph is soon burdened with a second tragedy: the shocking murder of his most gifted student, beautiful Sebastian Allard, loved and admired by everyone. Or so it appeared.Meanwhile, England’s seamless peace is cracking—as the distance between the murder of an Austrian archduke by a Serbian anarchist and the death of a brilliant university student by a bullet to the head of grows shorter by the day.Anne Perry is a sublime master of suspense. In No Graves As Yet, her latest haunting masterpiece, she reminds us that love and hate, cowardice and courage, good and evil are always a part of life, in our own time as well as on the eve of the greatest war the world has ever known.From the Hardcover edition.","384 pages, Paperback",Mystery,"3,203 followers",458 reviews,"447 books3,203 followers",131 (3%),351 (8%),"1,161 (28%)","1,475 (36%)",972 (23%)
The Seamstress and the Wind,César Aira,875,ratings119,"First published January 1, 1994","As he runs wildly amok, Aira captures childhood’s treasures ― the reality of the fable and the delirium of invention ― in this hilariously funny book. The Seamstress and the Wind is a deliciously laugh-out-loud-funny novel. A seamstress who is sewing a wedding dress for the pregnant local art teacher fears that her son, while playing in a big semitruck, has been accidentally kidnapped and driven off to Patagonia. Completely unhinged, she calls a local taxi to follow the semi in hot pursuit. When her husband finds out what’s happened, he takes off after wife and child. They race not only to the end of the world, but to adventures in desire ― where the wild Southern wind falls in love with the seamstress, and a monster child takes up with the truck driver. Interspersed are Aira’s musings about memory and childhood, and his hometown of Coronel Pringles, with a compelling view of the hard lot of this working-class town, situated not far from Buenos Aires.","144 pages, Paperback",Fiction,982 followers,119 reviews,223 books982 followers,25 (2%),81 (9%),246 (28%),329 (37%),194 (22%)
Lucky Penny,Catherine Anderson,"2,841",ratings214,"First published January 1, 2012","In this stirring novel of the Old West from New York Times bestselling author Catherine Anderson, a desperate woman's impulsive ruse brings a rough-looking stranger into her life...To support her orphaned niece, impoverished Brianna O'Keefe accepts work with a Colorado rancher. To guard herself from the unwanted attention, she resorts to a harmless little lie: that she's married to a Denver gold miner named David Paxton. When her boss forces her to write her ""husband,"" hoping he'll take Brianna off his hands, she can only pray that there is no real David Paxton who can expose her.When Colorado marshal David Paxton gets a letter from a stranger claiming to be his wife and pleading with him to come for her and his daughter, he dutifully sets out to find this woman and the child he may have sired. What stuns Brianna is the David is convinced the young girl is, in fact, his. As David and Brianna's wary attraction blossoms into deeper desire, David warms to the idea of a ready-made family. But can his dream survive Brianna's lingering distrust—and his own secrets?","413 pages, Mass Market Paperback",Romance,"2,818 followers",214 reviews,"81 books2,818 followers",36 (1%),126 (4%),561 (19%),"1,016 (35%)","1,102 (38%)"
A Holiday Fling,Mary Jo Putney,169,ratings13,"First published March 27, 2011","Romantic Novella, 88 pages Previously titled: A Christmas Fling British actress Jenny Lyme isn't a movie star, but she's well loved in England for her television work. Now her hometown community center is in danger of being sold. The only hope for its salvation is if Jenny can film and sell the Christmas Revels production she's directing. A really good cameraman is needed-and she knows just the one.... Greg Marino is a top Hollywood cinematographer with an Oscar in his kitchen to prove it. He also has fond memories of the fling he once had with Jenny Lyme when they worked together on a disastrous movie. So when Jenny calls and asks Greg to film her Christmas show, he decides it'd be a fun break... and really, really nice to see Jenny again. But how can they build a life together when both have demanding careers thousands of miles apart? STARTING OVER SERIES, in orderStirring the EmbersPhoenix FallingAn Imperfect ProcessA Holiday Fling (novella)",ebook,Romance,"2,191 followers",13 reviews,"130 books2,191 followers",2 (1%),8 (4%),44 (26%),59 (34%),56 (33%)
أن تكون هستيرياً,Heba El Saeid Mohammed,389,ratings128,"First published August 11, 2013","لا أريدك أن تشعر أنني كائن مختل أو يعاني خللاً عقلياً قد يودي بحياتك , فأنا كائن مسالم خارجياً شديد التصارع داخلياً , عالمي كله يكمن في عقلي وأفكاري و ما أشعر به من مشاعر سطحية في معظمها , يدور عالمي حول نفسي , ذاتي هي ما أحارب في معظم حالاتي و في نفس الوقت هي الأنيس الوحيد لي في وحدتي , و السبب في أن أظل حياً حتى لحظة كتابة هذه السطور .... للتحميلhttp://www.mediafire.com/download/dxk...http://www.mediafire.com/download/p97...http://www.4shared.com/office/zbFAgxh...","55 pages, ebook",Psychology,330 followers,128 reviews,3 books330 followers,43 (11%),95 (24%),119 (30%),93 (23%),39 (10%)
Lucky Man,Michael J. Fox,"27,359","ratings1,676","First published January 1, 2002","In September 1998, Michael J. Fox stunned the world by announcing he had been diagnosed with Parkinson's disease -- a degenerative neurological condition. In fact, he had been secretly fighting it for seven years. The worldwide response was staggering. Fortunately, he had accepted the diagnosis, and by the time the public started grieving for him, he had stopped grieving for himself. Now, with the same passion, humor, and energy, that Fox has invested in his dozens of performances over the last 18 years, he tells the story of his life, his career, and his campaign, to find a cure for Parkinson's.Combining his trademark ironic sensibility, and keen sense of the absurd, he recounts his life -- from his childhood in a small town in western Canada, to his meteoric rise in film and television which made him a worldwide celebrity. Most importantly however, he writes of the last 10 years, during which -- with the unswerving support of his wife, family, and friends -- he has dealt with his illness. He talks about what Parkinson's has given him: the chance to appreciate a wonderful life and career, and the opportunity to help search for a cure, and spread public awareness of the disease. He is a very lucky man, indeed.","260 pages, Hardcover",Nonfiction,926 followers,"1,676 reviews",23 books926 followers,465 (1%),973 (3%),"4,885 (17%)","11,080 (40%)","9,956 (36%)"
The Philosopher and the Wolf,Mark Rowlands,"3,016",ratings314,"First published January 1, 2008","This fascinating book charts the relationship between Mark Rowlands, a rootless philosopher, and Brenin, his well-traveled wolf. After acquiring Brenin as a cub, it quickly became apparent that Brenin was never to be left alone, as the consequences to Mark’s house and its contents were dire. As a result, Brenin and Mark went everywhere together—from classroom lecture to Ireland, England, and France. More than just an exotic pet, Brenin exerted an immense influence on Rowlands as both a person, and, strangely enough, as a philosopher, leading him to re-evaluate his attitude to love, happiness, nature and death. By turns funny (what do you do when your wolf eats your air-conditioning unit?) and poignant, this life-affirming book will make you reappraise what it means to be human.","256 pages, Hardcover",Philosophy,125 followers,314 reviews,39 books125 followers,39 (1%),131 (4%),497 (16%),"1,046 (34%)","1,303 (43%)"
