Title,Authors,Avg Ratings,Rating,first_published,Description,Total_Pages,Genre,author_followers,no_of_reviews,no_book_by_author,one_star_ratings,two_star_ratings,three_star_ratings,four_star_ratings,five_star_ratings
Wallbanger,Alice Clayton,"206,710","ratings15,307","November 27, 2012","The first night after Caroline moves into her fantastic new San Francisco apartment, she realizes she's gaining an intimate knowledge of her new neighbor's nocturnal adventures. Thanks to paper-thin walls and the guy's athletic prowess, she can hear not just his bed banging against the wall but the ecstatic response of what seems (as loud night after loud night goes by) like an endless parade of women. And since Caroline is currently on a self-imposed dating hiatus, and her neighbor is clearly lethally attractive to women, she finds her fantasies keep her awake even longer than the noise. So when the wallbanging threatens to literally bounce her out of bed, Caroline, clad in sexual frustration and a pink baby-doll nightie, confronts Simon Parker, her heard-but-never-seen neighbor. The tension between them is as thick as the walls are thin, and the results just as mixed. Suddenly, Caroline is finding she may have discovered a whole new definition of neighborly...In a delicious mix of silly and steamy, Alice Clayton dishes out a hot and hilarious tale of exasperation at first sight...","384 pages, Paperback",Romance,15.7k follower,"15,307 reviews",26,"6,861 (3%)","13,098 (6%)","38,540 (18%)","65,350 (31%)","82,861 (40%)"
The Vital Abyss,James S.A. Corey,"16,212",ratings869,"October 15, 2015","From New York Times bestselling author James S. A. Corey . . .
Somewhere in the vast expanse of space, a group of prisoners lives in permanent captivity.The only company they have is each other and the Belters who guard them. The only stories they know are the triumphs and crimes that brought them there. The only future they see is an empty life in an enormous room.And then the man from Mars came along . . .Set in the hard-scrabble solar system of the Expanse, The Vital Abyss deepens James S. A. Corey's acclaimed series.","75 pages, ebook",Science Fiction,21.7k follower,869 reviews,72,105 (<1%),627 (3%),"4,389 (27%)","6,704 (41%)","4,387 (27%)"
The Crooked Staircase,Dean Koontz,"13,006","ratings1,413","May 8, 2018","Jane Hawk -- who dazzled readers in The Silent Corner and The Whispering Room -- faces the fight of her life, against the threat of a lifetime in this electrifying new thriller by #1 New York Times bestselling suspense master Dean Koontz. ""I could be dead tomorrow. Or something worse than dead."" Jane Hawk knows she may be living on borrowed time. But as long as she's breathing, she'll never cease her one-woman war against the terrifying conspiracy that threatens the freedom--and free will--of millions. Battling the strange epidemic of murder-suicides that claimed Jane's husband, and is escalating across the country, has made the rogue FBI agent a wanted fugitive, relentlessly hunted not only by the government but by the secret cabal behind the plot. Deploying every resource their malign nexus of power and technology commands, Jane's enemies are determined to see her dead . . . or make her wish she was. Jane's ruthless pursuers can't stop her from drawing a bead on her prey: a cunning man with connections in high places, a twisted soul of unspeakable depths with an army of professional killers on call. Propelled by her righteous fury and implacable insistence on justice, Jane will make her way from southern California to the snow-swept slopes of Lake Tahoe to confront head-on the lethal forces arrayed against her. But nothing can prepare her for the chilling truth that awaits when she descends the crooked staircase to the dark and dreadful place where her long nightmare was born.","491 pages, Hardcover",Thriller,36.2k follower,"1,413 reviews",918,163 (1%),464 (3%),"2,131 (16%)","5,284 (40%)","4,964 (38%)"
The Serpent of Venice,Christopher Moore,"16,124","ratings1,758","April 22, 2014","New York Times bestselling author Christopher Moore channels William Shakespeare and Edgar Allan Poe in this satiric Venetian gothic that brings back the Pocket of Dog Snogging, the eponymous hero of Fool, along with his sidekick, Drool, and pet monkey, JeffVenice, a long time ago. Three prominent Venetians await their most loathsome and foul dinner guest, the erstwhile envoy of Britain and France, and widower of the murdered Queen Cordelia: the rascal-Fool Pocket.This trio of cunning plotters-the merchant, Antonio; the senator, Montressor Brabantio; and the naval officer, Iago-have lured Pocket to a dark dungeon, promising an evening of sprits and debauchery with a rare Amontillado sherry and Brabantio's beautiful daughter, Portia.But their invitation is, of course, bogus. The wine is drugged. The girl isn't even in the city limits. Desperate to rid themselves once and for all of the man who has consistently foiled their grand quest for power and wealth, they have lured him to his death. (How can such a small man, be such a huge obstacle?). But this Fool is no fool . . . and he's got more than a few tricks (and hand gestures) up his sleeve.","326 pages, Hardcover",Fiction,90.4k follower,"1,758 reviews",94,352 (2%),823 (5%),"3,826 (23%)","6,596 (40%)","4,527 (28%)"
Zita the Spacegirl,Ben Hatke,"18,303","ratings1,428","February 1, 2011","A NEW YORK TIMES BESTSELLERZita's life took a cosmic left turn in the blink of an eye.When her best friend is abducted by an alien doomsday cult, Zita leaps to the rescue and finds herself a stranger on a strange planet. Humanoid chickens and neurotic robots are shocking enough as new experiences go, but Zita is even more surprised to find herself taking on the role of intergalactic hero. Before long, aliens in all shapes and sizes don't even phase her. Neither do ancient prophecies, doomed planets, or even a friendly con man who takes a mysterious interest in Zita's quest.Zita the Spacegirl is a fun, captivating tale of friendship and redemption from Flight veteran Ben Hatke. It also has more whimsical, eye-catching, Miyazaki-esque monsters than you can shake a stick at.","186 pages, Paperback",Graphic Novels,"1,161 follower","1,428 reviews",49,466 (2%),848 (4%),"3,203 (17%)","5,672 (30%)","8,114 (44%)"
The Mighty Miss Malone,Christopher Paul Curtis,"15,689","ratings1,466","January 10, 2012","“We are a family on a journey to a place called wonderful” is the motto of Deza Malone’s family.Deza is the smartest girl in her class in Gary, Indiana, singled out by teachers for a special path in life. But the Great Depression hit Gary hard, and there are no jobs for black men. When her beloved father leaves to find work, Deza, Mother, and her older brother Jimmie go in search of him, and end up in a Hooverville outside Flint, Michigan. Jimmie’s beautiful voice inspires him to leave the camp to be a performer, while Deza and Mother find a new home, and cling to the hope that they will find Father.The twists and turns of their story reveal the devastation of the Depression and prove that Deza truly is the Mighty Miss Malone.","320 pages, Hardcover",Historical Fiction,"1,131 follower","1,466 reviews",48,374 (2%),581 (3%),"2,479 (15%)","5,457 (34%)","6,798 (43%)"
Last Light,Terri Blackstock,"12,300",ratings920,"January 1, 2005","In the face of a crisis that sweeps an entire high-tech planet back to the age before electricity, Deni Branning's career ambitions have vanished. She's not about to let her dream of marriage go as well.But keeping it alive will require extraordinary measures. Yesterday's world is gone. All Deni and her family have left is each other and their neighbors. Their little community will either stand or fall together. But they're only beginning to realize it - and trust doesn't come easily.Particularly when one of them is a killer.Best-selling suspense author Terri Blackstock weaves a masterful what-if novel in which global catastrophe reveals the darkness in human hearts - and lights the way to restoration for a self-centered world.","381 pages, Paperback",Christian Fiction,"4,828 follower",920 reviews,146,273 (2%),490 (3%),"1,800 (14%)","3,913 (31%)","5,824 (47%)"
Etty Hillesum: A Life Transformed,Patrick Woodhouse,234,ratings19,"January 29, 2009","On 8 March 1941, a 27-year-old Jewish Dutch student living in Nazi-occupied Amsterdam made the first entry in a diary that was to become one of the most remarkable documents to emerge from the Nazi Holocaust. Over the course of the next two and a half years, an insecure, chaotic and troubled young woman was transformed into someone who inspired those with whom she shared the suffering of the transit camp at Westerbork and with whom she eventually perished at Auschwitz. Through her diary and letters, she continues to inspire those whose lives she has touched since. She was an extraordinarily alive and vivid young woman who shaped and lived a spirituality of hope in the darkest period of the twentieth century. This book explores Etty Hillesum's life and writings, seeking to understand what it was about her that was so remarkable, how her journey developed, how her spirituality was shaped, and what her profound reflections on the roots of violence and the nature of evil can teach us today.","160 pages, Paperback",History,4 follower,19 reviews,7,2 (<1%),4 (1%),18 (7%),64 (27%),146 (62%)
Hotel World,Ali Smith,"7,077",ratings763,"April 25, 2001","Five disparate voices inhabit Ali Smith's dreamlike, mesmerising Hotel World, set in the luxurious anonymity of the Global Hotel, in an unnamed northern English city. The disembodied yet interconnected characters include Sara, a 19-year-old chambermaid who has recently died at the hotel; her bereaved sister, Clare, who visits the scene of Sara's death; Penny, an advertising copywriter who is staying in the room opposite; Lise, the Global's depressed receptionist; and the homeless Else who begs on the street outside. Smith's ambitious prose explores all facets of language and its uses. Sara takes us through the moment of her exit from the world and beyond; in her desperate, fading grip on words and senses she gropes to impart the meaning of her death in what she terms ""the lift for dishes""--then comes a flash of clarity: ""That's the name for it, the name for it; that's it; dumb waiter dumb waiter dumb waiter."" Blended with hers are other voices: Penny's bland journalese and Else's obsession with metaphysical poetry.  Hotel World is not an easy read: disturbing and witty by turns, with its stream-of-consciousness narrators reminiscent of Virgina Woolf's The Waves, its deceptively rambling language is underpinned by a formal construction. Exploring the ""big themes"" of love, death and millennial capitalism, it takes as its starting point Muriel Spark's Momento Mori (""Remember you must die"") and counteracts this axiom with a resolute ""Remember you must live"". Ali Smith's novel is a daring, compelling, and frankly spooky read. --Catherine Taylor","238 pages, Paperback",Fiction,"4,593 follower",763 reviews,148,267 (3%),771 (10%),"2,063 (29%)","2,506 (35%)","1,470 (20%)"
Lawless World: Making And Breaking Global Rules,Philippe Sands,153,ratings10,"February 24, 2005","International lawyer Philippe Sands has a unique insider's view of the elites who govern our lives. His sensational revelations in Lawless World changed the political agenda overnight, forcing Tony Blair to publish damning material that he'd tried to hide. Now, in this updated edition with a shocking new chapter, you can get the full story of how the US and UK governments are riding roughshod over international agreements on human rights, war, torture and the environment - the very laws they put in place. Here sands looks at why global rules matter for all of us. And he powerfully makes the case for preserving them ...before justice becomes history.",Paperback,Politics,427 follower,10 reviews,40,1 (<1%),6 (3%),32 (20%),71 (46%),43 (28%)
Shakespeare's Ideas,David Bevington,20,ratings5,"August 25, 2008","An in-depth exploration, through his plays and poems, of the philosophy of Shakespeare as a great poet, a great dramatist and a ""great mind"".","248 pages, Paperback",Literary Criticism,6 follower,5 reviews,99,0 (0%),1 (5%),8 (40%),7 (35%),4 (20%)
The Wilderness Warrior: Theodore Roosevelt and the Crusade for America,Douglas Brinkley,"2,210",ratings264,"July 28, 2009","""Douglas Brinkley brings to this magnificent story of Theodore Roosevelt's crusade on behalf of America's national parks the same qualities that made TR so fascinating a figure—an astonishing range of knowledge, a superb narrative skill, a wonderfully vivid writing style and an inexhaustible energy."" —Doris Kearns Goodwin, author of Team of RivalsA vast, inspiring, and enormously entertaining book.” — New York Times Book ReviewFrom New York Times bestselling historian Douglas Brinkley comes a sweeping historical narrative and eye-opening look at the pioneering environmental policies of President Theodore Roosevelt, avid bird-watcher, naturalist, and the founding father of America’s conservation movement—now approaching its 100th anniversary.","960 pages, Hardcover",History,361 follower,264 reviews,120,39 (1%),99 (4%),394 (17%),838 (37%),840 (38%)
Transition,Iain M. Banks,"10,789",ratings718,"September 3, 2009","There is a world that hangs suspended between triumph and catastrophe, between the dismantling of the Wall and the fall of the Twin Towers, frozen in the shadow of suicide terrorism and global financial collapse. Such a world requires a firm hand and a guiding light. But does it need the Concern: an all-powerful organization with a malevolent presiding genius, pervasive influence and numberless invisible operatives in possession of extraordinary powers?Among those operatives are Temudjin Oh, of mysterious Mongolian origins, an un-killable assassin who journeys between the peaks of Nepal, a version of Victorian London and the dark palaces of Venice under snow; Adrian Cubbish, a restlessly greedy City trader; and a nameless, faceless state-sponsored torturer known only as the Philosopher, who moves between time zones with sinister ease. Then there are those who question the Concern: the bandit queen Mrs. Mulverhill, roaming the worlds recruiting rebels to her side; and Patient 8262, under sedation and feigning madness in a forgotten hospital ward, in hiding from a dirty past.There is a world that needs help; but whether it needs the Concern is a different matter.","404 pages, Hardcover",Science Fiction,"5,768 follower",718 reviews,39,197 (1%),648 (6%),"2,551 (23%)","4,397 (40%)","2,996 (27%)"
The Big Rewind: A Memoir Brought to You by Pop Culture,Nathan Rabin,805,ratings114,"June 30, 2009","From the head writer at The Onion A.V. Club , a painfully funny memoir as seen through the sturdy prism of pop culture—for fans of Chuck Klosterman and Augusten Burroughs. As a child and teenager, Nathan Rabin viewed pop culture as a life-affirming form of escape. As an adult, pop culture became his life. For more than a decade he’s served as head writer for The Onion A.V. Club , and here, by way of music, books, films, and television, he shares his too-strange-for-fiction life story. Using a specific book, song, album, film, or television show as a springboard to discuss a period in his life, Rabin recounts his Dickensian upbringing with biting wit and brutal, perhaps unwise candor. Throughout a traumatic childhood that sent him ricocheting from a mental hospital to a foster home to a group home for emotionally disturbed adolescents, Rabin reveals that not only did pop culture shape and mold him, it helped save him from suicidal depression, institu- tionalization, and parental abandonment. Perhaps the most entertaining book ever written about depression and sweet, sweet sexual humiliation, The Big Rewind is also an emotional tale of a motherless child’s search for family and acceptance and a darkly comic valentine to Rabin’s irascible, lovable, hard-luck dad. Featuring unexpected cameos by Billy Bob Thornton, a vomiting Topher Grace, and some dude named Barack Obama, The Big Rewind chronicles the surreal journey of Rabin’s life, and its intersection with the dizzying, maddening, wonderful world of entertainment.","368 pages, Hardcover",Memoir,185 follower,114 reviews,21,32 (3%),122 (15%),284 (35%),272 (33%),95 (11%)
The Queen Mother: The Official Biography,William Shawcross,"2,153",ratings255,"January 1, 2009","The official and definitive biography of Queen Elizabeth the Queen Mother: consort of King George VI, mother of Queen Elizabeth II, grandmother of Prince Charles—and the most beloved British monarch of the twentieth century.Elizabeth Angela Marguerite Bowes-Lyon—the ninth of the Earl of Strathmore’s ten children—was born on August 4, 1900, and, certainly, no one could have imagined that her long life (she died in 2002) would come to reflect a changing nation over the course of an entire century. Now, William Shawcross—given unrestricted access to the Queen Mother’s personal papers, letters, and diaries—gives us a portrait of unprecedented vividness and detail. Here is the girl who helped convalescing soldiers during the First World War . . . the young Duchess of York helping her reluctant husband assume the throne when his brother abdicated . . . the Queen refusing to take refuge from the bombing of London, risking her own life to instill courage and hope in others who were living through the Blitz . . . the dowager Queen—the last Edwardian, the charming survivor of a long-lost era—representing her nation at home and abroad . . . the matriarch of the Royal Family and “the nation’s best-loved grandmother.”A revelatory royal biography that is, as well, a singular history of Britain in the twentieth century.","1096 pages, Hardcover",Biography,32 follower,255 reviews,31,32 (1%),116 (5%),443 (20%),781 (36%),781 (36%)
Full Circle,Rachel Roberts,623,ratings31,"January 1, 2010","Web of Magic Book 12, Full Circle by Rachel Roberts Avalon Needs a Hero! It started with a quest to find the home of all Avalon. It may end in darkness. Three girls, Emily, Adriane, and Kara, their fates set long ago, were to become mages. They were to discover the secrets of Avalon and save their animal friends. They failed. Now, the Gates of Avalon are locked, beloved friends are doomed, and the Dark Sorceress reigns supreme. There may be one final chance to fulfill their destiny. But it will take the strength of a warrior, the fire of a blazing star, and the heart of a healer. The mages must put everything they love on the line―and be prepared to sacrifice all―as the final battle for Avalon begins!","216 pages, Paperback",Fantasy,259 follower,31 reviews,70,2 (<1%),16 (2%),61 (9%),167 (26%),377 (60%)
Diamond Willow,Helen Frost,"3,277",ratings479,"April 1, 2008","There'smore to me thanmost peoplesee.Twelve-year-old Willow would rather blend in than stick out. But she still wants to be seen for who she is. She wants her parents to notice that she is growing up. She wants her best friend to like her better than she likes a certain boy. She wants, more than anything, to mush the dogs out to her grandparents' house, by herself, with Roxy in the lead. But sometimes when it's just you, one mistake can have frightening consequences . . . And when Willow stumbles, it takes a surprising group of friends to help her make things right again.Using diamond-shaped poems inspired by forms found in polished diamond willow sticks, Helen Frost tells the moving story of Willow and her family. Hidden messages within each diamond carry the reader further, into feelings Willow doesn't reveal even to herself.Diamond Willow is a 2009 Bank Street - Best Children's Book of the Year.","128 pages, Hardcover",Poetry,210 follower,479 reviews,158,75 (2%),182 (5%),658 (20%),"1,116 (34%)","1,246 (38%)"
Oz: The Wonderful Wizard of Oz,Eric Shanower,"26,036",ratings649,"September 1, 2009","The premiere American fantasy adventure gets the Merry Marvel treatment! Eisner Award-winning writer/artist Eric Shanower (Age of Bronze) teams up with fan-favorite artist Skottie Young (New X-Men) to bring L. Frank Baum's beloved classic to life! When Kansas farm girl Dorothy flies away to the magical Land of Oz, she fatally flattens a Wicked Witch, liberates a living Scarecrow and is hailed by the Munchkin people as a great sorceress...but all she really wants to know is: how does she get home?","192 pages, Hardcover",Graphic Novels,202 follower,649 reviews,347,626 (2%),"1,142 (4%)","4,748 (18%)","8,152 (31%)","11,368 (43%)"
Sabotaged,Margaret Peterson Haddix,"12,321",ratings856,"January 1, 2010","After helping Chip and Alex survive 15th century London, Jonah and Katherine are summoned to help another missing child, Andrea, face her fate. Andrea is really Virginia Dare, from the Lost Colony of Roanoke. Jonah and Katherine are confident in their ability to help Andrea fix history, but when their journey goes dangerously awry, they realize that they may be in over their head. They've landed in the wrong time period. Andrea doesn't seem that interested in leaving the past. And even worse, it appears that someone has deliberately sabotaged their mission...","377 pages, Hardcover",Science Fiction,"6,027 follower",856 reviews,103,136 (1%),705 (5%),"3,070 (24%)","4,272 (34%)","4,138 (33%)"
Refugee Boy,Benjamin Zephaniah,"3,575",ratings323,"August 1, 2001","Alem is on holiday with his father for a few days in London. He has never been out of Ethiopia before and is very excited. They have a great few days togther until one morning when Alem wakes up in the bed and breakfast they are staying at to find the unthinkable. His father has left him. It is only when the owner of the bed and breakfast hands him a letter that Alem is given an explanation. Alem's father admits that because of the political problems in Ethiopia both he and Alem's mother felt Alem would be safer in London - even though it is breaking their hearts to do this. Alem is now on his own, in the hands of the social services and the Refugee Council. He lives from letter to letter, waiting to hear from his father, and in particular about his mother, who has now gone missing... A powerful, gripping new novel from the popular Benjamin Zephaniah.","304 pages, Paperback",Fiction,372 follower,323 reviews,69,109 (3%),273 (7%),997 (27%),"1,289 (36%)",907 (25%)
Cethe,Becca  Abbott,"1,375",ratings122,"January 1, 2009","Human-like, but not human, the nara ruled Tanyrin for centuries. The most feared among them were their naragi, sorcerers whose power was all but invincible. Not until the coming of Arami Lothlain, King of Tanyrin and Blessed of Loth, did the rein of the nara come to a bloody end. For four hundred years afterwards, the land was at peace.Stefn Eldering was the youngest son of the Earl of Shia, the last in a long, proud line of demon hunters. He was also a sin-catcher, living proof of God's displeasure, the shame of his existence atonement for the sins of his ancestors. Michael Arranz was the son of a duke and one of the despised h'naran, half-bloods cursed with the blood of the nara running through their veins. Of all the h'nara, his family alone was immune from the persecution of the powerful Church of Loth, protected by an ancient covenant.In ordinary times, the paths of Michael and Stefn would never have crossed. Alas, times were no longer ordinary. The latest of the Lothlain kings was a weakling, unable to curb the ambitions of an increasingly powerful, corrupt clergy. Famine stalked the land. Fear of the h'nara, fanned by the Church, spread tentacles everywhere. Tanyrin teetered on the edge of chaos.A loyal and devoted friend to Tanyrin's crown prince, Michael could refuse Severyn Lothlain nothing, not even when Severyn asked the unspeakable of him. Determined to wrest the throne from his brother, Severyn intended nothing less than the resurrection of the ancient naragi. Michael, whose naran blood was the purest in Tanyrin, was the logical choice. But for Michael to become what mankind feared most, he needed a conduit through which to take the powerful, dangerous magic of the Dark Stream. He needed a man who carried the ancient blood of the cethera.He needed Stefn Eldering.___ This book is published by SL Publishing Group www.slpublishinggroup.com","528 pages, Paperback",Fantasy,93 follower,122 reviews,2,89 (6%),127 (9%),293 (21%),430 (31%),436 (31%)
