Title,Authors,Avg Ratings,Rating,first_published,Description,Total_Pages,Genre,author_followers,no_of_reviews,no_book_by_author,one_star_ratings,two_star_ratings,three_star_ratings,four_star_ratings,five_star_ratings
The Blue Chair,Richard Wolkomir,11,ratings0,"First published November 25, 2014","In a serene town in the Vermont mountains, who strangled the college student from Italy?Cooper North is a retired prosecutor and judge. She has a bad leg and just wants to watch birds. Yet, it's she who must find the murderer, even if it means putting her own life at risk.","32 pages, Kindle Edition",Mystery,42 followers,0 reviews,22 books42 followers,0 (0%),0 (0%),2 (18%),4 (36%),5 (45%)
Oz Omnibus,Eric Shanower,179,ratings21,"First published September 16, 2014","L. Frank Baum's magical world of Oz comes to life like never before, courtesy of the Eisner Award-winning team of Eric Shanower and Skottie Young! Join Kansas farmgirl Dorothy (and her little dog Toto), Scarecrow, Tin Woodsman, Cowardly Lion, Glinda the Good Witch, young Tip, Jack Pumpkinhead, Sawhorse, Queen Ozma, Butt on-Bright and more - and don't forget the Wonderful Wizard of Oz himself - as they explore the marvelous land of Oz, travel the Yellow Brick Road, and defend the Emerald City against the Wicked Witch of the West, Mombi, Jinjur, the evil Nome King and more! COLLECTING: THE WONDERFUL WIZARD OF OZ 1-8, THE MARVELOUS LAND OF OZ 1-8, OZMA OF OZ 1-8, DOROTHY & THE WIZARD IN OZ 1-8, ROAD TO OZ 1-6, THE EMERALD CITY OF OZ 1-5, MARVEL ILLUSTRATED: WIZARD OF OZ SKETCHBOOK, OZ PRIMER","1096 pages, Hardcover",Comics,202 followers,21 reviews,348 books202 followers,1 (<1%),7 (3%),27 (15%),46 (25%),98 (54%)
The Romanov Sisters: The Lost Lives of the Daughters of Nicholas and Alexandra,Helen Rappaport,"22,725","ratings2,257","First published June 3, 2014","They were the Princess Dianas of their day—perhaps the most photographed and talked about young royals of the early twentieth century. The four captivating Russian Grand Duchesses—Olga, Tatiana, Maria and Anastasia Romanov—were much admired for their happy dispositions, their looks, the clothes they wore and their privileged lifestyle.Over the years, the story of the four Romanov sisters and their tragic end in a basement at Ekaterinburg in 1918 has clouded our view of them, leading to a mass of sentimental and idealized hagiography. With this treasure trove of diaries and letters from the grand duchesses to their friends and family, we learn that they were intelligent, sensitive and perceptive witnesses to the dark turmoil within their immediate family and the ominous approach of the Russian Revolution, the nightmare that would sweep their world away, and them along with it.The Romanov Sisters sets out to capture the joy as well as the insecurities and poignancy of those young lives against the backdrop of the dying days of late Imperial Russia, World War I and the Russian Revolution. Rappaort aims to present a new and challenging take on the story, drawing extensively on previously unseen or unpublished letters, diaries and archival sources, as well as private collections. It is a book that will surprise people, even aficionados","492 pages, Hardcover",Nonfiction,752 followers,"2,257 reviews",29 books752 followers,717 (3%),"1,222 (5%)","4,886 (21%)","9,274 (40%)","6,626 (29%)"
Unclean Jobs for Women and Girls,Alissa Nutting,"3,049",ratings525,"First published October 1, 2010","In this darkly hilarious debut collection, misfit women and girls in every strata of society are investigated through various ill-fated jobs. One is the main course of dinner, another the porn star contracted to copulate in space for a reality TV show. They become futuristic ant farms, get knocked up by the star high school quarterback and have secret abortions, use parakeets to reverse amputations, make love to garden gnomes, go into air conditioning ducts to confront their mother’s ghost, and do so in settings that range from Hell to the local white-supremacist bowling alley.","188 pages, Paperback",Short Stories,"1,740 followers",525 reviews,"22 books1,740 followers",72 (2%),213 (6%),749 (24%),"1,139 (37%)",876 (28%)
The Long Dry,Cynan Jones,"1,390",ratings242,"First published January 1, 2006","Waking up early to check the cattle. Gareth notices that one of the calving cows is missing and sets off to find her before the sun gets too strong. What follows is a search through memory and anxiety about losing what he has as Gareth walks the land looking for the missing cow. The day unfolds, and the cow's behavior emerges as a metaphor for the relationship between Gareth and his wife Kate as they stumble on desperately in their changing care for each other. Only the reader is aware of the tragedy that awaits the family a few days down the line, throwing the story into shadow with a terrible poignancy.","136 pages, Paperback",Fiction,326 followers,242 reviews,18 books326 followers,13 (<1%),47 (3%),268 (19%),625 (44%),437 (31%)
Navigatio,Patrick Holland,49,ratings18,"First published November 1, 2014","Navigatio tells the story of Saint Brendan of Clonfert, a sixth century monk and adventurer, and his legendary quest for the Isle of the Blessed via a gauntlet of monsters, devils, angels, prophets and beautiful maidens. Brendan's battles with the sea and the cosmos bear out what William Faulkner once called ‘the human heart in conflict with itself’. This haunting parable of darkness and light, of temptation and belief, of voice and silence, is told with the utmost economy of words, making it a small masterpiece of compassionate perception","224 pages, Hardcover",Fantasy,36 followers,18 reviews,19 books36 followers,1 (2%),5 (10%),11 (22%),23 (46%),9 (18%)
Mom & Me & Mom,Maya Angelou,"25,317","ratings2,420","First published April 2, 2013","For the first time, Angelou reveals the triumphs and struggles of being the daughter of Vivian Baxter, an indomitable spirit whose petite size belied her larger-than-life presence—a presence absent during much of Angelou’s early life. When her marriage began to crumble, Vivian famously sent three-year-old Maya and her older brother away from their California home to live with their grandmother in Stamps, Arkansas. The subsequent feelings of abandonment stayed with Angelou for years, but their reunion, a decade later, began a story that has never before been told. In Mom & Me & Mom, Angelou dramatizes her years reconciling with the mother she preferred to simply call “Lady,” revealing the profound moments that shifted the balance of love and respect between them.   Delving into one of her life’s most rich, rewarding, and fraught relationships, Mom & Me & Mom explores the healing and love that evolved between the two women over the course of their lives, the love that fostered Maya Angelou’s rise to the heights.","201 pages, Hardcover",Nonfiction,13.2k followers,"2,420 reviews",228 books13.2k followers,249 (<1%),754 (2%),"3,876 (15%)","9,012 (35%)","11,426 (45%)"
Grayson,Lisa Eugene,"2,631",ratings444,"First published September 25, 2014","An insane love that will keep you from falling---or push you right off the edge.All she needed was a job…The last thing twenty-four year old grad student Angie Roberts needs is to worry about her new boss’s father. After all, she’s never even seen him. He remains sequestered upstairs in a house that looks like it should be the main feature in an episode of Hoarders. She had no idea the house was such a dump when she took the job. But she’s concerned about the safety and health of the old man living under such horrid conditions.What she got was a mystery…Despite warnings not to venture upstairs, she wanders up to the second floor. What she sees is shocking. The man she finds is a gorgeous, sexy, middle-aged man-- and he's stepping out of the shower. But something is definitely not right. Why would this wealthy, handsome man live in a house in such disrepair while his nine-teen year old son resides in a lavish penthouse? Why does he hide away from society? Why does he come to her rescue and then run away?What she discovered was heartbreaking…Angie learns that forty-four year old Grayson Whitmore suffers from schizophrenia. Paranoid, he retreats into his own world.What she ended up with was a treasure…Angie is determined to get through to Grayson. They form a friendship that blazes into an inconceivable love fired with raging passion. Angie must now come to Grayson’s rescue because the wicked that has been perpetrated on him is unconscionable. First, though, she must gain the trust of a man whose mind does not allow for such a thing.","200 pages, Paperback",Romance,781 followers,444 reviews,10 books781 followers,70 (2%),158 (6%),485 (18%),922 (35%),996 (37%)
That Frequent Visitor,K.Hari Kumar,409,ratings92,"First published December 26, 2014","Why are outsiders not allowed on Vypeen Island after sunset? What brought Richard Baxter to the dreaded Clifford Mansion in 1948? Where did Baxter and his wife disappear on the night of Pournami? Who is the visitor that the fishermen fear so much? How do true love and destiny justify their existence? How far will One Man go for the one he loves? Will he go beyond death? Six decades later, Shiuli Dutta is mysteriously lured into the Mansion, where she encounters the ghost of Richard Baxter. The grieving ghost tells her an incomplete story of its life. A story that will reveal the darker side of a man’s mind. A story that shall unveil a venomous truth of the past. A story so sinister that it could alter the fate of an entire nation’s future. A story of courage and cowardice, of deceit and insanity. The Story of THAT FREQUENT VISITOR.","202 pages, Paperback",Horror,148 followers,92 reviews,9 books148 followers,24 (5%),55 (13%),107 (26%),115 (28%),108 (26%)
Damnatio Memoriae,Laura Giebfried,110,ratings26,"First published August 24, 2014","Enim Lund's only goal is to finish his last year of school and to forget the tragedy that involved his mother the Christmas beforehand – a feat that should be easy given that he attends Bickerby Academy, an all-boys boarding school on a remote island off the coast of Maine. His plans are thwarted, though, when a teacher vanishes without explanation and a local girl’s body washes up on shore. With all signs pointing to one of Bickerby’s students, Enim’s best friend Jack Hadler convinces him to investigate the crime.As Jack becomes more and more obsessed with finding the killer, Enim finds himself consumed by his own responsibility in the accident that befell his mother, and neither can find a way to acquit himself of the crime. They soon realize that what's worse than not solving the crime is doing so but having no one believe them.","677 pages, Kindle Edition",Thriller,23 followers,26 reviews,8 books23 followers,4 (3%),9 (8%),12 (10%),33 (30%),52 (47%)
All Fall Down,Ally Carter,"28,650","ratings3,526","First published January 20, 2015","Grace can best be described as a daredevil, an Army brat, and a rebel. She is also the only granddaughter of perhaps the most powerful ambassador in the world and Grace has spent every summer of her childhood running across the roofs of Embassy Row.Now, at age sixteen, she's come back to stay - in order to solve the mystery of her mother's death. In the process, she uncovers an international conspiracy of unsettling proportions, and must choose her friends and watch her foes carefully if she and the world are to be saved.","312 pages, Paperback",Young Adult,16k followers,"3,526 reviews",44 books16k followers,530 (1%),"2,052 (7%)","7,395 (25%)","9,783 (34%)","8,890 (31%)"
The Pilgrims of Rayne,D.J. MacHale,"25,394",ratings366,"First published May 1, 2007","When Bobby Pendragon first arrives on the tropical world of Ibara, he finds paradise. There is beauty all around and the people of Ibara are blissfully happy. It's not long before Bobby discovers, however, that they are also blissfully...oblivious.The leaders of Ibara are keeping a devastating secret from their people, one that gives Saint Dane all the opportunity he needs to launch his final assault on Halla.While Bobby struggles to learn the truth in time to thwart Saint Dane, Courtney Chetwynde desperately searches for Mark Diamond. On the heels of a shocking tragedy, Mark has disappeared. Worse, he seems to be under Saint Dane's influence. It's up to Courtney to find Mark and stop him from making a grave mistake that could change the future of all existence.","560 pages, Hardcover",Fantasy,"2,241 followers",366 reviews,"84 books2,241 followers",291 (1%),945 (3%),"4,546 (17%)","8,339 (32%)","11,273 (44%)"
The Ruby Circle,Richelle Mead,"50,431","ratings4,909","First published February 10, 2015","THEY WILL BE TESTEDSydney Sage is an Alchemist, one of a group of humans who dabble in magic and serve to bridge the worlds of humans and vampires. They protect vampire secrets - and human lives.Their forbidden romance exposed, Sydney and Adrian find themselves facing the wrath of both the Alchemists and the Moroi in this electrifying conclusion to Richelle Mead’s bestselling Bloodlines series.When the life of someone they both love is put on the line, Sydney risks everything to hunt down a deadly former nemesis. Meanwhile, she and Adrian becomes enmeshed in a puzzle that could hold the key to a shocking secret about spirit magic, a secret that could shake the entire Moroi world and alter their lives forever.Don't miss their unforgettable final chapter. . . .LOVE WILL CONQUER ALL","348 pages, Hardcover",Young Adult,68.1k followers,"4,909 reviews",102 books68.1k followers,525 (1%),"1,754 (3%)","7,652 (15%)","16,342 (32%)","24,158 (47%)"
Tailing Her,Celia Kyle,"1,380",ratings74,"First published February 26, 2015","Quick & Furry: Love, Laughs, and a Bit of Rawr on the Go.Jennifer Palmer doesn’t have time for a mate. Yes, she’s a werelion whose beast is all about sexing up the hot beta, but she’s in the middle of prosecuting a high profile criminal case. Her primary responsibility is to see the bad guy ends up behind bars. Scratching her mating itch and screaming Brett’s name as she com—ahem. That isn’t anywhere on her list of to-dos. What she doesn’t realize is her werelion mate’s primary responsibility is ensuring her safety from the bad guy and… making her scream his name.",ebook,Paranormal,"2,775 followers",74 reviews,"262 books2,775 followers",9 (<1%),71 (5%),326 (23%),458 (33%),516 (37%)
The Silvering,Sonya Deanna Terry,22,ratings11,"First published December 28, 2014",".ATTENTION ALL READERS of BOOK 1 IN THE EPIPHANY SERIES:IF YOU ARE SEARCHING FOR BOOK 2, THIS EDITION OF EPIPHANY IS NOW OBSOLETE.DUE TO A DEMAND FOR BOOKS LIGHTER IN WEIGHT, THE TWO ORIGINAL EPIPHANY NOVELS WERE DIVIDED INTO A TRILOGY.THE 2nd BOOK IN THE EPIPHANY SERIES IS NOW:EPIPHANY - THE CRYSTALLING (Book 2)...AND THE THIRD IN THE SERIES ISEPIPHANY - THE SILVERING(Book 3)The story-within-a-story melds into a fascinating exploration of past and present lives intertwined, and a sequence of stunning revelations unfolds.The 2008 Global Financial Crisis is looming, a time of losses for some in Rosetta’s circle, and the odd astonishing gain. Via the path of mystery, reversals in fortunes and romantic love, Rosetta and her book club unwittingly get involved in a quest for The Silvering: an epoch rumoured to begin in 2022. The world's concept of worth, however, is keeping alive a body-king-created cycle of suffering, and the chance for a brighter future is fading fast.Beneath the red soil of a southern land lies a glimmer of hope—a legacy of Norwegian forest-dwellers—destined to bring about a worldwide epiphany…but only if two people are heartfelt enough to fulfil Lillibridge’s mystifying prophecy.Discoveries Matthew makes about Edward Lillibridge in the British village of Tintagel (letters the author wrote to his sister and son) align him with Rosetta and her desire to glean clues, but between them stands a wall of mistrust that threatens the sprites' noble plans. Each letter adds further detail to the tapestry of Lillibridge’s 18th-century existence, and Matthew is confronted with an uncanny truth that challenges his perceptions of life and death.","464 pages, Kindle Edition",favorites,43 followers,11 reviews,6 books43 followers,0 (0%),1 (4%),2 (9%),5 (22%),14 (63%)
Dreams Made Flesh,Anne Bishop,"17,310",ratings428,"First published January 2, 2005","Return to the realm of the Blood in Dreams Made Flesh—featuring four revelatory all-new adventures of Jaenelle and her kindred….Jaenelle is the most powerful Witch ever known, centuries of hopes and dreams made flesh at last. She has forged ties with three of the realm’s mightiest Blood warriors: Saetan, the High Lord of Hell, who trains Jaenelle in magic and adopts her as his daughter; Lucivar, the winged Eyrien warlord who becomes her protector; and the near-immortal Daemon born to be Witch’s lover. Jaenelle has assumed her rightful place as Queen of the Darkness and restored order and peace to the realms…but at a terrible cost.In Dreams Made Flesh, discover the origin of the mystical Jewels, and experience the forbidden passion between Lucivar and a simple hearth witch. Witness the clash between Saetan and a Priestess that may forever change reality. And learn whether the sacrifice of Jaenelle’s magic has destroyed any hope of happiness between her and Daemon.","439 pages, Mass Market Paperback",Fantasy,10.1k followers,428 reviews,56 books10.1k followers,84 (<1%),386 (2%),"2,214 (12%)","5,485 (31%)","9,141 (52%)"
The Trusted,John M. Green,75,ratings12,"First published April 1, 2013","How far would you go to save the planet? ...Would you destroy it?Imagine a global depression caused, not by greed or stupidity, but by a secret band of brilliant and radical environmentalists, 9S, using cyber-terror to slash the world’s population and smash its resource-hungry economy. Members of 9S have spent ten years secretly infiltrating industry and government, working themselves into the most trusted jobs in the world...sleepers ready to act.When the first global catastrophe erupts, the finger points at Australian-born Dr Tori Swyft, a former 9S member recently forced out of the CIA. Can the dark 9S conspiracy be stopped before it’s too late?They are the most trusted… until they betray their trust.","390 pages, Paperback",Fiction,27 followers,12 reviews,10 books27 followers,1 (1%),10 (13%),23 (30%),28 (37%),13 (17%)
Anissa's Redemption,Zack Love,183,ratings60,"First published March 27, 2015","Anissa Toma fled war-torn Syria after narrowly escaping the massacre of her Christian family by Islamists. Fortunate enough to rebuild her shattered life in New York City, the young refugee gained admission to an elite college, where she excelled. Her beauty, brains, and purity soon captured the interest of two powerful men: Michael, an activist working to establish Antioch, the first Mideast Christian state, and Julien, her professor and one of the city’s wealthiest bachelors.As Anissa's saga continues, the refugee-turned-rising-star must navigate between Michael and Julien, while trying to help her surviving relatives and other vulnerable Christians in Syria. As she gets closer to both men in a complex and evolving love triangle, can she unlock Julien's traumatic childhood to open up his heart? Or will Julien find greater solace from his nightmares and other demons in the sessions with his intriguing therapist? What will Michael do for Antioch and for Anissa, and what will Julien's role be? How far will each person go to help Anissa's remaining family and other persecuted Christians at risk in Syria? Find out in this stunning sequel to ""The Syrian Virgin.""","210 pages, Kindle Edition",Romance,898 followers,60 reviews,8 books898 followers,8 (4%),10 (5%),32 (17%),35 (19%),98 (53%)
Rising Storm,Erin Hunter,"51,312","ratings1,600","First published January 6, 2004","Fireheart's traitorous enemy Tigerclaw has been vanquished and exiled from Thunder Clan -- but Fireheart can't shake the feeling that he's lurking in the forest, waiting for his chance to strike. That's not the only problem facing the young warrior in these blazing summer months, as he struggles to handle sinister omens, an apprentice with a shocking secret, and a devastated Clan leader who is a shell of her former self.Meanwhile the forest gets hotter and hotter ... and everyone braces for the coming storm ...Ages 10+","336 pages, Library Binding",Fantasy,"9,274 followers","1,600 reviews","343 books9,274 followers",237 (<1%),940 (1%),"6,275 (12%)","14,539 (28%)","29,321 (57%)"
Der Märchenerzähler,Antonia Michaelis,"9,243","ratings1,546","First published February 1, 2011","Geliebter Mörder? Atemlos spannend - ein Meisterwerk von Antonia MichaelisAbel Tannatek ist ein Außenseiter, ein Schulschwänzer und Drogendealer. Wider besseres Wissen verliebt Anna sich rettungslos in ihn. Denn es gibt noch einen anderen Abel: den sanften, traurigen Jungen, der für seine Schwester sorgt und der ein Märchen erzählt, das Anna tief berührt. Doch die Grenzen zwischen Realität und Fantasie verschwimmen. Was, wenn das Märchen gar kein Märchen ist, sondern grausame Wirklichkeit? Was, wenn Annas schlimmste Befürchtungen wahr werden? Ein temporeicher Thriller und eine zu Herzen gehende Liebesgeschichte – lässt nicht los! Eindrucksvoll, begeisternd und abwechslungsreich - eine ganz neue Antonia Michaelis.","448 pages, Hardcover",Young Adult,318 followers,"1,546 reviews",115 books318 followers,453 (4%),623 (6%),"1,376 (14%)","2,612 (28%)","4,179 (45%)"
The Firebird,Susanna Kearsley,"28,626","ratings2,977","First published January 1, 2013","Nicola Marter was born with a gift. When she touches an object, she sometimes glimpses those who have owned it before. When a woman arrives with a small wooden carving at the gallery Nicola works at, she can see the object’s history and knows that it was named after the Firebird—the mythical creature from an old Russian fable.Compelled to know more, Nicola follows a young girl named Anna into the past who leads her on a quest through the glittering backdrops of the Jacobites and Russian courts, unearthing a tale of love, courage, and redemption.","539 pages, Paperback",Historical Fiction,"8,263 followers","2,977 reviews","26 books8,263 followers",344 (1%),952 (3%),"4,765 (16%)","11,601 (40%)","10,964 (38%)"
The Summer I Saved the World . . . in 65 Days,Michele Weber Hurwitz,"1,323",ratings271,"First published January 1, 2014","It's summertime, and thirteen-year-old Nina Ross is feeling kind of lost. Her beloved grandma died last year; her parents work all the time; her brother's busy; and her best friend is into clothes, makeup, and boys. While Nina doesn't know what ""her thing"" is yet, it's definitely not shopping and makeup. And it's not boys, either. Though . . . has Eli, the boy next door, always been so cute?   This summer, Nina decides to change things. She hatches a plan. There are sixty-five days of summer. Every day, she'll anonymously do one small but remarkable good thing for someone in her neighborhood, and find does doing good actually make a difference? Along the way, she discovers that her neighborhood, and her family, are full of surprises and secrets.   In this bighearted, sweetly romantic novel, things may not turn out exactly as Nina expects. They might be better.","272 pages, Hardcover",Young Adult,52 followers,271 reviews,5 books52 followers,11 (<1%),32 (2%),242 (18%),545 (41%),493 (37%)
Five-Star FLEECING,Maura Stone,70,ratings19,"First published December 11, 2009","Escape with laughter in this madcap adventure filled with crazy colleagues, paparazzi and celebrities. Linda Lane, an unconventional heroine, faces unbelievable obstacles which prevent her from doing her job. How can she handle renegade guests, racist mercenaries, nasty coworkers while stopping the employees, especially the General Manager, from ripping off the luxury hotel from inside? How does she deal with the moral dilemma? What’s a girl to do?","320 pages, Paperback",Fiction,34 followers,19 reviews,9 books34 followers,1 (1%),1 (1%),3 (4%),31 (44%),34 (48%)
Freedom Climbers,Bernadette McDonald,839,ratings60,"First published January 1, 2011","Winner! 2012 American Alpine Club Literary Prize (USA)Winner! 2011 Munday Award, Banff Mountain Festival (CANADA)Winner! 2011 Boardman Tasker Prize, Kendal Mountain Festival (UNITED KINGDOM)Freedom Climbers — the most honoured book of mountaineering literature published in Canada — tells the story of a group of extraordinary Polish adventurers who emerged from under the blanket of oppression following the Second World War to become the world's leading Himalayan climbers. Although they lived in a dreary, war-ravaged landscape, with seemingly no hope of creating a meaningful life, these curious, motivated and skilled mountaineers created their own free-market economy under the very noses of their Communist bosses and climbed their way to liberation. At a time when Polish citizens were locked behind the Iron Curtain, these intrepid explorers found a way to travel the world in search of extreme adventure—to Alaska, South America and Europe, but mostly to the highest and most inspiring mountains of the world. To this end, Afghanistan, India, Pakistan and Nepal became their second homes as they evolved into the toughest group of Himalayan climbers the world has ever known.","352 pages, Hardcover",Nonfiction,49 followers,60 reviews,21 books49 followers,2 (<1%),13 (1%),106 (12%),331 (39%),387 (46%)
