Title,Authors,Avg Ratings,Rating,first_published,Description,Total_Pages,Genre,author_followers,no_of_reviews,no_book_by_author,one_star_ratings,two_star_ratings,three_star_ratings,four_star_ratings,five_star_ratings
I've Got Your Number,Sophie Kinsella,"225,902","ratings14,541","First published November 2, 2011","Poppy Wyatt has never felt luckier. She is about to marry her ideal man, Magnus Tavish, but in one afternoon her “happily ever after” begins to fall apart. Not only has she lost her engagement ring in a hotel fire drill, but in the panic that follows, her phone is stolen. As she paces shakily around the lobby, she spots an abandoned phone in a trash can. Finders keepers! Now she can leave a number for the hotel to contact her when they find her ring. Perfect! Well, perfect except that the phone’s owner, businessman Sam Roxton, doesn’t agree. He wants his phone back and doesn’t appreciate Poppy reading his messages and wading into his personal life. What ensues is a hilarious and unpredictable turn of events as Poppy and Sam increasingly upend each other’s lives through emails and text messages. As Poppy juggles wedding preparations, mysterious phone calls, and hiding her left hand from Magnus and his parents, she soon realizes that she is in for the biggest surprise of her life.","448 pages, Hardcover",Chick Lit,39.9k followers,"14,541 reviews",131 books39.9k followers,"4,944 (2%)","11,436 (5%)","50,147 (22%)","84,898 (37%)","74,477 (32%)"
The Icebound Land,John Flanagan,"85,954","ratings3,109","First published November 25, 2005","Kidnapped after the fierce battle with Lord Morgarath, Will and Evanlyn are bound for Skandia as captives aboard a fearsome wolfship. Halt has sworn to rescue Will, and he will do anything to keep his promise–even defy his King. Expelled from the Rangers he has served so loyally, Halt is joined by Will's friend Horace as he travels toward Skandia. On their way, they are challenged constantly by freelance knights–but Horace knows a thing or two about combat. Soon he begins to attract the attention of knights and warlords for miles around with his uncanny skill. Even so, will they be in time to rescue Will from a horrific life of slavery?","266 pages, Hardcover",Fantasy,"8,531 followers","3,109 reviews","71 books8,531 followers",582 (<1%),"2,016 (2%)","13,415 (15%)","30,101 (35%)","39,840 (46%)"
Doctor Who: Flip-Flop,Jonathan Morris,312,ratings39,"First published July 1, 2003","Christmas Eve in the year 3060, and the planet Puxatornee is home to a prosperous human colony. A space craft has arrived in orbit carrying the Slithergees, a race of obsequious alien slugs. Their home world has been destroyed and they are humbly requesting permission to settle on the first moon. And if they don't get permission, then they are humbly threatening to declare all-out war. The future hangs in the balance. The decision rests with Bailey, the colony' s president - but she has other things on her mind. Christmas Eve in the year 3090, and the planet Puxatornee has changed beyond all recognition. The Doctor and Mel arrive, on a completely unrelated mission to defeat a race of terrible monsters, and soon discover that something rather confusing has been happening to history. Flip-Flop is a unique innovation in storytelling. A Doctor Who adventure told over two CDs, one black, one white - where the CDs can be listened to in either order. Chronological Placement This story takes place between the television adventures, Paradise Towers and Delta and the Bannermen.",Audio Play,Doctor Who,61 followers,39 reviews,181 books61 followers,21 (6%),31 (9%),111 (35%),103 (33%),46 (14%)
The Bell at Sealey Head,Patricia A. McKillip,"2,674",ratings295,"First published September 2, 2008","Sealey Head is a small sleepy town on the edge of the ocean, where sunset marks the tolling of a bell no one can see. On the outskirts is the great Aislinn House, where heir Miss Miranda Beryl and her entourage of friends and servants wait while aged Lady Eglantyne dies; where maid Emma opens doors sometimes to a castle with Princess Ysabo and knights.","277 pages, Hardcover",Fantasy,"2,633 followers",295 reviews,"112 books2,633 followers",24 (<1%),90 (3%),589 (22%),"1,095 (40%)",876 (32%)
Necropolis,Anthony Horowitz,"12,670",ratings446,"First published January 1, 2008","Hong Kong has been taken over by the Old Ones and has become Necropolis, City of the Dead. Once in, there is no way out… Evil has been unleashed on the world and only five children – with special powers – can save it. Matt and the other three desperately need to find Scar, the final Gatekeeper, who has been trapped in Hong Kong, where puddles of water turn into puddles of blood, where ghosts, demons and hideous creatures stalk the streets. Matt has no choice but to follow her. Now, both imprisoned, their only hope of survival is to reach a secret door in the Man Ho temple. But even if Scar can find her psychic power, it may already be too late.","388 pages, Paperback",Fantasy,17.2k followers,446 reviews,426 books17.2k followers,83 (<1%),407 (3%),"2,300 (18%)","4,868 (38%)","5,012 (39%)"
The Institute,Stephen King,"265,975","ratings26,146","First published September 10, 2019","In the middle of the night, in a house on a quiet street in suburban Minneapolis, intruders silently murder Luke Ellis’s parents and load him into a black SUV. The operation takes less than two minutes. Luke will wake up at The Institute, in a room that looks just like his own, except there’s no window. And outside his door are other doors, behind which are other kids with special talents—telekinesis and telepathy—who got to this place the same way Luke did: Kalisha, Nick, George, Iris, and ten-year-old Avery Dixon. They are all in Front Half. Others, Luke learns, graduated to Back Half, “like the roach motel,” Kalisha says. “You check in, but you don’t check out.”In this most sinister of institutions, the director, Mrs. Sigsby, and her staff are ruthlessly dedicated to extracting from these children the force of their extranormal gifts. There are no scruples here. If you go along, you get tokens for the vending machines. If you don’t, punishment is brutal. As each new victim disappears to Back Half, Luke becomes more and more desperate to get out and get help. But no one has ever escaped from the Institute.As psychically terrifying as Firestarter, and with the spectacular kid power of It, The Institute is Stephen King's gut-wrenchingly dramatic story of good versus evil in a world where the good guys don't always win.--front flap","561 pages, Hardcover",Horror,841k followers,"26,146 reviews","2,518 books841k followers","2,199 (<1%)","6,641 (2%)","37,186 (13%)","109,064 (41%)","110,885 (41%)"
Blood and Treasure: Daniel Boone and the Fight for America's First Frontier,Bob Drury,"2,833",ratings432,"First published April 20, 2021","The Instant New York Times BestellerNational Bestseller""[The] authors’ finest work to date."" —Wall Street JournalThe explosive true saga of the legendary figure Daniel Boone and the bloody struggle for America's frontier by two bestselling authors at the height of their writing power—Bob Drury and Tom Clavin.It is the mid-eighteenth century, and in the thirteen colonies founded by Great Britain, anxious colonists desperate to conquer and settle North America’s “First Frontier” beyond the Appalachian Mountains commence a series of bloody battles. These violent conflicts are waged against the Native American tribes whose lands they covet, the French, and the mother country itself in an American Revolution destined to reverberate around the world.This is the setting of Blood and Treasure, and the guide to this epic narrative is America’s first and arguably greatest pathfinder, Daniel Boone—not the coonskin cap-wearing caricature of popular culture but the flesh-and-blood frontiersman and Revolutionary War hero whose explorations into the forested frontier beyond the great mountains would become the stuff of legend. Now, thanks to painstaking research by two award-winning authors, the story of the brutal birth of the United States is told through the eyes of both the ordinary and larger-than-life men and women who witnessed it.This fast-paced and fiery narrative, fueled by contemporary diaries and journals, newspaper reports, and eyewitness accounts, is a stirring chronicle of the conflict over America’s “First Frontier” that places the reader at the center of this remarkable epoch and its gripping tales of courage and sacrifice.","384 pages, Kindle Edition",History,128 followers,432 reviews,29 books128 followers,24 (<1%),85 (3%),494 (17%),"1,309 (46%)",921 (32%)
Snarky Responses to Yahoo! Answers,Matthew  Cory,18,ratings8,"First published February 1, 2009","Snarky Responses to Yahoo! Answers, is a four-month excursion into the bowels of the Internet, otherwise known as Yahoo! Answers.Comic writer Matthew Cory wastes four months of his life answering questions on Yahoo! Answers with unhelpful but hilarious responses. This book is a collection of those responses.From helping teenage girls determine what a smile means, to giving baby-naming advice to a parent-to-be, to helping a user who wants to know how to use his zipper, Matthew is quick with a sarcastic response or a clever quip. Every once in a while, Matthew will dispense advice that may actually be useful…but don’t count on it.Yahoo! Answers is one of the most popular websites on the Internet. The site generates millions of hits per day from users seeking answers from complete strangers to the burning questions of life, such as “Where did emimen grow up? the raper?” This book is required reading for anyone with a sense of humor, a functioning brain, and an Internet connection.","184 pages, Paperback",Humor,4 followers,8 reviews,5 books4 followers,0 (0%),1 (5%),7 (38%),5 (27%),5 (27%)
Lover Enshrined,J.R. Ward,"117,118","ratings4,771","First published June 3, 2008","In the shadows of the night in Caldwell, New York, there’s a deadly war raging between vampires and their slayers. And there exists a secret band of brothers like no other—six vampire warriors, defenders of their race. And now, a dutiful twin must choose between two lives...Fiercely loyal to the Black Dagger Brotherhood, Phury has sacrificed himself for the good of the race, becoming the male responsible for keeping the Brotherhood's bloodlines alive. As Primale of the Chosen, he is to father the sons and daughters who will ensure that the traditions of the race survive and that there are warriors to fight those who want all vampires extinguished.As his first mate, the Chosen Cormia wants to win not only his body but his heart for herself- she sees the emotionally scarred male behind all his noble responsibility. But while the war with the Lessening Society grows more grim, and tragedy looms over the Brotherhood's mansion, Phury must decide between duty and love.","560 pages, Mass Market Paperback",Romance,49.7k followers,"4,771 reviews",232 books49.7k followers,"1,533 (1%)","5,886 (5%)","22,462 (19%)","35,130 (29%)","52,107 (44%)"
Changeless,Gail Carriger,"46,291","ratings4,194","First published April 1, 2010","Alexia Maccon, the Lady Woolsey, awakens in the wee hours of the mid-afternoon to find her husband, who should be decently asleep like any normal werewolf, yelling at the top of his lungs. Then he disappears; leaving her to deal with a regiment of supernatural soldiers encamped on her doorstep, a plethora of exorcised ghosts, and an angry Queen Victoria.But Alexia is armed with her trusty parasol, the latest fashions, and an arsenal of biting civility. So even when her investigations take her to Scotland, the backwater of ugly waistcoats, she is prepared: upending werewolf pack dynamics as only the soulless can. She might even find time to track down her wayward husband, if she feels like it.CHANGELESS is the second book of the Parasol Protectorate series: a comedy of manners set in Victorian London, full of werewolves, vampires, dirigibles, and tea-drinking.","389 pages, Mass Market Paperback",Steampunk,15.1k followers,"4,194 reviews",57 books15.1k followers,372 (<1%),"1,584 (3%)","10,175 (21%)","20,172 (43%)","13,988 (30%)"
Doctor Who: The Dark Flame,Trevor Baxendale,271,ratings26,"First published March 1, 2003","A thousand years ago, the evil Cult of the Dark Flame infiltrated every star system in the galaxy. In the history books the Cult is legendary, its despotic leader a terrible memory.But for some the Dark Flame still burns.For some, its horrifying power is the ultimate goal.All that is required is for the right people to be in the wrong place and time.An archaeologist and his robot are on the poisonous world of Sorus Alpha, where they will uncover a hideous relic. The Doctor and Ace are on their way to the deep space research centre Orbos, where Professor Bernice Summerfield is soon to start the countdown to universal Armageddon.Four acolytes of Evil.Three mad scientists.Two companions.One Doctor.",Audiobook,Doctor Who,46 followers,26 reviews,89 books46 followers,10 (3%),48 (17%),117 (43%),71 (26%),25 (9%)
Lifespan of a Fact,John D'Agata,"1,469",ratings258,"First published February 27, 2012","Now a Broadway Play.An innovative essayist and his fact-checker do battle about the use of truth and the definition of nonfiction.How negotiable is a fact? In 2003, after publishing his book of experimental essays, Halls of Fame, John D’Agata was approached by Harper’s magazine to write an essay for them, one that was eventually rejected due to disagreements related to its fact checking. That essay which eventually became the foundation of D’Agata’s critically acclaimed About a Mountain was accepted by another magazine, the Believer, but not before they handed it to their own fact-checker, Jim Fingal. What resulted from that assignment, and beyond the essay’s eventual publication in the magazine, was seven years of arguments, negotiations, and revisions as D’Agata and Fingal struggled to navigate the boundaries of literary nonfiction.This book includes an early draft of D’Agata’s essay, along with D’Agata and Fingal’s extensive discussion around the text. What emerges is a brilliant and eye-opening meditation on the relationship between “truth” and “accuracy” and a penetrating conversation about whether it is appropriate for a writer to substitute one for the other.","128 pages, Paperback",Nonfiction,72 followers,258 reviews,14 books72 followers,37 (2%),128 (8%),339 (23%),522 (35%),443 (30%)
Strange the Dreamer,Laini Taylor,"119,909","ratings21,232","First published March 28, 2017","The dream chooses the dreamer, not the other way around—and Lazlo Strange, war orphan and junior librarian, has always feared that his dream chose poorly. Since he was five years old he’s been obsessed with the mythic lost city of Weep, but it would take someone bolder than he to cross half the world in search of it. Then a stunning opportunity presents itself, in the person of a hero called the Godslayer and a band of legendary warriors, and he has to seize his chance or lose his dream forever.What happened in Weep two hundred years ago to cut it off from the rest of the world? What exactly did the Godslayer slay that went by the name of god? And what is the mysterious problem he now seeks help in solving?The answers await in Weep, but so do more mysteries—including the blue-skinned goddess who appears in Lazlo’s dreams. How did he dream her before he knew she existed? And if all the gods are dead, why does she seem so real?Welcome to Weep.","544 pages, Hardcover",Fantasy,38.6k followers,"21,232 reviews",35 books38.6k followers,"1,681 (1%)","4,028 (3%)","14,024 (11%)","38,660 (32%)","61,516 (51%)"
The Flatshare,Beth O'Leary,"379,225","ratings42,319","First published April 10, 2019","Tiffy and Leon share a flatTiffy and Leon share a bedTiffy and Leon have never met…
Tiffy Moore needs a cheap flat, and fast. Leon Twomey works nights and needs cash. Their friends think they’re crazy, but it’s the perfect solution: Leon occupies the one-bed flat while Tiffy’s at work in the day, and she has the run of the place the rest of the time. But with obsessive ex-boyfriends, demanding clients at work, wrongly imprisoned brothers and, of course, the fact that they still haven’t met yet, they’re about to discover that if you want the perfect home you need to throw the rulebook out the window…","394 pages, Hardcover",Romance,13.6k followers,"42,319 reviews",18 books13.6k followers,"4,684 (1%)","15,812 (4%)","74,783 (19%)","159,150 (41%)","124,796 (32%)"
Ashes of Midnight,Lara Adrian,"25,306",ratings859,"First published May 26, 2009","A woman driven by blood. A man thirsting for vengeance.A place where darkness and desire meet...As night falls, Claire Roth flees, driven from her home by a fiery threat that seems to come from hell itself. Then, from out of the flames and ash, a vampire warrior emerges. He is Andreas Reichen, her onetime lover, now a stranger consumed by vengeance. Caught in the cross fire, Claire cannot escape his savage fury—or the hunger that plunges her into his world of eternal darkness and unending pleasure.Nothing will stop Andreas from destroying the vampire responsible for slaughtering his Breed brethren . . . even if he must use his former lover as a pawn in his deadly mission. Blood-bonded to his treacherous adversary, Claire can lead Andreas to the enemy he seeks, but it is a journey fraught with danger—and deep, unbidden desires. For Claire is the one woman Andreas should not crave, and the only one he’s ever loved. A dangerous seduction begins—one that blurs the lines between predator and prey, and stokes the flames of a white-hot passion that may consume all in its path. . . .","368 pages, Mass Market Paperback",Paranormal Romance,10.6k followers,859 reviews,106 books10.6k followers,272 (1%),877 (3%),"4,268 (16%)","8,998 (35%)","10,891 (43%)"
May We Be Forgiven,A.M. Homes,"15,931","ratings2,190","First published September 1, 2012","A darkly comic novel of twenty-first-century domestic life and the possibility of personal transformationHarold Silver has spent a lifetime watching his younger brother, George, a taller, smarter, and more successful high-flying TV executive, acquire a covetable wife, two kids, and a beautiful home in the suburbs of New York City. But Harry, a historian and Nixon scholar, also knows George has a murderous temper, and when George loses control the result is an act of violence so shocking that both brothers are hurled into entirely new lives in which they both must seek absolution.Harry finds himself suddenly playing parent to his brother’s two adolescent children, tumbling down the rabbit hole of Internet sex, dealing with aging parents who move through time like travelers on a fantastic voyage. As Harry builds a twenty-first-century family created by choice rather than biology, we become all the more aware of the ways in which our history, both personal and political, can become our destiny and either compel us to repeat our errors or be the catalyst for change.May We Be Forgiven is an unnerving, funny tale of unexpected intimacies and of how one deeply fractured family might begin to put itself back together.","480 pages, Hardcover",Fiction,"1,296 followers","2,190 reviews","62 books1,296 followers",539 (3%),"1,454 (9%)","4,215 (26%)","6,179 (38%)","3,544 (22%)"
Red River,Lalita Tademy,"3,325",ratings418,"First published December 4, 2006","Hailed as ""powerful,""""accomplished,"" and ""spellbinding,"" Lalita Tademy's first novel Cane River was a New York Times bestseller and the 2001 Oprah Book Club Summer Selection. Now with her evocative, luminous style and painstaking research, she takes her family's story even further, back to a little-chronicled, deliberately-forgotten time...and the struggle of three extraordinary generations of African-American men to forge brutal injustice and shattered promise into a limitless future for their children... RED RIVERFor the newly-freed black residents of Colfax, Louisiana, the beginning of Reconstruction promised them the right to vote, own property-and at last control their own lives.Tademy saw a chance to start a school for his children and neighbors. His friend Israel Smith was determined to start a community business and gain economic freedom. But in the space of a day, marauding whites would ""take back"" Colfax in one of the deadliest cases of racial violence in the South. In the bitter aftermath, Sam and Israel's fight to recover and build their dreams will draw on the best they and their families have to give-and the worst they couldn't have foreseen. Sam's hidden resilience will make him an unexpected leader, even as it puts his conscience and life on the line. Israel finds ironic success-and the bitterest of betrayals. And their greatest challenge will be to pass on to their sons and grandsons a proud heritage never forgotten-and the strength to meet the demands of the past and future in their own unique ways. An unforgettable achievement, a history brought to vibrant life through one of the most memorable families in fiction, RED RIVER is about fathers and sons, husbands and wives-and the hopeful, heartbreaking choices we all must make to claim the legacy that is ours.","420 pages, Hardcover",Historical Fiction,565 followers,418 reviews,9 books565 followers,67 (2%),187 (5%),786 (23%),"1,310 (39%)",975 (29%)
The Virgin's Lover,Philippa Gregory,"54,943","ratings2,514","First published November 16, 2004","From the author of The Other Boleyn Girl and The Queen's Fool comes a stunning portrait of the first perilous years of Elizabeth I's reign.As a new queen, Elizabeth faces two great dangers: the French invasion of Scotland, which threatens to put Mary Queen of Scots on her throne, and her passion for the convicted traitor Robert Dudley.But Dudley is already married, and his devoted wife Amy will never give him up, least of all to an upstart Protestant Princess. She refuses to set her beloved husband free to marry the queen; but she cannot prevent him from becoming the favorite and the focus of the feverishly plotting, pleasure seeking court.Others too oppose the marriage, but for very different reasons. William Cecil, the queen's wisest counselor, knows she must marry for policy; her uncle hates Dudley and swears he will be murder him first. Behind the triangle of lovers, the factions take up their places: the Protestants, the priests, the assassins, the diplomats and the moneymakers. The very coin of England is shaved and clipped to nothing as Elizabeth uncertainly leads her bankrupt country into a war that no-one thinks can be won.Then someone acts in secret, and for Elizabeth, Dudley and the emerging kingdom, nothing will be as planned.Blending historical fact with contemporary rumor, Philippa Gregory has created a dark and tense novel of Tudor times, which casts Elizabeth I in a light no one has suggested before. Passionate, fearful, emotionally needy, this is a queen who will stop at nothing.","441 pages, Paperback",Historical Fiction,34k followers,"2,514 reviews",124 books34k followers,956 (1%),"4,147 (7%)","16,556 (30%)","20,417 (37%)","12,867 (23%)"
Charlie Bone and the Invisible Boy,Jenny Nimmo,"23,457",ratings511,"First published July 1, 2004","The third book in the Children of the Red King series, CHARLIE BONE AND THE INVISIBLE BOY offers more magical fantasy that is fast paced and easy to read.This semester at Bloor's Academy brings a few changes. There is a new art teacher, Mr. Boldova, and a new student named Belle, who lives with the Yewbeam aunts and seems to have strange power over them. Emma and Charlie soon discover Mr. Boldova's secret He is the older brother of Ollie Sparks, the boy who lives in the attic of Bloor's Academy. Ollie had always been prying into matters that didn't concern him, so Ezekiel Bloor had made him invisible. When Charlie and his friends find him, Ollie is alone and hungry, so they promise to help him become visible again.","408 pages, Hardcover",Fantasy,927 followers,511 reviews,161 books927 followers,294 (1%),"1,233 (5%)","6,184 (26%)","8,050 (34%)","7,696 (32%)"
Charlie Bone and the Time Twister,Jenny Nimmo,"23,940",ratings678,"First published April 1, 2003","Time is running out for Charlie Bone . . . Charlies hopes that the new term at Bloor's Academy will hold no nasty surprises. But then Henry Yewbeam appears, twisted through time from the icy winter of 1916.With the scheming Yewbeam aunts on the prowl, and the Bloors out to catch him, Henry will need Charlie's help just to stay alive. Bloor's Academy can be a very dangerous place . . .Book Two in The Children of the Red King series!",Audio Cassette,Fantasy,927 followers,678 reviews,161 books927 followers,314 (1%),"1,215 (5%)","6,302 (26%)","8,500 (35%)","7,609 (31%)"
