Title,Authors,Avg Ratings,Rating,first_published,Description,Total_Pages,Genre,author_followers,no_of_reviews,no_book_by_author,one_star_ratings,two_star_ratings,three_star_ratings,four_star_ratings,five_star_ratings
Ghosts of 42nd Street: A History of America's Most Infamous Block,Anthony Bianco,82,ratings8,"January 1, 2004","Imagine shuffling down Broadway through the hustle and bustle right into the nonstop, neon heart of New York 42nd Street. Once a quiet neighborhood of brownstones and churches, the area wastransformed in the early 1900s into an entertainment hub unlike any in theworld. No place has ever evoked the glamour and romantic possibility of bigcity nightlife as vividly as did 42nd Street. It was the dazzle of ""naughty, bawdy, gaudy"" 42nd Street that put Times Square on the map and turned the Broadway theater district into the Great White Way. Ghosts of 42nd Street stirs your imagination as it takes you on a historical journey of this glamorized strip still known today as the Crossroads of the World. From the bold innovations of Oscar Hammerstein and Florenz Ziegfeld through the porn-laden 1960s and 1970s to the present-day ""Disneyfication"" of New York's bright lights district, Ghosts of 42nd Street is as fascinating as a tabloid frozen in time.","400 pages, Paperback",History,12 book,8 reviews,12,1 (1%),3 (3%),30 (36%),33 (40%),15 (18%)
The Maze Runner Trilogy,James Dashner,"8,878",ratings421,"January 1, 2012","The Maze Runner trilogy boxed set contains the paperback editions of James Dashner's New York Times bestselling series. The Maze Runner, The Scorch Trials, and The Death Cure are action-packed, edge-of-your-seat, dystopian adventures for readers young and old. And now they are available together as the perfect gift.",Paperback,Young Adult,34.1k follower,421 reviews,100,151 (1%),347 (3%),"1,395 (15%)","2,790 (31%)","4,195 (47%)"
The Radleys,Matt Haig,"21,861","ratings2,630","July 1, 2010","The Radleys are an everyday family who juggle dysfunctional lives. Except, as Peter and Helen Radley know but their children have yet to find out, the Radleys happen to be a family of abstaining vampires. When one night Clara finds herself driven to commit a bloodthirsty act, her parents decide to explain a few things.","341 pages, Paperback",Fantasy,36.7k follower,"2,630 reviews",128,428 (1%),"1,930 (8%)","7,524 (34%)","8,521 (38%)","3,458 (15%)"
Girl in a Blue Dress,Gaynor Arnold,"2,468",ratings471,"August 1, 2008","A sweeping tale of love and loss, Girl in a Blue Dress is both an intimate peek at the woman who was behind one of literature’s most esteemed men and a fascinating rumination on marriage that will resonate across centuries.At the end of her life, Catherine, the cast-off wife of Charles Dickens, gave the letters she had received from her husband to their daughter Kate, asking her to donate them to the British Museum, “so the world may know that he loved me once.” The incredible vulnerability and heartache evident beneath the surface of this remark inspired Gaynor Arnold to write Girl in a Blue Dress, a dazzling debut novel inspired by the life of this tragic yet devoted woman. Arnold brings the spirit of Catherine Dickens to life in the form of Dorothea “Dodo” Gibson–a woman who is doomed to live in the shadow of her husband, Alfred, the most celebrated author in the Victorian world. The story opens on the day of Alfred’s funeral. Dorothea is not among the throngs in attendance when The One and Only is laid to rest. Her mourning must take place within the walls of her modest apartment, a parting gift from Alfred as he ushered her out of their shared home and his life more than a decade earlier. Even her own children, save her outspoken daughter Kitty, are not there to offer her comfort–they were poisoned against her when Alfred publicly declared her an unfit wife and mother. Though she refuses to don the proper mourning attire, Dodo cannot bring herself to demonize her late husband, something that comes all too easily to Kitty. Instead, she reflects on their time together–their clandestine and passionate courtship, when he was a force of nature and she a willing follower; and the salad days of their marriage, before too many children sapped her vitality and his interest. She uncovers the frighteningly hypnotic power of the celebrity author she married. Now liberated from his hold on her, Dodo finds the courage to face her adult children, the sister who betrayed her, and the charming actress who claimed her husband’s love and left her heart aching. A sweeping tale of love and loss that was long-listed for both the Man Booker Prize and the Orange Prize, Girl in a Blue Dress is both an intimate peek at the woman who was behind one of literature’s most esteemed men and a fascinating rumination on marriage that will resonate across centuries.","442 pages, Paperback",Historical Fiction,14 follower,471 reviews,7,65 (2%),222 (8%),809 (32%),999 (40%),373 (15%)
Ghost Hand,Ripley Patton,"1,060",ratings283,"November 28, 2012","Seventeen-year-old Olivia Black has a rare birth defect known as Psyche Sans Soma, or PSS. Instead of a right hand made of flesh and blood, she was born with a hand made of ethereal energy.How does Olivia handle being the girl with the ghost hand? Well, she's a little bit morbid and a whole lot snarky. Her mother thinks her obsession with death, black clothing, and the local cemetery is a bid for attention. But when Marcus, the new guy in Olivia's calculus class, stares at her like she's a freak, Olivia doesn't like it. And when her hand goes rogue, doing things she never imagined possible, Olivia finds herself running for her life with Marcus from a group of men bent on taking the power of her hand for their own nefarious purposes.","372 pages, Paperback",Paranormal,397 follower,283 reviews,17,46 (4%),66 (6%),211 (19%),368 (34%),369 (34%)
The Undertaking,Audrey Magee,"3,423",ratings573,"February 1, 2014","Desperate to escape the Eastern front, Peter Faber, an ordinary German soldier, marries Katharina Spinell, a woman he has never met; it is a marriage of convenience that promises 'honeymoon' leave for him and a pension for her should he die on the front. With ten days' leave secured, Peter visits his new wife in Berlin; both are surprised by the attraction that develops between them. When Peter returns to the horror of the front, it is only the dream of Katharina that sustains him as he approaches Stalingrad. Back in Berlin, Katharina, goaded on by her desperate and delusional parents, ruthlessly works her way into the Nazi party hierarchy, wedding herself, her young husband and their unborn child to the regime. But when the tide of war turns and Berlin falls, Peter and Katharina, ordinary people stained with their small share of an extraordinary guilt, find their simple dream of family increasingly hard to hold on to...","291 pages, Hardcover",Historical Fiction,196 follower,573 reviews,2,61 (1%),254 (7%),891 (26%),"1,404 (41%)",813 (23%)
"Sword Art Online, Vol. 2: Aincrad",Reki Kawahara,"4,897",ratings200,"August 10, 2009","Linked up and logged into the deadly VMMORPG ""Sword Art Online"" in both the real and virtual worlds, Kirito is stuck in a hell of one man's making, and like everyone else, unable to escape until the game is beaten. But while some players are crippled by fear and others throw themselves into completing the game, still others relax into everyday life in the face of their cruel predicament and live to the best of their ability...laughing, crying, but always enjoying the game. Among them are four women who make a mark upon the solo adventurer that Kirito has become: Silica, the beast-tamer; Lisbeth, the blacksmith; Yui, the mysterious orphan; and the tragic Sachi, never to be forgotten by the black swordsman...","264 pages, Paperback",Light Novel,859 follower,200 reviews,373,64 (1%),208 (4%),795 (16%),"1,473 (30%)","2,357 (48%)"
The City of Your Final Destination,Peter    Cameron,"2,646",ratings276,"January 1, 2002","Omar Razaghi, a twenty-eight-year-old doctoral student at the University of Kansas, has won a grant to write a biography of Jules Gund, a deceased Latin American writer. There's just one Gund's family has not given him authorization. Undeterred, Omar travels to Uruguay, unannounced, to petition the author's three executors in Gund's widow, his much younger mistress, and his brother. Omar's arrival sets in motion a series of events that upsets the precarious balance of life at Ochos Rios, the family's crumbling estate. As long-standing relationships undergo seismic shifts and force the time-stuck inhabitants of Ochos to look toward that most dreaded of the future.","320 pages, Paperback",Fiction,511 follower,276 reviews,26,24 (<1%),157 (5%),661 (24%),"1,115 (42%)",689 (26%)
"Merry Christmas, Squirrels!",Nancy     Rose,346,ratings67,"October 6, 2015","Christmas will never be the same with this irresistible photographic story featuring wild squirrels in homemade miniature settings - wearing Christmas sweaters, building snowmen, and opening presents -- delighting readers and animal lovers of all ages!Mr. Peanuts loves Christmas - but he loves it even more when he has a friend to share it with. When Cousin Squirrel invites him to spend the holidays together, Mr. Peanuts is in for a whirlwind of winter fun! Mr. Peanuts and Cousin Squirrel are the perfect holiday addition to every household. Featuring photographs of wild squirrels in handcrafted homemade miniature settings, this striking book is sure to surprise and delight young and old alike.","32 pages, Hardcover",Picture Books,38 follower,67 reviews,7,0 (0%),10 (2%),76 (21%),128 (36%),132 (38%)
The House of Twenty Thousand Books,Sasha Abramsky,378,ratings66,"June 26, 2014","The House of Twenty Thousand Books is the story of Chimen Abramsky, an extraordinary polymath and bibliophile who amassed a vast collection of socialist literature and Jewish history. For more than 50 years, Chimen and his wife, Miriam, hosted epic gatherings in their house of books that brought together many of the age's greatest thinkers. The atheist son of one of the century's most important rabbis, Chimen was born in 1916 near Minsk, spent his early teenage years in Moscow while his father served time in a Siberian labor camp for religious proselytizing, and then immigrated to London, where he discovered the writings of Karl Marx and became involved in left-wing politics. He briefly attended the newly established Hebrew University in Jerusalem, until World War II interrupted his studies. Back in England, he married, and for many years he and Miriam ran a respected Jewish bookshop in London's East End. When the Nazis invaded Russia in June 1941, Chimen joined the Communist Party, becoming a leading figure in the party's National Jewish Committee. He remained a member until 1958, when, shockingly late in the day, he finally acknowledged the atrocities committed by Stalin. In middle age, Chimen reinvented himself once more, this time as a liberal thinker, humanist, professor, and manuscript expert for Sotheby's auction house. Journalist Sasha Abramsky re-creates here a lost world, bringing to life the people, the books, and the ideas that filled his grandparents' house, from gatherings that included Eric Hobsbawm and Isaiah Berlin to books with Marx's handwritten notes, William Morris manuscripts and woodcuts, an early 16th-century Bomberg Bible, and a first edition of Descartes' Meditations . The House of Twenty Thousand Books is a wondrous journey through our times, from the vanished worlds of Eastern European Jewry to the cacophonous politics of modernity.","336 pages, Kindle Edition",Books About Books,42 follower,66 reviews,22,7 (1%),32 (8%),114 (30%),145 (38%),80 (21%)
Deadly Forecast,Victoria Laurie,"3,243",ratings258,"July 2, 2013","Wedding bells are ringing for psychic Abigail Cooper. But her senses are tingling that her fiancé, Dutch, is in danger. And he’s not the only one.…ON HER WEDDING DAY, ABBY’S A TICKING TIME BOMB.   It’s said to be good luck if it rains on your wedding day, but Abby sees something darker than storm clouds on the horizon. She’s just had a disturbing premonition of her fiancé’s murder. Her husband-to-be has been assigned to a case involving a series of bombings, and Abby’s spirit guides warn her of imminent danger.   FBI agent Dutch Rivers is keeping his cool, but Abby can’t quell her anxiety. After another bombing at a local beauty salon, Abby vows to do everything in her power to keep Dutch safe and get him to the altar. But on the morning of the ceremony, she finds herself in a dire situation, with time running out….","384 pages, Hardcover",Mystery,"3,016 follower",258 reviews,65,22 (<1%),62 (1%),538 (16%),"1,196 (36%)","1,425 (43%)"
Mrs. Lincoln's Dressmaker,Jennifer Chiaverini,"29,863","ratings3,976","January 15, 2013","In Mrs. Lincoln’s Dressmaker, novelist Jennifer Chiaverini presents a stunning account of the friendship that blossomed between Mary Todd Lincoln and her seamstress, Elizabeth “Lizzie” Keckley, a former slave who gained her professional reputation in Washington, D.C. by outfitting the city’s elite. Keckley made history by sewing for First Lady Mary Todd Lincoln within the White House, a trusted witness to many private moments between the President and his wife, two of the most compelling figures in American history. In March 1861, Mrs. Lincoln chose Keckley from among a number of applicants to be her personal “modiste,” responsible not only for creating the First Lady’s gowns, but also for dressing Mrs. Lincoln in the beautiful attire Keckley had fashioned. The relationship between the two women quickly evolved, as Keckley was drawn into the intimate life of the Lincoln family, supporting Mary Todd Lincoln in the loss of first her son, and then her husband to the assassination that stunned the nation and the world. Keckley saved scraps from the dozens of gowns she made for Mrs. Lincoln, eventually piecing together a tribute known as the Mary Todd Lincoln Quilt. She also saved memories, which she fashioned into a book, Behind the Scenes: Thirty Years a Slave and Four Years in the White House. Upon its publication, Keckley’s memoir created a scandal that compelled Mary Todd Lincoln to sever all ties with her, but in the decades since, Keckley’s story has languished in the archives. In this impeccably researched, engrossing novel, Chiaverini brings history to life in rich, moving style.","356 pages, Hardcover",Historical Fiction,"4,331 follower","3,976 reviews",70,928 (3%),"3,388 (11%)","10,056 (33%)","10,164 (34%)","5,327 (17%)"
The One Thing: The Surprisingly Simple Truth Behind Extraordinary Results,Gary Keller,"65,047","ratings4,706","January 1, 2012","The One Thing explains the success habit to overcome the six lies that block our success, beat the seven thieves that steal time, and leverage the laws of purpose, priority, and productivity.","240 pages, Hardcover",Business,951 follower,"4,706 reviews",60,"1,293 (1%)","2,960 (4%)","10,417 (16%)","21,573 (33%)","28,804 (44%)"
The Secret of Ventriloquism,Jon Padgett,"1,957",ratings344,"October 31, 2016","Jon Padgett's The Secret of Ventriloquism, named the Best Fiction Book of 2016 by Rue Morgue Magazine, heralds the arrival of a significant new literary talent. With themes reminiscent of Shirley Jackson, Thomas Ligotti, and Bruno Schulz, but with a strikingly unique vision, Padgett's work explores the mystery of human suffering, the agony of personal existence, and the ghastly means by which someone might achieve salvation from both. A bullied child seeks vengeance within a bed's hollow box spring. A lucid dreamer is haunted by an impossible house. A dummy reveals its own anatomy in 20 simple steps. A stuttering librarian holds the key to a mill town's unspeakable secrets. A commuter's worldview is shattered by two words printed on a cardboard sign. An aspiring ventriloquist spends a little too much time looking at himself in a mirror. And a presence speaks through them all. Contents: Introduction by Matt Cardin The Mindfulness of Horror Practice Murmurs of a Voice Foreknown The Indoor Swamp Origami Dreams 20 Simple Steps to Ventriloquism Infusorium Organ Void The Secret of VentriloquismEscape to Thin Mountain","201 pages, Hardcover",Horror,480 follower,344 reviews,49,53 (2%),142 (7%),421 (21%),666 (34%),675 (34%)
Jacob's Oath,Martin Fletcher,930,ratings118,"October 8, 2013","As World War II winds to a close, Europe's roads are clogged with twenty million exhausted refugees walking home. Among them are Jacob and Sarah, lonely Holocaust survivors who meet in Heidelberg. But Jacob is consumed with hatred and cannot rest until he has killed his brother’s murderer, a concentration camp guard nicknamed ""The Rat."" Now he must choose between revenge and love, between avenging the past and building a future.Martin Fletcher, who won the National Jewish Book Award for Walking Israel, proved his chops as a novelist with The List, which was selected as the One Book, One Jewish Community title for the city of Philadelphia. Now, Fletcher brings us another touching novel of love, loyalty, and loss, set in the aftermath of the Holocaust.","323 pages, Hardcover",Historical Fiction,131 follower,118 reviews,22,14 (1%),45 (4%),239 (25%),389 (41%),243 (26%)
Devotion,Patti Smith,"12,858","ratings1,392","September 12, 2017","A work of creative brilliance may seem like magic—its source a mystery, its impact unexpectedly stirring. How does an artist accomplish such an achievement, connecting deeply with an audience never met? In this groundbreaking book, one of our culture’s beloved artists offers a detailed account of her own creative process, inspirations, and unexpected connections. Patti Smith, a National Book Award-winning author, first presents an original and beautifully crafted tale of obsession—a young skater who lives for her art, a possessive collector who ruthlessly seeks his prize, a relationship forged of need both craven and exalted. She then takes us on a second journey, exploring the sources of her story. We travel through the South of France to Camus’s house, and visit the garden of the great publisher Gallimard where the ghosts of Mishima, Nabokov, and Genet mingle. Smith tracks down Simone Weil’s grave in a lonely cemetery, hours from London, and winds through the nameless Paris streets of Patrick Modiano’s novels. Whether writing in a café or a train, Smith generously opens her notebooks and lets us glimpse the alchemy of her art and craft in this arresting and original book on writing.The Why I Write series is based on the Windham-Campbell Lectures, delivered annually to commemorate the awarding of the Donald Windham-Sandy M. Campbell Literature Prizes at Yale University.","95 pages, Hardcover",Nonfiction,11.3k follower,"1,392 reviews",137,250 (1%),778 (6%),"3,230 (25%)","4,993 (38%)","3,607 (28%)"
Tango: Stories of Desire in Poetry,Deborah Grace,2,ratings1,"February 14, 2014","Stories of Desire in Poetry is a kaleidoscope of lust and love.Grace invites the reader into the world of a woman who deeply experiences life from sexual obsession to the familiarities of marriage, to juggling what it is to be a lover and mother. She explores the shadow side of desire including infatuation and infidelity, as well as the creative cauldron that a Beloved inspires, all with honesty, poignancy and celebration, very rarely offered in our society that merely titillates and discourages true expression. Grace asserts to get to know our passion is a spiritual journey. She takes us on hers with care, exquisite imagery and eroticism. Read these poems to be turned on, tuned in, ultimately connected to your own heart.","159 pages, Paperback",my-literature-loves,14 book,1 review,14,0 (0%),0 (0%),0 (0%),1 (50%),1 (50%)
Allies of the Night,Darren Shan,"26,770",ratings578,"November 4, 2002","Darren Shan, Vampire Prince and ""vampaneze"" killer, faces his worst nightmare yet--school. But homework is the least of Darren's problems. Bodies are piling up. Time is running out. And the past is catching up with the hunters fast.","256 pages, Paperback",Fantasy,"7,759 follower",578 reviews,253,169 (<1%),870 (3%),"4,779 (17%)","8,947 (33%)","12,005 (44%)"
"Lennon: The Man, the Myth, the Music - The Definitive Life",Tim Riley,465,ratings72,"December 1, 2010","In his commanding new book, the eminent NPR critic Tim Riley takes us on the remarkable journey that brought a Liverpool art student from a disastrous childhood to the highest realms of fame.Riley portrays Lennon’s rise from Hamburg’s red light district to Britain’s Royal Variety Show; from the charmed naivetÉ of “Love Me Do” to the soaring ambivalence of “Don’t Let Me Down”; from his shotgun marriage to Cynthia Powell in 1962 to his epic media romance with Yoko Ono. Written with the critical insight and stylistic mastery readers have come to expect from Riley, this richly textured narrative draws on numerous new and exclusive interviews with Lennon’s friends, enemies, confidantes, and associates; lost memoirs written by relatives and friends; as well as previously undiscovered City of Liverpool records. Riley explores Lennon in all of his the British art student who universalized an American style, the anarchic rock ’n’ roller with the moral spine, the anti-jazz snob who posed naked with his avant-garde lover, and the misogynist who became a househusband. What emerges is the enormous, seductive, and confounding personality that made Lennon a cultural touchstone.In Lennon , Riley casts Lennon as a modernist hero in a sweeping epic, dramatizing rock history anew as Lennon himself might have experienced it.","765 pages, Hardcover",Biography,30 follower,72 reviews,24,6 (1%),26 (5%),111 (23%),184 (39%),138 (29%)
Yes: My Improbable Journey to the Main Event of WrestleMania,Daniel   Bryan,"2,441",ratings242,"April 1, 2015","One of WWE's most unlikely champions of all time and also one of its most popular, Bryan has proved to the world and to all of WWE that looks can be deceiving. Just ask anyyone who's ever underestimated him . . . right before he went out and whipped the WWE universe into a frenzy.This is Bryan's behind-the-scenes story told for the first time ever by the ""YES!"" Man himself---from his beginnings as a child wanting to wrestle to his ten years circling the globe on the independent circuit and his remarkable climb to the upper ranks of WWE.As the biggest week of his life unfolds, Aberdeen, Washington's bearded son reflects in full detail on his incredible path to the top and gives his take on the events that have shaped him. With his Bryan-ized blend of modesty and surprising candor, Daniel pulls no punches (or martial arts kicks) as he reveals his true thoughts on his evolution as a performer, his various roles in WWE versus the independent years, life on the road, at home, and much more.And of course, get the untold story surrounding the ""YES!"" chant that evolved to full-fledged movement, skyrocketing his career. This book chronicles all the hard work, values, influences, unique life choices, and more, leading to his watershed week at WrestleMania 30. You won't want to miss it. Yes! We're sure about this.","308 pages, Hardcover",Nonfiction,10 follower,242 reviews,2,12 (<1%),50 (2%),517 (21%),"1,003 (41%)",859 (35%)
A Little Hatred,Joe Abercrombie,"41,970","ratings3,515","September 17, 2019","The chimneys of industry rise over Adua and the world seethes with new opportunities. But old scores run deep as ever.On the blood-soaked borders of Angland, Leo dan Brock struggles to win fame on the battlefield, and defeat the marauding armies of Stour Nightfall. He hopes for help from the crown. But King Jezal's son, the feckless Prince Orso, is a man who specializes in disappointments.Savine dan Glokta - socialite, investor, and daughter of the most feared man in the Union - plans to claw her way to the top of the slag-heap of society by any means necessary. But the slums boil over with a rage that all the money in the world cannot control.The age of the machine dawns, but the age of magic refuses to die. With the help of the mad hillwoman Isern-i-Phail, Rikke struggles to control the blessing, or the curse, of the Long Eye. Glimpsing the future is one thing, but with the guiding hand of the First of the Magi still pulling the strings, changing it will be quite another...","480 pages, Hardcover",Fantasy,28.2k follower,"3,515 reviews",116,214 (<1%),545 (1%),"3,031 (7%)","14,451 (34%)","23,729 (56%)"
"Little Dog, Lost",Marion Dane Bauer,"1,318",ratings230,"May 1, 2012","From Newbery Honoree Marion Dane Bauer comes the tale of a boy who needs a dog, and a dog who needs a boya match made in heaven, if only the two can meet.Mark is a boy who needs a dog. But he can't get his mom on board with his plan.Buddy is a dog who needs a boy. Buddy has an owner already, but not one who understands the kind of love and care -the 'something more' a dog needs.Mr. LaRue is a neighbor who needs a community. He's alone all the time in his huge old house and everyone needs more than that.Over the course of a summer thunderstorm and one chaotic town council meeting, these three characters cross paths and come together in a timeless tale ripe with emotions and told in verse that resolves with love, understanding, and a sense of belonging - plus a place to play a game of fetch!","208 pages, Hardcover",Poetry,171 follower,230 reviews,176,25 (1%),60 (4%),305 (23%),508 (38%),420 (31%)
