Title,Authors,Avg Ratings,Rating,first_published,Description,Total_Pages,Genre,author_followers,no_of_reviews,no_book_by_author,one_star_ratings,two_star_ratings,three_star_ratings,four_star_ratings,five_star_ratings
Genius: The Game,Leopoldo Gout,"2,574",ratings467,"June 7, 2016","Trust no one. Every camera is an eye. Every microphone an ear. Find me and we can stop him together.The Game: Get ready for Zero Hour as 200 geniuses from around the world go head to head in a competition hand-devised by India's youngest CEO and visionary.The Players:Rex- One of the best programmers/hackers in the world, this 16-year-old Mexican-American is determined to find his missing brother.Tunde- This 14-year-old self-taught engineering genius has drawn the attention of a ruthless military warlord by single-handedly bringing electricity and internet to his small Nigerian village.Painted Wolf- One of China's most respected activist bloggers, this mysterious 16-year-old is being pulled into the spotlight by her father's new deal with a corrupt Chinese official.The Stakes: Are higher than you can imagine. Like life and death. Welcome to the revolution. And get ready to run.","304 pages, Hardcover",Young Adult,213 follower,467 reviews,10,72 (2%),201 (7%),735 (28%),891 (34%),675 (26%)
Nexus,Ramez Naam,"20,095","ratings1,757","December 16, 2012","Mankind gets an upgradeIn the near future, the experimental nano-drug Nexus can link humans together, mind to mind. There are some who want to improve it. There are some who want to eradicate it. And there are others who just want to exploit it.When a young scientist is caught improving Nexus, he’s thrust over his head into a world of danger and international espionage – for there is far more at stake than anyone realizes.From the halls of academe to the halls of power, from the headquarters of an elite US agency in Washington DC to a secret lab beneath a top university in Shanghai, from the underground parties of San Francisco to the illegal biotech markets of Bangkok, from an international neuroscience conference to a remote monastery in the mountains of Thailand – Nexus is a thrill ride through a future on the brink of explosion.","460 pages, Paperback",Science Fiction,"1,403 follower","1,757 reviews",30,360 (1%),929 (4%),"3,552 (17%)","7,912 (39%)","7,342 (36%)"
Rump: The True Story of Rumpelstiltskin,Liesl Shurtliff,"18,440","ratings2,130","April 9, 2013","In a magic kingdom where your name is your destiny, 12-year-old Rump is the butt of everyone's joke. But when he finds an old spinning wheel, his luck seems to change. Rump discovers he has a gift for spinning straw into gold. His best friend, Red Riding Hood, warns him that magic is dangerous, and she’s right. With each thread he spins, he weaves himself deeper into a curse. To break the spell, Rump must go on a perilous quest, fighting off pixies, trolls, poison apples, and a wickedly foolish queen. The odds are against him, but with courage and friendship—and a cheeky sense of humor—he just might triumph in the end.","272 pages, Hardcover",Fantasy,678 follower,"2,130 reviews",11,316 (1%),764 (4%),"3,638 (19%)","6,716 (36%)","7,006 (37%)"
Midnight's Daughter,Karen Chance,"19,880",ratings802,"August 26, 2008","Dorina Basarab is a dhampir-half human, half vampire. Subject to uncontrollable rages, most dhampirs live very short, very violent lives. So far Dory has managed to maintain her sanity by unleashing her anger on those demons and vampires who deserve killing.Now Dory's vampire father has come back into her life. Her Uncle Dracula (yes, the Dracula), infamous even among vampires for his cruelty and murderous ways, has escaped his prison. And her father wants Dory to work with gorgeous master vampire Louis-Cesare to put him back there.Vampires and dhampirs are mortal enemies, and Dory prefers to work alone. But Dracula is the only thing on Earth that truly scares her, so when Dory has to go up against him, she'll take all the help she can get… ...","373 pages, Mass Market Paperback",Urban Fantasy,"5,177 follower",802 reviews,63,415 (2%),964 (4%),"4,046 (20%)","7,165 (36%)","7,290 (36%)"
Waiting for Snow in Havana: Confessions of a Cuban Boy,Carlos Eire,"7,339","ratings1,008","January 28, 2003","In 1962, at the age of eleven, Carlos Eire was one of 14,000 children airlifted out of Cuba, his parents left behind. His life until then is the subject of Waiting for Snow in Havana, a wry, heartbreaking, intoxicatingly beautiful memoir of growing up in a privileged Havana household -- and of being exiled from his own childhood by the Cuban revolution.That childhood, until his world changes, is as joyous and troubled as any other -- but with exotic differences. Lizards roam the house and grounds. Fights aren't waged with snowballs but with breadfruit. The rich are outlandishly rich, like the eight-year-old son of a sugar baron who has a real miniature race car, or the neighbor with a private animal garden, complete with tiger. All this is bathed in sunlight and shades of turquoise and tangerine: the island of Cuba, says one of the stern monks at Carlos's school, might have been the original Paradise -- and it is tempting to believe.His father is a municipal judge and an obsessive collector of art and antiques, convinced that in a past life he was Louis XVI and that his wife was Marie Antoinette. His mother looks to the future; conceived on a transatlantic liner bound for Cuba from Spain, she wants her children to be modern, which means embracing all things American. His older brother electrocutes lizards. Surrounded by eccentrics, in a home crammed with portraits of Jesus that speak to him in dreams and nightmares, Carlos searches for secret proofs of the existence of God.Then, in January 1959, President Batista is suddenly gone, a cigar-smoking guerrilla named Castro has taken his place, and Christmas is canceled. The echo of firingsquads is everywhere. At the Aquarium of the Revolution, sharks multiply in a swimming pool. And one by one, the author's schoolmates begin to disappear -- spirited away to the United States. Carlos will end up there himself, alone, never to see his father again.Narrated with the urgency of a confession, Waiting for Snow in Havana is both an exorcism and an ode to a paradise lost. More than that, it captures the terrible beauty of those times in our lives when we are certain we have died -- and then are somehow, miraculously, reborn.","400 pages, Paperback",Memoir,58 follower,"1,008 reviews",11,247 (3%),576 (7%),"1,711 (23%)","2,630 (35%)","2,175 (29%)"
The Ha-Ha,Dave King,"3,420",ratings482,"January 1, 2005","A debut novel of extraordinary emotional When a mute war veteran opens his home to a young boy, he gets a glimpse of life outside his shell--with all its exuberant joys and crushing sorrows.Its been 30 years since a Vietnam War injury left Howard Kapostash unable to speak, read, or write. Since then he can communicate only with sounds and gestures--a condition that makes him appear slow and disturbed. But inside his head, Howie is the same man he was before the war, longing for Sylvia, his high school sweetheart, and mourning his parents and his chance at a family. Howies solitude comes to an abrupt end with a desperate phone call in the middle of the night; Sylvia is being forced into rehab and needs him to care for her nine-year-old son Ryan until she returns. Though Ryans first days with Howie are strained by misunderstanding, his presence gradually transforms Howie and his entire household, which includes Laurel, a soup chef, and a pair of housepainters Howie grumpily thinks of as Nit and Nat. By midsummer, their once-cold home is alive with the happiness, disappointment, and love of a real family. But with Sylvias return imminent, Howie is obliged to wonder if the change is only temporary--and to reconsider, in the process, just what the war cost him.Triumphant and heartbreaking, THE HA-HA tells a singular and engaging story and heralds the arrival of a tremendous new voice in fiction.","340 pages, Hardcover",Fiction,29 follower,482 reviews,192,91 (2%),286 (8%),"1,088 (31%)","1,391 (40%)",564 (16%)
The Complete Artist's Way : Creativity as a Spiritual Practice,Julia Cameron,"110,631","ratings4,287","March 4, 2002","For the millions of readers who have experienced the rich rewards of following any or all of Julia Cameron's three twelve-week programs for creative recovery, here is a gorgeous cloth-bound edition that includes The Artist's Way, Walking in This World, and Finding Water. In her introduction, Cameron reflects on the artist's journey and provides deep insights into how readers may set about cultivating a more creative and spiritually rewarding existence by using the principles contained in these books.  Encompassing Cameron's most vital work from over the course of the last two decades, The Complete Artist's Way is an essential volume for Cameron's legions of fans.  This collector's edition features:  - a ribbon bookmark - a cloth spine - a printed case with debossing and foil - elegant rough-front pages","730 pages, Hardcover",Nonfiction,"1,884 follower","4,287 reviews",107,"6,610 (5%)","7,314 (6%)","18,705 (16%)","31,045 (28%)","46,957 (42%)"
Magic in the Blood,Devon Monk,"7,605",ratings357,"May 5, 2009","In the second book in Devon Monk’s Allie Beckstrom series, when the police’s magical enforcement division asks Allie to consult on a missing persons case, she finds herself drawn into an underworld of criminals, ghosts, and blood magic. Working as a Hound—tracing illegal spells back to their casters—has taken its toll on Allison Beckstrom. But even though magic has given her migraines and stolen her recent memory, Allie isn’t about to quit. Then the police’s magic enforcement division asks her to consult on a missing persons case. But what seems to be a straightforward job turns out to be anything but, as Allie finds herself drawn into the underworld of criminals, ghosts, and blood magic.","368 pages, Mass Market Paperback",Urban Fantasy,"2,023 follower",357 reviews,73,65 (<1%),258 (3%),"1,875 (24%)","3,080 (40%)","2,327 (30%)"
The Horse Boy: A Father's Quest to Heal His Son,Rupert Isaacson,"4,339",ratings636,"January 1, 2009","When his son Rowan was diagnosed with autism, Rupert Isaacson was devastated, afraid he might never be able to communicate with his child. But when Isaacson, a lifelong horseman, rode their neighbor's horse with Rowan, Rowan improved immeasurably. He was struck with a crazy why not take Rowan to Mongolia, the one place in the world where horses and shamanic healing intersected?THE HORSE BOY is the dramatic and heartwarming story of that impossible adventure. In Mongolia, the family found undreamed of landscapes and people, unbearable setbacks, and advances beyond their wildest dreams. This is a deeply moving, truly one-of-a-kind story--of a family willing to go to the ends of the earth to help their son, and of a boy learning to connect with the world for the first time.","368 pages, Hardcover",Nonfiction,38 follower,636 reviews,15,58 (1%),203 (4%),911 (20%),"1,634 (37%)","1,533 (35%)"
Mutants: On Genetic Variety and the Human Body,Armand Marie Leroi,"3,780",ratings277,"January 1, 2003","Mutants gives a brilliant narrative account of our genetic code and the captivating people whose bodies have revealed it--a French convent girl who found herself changing sex at puberty; children who, echoing Homer's Cyclops, are born with a single eye in the middle of their foreheads; a village of long-lived Croatian dwarves; one family, whose bodies were entirely covered with hair, was kept at the Burmese royal court for four generations and gave Darwin one of his keenest insights into heredity. This elegant, humane, and engaging book ""captures what we know of the development of what makes us human"" (Nature).Visit Armand Marie Leroi on the web: http: //armandleroi.com/index.htmlStepping effortlessly from myth to cutting-edge science,","448 pages, Paperback",Science,28 follower,277 reviews,2,64 (1%),168 (4%),713 (18%),"1,402 (37%)","1,433 (37%)"
Heart Of Stone,C.E. Murphy,"4,457",ratings327,"November 1, 2007","What secrets lie shrouded in darkness?Okay, so jogging through Central Park after midnight wasn't a bright idea. But Margrit Knight never thought she'd encounter a dark new world filled with magical beings, not to mention a dying woman and a mysterious stranger with blood on his hands. Her logical lawyer instincts told her it couldn't all be real, but she could hardly deny what she'd seen...and touched.The mystery man, Alban, was a gargoyle. One of the fabled Old Races who had hidden their existence for centuries. Now he was a murder suspect, and he needed Margrit's help to take the heat off him and find the real killer. And as the dead pile up, it's a race against the sunrise to clear Alban's name and keep them both alive.",Audiobook,Urban Fantasy,"1,776 follower",327 reviews,84,112 (2%),375 (8%),"1,298 (29%)","1,587 (35%)","1,085 (24%)"
The Huntress,Susan Carroll,"1,354",ratings66,"July 31, 2007","In a time of intrigue and betrayal, the Huntress is on a quest that could jeopardize two empires and two great queens: Catherine de Medici and Elizabeth I. The year is 1585—and prophecy has foretold the coming of a daughter of the Earth whose powers are so extraordinary they could usurp the very rule of the Dark Queen herself, Catherine de Medici. Dispatched from Brittany to London, Catriona O'Hanlon, known as the Huntress, must find this mysterious young girl and shield her from those who will exploit her mystic abilities, which have the potential to change the course of history. Catriona's skill with weaponry is all she has to protect herself and her young charge from spies who snake through the courts of Elizabeth I, the Virgin Queen—including the girl's own father, whose loyalties are stretched to the breaking point. But Catriona will soon face menacing forces and sinister plots unlike any she has ever encountered. From Susan Carroll, the celebrated storyteller of historical fiction, The Huntress is an unforgettable portrait of power and passion—and one woman's courage to risk everything for those she loves.","490 pages, Paperback",Historical Fiction,358 follower,66 reviews,63,13 (<1%),71 (5%),367 (27%),506 (37%),397 (29%)
Not the End of the World,Kate Atkinson,"6,697",ratings533,"November 4, 2002",Arthur is a precocious eight-year-old boy whose mother is a B-list celebrity more concerned with the state of her bank account than with her son's development. Then an enigmatic young nanny named Missy introduces him to a world he never knew existed.,"289 pages, Paperback",Short Stories,10.8k follower,533 reviews,58,203 (3%),535 (7%),"1,664 (24%)","2,576 (38%)","1,719 (25%)"
Charlie Johnson in the Flames,Michael Ignatieff,71,ratings11,"January 1, 2003","Michale Ignatieff is a profound meditation on war, guilt and one man's search for justice by one of our most important moral, ethical and political thinkers.",Hardcover,Fiction,130 follower,11 reviews,66,0 (0%),17 (23%),33 (46%),17 (23%),4 (5%)
The Ghosts of Cannae: Hannibal and the Darkest Hour of the Roman Republic,Robert L. O'Connell,"2,534",ratings228,"July 13, 2010","A stirring account of the most influential battle in history: For millennia, Carthage's triumph over Rome at Cannae in 216 BCE has inspired reverent awe. It was the battle that countless armies tried to imitate, most notably in World Wars I & II, the battle that obsessed military minds. Yet no general ever matched Hannibal's unexpected, innovative & brutal military victory--the costliest day of combat for any army in history. Robert L. O'Connell, an admired military historian, now tells the whole story of Cannae, giving a stirring account of this apocalyptic battle of the 2nd Punic War, its causes & consequences. O'Connell shows how a restive Rome amassed a giant army to punish Carthage's commander, who'd dealt them deadly blows at Trebia & Lake Trasimene, & how Hannibal outwitted enemies that outnumbered him. He describes Hannibal's strategy of blinding his opponents with sun & dust, enveloping them in a deadly embrace & sealing their escape, before launching a massive knife fight that would kill 48,000 men in close contact. The Ghosts of Cannae then conveys how this disastrous pivot point in Rome's history ultimately led to the republic's resurgence & the creation of its empire. Piecing together decayed shreds of ancient reportage, the author paints powerful portraits of the leading players: Hannibal, resolutely sane & uncannily strategic; Varro, Rome's co-consul scapegoated for the loss; & Scipio Africanus, the surviving, self-promoting Roman military tribune who would one day pay back Hannibal at Zama in N. Africa. Finally, O'Connell reveals how Cannae's legend has inspired & haunted military leaders ever since, & the lessons it teaches. Superbly researched, written with erudite wit, The Ghosts of Cannae is the definitive account of a battle whose history still resonates.","336 pages, Hardcover",History,57 follower,228 reviews,15,28 (1%),97 (3%),432 (17%),"1,062 (41%)",915 (36%)
"Marie, Dancing",Carolyn Meyer,"1,174",ratings95,"January 1, 2005","Marie van Goethem, a fourteen-year-old ballet dancer in the famed Paris Opéra, has led a life of hardship and poverty. For her, dancing is the only joy to counter the pain inflicted by hunger, her mother's drinking, and her selfish older sister. But when famed artist Edgar Degas demands Marie's presence in his studio, it appears that her life will be transformed: He will pay her to pose for a new sculpture, and he promises to make her a star.As Marie patiently stands before Mr. Degas each week, she dreams about supporting her family without being corrupted like most young dancers. She dreams about a life as a ballerina on the stage of the Opéra. And she dreams about being with her true love.In this deeply moving, historically based account, Carolyn Meyer examines the life of the model for Edgar Degas's most famous sculpture, Little Dancer Aged Fourteen .Includes an author's note.","272 pages, Hardcover",Historical Fiction,"1,048 follower",95 reviews,105,23 (1%),86 (7%),338 (28%),420 (35%),307 (26%)
Cum Laude,Cecily von Ziegesar,"1,903",ratings251,"January 1, 2010","They're here for a higher education . . . and you won't believe how far they'll go. Dexter College is a small liberal arts college in the quiet town of Home, Maine. But it won't stay quiet for long with this group of freshmen. There's Shipley--blonde and beautiful, the object of envy and more than a little lust. Determined to assert herself and to shed her good-girl image, she buys cigarettes and condoms, because that's what every self-respecting college girl does. Her edgy roommate, Eliza, came to Dexter to get noticed, and she has the attitude and the mouth to prove it. Then there's Tom. Handsome, privileged, used to getting his own way, he's a jock-turned-artist who thinks his paintings will change the world. Sensitive Nick, Tom's wake-and-bake pot-smoking roommate, wants to follow in the footsteps of his boarding-school hero. And then there are brother and sister Adam and Tragedy Gatz. The freckle-faced farm boy lives at home with his parents and his little sister, who does all she can to stop him from being a wuss. As Shipley, Eliza, Tom, Nick, and Adam find out, that first year of college is more than credits and cramming. Between the lust and the love, the secrecy and the scandal, they'll all receive an unexpected education. It's a time of shifting alliances, unrequited crushes, and coming of age. Find Yourself is Dexter's motto. And they are determined to do just that.","272 pages, Hardcover",Young Adult,"2,801 follower",251 reviews,146,370 (19%),653 (34%),535 (28%),224 (11%),121 (6%)
Vampires are Forever,Lynsay Sands,"19,505",ratings496,"January 1, 2008","Vampires Don't Exist...Do They?Inez Urso is beginning to have her doubts. Her business associate Thomas Argeneau has some interesting traits, like an allergic reaction to the sun, excellent night vision, and not much of an appetite for food. And to top it all off, he just tried to bite her neck...but maybe that was a sign of passion. If so, she'd be happy to experience more, despite her determination not to mix business with pleasure.
He's Been Waiting Forever For A Woman Like Her...
Well, if not forever, at least two hundred years. Inez is the most beautiful woman he's seen in centuries. Those luscious lips, seductive curves, and her elegant neck...he just couldn't resist the temptation of one little bite. Now Thomas will do anything to convince her that only an immortal like him can satisfy her all night long...","361 pages, Mass Market Paperback",Romance,11.6k follower,496 reviews,123,88 (<1%),459 (2%),"3,175 (16%)","6,380 (32%)","9,403 (48%)"
The Hero's Guide to Being an Outlaw,Christopher Healy,"3,041",ratings320,"April 29, 2014","The League of Princes returns in the hilariously epic conclusion to the hit series that began with Christopher Healy's The Hero's Guide to Saving Your Kingdom, which the Los Angeles Times called ""one of the more clever, hilariously successful incarnations of the current literary rage to rip apart and rewrite fairy tales.""Prince Liam. Prince Frederic. Prince Duncan. Prince Gustav. You think you know those guys pretty well by now, don't you? Well, think again. Posters plastered across the thirteen kingdoms are saying that Briar Rose has been murdered—and the four Princes Charming are the prime suspects. Now they're on the run in a desperate attempt to clear their names. Along the way, however, they discover that Briar's murder is just one part of a nefarious plot to take control of all thirteen kingdoms—a plot that will lead to the doorstep of an eerily familiar fortress for a final showdown with an eerily familiar enemy.","529 pages, Kindle Edition",Fantasy,452 follower,320 reviews,17,33 (1%),60 (1%),372 (12%),"1,003 (32%)","1,573 (51%)"
Treasure of Lima,Alex Archer,201,ratings15,"July 2, 2013","White beaches and coral reefs should be adventure-proof... For archaeologist and TV show host Annja Creed, a restful vacation in Costa Rica is as elusive as a rare artifact. Days into her sojourn, Annja's peace is interrupted by a woman with a mysterious - and enticing - tale. Weeks earlier, her husband led an expedition into the rain forest, in search of the lost treasure of Lima, and hadn't returned. The priceless hoard was smuggled out of Peru during the country's nineteenth-century revolt against Spain. But it disappeared when a ship captain went mad with greed. Twenty-six expeditions have gone after the treasure. And twenty-six expeditions have vanished. Sympathetic to the woman's distress, Annja agrees to head up a rescue party for her missing husband. And Annja can't deny her own interest in the lost hoard. Now the fates of two expeditions are at stake, along with a fortune in gold, silver and jewels rumoured to be exquisite. But the dense jungle of Cocos Island guards its primitive secrets well. Danger lurks beneath the ancient green canopy. And this time, Annja doesn't see it coming....","320 pages, Mass Market Paperback",Fantasy,226 follower,15 reviews,96,2 (<1%),4 (1%),71 (35%),71 (35%),53 (26%)
The Seduction of the Crimson Rose,Lauren Willig,"8,510",ratings606,"January 6, 2008","A continuation of the series that began with The Masque of the Black Tulip and The Deception of the Emerald Ring finds Mary accepting a secret assignment from spy Lord Vaughn to infiltrate the Black Tulip's operation in order to prevent an invasion of England. 40,000 first printing.","385 pages, Hardcover",Historical Fiction,"4,466 follower",606 reviews,43,57 (<1%),399 (4%),"2,294 (26%)","3,522 (41%)","2,238 (26%)"
Threshold,Jeremy Robinson,"2,168",ratings95,"March 17, 2011","After a terrorist attack on a reservation in Oregon leaves thousands dead, Jack Sigler, call sign King and his Chess Team — Queen, Rook, Bishop and Knight — must protect the only survivor, thirteen year-old Fiona Lane. When a death in the family pulls King away, and the rest of the team is sent on a mission, Fort Bragg is attacked by a strange and overwhelming force. When the dust settles, Fiona is gone.But the attack is part of a larger offensive. Around the world the last speakers of ancient languages are being systematically exterminated. As they fight to find the mastermind behind the killings, and Fiona, the team is hunted by strange creatures that defy explanation — living statues, genetically modified monsters and walking megaliths — sent by an enemy from their past. If not stopped, he will be able to remake himself, and the world.Calling on help from old friends and ancient heroes, the team fights their most desperate battle yet, not just to save the world as we know it, but to rescue a little girl who wants nothing more than to call King Dad.An ancient tower holds the key to unlocking a horrifying secret hidden within mankind’s most antiquated languages. If unlocked, the world as we know it will cease to exist.Jeremy Robinson’s third book in the Jack Sigler series is a rocket-powered thriller, combining high adrenaline action, smart science, ancient legends, and stunning locations.","352 pages, Hardcover",Thriller,"2,324 follower",95 reviews,132,17 (<1%),52 (2%),337 (15%),843 (38%),919 (42%)
