Title,Authors,Avg Ratings,Rating,first_published,Description,Total_Pages,Genre,author_followers,no_of_reviews,no_book_by_author,one_star_ratings,two_star_ratings,three_star_ratings,four_star_ratings,five_star_ratings
The Spectrum Girl’s Survival Guide,Siena Castellon,290,ratings55,"March 19, 2020","""Never be ashamed of being different: it is this difference that makes you extraordinary and unique.""This essential go-to guide gives you all the advice and tools you'll need to help you flourish and achieve what you want in life. From the answers to everyday questions such as 'Am I using appropriate body language?' and 'Did I say the wrong thing?', through to discussing the importance of understanding your emotions, looking after your physical and mental health and coping with anxiety and sensory overloads, award-winning neurodiversity campaigner Siena Castellon uses her own experiences to provide you with the skills to overcome any challenge.With practical tips on friendships, dating, body image, consent and appearance, as well as how to survive school and bullying, The Spectrum Girl's Survival Guide gives you the power to embrace who you are, reminding you that even during the toughest of teen moments, you are never alone.","256 pages, Paperback",Autistic Spectrum Disorder,25 follower,55 reviews,4,1 (<1%),7 (2%),50 (17%),110 (37%),122 (42%)
"My Sister, the Serial Killer",Oyinkan Braithwaite,"289,578","ratings33,077","July 17, 2018","When Korede's dinner is interrupted one night by a distress call from her sister, Ayoola, she knows what's expected of her: bleach, rubber gloves, nerves of steel and a strong stomach. This'll be the third boyfriend Ayoola's dispatched in, quote, self-defence and the third mess that her lethal little sibling has left Korede to clear away. She should probably go to the police for the good of the menfolk of Nigeria, but she loves her sister and, as they say, family always comes first. Until, that is, Ayoola starts dating the doctor where Korede works as a nurse. Korede's long been in love with him, and isn't prepared to see him wind up with a knife in his back: but to save one would mean sacrificing the other...My Sister, the Serial Killer is a blackly comic novel about how blood is thicker - and more difficult to get out of the carpet - than water...","226 pages, Hardcover",Fiction,"4,256 follower","33,077 reviews",10,"4,390 (1%)","20,178 (6%)","91,865 (31%)","122,512 (42%)","50,633 (17%)"
Quantum of Nightmares,Charles Stross,"1,956",ratings162,"January 11, 2022","A unique blend of espionage thrills and Lovecraftian horror, Hugo Award-winning author Charles Stross's Laundry Files continues with Quantum of Nightmares. It’s a brave new Britain under the New Management. The avuncular Prime Minister is an ancient eldritch god of unimaginable power. Crime is plummeting as almost every offense is punishable by death. And everywhere you look, there are people with strange powers, some of which they can control, and some, not so much. Hyperorganized and formidable, Eve Starkey defeated her boss, the louche magical adept and billionaire Rupert de Montfort Bigge, in a supernatural duel to the death. Now she’s in charge of the Bigge Corporation—just in time to discover the lethal trap Rupert set for her long ago. Wendy Deere’s transhuman abilities have gotten her through many a scrape. Now she’s gainfully employed investigating unauthorized supernatural shenanigans. She swore to herself she wouldn’t again get entangled with Eve Starkey’s bohemian brother Imp and his crew of transhuman misfits. Yeah, right. Mary Macandless has powers of her own. Right now she’s pretending to be a nanny in order to kidnap the children of a pair of famous, Government-authorized superheroes. These children have powers of their own, and Mary Macandless is in way over her head. Amanda Sullivan is the HR manager of a minor grocery chain, much oppressed by her glossy blonde boss—who is cooking up an appalling, extralegal scheme literally involving human flesh. All of these stories will come together, with world-bending results...","368 pages, Hardcover",Fantasy,"5,612 follower",162 reviews,161,9 (<1%),50 (2%),368 (18%),794 (40%),735 (37%)
The Demigod Diaries,Rick Riordan,"60,442","ratings2,589","August 14, 2012","What dangers do runaway demigods Luke and Thalia face on their way to Camp Half-Blood? Are Percy and Annabeth up to the task of rescuing stolen goods from a fire-breathing giant who doesn't take kindly to intruders? How exactly are Leo, Piper, and Jason supposed to find a runaway table, dodge a band of party-loving Maenads (who just might be a little psychotic), and stave off a massive explosion...all in one hour or less? With his trademark wit and creativity, Rick Riordan answers these questions and more in three never-before-seen short stories that provide vital back-story to the Heroes of Olympus and Percy Jackson books. Original art, enlightening character interviews and profiles, puzzles, and a quiz add to the fun in this action-packed collection.","244 pages, Hardcover",Fantasy,423k follower,"2,589 reviews",241,347 (<1%),"1,925 (3%)","12,340 (20%)","20,275 (33%)","25,555 (42%)"
Lady Tan's Circle Of Women,Lisa See,"72,759","ratings7,605","June 6, 2023","13 hours, 15 minutesThe latest historical novel from New York Times bestselling author Lisa See, inspired by the true story of a woman physician from 15th-century China—perfect for fans of See’s classic Snow Flower and the Secret Fan and TheIsland of Sea Women.According to Confucius, “an educated woman is a worthless woman,” but Tan Yunxian—born into an elite family, yet haunted by death, separations, and loneliness—is being raised by her grandparents to be of use. Her grandmother is one of only a handful of female doctors in China, and she teaches Yunxian the pillars of Chinese medicine, the Four Examinations—looking, listening, touching, and asking—something a man can never do with a female patient.From a young age, Yunxian learns about women’s illnesses, many of which relate to childbearing, alongside a young midwife-in-training, Meiling. The two girls find fast friendship and a mutual purpose—despite the prohibition that a doctor should never touch blood while a midwife comes in frequent contact with it—and they vow to be forever friends, sharing in each other’s joys and struggles. No mud, no lotus, they tell themselves: from adversity beauty can bloom.But when Yunxian is sent into an arranged marriage, her mother-in-law forbids her from seeing Meiling and from helping the women and girls in the household. Yunxian is to act like a proper wife—embroider bound-foot slippers, pluck instruments, recite poetry, give birth to sons, and stay forever within the walls of the family compound, the Garden of Fragrant Delights.How might a woman like Yunxian break free of these traditions, go on to treat women and girls from every level of society, and lead a life of such importance that many of her remedies are still used five centuries later? How might the power of friendship support or complicate these efforts? Lady Tan’s Circle of Women is a captivating story of women helping other women. It is also a triumphant reimagining of the life of a woman who was remarkable in the Ming dynasty and would be considered remarkable today.",Audiobook,Historical Fiction,50.2k follower,"7,605 reviews",26,161 (<1%),713 (<1%),"6,854 (9%)","28,955 (39%)","36,076 (49%)"
I Am The Wind,Jon Fosse,254,ratings42,"January 1, 2003","I Am The Wind is a tale of enduring humanity against insurmountable odds. Two lifelong traveling companions are bound together on a journey across a vast ocean. At once moving and comic, this new work by one of Europe’s most widely performed playwrights dramatizes the endless struggle to be human.","96 pages, Paperback",Plays,"1,079 follower",42 reviews,207,7 (2%),18 (7%),49 (19%),102 (40%),78 (30%)
The Sweet Spot,Amy Poeppel,"11,126","ratings1,649","January 31, 2023","Amy Poeppel brings her signature “big-hearted, charming” (The Washington Post) style to this wise and joyful novel that celebrates love, hate, and all of the glorious absurdity in between.In the heart of Greenwich Village, three women form an accidental sorority when a baby—belonging to exactly none of them—lands on their collective doorstep. Lauren and her family—lucky bastards—have been granted the use of a spectacular brownstone, teeming with history and dizzyingly unattractive 70s wallpaper. Adding to the home’s bohemian, grungy splendor is the bar occupying the basement, a (mostly) beloved dive called The Sweet Spot. Within days of moving in, Lauren discovers that she has already made an enemy in the neighborhood by inadvertently sparking the divorce of a couple she has never actually met. Melinda’s husband of thirty years has dumped her for a young celebrity entrepreneur named Felicity, and, to Melinda’s horror, the lovebirds are soon to become parents. In her incandescent rage, Melinda wreaks havoc wherever she can, including in Felicity’s Soho boutique, where she has a fit of epic proportions, which happens to be caught on film.​ Olivia—the industrious twenty-something behind the counter, who has big dreams and bigger debt—gets caught in the crossfire. In an effort to diffuse Melinda’s temper, Olivia has a tantrum of her own and gets unceremoniously canned, thanks to TikTok. When Melinda’s ex follows his lover across the country, leaving their squalling baby behind, the three women rise to the occasion in order to forgive, to forget, to Ferberize, and to track down the wayward parents. But can their little village find a way toward the happily ever afters they all desire? Welcome to The Sweet Spot.","400 pages, Hardcover",Fiction,956 follower,"1,649 reviews",4,110 (<1%),406 (3%),"2,469 (22%)","5,308 (47%)","2,833 (25%)"
The Divine Circle of Ladies Playing with Fire,Dolores Stewart Riccio,162,ratings15,"June 23, 2009","They're back...and they're playing with fire! In this 5th episode of Riccio's wickedly entertaining Circle series, Cass Shipton and her bewitching friends return for more crime-solving escapades in historic Plymouth, Massachusetts. When Fresh Meadow stable is set ablaze one frosty January night, clairvoyant Cass has the vivid impression of a serial arsonist in their midst. Ever willing to ""walk on the wild side,"" Cass and her talented Wiccan circle make it their quest to reveal the identity of this clever fire-starter. Can they bring him to justice before more animals and humans are harmed? But that's not all! In a riveting personal drama, how will they protect their new young friend Sylvie from her abusive stalker? All of the Circle's resourcefulness, courage, and magical skills will be needed to cope with the danger and tragedy of this fast-paced adventure.","377 pages, Trade Paperback",Mystery,66 follower,15 reviews,27,1 (<1%),4 (2%),20 (12%),50 (30%),87 (53%)
Nox Dormienda: A Long Night for Sleeping,Kelli Stanley,270,ratings52,"January 1, 2008","One week to solve a murder. Londinium, 83 AD. Vibius Maecenas, spy for Emperor Domitian, lies on an underground altar ... his throat slit to the spinal chord. One week to stop a civil war. Arcturus, the governor's doctor and sometime investigator, must find out who butchered him--and why--before Agricola and all of Britannia are plunged into civil war with Rome. He'd also like to know where the blonde fits in ... Welcome to Roman Noir. NOX DORMIENDA is the first of a new series in a new Roman Noir. Featuring Arcturus, a hardboiled protagonist in the best Philip Marlowe tradition, NOX is a different kind of historical mystery, a suspense thriller that combines a classic noir style with the rich texture of the ancient past.","323 pages, Paperback",Mystery,110 follower,52 reviews,17,11 (4%),24 (8%),81 (30%),91 (33%),63 (23%)
Branded by Fire,Nalini Singh,"32,484","ratings1,670","July 7, 2009","Hailed by Christine Feehan as “a major new talent,” NYT bestselling author Nalini Singh now brings together two fierce changelings in her most explosive story yet.
Though DarkRiver sentinel Mercy is feeling the pressure to mate, she savagely resists when Riley Kincaid, a lieutenant from the SnowDancer pack, tries to possess her. The problem is not simply that he pushes her buttons; the problem is that he's a wolf, she's a cat, and they're both used to being on top.But when a brilliant changeling researcher is kidnapped from DarkRiver territory, Mercy and Riley must work together to track the young man—before his shadowy captors decide he's no longer useful. Along the way, the two dominants may find that submitting to one another uncovers not just a deadly conspiracy, but a passion so raw that it'll leave them both branded by fire . . .","358 pages, Mass Market Paperback",Paranormal Romance,25.5k follower,"1,670 reviews",254,256 (<1%),695 (2%),"4,465 (13%)","11,627 (35%)","15,441 (47%)"
The Scrapbook of Frankie Pratt,Caroline Preston,"40,253",ratings877,"October 25, 2011","“The Scrapbook of Frankie Pratt is a literary bottle rocket—loaded with whimsy, pizzazz, and heart.”—Adriana Trigiani“Is it possible that I have just read/experienced/devoured the most delightful book ever published? Do not argue with me: There is magic here and genius.”—Elinor Lipman“A ripping yarn of emancipated girlish adventure.”—Audrey NiffeneggerThe Scrapbook of Frankie Pratt is a visually stunning, totally unique, full-color novel in the form of a scrapbook, set in the burgeoning bohemian culture of the 1920s and featuring an endearing, unforgettable heroine. Caroline Preston, author of the New York Times Notable Book Jackie by Josie, uses a kaleidoscopic array of vintage memorabilia—postcards, letters, magazine ads, ticket stubs, catalog pages, fabric swatches, candy wrappers, fashion spreads, menus and more—to tell the tale of spirited and ambitious Frankie’s remarkable odyssey from Vassar to Greenwich Village to Paris, in a manner that will delight crafters, historical fiction fans, and anyone who loves a good coming-of-age story ingeniously told.","233 pages, Hardcover",Historical Fiction,255 follower,877 reviews,11,"2,034 (5%)","3,493 (8%)","8,479 (21%)","9,781 (24%)","16,466 (40%)"
Taken by Midnight,Lara Adrian,"23,624",ratings898,"September 28, 2010","AT THE CROSSROADS OF DEATH AND DESIRE, A WOMAN TASTES A PLEASURE NO MORTAL IS MEANT TO SURVIVE. In the frozen Alaskan wilderness, former state trooper Jenna Darrow survives an unspeakable breach of body and soul. But with her narrow escape comes an even greater challenge. For strange changes are taking place within her, as she struggles to understand—and control—a new hunger. To do so, she will seek shelter in the Boston compound of the Order, an ancient race of vampire warriors whose very existence is shrouded in mystery. Perhaps the most mysterious of them all is Brock, a brooding, dark-eyed alpha male whose hands hold the power to comfort, heal . . . and arouse. As she recovers under Brock’s care, Jenna finds herself drawn to the Order’s mission: to stop a ruthless enemy and its army of assassins from subjecting Earth to a reign of terror. Yet in spite of their resolve, a purely physical relationship without strings soon binds Brock and Jenna together with a desire fiercer than life and stronger than death itself—until a secret from Brock’s past and Jenna’s own mortality challenges their forbidden love to the ultimate trial by fire.From the Paperback edition.","370 pages, Mass Market Paperback",Paranormal Romance,10.6k follower,898 reviews,106,122 (<1%),514 (2%),"3,437 (14%)","8,277 (35%)","11,274 (47%)"
Running the Books: The Adventures of an Accidental Prison Librarian,Avi Steinberg,"4,272",ratings733,"January 1, 2010","Avi Steinberg is stumped. After defecting from yeshiva to Harvard, he has only a senior thesis essay on Bugs Bunny to show for his effort. While his friends and classmates advance in the world, he remains stuck at a crossroads, unable to meet the lofty expectations of his Orthodox Jewish upbringing. And his romantic existence as a freelance obituary writer just isn’t cutting it. Seeking direction—and dental insurance—Steinberg takes a job as a librarian in a tough Boston prison.  The prison library counter, his new post, attracts con men, minor prophets, ghosts, and an assortment of quirky regulars searching for the perfect book and a connection to the outside world. There’s an anxious pimp who solicits Steinberg’s help in writing a memoir. A passionate gangster who dreams of hosting a cooking show titled Thug Sizzle. A disgruntled officer who instigates a major feud over a Post-it note. A doomed ex-stripper who asks Steinberg to orchestrate a reunion with her estranged son, himself an inmate. Over time, Steinberg is drawn into the accidental community of outcasts that has formed among his bookshelves — a drama he recounts with heartbreak and humor. But when the struggles of the prison library — between life and death, love and loyalty — become personal, Steinberg is forced to take sides.Running the Books is a trenchant exploration of prison culture and an entertaining tale of one young man’s earnest attempt to find his place in the world while trying not to get fired in the process.","399 pages, Hardcover",Nonfiction,135 follower,733 reviews,7,147 (3%),456 (10%),"1,463 (34%)","1,494 (34%)",712 (16%)
Fairyopolis: A Flower Fairies Journal,Glen Bird,"7,114",ratings133,"October 20, 2005","Protected and hidden by a society of fairy lovers for over 80 years, the secret fairy journal of Cicely Mary Barker is available for the first time. Learn what really happened during that magical summer of 1920 when she discovered the secret world of the Flower Fairies.","32 pages, Hardcover",Fantasy,49 book,133 reviews,49,179 (2%),391 (5%),"1,429 (20%)","1,779 (25%)","3,336 (46%)"
Rodrick Rules,Jeff Kinney,"177,777","ratings8,696","October 15, 2008","The highly anticipated sequel to the #1 NEW YORK TIMES bestselling book! Secrets have a way of getting out, especially when a diary is involved. Whatever you do, don’t ask Greg Heffley how he spent his summer vacation, because he definitely doesn’t want to talk about it. As Greg enters the new school year, he’s eager to put the past three months behind him . . . and one event in particular. Unfortunately for Greg, his older brother, Rodrick, knows all about the incident Greg wants to keep under wraps. But secrets have a way of getting out . . . especially when a diary is involved. Diary of a Wimpy Kid: Rodrick Rules chronicles Greg’s attempts to navigate the hazards of middle school, impress the girls, steer clear of the school talent show, and most important, keep his secret safe.","226 pages, Hardcover",Fiction,16.2k follower,"8,696 reviews",369,"3,550 (1%)","8,546 (4%)","31,040 (17%)","48,521 (27%)","86,120 (48%)"
Meet Addy: An American Girl,Connie Rose Porter,"10,002",ratings362,"September 1, 1993","Addy Walker's family is planning a dangerous escapefrom slavery in the summer of 1864. But before they can make the escape, the worst happens--Master Stevens decides to sell some of his slaves, including Poppa and Addy's brother, Sam. Addy and Momma take the terrible risk of escaping by themselves, hoping that the family eventually will be together again in Philadelphia. Set during America's own struggle over slavery, the Civil War, Addy's story is one of great courage and love--love of family and love of freedom.","88 pages, Paperback",Historical Fiction,92 follower,362 reviews,32,113 (1%),388 (3%),"2,161 (21%)","2,932 (29%)","4,408 (44%)"
The Third Circle,Amanda Quick,"9,148",ratings462,"January 1, 2008","The Arcane Society novels, written under both the Amanda Quick and Jayne Ann Krentz names, have pulled readers into a saga filled with steamy romance, drama, and dark intrigue. Her newest novel promises to mesmerize as well.Leona Hewitt, disguised in men's formal evening clothes, has secretly made her way into Lord Delbridge’s private museum to retrieve a relic stolen from her family years ago. But someone else is there in the dimly lit gallery, on the same errand: a tall, black-cloaked man whose very voice is enough to put her in a trance.Thaddeus Ware, a mesmerist with psychic energy, is accustomed to fearful reactions from others—women, in particular. After all, a man who can control the minds and actions of others could rob a lady of her virtue—without her ever knowing! But Leona shows no trace of hysteria in his presence. A force to be reckoned with as both a gifted crystal worker and a woman, she exerts a rather hypnotic power over the hypnotist himself. And she is determined to keep the coveted crystal they recovered, by giving him the slip at a run-down London inn.Thaddeus, on assignment for the Arcane Society, knows the menace Leona is courting by absconding with the crystal. It is a source of remarkable energy, and it holds the potential for great destruction. Lord Delbridge has already killed two men to acquire it, for it is his key to membership in the elite, shadowy group known as the Third Circle. And, with the help of a seductive hunter of preternatural skill—dubbed ""The Midnight Monster"" by the press—Delbridge intends to find her. With the stolen crystal in their possession, the danger is only beginning.","342 pages, Hardcover",Romance,"5,207 follower",462 reviews,117,56 (<1%),334 (3%),"2,215 (24%)","3,425 (37%)","3,118 (34%)"
After the Apocalypse,Maureen F. McHugh,"2,394",ratings383,"October 24, 2011","Publishers Weekly Top 10 Best of the YearIn her new collection, Story Prize finalist Maureen F. McHugh delves into the dark heart of contemporary life and life five minutes from now and how easy it is to mix up one with the other. Her stories are post-bird flu, in the middle of medical trials, wondering if our computers are smarter than us, wondering when our jobs are going to be outsourced overseas, wondering if we are who we say we are, and not sure what we'd do to survive the coming zombie plague.Praise for Maureen F. ""Gorgeously crafted stories.""-Nancy Pearl, NPR""Hauntingly beautiful.""-Booklist""Unpredictable and poetic work.""-The Plain DealerMaureen F. McHugh has lived in New York; Shijiazhuang, China; Ohio; Austin, Texas; and now lives in Los Angeles, California. She is the author of a Story Prize finalist collection, Mothers & Other Monsters, and four novels, including Tiptree Award-winner China Mountain Zhang and New York Times editor's choice Nekropolis. McHugh has also worked on alternate reality games for Halo 2, The Watchmen, and Nine Inch Nails, among others.","201 pages, Kindle Edition",Short Stories,256 follower,383 reviews,110,65 (2%),196 (8%),768 (32%),971 (40%),394 (16%)
Shift,Jeri Smith-Ready,"6,609",ratings617,"April 28, 2011","Aura’s life is anything but easy. Her boyfriend, Logan, died, and his slides between ghost and shade have left her reeling. Aura knows he needs her now more than ever. She loves Logan, but she can’t deny her connection with the totally supportive, totally gorgeous Zachary. And she’s not sure that she wants to. Logan and Zachary will fight to be the one by her side, but Aura needs them both to uncover the mystery of her past—the mystery of the Shift. As Aura’s search uncovers new truths, she must decide whom to trust with her secrets…and her heart.","367 pages, Hardcover",Paranormal Romance,"1,599 follower",617 reviews,28,120 (1%),324 (4%),"1,162 (17%)","2,065 (31%)","2,938 (44%)"
"Alex + Ada, Vol. 1",Jonathan Luna,"9,055","ratings1,356","July 16, 2014","From JONATHAN LUNA (GIRLS, THE SWORD, ULTRA, Spider-Woman: Origin) and SARAH VAUGHN (Sparkshooter) comes ALEX + ADA, a sci-fi drama set in the near future. The last thing in the world Alex wanted was an X5, the latest in realistic androids. But after Ada is dropped into his life, he discovers she is more than just a robot.Collects ALEX + ADA #1-5.","128 pages, Paperback",Graphic Novels,185 follower,"1,356 reviews",155,87 (<1%),375 (4%),"1,946 (21%)","4,100 (45%)","2,547 (28%)"
Doctor Who: The King's Dragon,Una McCormack,"1,059",ratings89,"January 1, 2010","From the back cover:In the city-state of Geath, the King lives in a golden hall, and the people want for nothing. Everyone is happy and everyone is rich. Or so it seems. When the Doctor, Amy and Rory look beneath the surface, they discover a city of secrets. In dark corners, strange creatures are stirring. At the heart of the hall, a great metal dragon oozes gold. Then the Herald appears, demanding the return of her treasure.... And next come the gunships. The battle for possession of the treasure has begun, and only the Doctor and his friends can save the people of the city from being destroyed in the crosfire of an ancient civil war. But will the King surrender his new-found wealthy? Or will he fight to keep it...?","245 pages, Hardcover",Doctor Who,326 follower,89 reviews,96,15 (1%),115 (10%),349 (32%),325 (30%),255 (24%)
