Title,Authors,Avg Ratings,Rating,first_published,Description,Total_Pages,Genre,author_followers,no_of_reviews,no_book_by_author,one_star_ratings,two_star_ratings,three_star_ratings,four_star_ratings,five_star_ratings
Indulgence in Death,J.D. Robb,"28,227","ratings1,237","November 1, 2010","When a murder disrupts the Irish vacation she is taking with her husband, Roarke, Eve realizes that no place is safe - not an Irish wood or the streets of the manic city she calls home. But nothing prepares her for what she discovers upon her return to the cop shop in New York City....A driver for a top-of-the-line limousine service is found dead - shot through the neck with a crossbow. The car was booked by an executive at a venerable security company whose identity had been stolen. Days later, a stunning, high-priced escort is found killed at Coney Island, a bayonet stuck in her heart. And again, the trail leads to a CEO whose information has been hijacked.With a method established, but no motive to be found, Eve begins to fear that she has come across that most dangerous of criminals, a thrill killer, but one with a taste for the finer things in life - and death. Eve does not know where or when the next kill will be, or that her investigation will take her to the rarefied circle that Roarke travels in - and into the perverted heart of madness....","373 pages, Hardcover",Mystery,33.5k follower,"1,237 reviews",254,123 (<1%),384 (1%),"3,459 (12%)","9,777 (34%)","14,484 (51%)"
Nightingales: The Extraordinary Upbringing and Curious Life of Miss Florence Nightingale,Gillian Gill,426,ratings78,"January 1, 2004","Florence Nightingale was for a time the most famous woman in Britain–if not the world. We know her today primarily as a saintly character, perhaps as a heroic reformer of Britain’s health-care system. The reality is more involved and far more fascinating. In an utterly beguiling narrative that reads like the best Victorian fiction, acclaimed author Gillian Gill tells the story of this richly complex woman and her extraordinary family.Born to an adoring wealthy, cultivated father and a mother whose conventional facade concealed a surprisingly unfettered intelligence, Florence was connected by kinship or friendship to the cream of Victorian England’s intellectual aristocracy. Though moving in a world of ease and privilege, the Nightingales came from solidly middle-class stock with deep traditions of hard work, natural curiosity, and moral clarity. So it should have come as no surprise to William Edward and Fanny Nightingale when their younger daughter, Florence, showed an early passion for helping others combined with a precocious bent for power.Far more problematic was Florence’s inexplicable refusal to marry the well-connected Richard Monckton Milnes. As Gill so brilliantly shows, this matrimonial refusal was at once an act of religious dedication and a cry for her freedom–as a woman and as a leader. Florence’s later insistence on traveling to the Crimea at the height of war to tend to wounded soldiers was all but incendiary–especially for her older sister, Parthenope, whose frustration at being in the shade of her more charismatic sibling often led to illness.Florence succeeded beyond her wildest dreams. But at the height of her celebrity, at the age of thirty-seven, she retired to her bedroom and remained there for most of the rest of her life, allowing visitors only by appointment.Combining biography, politics, social history, and consummate storytelling, Nightingales is a dazzling portrait of an amazing woman, her difficult but loving family, and the high Victorian era they so perfectly epitomized. Beautifully written, witty, and irresistible, Nightingales is truly a tour de force.","544 pages, Paperback",Biography,49 follower,78 reviews,14,15 (3%),27 (6%),103 (24%),169 (39%),112 (26%)
"She Has Her Mother's Laugh: The Powers, Perversions, and Potential of Heredity",Carl Zimmer,"6,396",ratings912,"May 29, 2018","Carl Zimmer presents a history of our understanding of heredity in this sweeping, resonating overview of a force that shaped human society--a force set to shape our future even more radically.She Has Her Mother's Laugh presents a profoundly original perspective on what we pass along from generation to generation. Charles Darwin played a crucial part in turning heredity into a scientific question, and yet he failed spectacularly to answer it. The birth of genetics in the early 1900s seemed to do precisely that. Gradually, people translated their old notions about heredity into a language of genes. As the technology for studying genes became cheaper, millions of people ordered genetic tests to link themselves to missing parents, to distant ancestors, to ethnic identities. . . .But, Zimmer writes, ""Each of us carries an amalgam of fragments of DNA, stitched together from some of our many ancestors. Each piece has its own ancestry, traveling a different path back through human history. A particular fragment may sometimes be cause for worry, but most of our DNA influences who we are--our appearance, our height, our penchants--in inconceivably subtle ways."" Heredity isn't just about genes that pass from parent to child. Heredity continues within our own bodies, as a single cell gives rise to trillions of cells that make up our bodies. We say we inherit genes from our ancestors--using a word that once referred to kingdoms and estates--but we inherit other things that matter as much or more to our lives, from microbes to technologies we use to make life more comfortable. We need a new definition of what heredity is and, through Carl Zimmer's lucid exposition and storytelling, this resounding tour de force delivers it. Weaving historical and current scientific research, his own experience with his two daughters, and the kind of original reporting expected of one of the world's best science journalists, Zimmer ultimately unpacks urgent bioethical quandaries arising from new biomedical technologies, but also long-standing presumptions about who we really are and what we can pass on to future generations.","657 pages, Hardcover",Science,"1,545 follower",912 reviews,70,46 (<1%),180 (2%),"1,026 (16%)","2,572 (40%)","2,572 (40%)"
Tales from a Not-So-Dorky Drama Queen,Rachel Renée Russell,"13,205",ratings744,"June 1, 2015",Nikki Maxwell’s worst nightmare comes true in book nine of the #1 New York Times bestselling Dork Diaries series!A certain member of the CCP girls Dork fans know all about has gotten her hands on Nikki’s diary and has decided to share some thoughts of her own…Find out what happens when Nikki’s worst nightmare becomes a reality. Welcome to MacKenzie’s world!!,Audiobook,Middle Grade,"6,580 follower",744 reviews,126,247 (1%),470 (3%),"1,795 (13%)","3,154 (23%)","7,539 (57%)"
Application for Release from the Dream: Poems,Tony Hoagland,471,ratings64,"September 1, 2015","The eagerly awaited, brilliant, and engaging new poems by Tony Hoagland, author of What Narcissism Means to Me The parade for the slain police officergoes past the bakery and the smell of fresh breadmakes the mourners salivate against their will. —from ""Note to Reality""Are we corrupt or innocent, fragmented or whole? Are responsibility and freedom irreconcilable? Do we value memory or succumb to our forgetfulness? Application for Release from the Dream, Tony Hoagland's fifth collection of poems, pursues these questions with the hobnailed abandon of one who needs to know how a citizen of twenty-first-century America can stay human. With whiplash nerve and tender curiosity, Hoagland both surveys the damage and finds the wonder that makes living worthwhile. Mirthful, fearless, and precise, these poems are full of judgment and mercy.","96 pages, Paperback",Poetry,174 follower,64 reviews,47,6 (1%),17 (3%),62 (13%),187 (39%),199 (42%)
Fooled by Randomness: The Hidden Role of Chance in Life and in the Markets,Nassim Nicholas Taleb,"64,095","ratings3,090","January 1, 2001","Fooled by Randomness is a standalone book in Nassim Nicholas Taleb’s landmark Incerto series, an investigation of opacity, luck, uncertainty, probability, human error, risk, and decision-making in a world we don’t understand. The other books in the series are The Black Swan, Antifragile,and The Bed of Procrustes.","368 pages, Paperback",Nonfiction,12.8k follower,"3,090 reviews",66,"1,337 (2%)","2,950 (4%)","10,660 (16%)","23,330 (36%)","25,818 (40%)"
Dare Me,Megan Abbott,"28,641","ratings3,934","May 10, 2012","""I dare you not to love this book. You lucky reader.""---Tom Franklin, New York Times bestselling author ofCrooked Letter, Crooked Letter

 Addy Hanlon has always been Beth Cassidy's best friend and trusted lieutenant. Beth calls the shots and Addy carries them out, a long-established order of things that has brought them to the pinnacle of their high-school careers. Now they're seniors who rule the intensely competitive cheer squad, feared and followed by the other girls -- until the young new coach arrives.Cool and commanding, an emissary from the adult world just beyond their reach, Coach Colette French draws Addy and the other cheerleaders into her life. Only Beth, unsettled by the new regime, remains outside Coach's golden circle, waging a subtle but vicious campaign to regain her position as ""top girl"" -- both with the team and with Addy herself. Then a suicide focuses a police investigation on Coach and her squad. After the first wave of shock and grief, Addy tries to uncover the truth behind the death -- and learns that the boundary between loyalty and love can be dangerous terrain. The raw passions of girlhood are brought to life in this taut, unflinching exploration of friendship, ambition, and power. Award-winning novelist Megan Abbott, writing with what Tom Perrotta has hailed as ""total authority and an almost desperate intensity,"" provides a harrowing glimpse into the dark heart of the all-American girl.","290 pages, Paperback",Fiction,"5,875 follower","3,934 reviews",60,"1,826 (6%)","5,005 (17%)","10,127 (35%)","8,013 (27%)","3,670 (12%)"
Wrath of the Storm,Jennifer A. Nielsen,"4,158",ratings383,"January 31, 2017","A quest for freedom. The magic of the gods. A storm to destroy a world.Trouble has a way of finding Nicolas Calva, and it’s not likely to leave him alone any time soon. With Caesar’s magic bulla, the Malice of Mars, and the possibility of a Jupiter Stone in play, all the powers of Rome are circling Nic. He’ll have to maneuver his way through scheming government officials and reawakened magical beasts to save the Empire. Can he manage to keep his friends and family safe, claim his own freedom once and for all, and rescue the Empire—before the magic gets the better of him?","343 pages, Hardcover",Fantasy,"8,084 follower",383 reviews,44,18 (<1%),164 (3%),720 (17%),"1,471 (35%)","1,785 (42%)"
The Fortunes of Jaded Women,Carolyn Huynh,"14,965","ratings2,087","September 6, 2022","Everyone in Orange County’s Little Saigon knew that the Duong sisters were cursed.  It started with their ancestor Oanh who dared to leave her marriage for true love—so a fearsome Vietnamese witch cursed Oanh and her descendants so that they would never find love or happiness, and the Duong women would give birth to daughters, never sons.​  Oanh’s current descendant Mai Nguyen knows this curse well. She’s divorced, and after an explosive disagreement a decade ago, she’s estranged from her younger sisters, Minh Pham (the middle and the mediator) and Khuyen Lam (the youngest who swears she just runs humble coffee shops and nail salons, not Little Saigon’s underground). Though Mai’s three adult daughters, Priscilla, Thuy, and Thao, are successful in their careers (one of them is John Cho’s dermatologist!), the same can’t be said for their love life. Mai is convinced they might drive her to an early grave.  Desperate for guidance, she consults Auntie Hua, her trusted psychic in Hawaii, who delivers an unexpected prediction: this year, her family will witness a marriage, a funeral, and the birth of a son. This prophecy will reunite estranged mothers, daughters, aunts, and cousins—for better or for worse.  A multi-narrative novel brimming with levity and candor, The Fortunes of Jaded Women is about mourning, meddling, celebrating, and healing together as a family. It shows how Vietnamese women emerge victorious, even if the world is against them.","272 pages, Hardcover",Fiction,279 follower,"2,087 reviews",2,200 (1%),994 (6%),"5,193 (34%)","6,207 (41%)","2,371 (15%)"
"Hello, Universe",Erin Entrada Kelly,"22,398","ratings3,619","March 14, 2017","Winner of the 2018 Newbery Medal. Told from four intertwining points of view—two boys and two girls—the novel celebrates bravery, being different, and finding your inner bayani (hero).In one day, four lives weave together in unexpected ways. Virgil Salinas is shy and kindhearted and feels out of place in his loud and boisterous family. Valencia Somerset, who is deaf, is smart, brave, and secretly lonely, and loves everything about nature. Kaori Tanaka is a self-proclaimed psychic, whose little sister Gen is always following her around. And Chet Bullens wishes the weird kids would just act normal so that he can concentrate on basketball.They aren’t friends -- at least not until Chet pulls a prank that traps Virgil and his pet guinea pig at the bottom of a well. This disaster leads Kaori, Gen, and Valencia on an epic quest to find the missing Virgil. Through luck, smarts, bravery, and a little help from the universe, a rescue is performed, a bully is put in his place, and friendship blooms.","320 pages, Hardcover",Middle Grade,"1,567 follower","3,619 reviews",19,269 (1%),970 (4%),"5,085 (22%)","9,614 (42%)","6,460 (28%)"
The Barefoot Tribe: A Manifesto for a New Kind of Church,Palmer Chinchen,44,ratings5,"September 2, 2014","Written for the millennial generation, gathering the church around twelve key commitments to justice, sustainability, art, compassion, austerity, and a desire to make the world better by living out the love of Christ.We are on the crest of an epic shift in humanity. As Jeremy Rifkin writes, “The Age of Reason is being eclipsed by the Age of Empathy.” The current millennial generation views the world as an extended family—increasingly interconnected through technology—and they live with a deep moral obligation to care for one another. In The Barefoot Tribe, Palmer Chinchen issues a wake-up call to the church of today, highlighting this new wave of social justice leaders, who are not afraid to take action, take risks, and remake the world into one more like what Jesus had in mind. Chinchen challenges the dispassion of the church of decades past, calling for one that does not withdraw into the safe confines of its sanctuary walls. Drawing on compelling stories from his life growing up in Liberia and various experiences from his own church, he maps out a new course that addresses the world's needs in a way that is outside the norm for many evangelicals.Conversational, fresh, and accessible, The Barefoot Tribe invites readers to join others also seeking to live a life of meaning and purpose in this world made smaller by technology. Because with the power of the tribe...we can make the world a better place.","240 pages, Kindle Edition",Nonfiction,8 follower,5 reviews,7,1 (2%),1 (2%),8 (18%),10 (22%),24 (54%)
Ghost Hunting: True Stories of Unexplained Phenomena from The Atlantic Paranormal Society,Jason Hawes,"2,114",ratings204,"October 2, 2007","The Atlantic Paranormal Society, also known as T.A.P.S., is the brainchild of two plumbers by day, paranormal investigators by night: Jason Hawes and Grant Wilson. Their hair-raising investigations, fueled by their unique abilities and a healthy dose of scientific method, have made them the subject of a hit TV show: the SCI FI Channel's Ghost Hunters.  Now their experiences are in print for the first time, as Jason and Grant recount for us, with the help of veteran author Michael Jan Friedman, the stories of some of their most memorable investigations. The men and women of T.A.P.S. pursue ghosts and other supernatural phenomena with the most sophisticated scientific equipment available -- from thermal-imaging cameras to electromagnetic-field recorders to digital thermometers -- and the results may surprise you. Featuring both cases depicted on Ghost Hunters and earlier T.A.P.S. adventures never told before now, this funny, fascinating, frightening collection will challenge everything you thought you knew about the spirit world.","288 pages, Paperback",Paranormal,138 follower,204 reviews,12,40 (1%),138 (6%),588 (27%),668 (31%),680 (32%)
Kiwis Might Fly: A New Zealand Adventure,Polly Evans,335,ratings40,"January 1, 2004","NEW YORK TIMES BESTSELLERPolly Evans was a woman with a mission. Before the traditional New Zealand male hung up his sheep shears for good, Polly wanted to see this vanishing species with her own eyes. Venturing into the land of giant kauri trees and smaller kiwi birds, she explores the country once inhabited by fierce Maori who carved their enemies’ bones into cutlery, bushwhacking pioneers, and gold miners who lit their pipes with banknotes—and comes face-to-face with their surprisingly tame descendants. So what had become of the mighty Kiwi warrior?As Polly tears through the countryside at seventy-five miles an hour, she attempts to solve this mystery while pub-crawling in Hokitika, scaling the Southern Alps, and enduring a hair-raising stay in a mining town where the earth has been known to swallow houses whole. And as she chronicles the thrills and travails of her extraordinary odyssey, Polly’s search for the elusive Kiwi comes full circle—teaching her some hilarious and surprising lessons about motorcycles, modern civilization, and men.","309 pages, Paperback",Travel,20 follower,40 reviews,15,10 (2%),39 (11%),126 (37%),102 (30%),58 (17%)
Can't Get There from Here,Todd Strasser,"3,000",ratings341,"January 1, 2004","Her street name is Maybe  She lives with a tribe of homeless teens -- runaways and throwaways, kids who have no place to go other than the cold city streets, and no family except for one another. Abused, abandoned, and forgotten, they struggle against the cold, hunger, and constant danger.  With the frigid winds of January comes a new girl: Tears, a twelve-year-old whose mother doesn't believe her stepfather abuses her. As the other kids start to disappear -- victims of violence, addiction, and exposure -- Maybe tries to help Tears get off the streets...if it's not already too late.  Todd Strasser, author of the powerful and disturbing Give a Boy a Gun, again focuses on an important social issue as he tells a thought-provoking, heart-wrenching story of young lives lost to the streets, and of a society that has forgotten how to care.","208 pages, Hardcover",Young Adult,768 follower,341 reviews,229,54 (1%),170 (5%),695 (23%),988 (32%),"1,093 (36%)"
Haven,Justin Kemppainen,"1,063",ratings115,"December 15, 2009","Looking for the Uprising version? See here.The Citizens of Haven have finally realized their dream; separation. They have ascended. A new layer has been placed upon the city, sealing anyone they deem unfit down below. In the dark slums beneath the city, something has been set in motion that will usher in a change. Something that will rattle the city of Haven to its core and forever alter the lives of everyone within.","926 pages, Nook",Science Fiction,43 follower,115 reviews,8,72 (6%),139 (13%),357 (33%),310 (29%),185 (17%)
Off With Their Heads: The Prequel to Alice in Deadland,Mainak Dhar,530,ratings39,"June 19, 2012","The prequel to the Amazon.com Bestseller, Alice in DeadlandA few months before Alice was born and fifteen years before the dramatic events depicted in Alice in Deadland, there was The Rising. A few days that destroyed human civilization as we know it, reducing much of the world to a radioactive wasteland teeming with hordes of undead Biters and controlled by a shadowy Central Committee.Off With Their Heads brings to life the final harrowing days of The Rising through four shorts, each depicting events through the eyes of one pivotal character in the Alice in Deadland series. See how Dr. Protima became the Queen of the Biters; feel the pain of a young man’s sacrifice as he becomes the bunny-eared Biter whom Alice later follows down a hole; follow the rise of Chen from a conflicted young Chinese Army officer to a General in the Red Guards; and finally share in the dramatic escape of Alice’s parents from a city overrun by Biters.Off With Their Heads can be enjoyed as a standalone book or as a companion to the two other books in the bestselling Alice in Deadland series (Alice in Deadland and Through The Killing Glass).","105 pages, Kindle Edition",Horror,270 follower,39 reviews,55,13 (2%),44 (8%),143 (26%),174 (32%),156 (29%)
Walking to Hollywood,Will Self,270,ratings49,"September 1, 2010","This title is an extraordinary triptych in which Will Self burrows down through the intersections of time, place and psyche to explore some of our deepest fears and anxieties with his characteristic fearlessness and edgy humour.","432 pages, Hardcover",Fiction,938 follower,49 reviews,144,29 (10%),59 (21%),84 (31%),70 (25%),28 (10%)
Is Marriage for White People?: How the African American Marriage Decline Affects Everyone,Ralph Richard Banks,566,ratings92,"February 3, 2011","During the past half century, African Americans have become the most unmarried people in our nation. More than two out of every three black women are unmarried, and they are more than twice as likely as white women never to marry. The racial gap in marriage extends beyond the poor. Affluent and college educated African Americans are also less likely to marry or stay married than their white counterparts. That harms black children and adults, and imperils the growth and stability of the black middle class.One reason that marriage has declined is that as black women have advanced economically and educationally, black men have fallen behind. Nearly twice as many black women as black men graduate from college each year.Thus, not only are many college-educated black women unmarried, they are more likely than any other group of women to marry less educated and lower earning men. Half of college-educated black wives are more educated than their husbands.Yet black women rarely marry men of other races. They are less than half as likely as black men, and only a third as likely as Latinos or Asian Americans, to wed across group lines. Is Marriage for White People? traces the far-reaching consequences of the African American marriage decline. It also explains why black women marry down rather than out. Its provocative conclusion is that black women would benefit both themselves and the black race if they crossed class lines less and race lines more.As particular as this inquiry may seem, it is also universal. Americans of all races are more unmarried now than ever. And as women surpass men educationally, wives increasingly earn more than their husbands. In illuminating the lives of African Americans, Is Marriage for White People? thus probes cultural and economic trends that implicate everyone, highlighting the extent to which the experience of black women may become that of all women.This book both informs and entertains. The culmination of a decade of research by a distinguished Stanford law professor, it melds scholarly theory and data with the poignant stories shared by black women throughout the nation. This unforgettable book is essential reading for anyone who wants to understand the shifting terrain of intimacy in American society.","289 pages, Hardcover",Nonfiction,9 follower,92 reviews,2,10 (1%),33 (5%),140 (24%),230 (40%),153 (27%)
Loose Ends,Greg Cox,259,ratings15,"May 1, 2001","Eight hundred feet underground...and deep into danger. It started out as an innocent road trip to Carlsbad Caverns to unwind, but now Max, Isabel, Michael, Liz, and Maria are totally regretting their plan.Hundreds of feet underground, in the cavern gift shop, Liz turns and is stunned to see someone she thought she'd never meet again -- the man who shot her long ago in the diner. Their eyes meet and Liz bolts.But running won't solve the group's new ""problem."" Because the shooter has recognized Liz. Now he wants her dead.And nobody knows why.","277 pages, Mass Market Paperback",Science Fiction,378 follower,15 reviews,160,6 (2%),29 (11%),81 (31%),57 (22%),86 (33%)
