Title,Authors,Avg Ratings,Rating,first_published,Description,Total_Pages,Genre,author_followers,no_of_reviews,no_book_by_author,one_star_ratings,two_star_ratings,three_star_ratings,four_star_ratings,five_star_ratings
Women Around the Messenger,محمد قطب,440,ratings46,"January 1, 2008","This work is an attempt at dispelling any misconception by bringing into focus biographies of the first generation of Muslim women and the important role they played in the overall development of their society, right from the beginning.","364 pages, Hardcover",Islam,"1,445 follower",46 reviews,87,11 (2%),17 (3%),51 (11%),121 (27%),240 (54%)
The Runaway,Kate O'Hearn,"1,310",ratings76,"February 6, 2014","Fourteen-year-old Freya is a Valkyrie: a Norse goddess, a reaper of souls from human battlefields. She has the power to cause death with just one touch. But Freya has not followed in the footsteps of the legends before her. She has been to the World of Man to befriend humans - and not to reap their souls. Now she must go to the World of Man again on a new quest to track down the runaway Valkyrie of legend. There she will discover a dark secret that leads her to the Land of the Frost Giants where she must take on new enemies. But this time she has friends to rely on, and lots more to gain ...and create a new VALKYRIE legend. 'Kate O'Hearn serves up a winning mix of modern adventure and classic fantasy.' Rick Riordan, author of Percy Jackson","360 pages, Paperback",Fantasy,874 follower,76 reviews,35,9 (<1%),28 (2%),148 (11%),383 (29%),742 (56%)
The Jakarta Method: Washington's Anticommunist Crusade and the Mass Murder Program that Shaped Our World,Vincent Bevins,"9,186","ratings1,391","May 19, 2020","The hidden story of the wanton slaughter -- in Indonesia, Latin America, and around the world -- backed by the United States. In 1965, the U.S. government helped the Indonesian military kill approximately one million innocent civilians. This was one of the most important turning points of the twentieth century, eliminating the largest communist party outside China and the Soviet Union and inspiring copycat terror programs in faraway countries like Brazil and Chile. But these events remain widely overlooked, precisely because the CIA's secret interventions were so successful. In this bold and comprehensive new history, Vincent Bevins builds on his incisive reporting for the Washington Post, using recently declassified documents, archival research and eye-witness testimony collected across twelve countries to reveal a shocking legacy that spans the globe. For decades, it's been believed that parts of the developing world passed peacefully into the U.S.-led capitalist system. The Jakarta Method demonstrates that the brutal extermination of unarmed leftists was a fundamental part of Washington's final triumph in the Cold War.","320 pages, Hardcover",History,510 follower,"1,391 reviews",5,24 (<1%),75 (<1%),470 (5%),"2,296 (24%)","6,321 (68%)"
"A Higher Loyalty: Truth, Lies, and Leadership",James Comey,"47,894","ratings5,496","April 17, 2018","In his book, former FBI director James Comey shares his never-before-told experiences from some of the highest-stakes situations of his career in the past two decades of American government, exploring what good, ethical leadership looks like, and how it drives sound decisions. His journey provides an unprecedented entry into the corridors of power, and a remarkable lesson in what makes an effective leader.Mr. Comey served as director of the FBI from 2013 to 2017, appointed to the post by President Barack Obama. He previously served as U.S. attorney for the Southern District of New York, and the U.S. deputy attorney general in the administration of President George W. Bush. From prosecuting the Mafia and Martha Stewart to helping change the Bush administration's policies on torture and electronic surveillance, overseeing the Hillary Clinton e-mail investigation as well as ties between the Trump campaign and Russia, Comey has been involved in some of the most consequential cases and policies of recent history.","290 pages, Hardcover",Nonfiction,516 follower,"5,496 reviews",20,"1,111 (2%)","1,728 (3%)","7,258 (15%)","19,018 (39%)","18,779 (39%)"
The Undoing Project: A Friendship That Changed Our Minds,Michael   Lewis,"59,045","ratings4,438","December 6, 2016","“Brilliant. . . . Lewis has given us a spectacular account of two great men who faced up to uncertainty and the limits of human reason.” —William Easterly, Wall Street JournalForty years ago, Israeli psychologists Daniel Kahneman and Amos Tversky wrote a series of breathtakingly original papers that invented the field of behavioral economics. One of the greatest partnerships in the history of science, Kahneman and Tversky’s extraordinary friendship incited a revolution in Big Data studies, advanced evidence-based medicine, led to a new approach to government regulation, and made much of Michael Lewis’s own work possible. In The Undoing Project, Lewis shows how their Nobel Prize–winning theory of the mind altered our perception of reality.","369 pages, Kindle Edition",Nonfiction,13.3k follower,"4,438 reviews",48,"1,225 (2%)","2,785 (4%)","11,640 (19%)","23,372 (39%)","20,023 (33%)"
The Push,Ashley Audrain,"328,602","ratings37,709","January 5, 2021","An alternative cover edition for this ISBN can be found here.A tense, page-turning psychological drama about the making and breaking of a family–and a woman whose experience of motherhood is nothing at all what she hoped for–and everything she feared.Blythe Connor is determined that she will be the warm, comforting mother to her new baby Violet that she herself never had.But in the thick of motherhood’s exhausting early days, Blythe becomes convinced that something is wrong with her daughter–she doesn’t behave like most children do.Or is it all in Blythe’s head? Her husband, Fox, says she’s imagining things. The more Fox dismisses her fears, the more Blythe begins to question her own sanity, and the more we begin to question what Blythe is telling us about her life as well.Then their son Sam is born–and with him, Blythe has the blissful connection she’d always imagined with her child. Even Violet seems to love her little brother. But when life as they know it is changed in an instant, the devastating fall-out forces Blythe to face the truth.The Push is a tour de force you will read in a sitting, an utterly immersive novel that will challenge everything you think you know about motherhood, about what we owe our children, and what it feels like when women are not believed.","307 pages, Hardcover",Thriller,"6,244 follower","37,709 reviews",3,"3,737 (1%)","13,321 (4%)","56,754 (17%)","139,402 (42%)","115,388 (35%)"
Echoes in Death,J.D. Robb,"25,393","ratings1,853","February 7, 2017","This chilling new suspense novel from #1 
New York Times
 bestselling author J.D. Robb is the perfect entry point into the compelling In Death police procedural series featuring Lieutenant Eve Dallas.As NY Lt. Eve Dallas and her billionaire husband Roarke are driving home, a young woman—dazed, naked, and bloody—suddenly stumbles out in front of their car. Roarke slams on the brakes and Eve springs into action.Daphne Strazza is rushed to the ER, but it’s too late for her husband Dr. Anthony Strazza. A brilliant orthopedic surgeon, he now lies dead amid the wreckage of his obsessively organized town house, his three safes opened and emptied. Daphne would be a valuable witness, but in her terror and shock the only description of the perp she can offer is repeatedly calling him “the devil”...While it emerges that Dr. Strazza was cold, controlling, and widely disliked, this is one case where the evidence doesn’t point to the spouse. So Eve and her team must get started on the legwork, interviewing everyone from dinner-party guests to professional colleagues to caterers, in a desperate race to answer some crucial questions:What does the devil look like? And where will he show up next?","371 pages, Hardcover",Mystery,33.5k follower,"1,853 reviews",254,141 (<1%),331 (1%),"2,595 (10%)","7,823 (30%)","14,503 (57%)"
The Chickens of Atlantis and Other Fowl and Filthy Fiends,Robert Rankin,185,ratings14,"September 19, 2013","Darwin, the educated ape, sets off on another madcap adventure through time, space, and chickens   Robert Rankin, the master of far-fetched fiction presents for the first time a book written in ""the first monkey."" Sure to be taken up as the newest of literary fads, Darwin, the educated ape here tells his life story to his legions of fans. Featuring chickens, Martians, doodlebugs, the far future, the distant past, Sherlock Holmes, Winston Churchill, dynamite, more monkeys than you can shake a stick at, barmen, pubs, the end of the world, and more, this is the fourth in Robert Rankin's series of steampunk-tinged Victoriana novels featuring the master detective Cameron Bell and his companion Darwin, the educated ape. This is another masterpiece of comic fiction and SF.","339 pages, Paperback",Humor,828 follower,14 reviews,84,2 (1%),16 (8%),46 (24%),73 (39%),48 (25%)
The Shadow Crosser,J.C. Cervantes,"2,418",ratings213,"September 1, 2020","Best-selling author Rick Riordan presents J.C. Cervantes' epic finale to the Storm Runner trilogy, a tale of mystery, magic, and mayhem featuring gods from both Maya and Aztec mythology.Zane Obispo has been looking forward to his training at the Shaman Institute for Higher Order Magic, and not only because it means he'll be reunited with his best friend, Brooks. Anything would be better than how he has spent the last three months: searching for the remaining godborns with a nasty demon who can sniff them out (literally). But when Zane tracks down the last kid on his list, he's in for a surprise: the """"one"""" is actually a pair of twins, and they're trying to prevent a mysterious object from falling into the wrong hands.After a shocking betrayal, Zane finds himself at SHIHOM sooner than expected. Even more shocking is the news that the Maya gods have gone missing. The bat god, Camazotz, and Ixkik' (aka Blood Moon) have taken them out of commission . . . and the godborns are their next target. The only thing the villains need now? The object that the twins possess.Zane knows the godborns aren't strong enough yet to stand up to Zotz, Ixkik', and their army. There might be a way to save the gods, but it involves locating a magical calendar that can see across time and space . . . not to mention traveling more than thirty years into the past.In The Shadow Crosser, Zane and his friends embark on their most treacherous mission yet--a mission that, with one blunder, could change history as we know it, and worse, destroy the universe.","432 pages, Hardcover",Fantasy,701 follower,213 reviews,18,10 (<1%),39 (1%),233 (9%),817 (33%),"1,319 (54%)"
The Choice: Embrace the Possible,Edith Eger,"97,676","ratings9,690","September 5, 2017","It’s 1944 and sixteen-year-old ballerina and gymnast Edith Eger is sent to Auschwitz. Separated from her parents on arrival, she endures unimaginable experiences, including being made to dance for the infamous Josef Mengele. When the camp is finally liberated, she is pulled from a pile of bodies, barely alive.The horrors of the Holocaust didn’t break Edith. In fact, they helped her learn to live again with a life-affirming strength and a truly remarkable resilience. The Choice is her unforgettable story.","289 pages, Hardcover",Nonfiction,"2,343 follower","9,690 reviews",11,440 (<1%),919 (<1%),"6,239 (6%)","23,795 (24%)","66,283 (67%)"
The Extraordinary Deaths of Mrs. Kip,Sara Brunsvold,"2,929",ratings798,"July 5, 2022","Aidyn Kelley is talented, ambitious, and ready for a more serious assignment than the fluff pieces she’s been getting as a cub reporter for the Kansas City Star. In her eagerness, she pushes too hard, earning herself the menial task of writing an obituary for an unremarkable woman who’s just entered hospice care. But there’s more to Clara Kip than meets the eye. The spirited septuagenarian may be dying, but she’s not quite ready to cash it in yet. Never one to shy away from an assignment herself, she can see that God brought the young reporter into her life for a reason. And if it’s a story Aidyn Kelley wants, that’s just what Mrs. Kip will give her—but she’s going to have to work for it.","368 pages, Paperback",Christian Fiction,343 follower,798 reviews,4,17 (<1%),68 (2%),335 (11%),796 (27%),"1,713 (58%)"
"Unsettling Truths: The Ongoing, Dehumanizing Legacy of the Doctrine of Discovery",Mark  Charles,"1,253",ratings249,"November 5, 2019","You cannot discover lands already inhabited.Injustice has plagued American society for centuries. And we cannot move toward being a more just nation without understanding the root causes that have shaped our culture and institutions.In this prophetic blend of history, theology, and cultural commentary, Mark Charles and Soong-Chan Rah reveal the far-reaching, damaging effects of the ""Doctrine of Discovery."" In the fifteenth century, official church edicts gave Christian explorers the right to claim territories they ""discovered."" This was institutionalized as an implicit national framework that justifies American triumphalism, white supremacy, and ongoing injustices. The result is that the dominant culture idealizes a history of discovery, opportunity, expansion, and equality, while minority communities have been traumatized by colonization, slavery, segregation, and dehumanization.Healing begins when deeply entrenched beliefs are unsettled. Charles and Rah aim to recover a common memory and shared understanding of where we have been and where we are going. As other nations have instituted truth and reconciliation commissions, so do the authors call our nation and churches to a truth-telling that will expose past injustices and open the door to conciliation and true community.","224 pages, Paperback",History,1 book53 follower,249 reviews,1,17 (1%),27 (2%),120 (9%),397 (31%),692 (55%)
"The First Man-Made Man: The Story of Two Sex Changes, One Love Affair, and a Twentieth-Century Medical Revolution",Pagan Kennedy,327,ratings44,"January 1, 2007","In the 1920s when Laura Dillon felt like a man trapped in a woman's body, there were no words to describe her condition; transsexuals had yet to enter common usage. And there was no known solution to being stuck between the sexes. Laura Dillon did all she could on her own: she cut her hair, dressed in men's clothing, bound her breasts with a belt. But in a desperate bid to feel comfortable in her own skin, she experimented with breakthrough technologies that ultimately transformed the human body and revolutionized medicine. From upper-class orphan girl to Oxford lesbian, from post-surgery romance with Roberta Cowell (an early male-to-female) to self-imposed exile in India, Michael Dillon's incredible story reveals the struggles of early transsexuals and challenges conventional notions of what gender really means.","215 pages, Hardcover",Nonfiction,36 follower,44 reviews,23,3 (<1%),28 (8%),104 (31%),135 (41%),57 (17%)
William Mulholland and the Rise of Los Angeles,Catherine Mulholland,90,ratings11,"July 23, 2000","William Mulholland presided over the creation of a water system that forever changed the course of southern California's history. Mulholland, a self-taught engineer, was the chief architect of the Owens Valley Aqueduct―a project ranking in magnitude and daring with the Panama Canal―that brought water to semi-arid Los Angeles from the lush Owens Valley. The story of Los Angeles's quest for water is both famous and it has been the subject of the classic yet historically distorted movie Chinatown, as well as many other accounts. This first full-length biography of Mulholland challenges many of the prevailing versions of his life story and sheds new light on the history of Los Angeles and its relationship with its most prized water.Catherine Mulholland, the engineer's granddaughter, provides insights into this story that family familiarity affords, and adds to our historical understanding with extensive primary research in sources such as Mulholland's recently uncovered office files, newspapers, and Department of Water and Power archives. She scrutinizes Mulholland's life―from his childhood in Ireland to his triumphant completion of the Owens Valley Aqueduct to the tragedy that ended his career. This vivid portrait of a rich chapter in the history of Los Angeles is enhanced with a generous selection of previously unpublished photographs.Los Angeles Times Best Nonfiction Book of 2000","436 pages, Paperback",Biography,10 book,11 reviews,10,0 (0%),9 (10%),25 (27%),36 (40%),20 (22%)
The Dark Divine,Bree Despain,"38,057","ratings2,531","December 1, 2009","Grace Divine, daughter of the local pastor, always knew something terrible happened the night Daniel Kalbi disappeared--the night she found her brother Jude collapsed on the porch, covered in his own blood--but she has no idea what a truly monstrous secret that night held.The memories her family has tried to bury resurface when Daniel returns, three years later, and enrolls in Grace and Jude's high school. Despite promising Jude she'll stay away, Grace cannot deny her attraction to Daniel's shocking artistic abilities, his way of getting her to look at the world from new angles, and the strange, hungry glint in his eyes.The closer Grace gets to Daniel, the more she jeopardizes her life, as her actions stir resentment in Jude and drive him to embrace the ancient evil Daniel unleashed that horrific night. Grace must discover the truth behind the boy's dark secret...and the cure that can save the ones she loves. But she may have to lay down the ultimate sacrifice to do it--her soul.","372 pages, Hardcover",Young Adult,"2,680 follower","2,531 reviews",13,"1,515 (3%)","3,340 (8%)","9,197 (24%)","11,403 (29%)","12,602 (33%)"
"Just Like Me, Only Better",Carol Snow,885,ratings125,"March 31, 2010","From the author of Here Today, Gone to Maui, the story of a woman who finally got a life...some else's.   Ever since Veronica's husband found the love of his life—not her—she's been a walking zombie with runny mascara. It doesn't help that she keeps getting mistaken for Haley Rush—the Hollywood starlet whose dazzling life is plastered on every magazine.  When Haley's manager offers Veronica a job as a celebrity double, it only takes a moment before she says yes. Veronica gets to drive Haley's car, wear her phenomenal clothes-and have fun with her hot celebrity boyfriend, Brady Ellis. Too bad the job's only part-time, and at the end of the day she has to return to her life as a cash-strapped substitute teacher and Cub Scout mom.  But when real sparks fly with Brady, is it a fantasy come true or a disaster in disguise?","306 pages, Paperback",Chick Lit,225 follower,125 reviews,34,30 (3%),105 (11%),338 (38%),291 (32%),121 (13%)
Misguided Angel,Melissa de la Cruz,"39,337","ratings1,315","October 26, 2010","After inheriting the dark Van Alen Legacy, Schuyler fled to Florence with her forbidden love, Jack. Now the two of them must embark on the mission Schuyler was destined to complete: to find and protect the five remaining gates that guard the earth from Lucifer, lord of the Silver Bloods.Back in New York, Mimi has been elected Regent of a crumbling coven. Struggling with her heartache over the loss of Kingsley and with her overwhelming desire to destroy Jack, she must focus all of her energy on a perilous new threat. Vampires are being abducted and their captors are planning to burn them alive online...for all the world to see. Help arrives in the form of Deming Chen, a Venator from Shanghai, who must untangle the web of deceptions before the killers strike again.As the young vampires struggle for the survival of the coven, they uncover a deadly secret, a truth first discovered by Schuyler’s mother during the Renaissance but kept buried for centuries. And as the Blue Blood enclave weakens yet further, fate leads Schuyler to a terrible choice that will ultimately map the destiny of her heart.","265 pages, Hardcover",Young Adult,15.1k follower,"1,315 reviews",125,730 (1%),"2,693 (6%)","9,501 (24%)","12,103 (30%)","14,310 (36%)"
Overtaken,Alexei Sayle,311,ratings22,"224 pages, PaperbackPublished January 1, 2004","Kelvin is a 33-year-old property developer living in a small Lancashire town. He has five close friends, all in well-paid jobs. Having bought their lovely houses cheaply in the early 1990s, they are free to spend money on their own pleasures - particularly clothes, meals and cars. Most of all, their life revolves around going to see things - art exhibitions, comedians, live music, plays...When we first meet the six friends they are on their way to see a new kind of circus. Once there Kelvin does something unforgivable to a clown, has a strange snack and meets the most beautiful girl he has ever seen. It's the beginning of the end of the good life.","224 pages, Paperback",Fiction,60 follower,22 reviews,26,5 (1%),23 (7%),98 (31%),132 (42%),53 (17%)
Abandoned,Cody McFadyen,"7,303",ratings462,"October 15, 2009","For FBI Special Agent Smoky Barrett, her colleague’s wedding is cause for celebration. Until a woman staggers down the aisle—incoherent, wearing only a white nightgown. A fingerprint check determines that she’s been missing for nearly eight years. Her coldly efficient captor toyed with her mind and body, imprisoning her, depriving her of any contact with the outside world. As Smoky fits together the pieces of what remains of the victim’s fractured life, a chilling picture emerges of a cerebral psychopath who doesn’t take murder personally, never makes a mistake, follows his own sinister logic, and has set the perfect trap.","400 pages, Hardcover",Thriller,"1,118 follower",462 reviews,28,83 (1%),238 (3%),"1,210 (16%)","2,754 (37%)","3,018 (41%)"
The Mermaid's Mirror,L.K. Madigan,"4,345",ratings517,"January 1, 2010","LENA HAS LIVED her whole life near the beach - walking for miles up and down the shore and breathing the salty air, swimming in the cold water, and watching the surfers rule the waves - the problem is, she's spent her whole life just watching.As her sixteenth birthday approaches, Lena vows she will no longer watch from the sand: she will learn to surf.But her father - a former surfer himself - refuses to allow her to take lessons. After his near drowning years ago, he can't bear to let Lena take up the risky sport.Yet something keeps drawing Lena to the water... an ancient, powerful magic. And one morning Lena catches sight of this magic: a beautiful woman - with a silvery tail.Now nothing can stop Lena from seeking the mermaid, not even the dangerous waves at Magic Crescent Cove.And soon... what she sees in the mermaid's mirror will change her life forever.","308 pages, Hardcover",Fantasy,145 follower,517 reviews,3,132 (3%),484 (11%),"1,272 (29%)","1,161 (26%)","1,296 (29%)"
Skinned,Robin Wasserman,"12,888","ratings1,039","September 9, 2008","The Download was supposed to change the world. It was supposed to mean the end of aging, the end of death, the birth of a new humanity. But it wasn't supposed to happen to someone like Lia Kahn.And it wasn't supposed to ruin her life.Lia knows she should be grateful she didn't die in the accident. The Download saved her--but it also changed her, forever. She can deal with being a freak. She can deal with the fear in her parents' eyes and the way her boyfriend flinches at her touch. But she can't deal with what she knows, deep down, every time she forces herself to look in the mirror: She's not the same person she used to be.Maybe she's not even a person at all.","368 pages, Hardcover",Young Adult,"1,467 follower","1,039 reviews",86,708 (5%),"1,557 (12%)","3,682 (28%)","3,938 (30%)","3,003 (23%)"
The Darlings in Love,Melissa Kantor,525,ratings69,"January 10, 2012","The Darlings have just begun their second semester of ninth grade, and love is in the air. The sweetheart The irresistible songwriter…but is he writing off Victoria? The overachiever The perfect match, if only the game were less complicated The drama queen The Greek god… of mixed signalsIn the face of both joy and heartbreak, the Darlings know that they'll always have each other. Boys come and go, but the Darlings are still forever.","320 pages, Hardcover",Romance,648 follower,69 reviews,14,23 (4%),53 (10%),131 (24%),160 (30%),158 (30%)
Web of Lies,Jennifer Estep,"22,920","ratings1,054","May 5, 2010","Curiosity is definitely going to get me dead one of these days. Probably real soon.I'm Gin Blanco.You might know me as the Spider, the most feared assassin in the South. I’m retired now, but trouble still has a way of finding me. Like the other day when two punks tried to rob my popular barbecue joint, the Pork Pit. Then there was the barrage of gunfire on the restaurant. Only, for once, those kill shots weren’t aimed at me. They were meant for Violet Fox. Ever since I agreed to help Violet and her grandfather protect their property from an evil coalmining tycoon, I’m beginning to wonder if I’m really retired. So is Detective Donovan Caine. The only honest cop in Ashland is having a real hard time reconciling his attraction to me with his Boy Scout mentality. And I can barely keep my hands off his sexy body. What can I say? I’m a Stone elemental with a little Ice magic thrown in, but my heart isn’t made of solid rock. Luckily, Gin Blanco always gets her man . . . dead or alive.","400 pages, Mass Market Paperback",Urban Fantasy,11.6k follower,"1,054 reviews",90,179 (<1%),715 (3%),"4,245 (18%)","9,378 (40%)","8,403 (36%)"
