Title,Authors,Avg Ratings,Rating,first_published,Description,Total_Pages,Genre,author_followers,no_of_reviews,no_book_by_author,one_star_ratings,two_star_ratings,three_star_ratings,four_star_ratings,five_star_ratings
Memoirs of an Addicted Brain: A Neuroscientist Examines his Former Life on Drugs,Marc  Lewis,"2,075",ratings186,"October 4, 2011","A gripping, ultimately triumphant memoir that's also the most comprehensive and comprehensible study of the neuroscience of addiction written for the general public.FROM THE ""We are prone to a cycle of craving what we don't have, finding it, using it up or losing it, and then craving it all the more. This cycle is at the root of all addictions, addictions to drugs, sex, love, cigarettes, soap operas, wealth, and wisdom itself. But why should this be so? Why are we desperate for what we don't have, or can't have, often at great cost to what we do have, thereby risking our peace and contentment, our safety, and even our lives?""The answer, says Dr. Marc Lewis, lies in the structure and function of the human brain.Marc Lewis is a distinguished neuroscientist. And, for many years, he was a drug addict himself, dependent on a series of dangerous substances, from LSD to heroin. His narrative moves back and forth between the often dark, compellingly recounted story of his relationship with drugs and a revelatory analysis of what was going on in his brain.He shows how drugs speak to the brain - which is designed to seek rewards and soothe pain - in its own language. He shows in detail the neural mechanics of a variety of powerful drugs and of the onset of addiction, itself a distortion of normal perception.Dr. Lewis freed himself from addiction and ended up studying it. At the age of 30 he traded in his pharmaceutical supplies for the life of a graduate student, eventually becoming a professor of developmental psychology, and then of neuroscience - his field for the last 12 years. This is the story of his journey, seen from the inside out.","320 pages, Hardcover",Nonfiction,78 follower,186 reviews,7,18 (<1%),88 (4%),419 (20%),809 (38%),741 (35%)
Sail,James Patterson,"28,793","ratings2,265","June 9, 2008","Since the death of her husband, Anne Dunne and her three children have struggled in every way. In a last ditch effort to save the family, Anne plans an elaborate sailing vacation to bring everyone together once again. But only an hour out of port, everything is going wrong. The teenage daughter, Carrie, is planning to drown herself. The teenage son, Mark, is high on drugs and ten-year-old Ernie is nearly catatonic. This is the worst vacation ever.Anne manages to pull things together bit by bit, but just as they begin feeling like a family again, something catastrophic happens. Survival may be the least of their concerns. Written with the blistering pace and shocking twists that only James Patterson can master, Sail takes ""Lost"" and ""Survivor"" to a new level of terror.","388 pages, Hardcover",Fiction,345k follower,"2,265 reviews","1,573",627 (2%),"1,845 (6%)","7,570 (26%)","10,562 (36%)","8,189 (28%)"
UnWholly,Neal Shusterman,"59,434","ratings5,124","August 28, 2012","Thanks to Connor, Lev, and Risa — and their high-profile revolt at Happy Jack Harvest Camp — people can no longer turn a blind eye to unwinding. Ridding society of troublesome teens while simultaneously providing much-needed tissues for transplant might be convenient, but its morality has finally been brought into question. However, unwinding has become big business, and there are powerful political and corporate interests that want to see it not only continue, but also expand to the unwinding of prisoners and the impoverished.Cam is a product of unwinding; made entirely out of the parts of other unwinds, he is a teen who does not technically exist. A futuristic Frankenstein, Cam struggles with a search for identity and meaning and wonders if a rewound being can have a soul. And when the actions of a sadistic bounty hunter cause Cam’s fate to become inextricably bound with the fates of Connor, Risa, and Lev, he’ll have to question humanity itself.Rife with action and suspense, this riveting companion to the perennially popular Unwind challenges assumptions about where life begins and ends—and what it means to live.","402 pages, Hardcover",Young Adult,26.4k follower,"5,124 reviews",86,516 (<1%),"1,377 (2%)","8,107 (13%)","22,485 (37%)","26,949 (45%)"
The Future Is Wild,Dougal Dixon,131,ratings13,"December 1, 2002","Imagine the world in the far distant future -- a world without humans, a world so different from ours that, until now, it's been impossible to consider.What creatures will roam the land or swim in the oceans? The Future Is Wild brings to life a world of amazing creatures and sets them loose in our imagination.Based on fundamental biological and evolutionary principles, they could -- and may yet -- exist: 5 million years from now. It cannot fly, but the carakiller is the Amazon's swiftest predator. 100 million years from now. Toratons, descendents of tortoises, are the biggest animals ever to walk the Earth. 200 million years from now. Warrior terabytes disable victims by spraying chemicals at them.In five million years, Northern Europe and North America are covered by ice sheets. Only the hardiest, most adaptable species are able to survive. In 100 million years, Earth is a global hothouse, brimming with life. Another 100 million years and Earth is a single, huge supercontinent and one vast, warm ocean.Using state-of-the-art computer animation, The Future Is Wild is able to transform the imagination into actual images, creating a living world of strange creatures and extraordinary habitats.","160 pages, Paperback",Science,103 follower,13 reviews,295,1 (<1%),5 (3%),34 (25%),42 (32%),49 (37%)
Antigoddess,Kendare Blake,"8,379","ratings1,359","September 10, 2013","Old Gods never die…Or so Athena thought. But then the feathers started sprouting beneath her skin, invading her lungs like a strange cancer, and Hermes showed up with a fever eating away his flesh. So much for living a quiet eternity in perpetual health.Desperately seeking the cause of their slow, miserable deaths, Athena and Hermes travel the world, gathering allies and discovering enemies both new and old. Their search leads them to Cassandra—an ordinary girl who was once an extraordinary prophetess, protected and loved by a god. These days, Cassandra doesn’t involve herself in the business of gods—in fact, she doesn’t even know they exist. But she could be the key in a war that is only just beginning. Because Hera, the queen of the gods, has aligned herself with other of the ancient Olympians, who are killing off rivals in an attempt to prolong their own lives. But these anti-gods have become corrupted in their desperation to survive, horrific caricatures of their former glory. Athena will need every advantage she can get, because immortals don’t just flicker out. Every one of them dies in their own way. Some choke on feathers. Others become monsters. All of them rage against their last breath.The Goddess War is about to begin.","333 pages, Hardcover",Fantasy,55.1k follower,"1,359 reviews",36,305 (3%),826 (9%),"2,390 (28%)","2,918 (34%)","1,940 (23%)"
The Blood of Gods,Conn Iggulden,"7,892",ratings362,"January 1, 2013","The fifth and final instalment of the Emperor series.Julius Caesar has been assassinated. A nation is in mourning. Revenge will be bloody.Rome’s great hero Julius Caesar has been brutally murdered by his most trusted allies. While these self-appointed Liberatores seek refuge in the senate, they have underestimated one man: Caesar’s adopted son Octavian, a man whose name will echo through history as Augustus Caesar.Uniting with his great rival Mark Antony, Octavian will stop at nothing to seek retribution from the traitors and avenge his father’s death. His greatest hatred is reserved for Brutus, Caesar’s childhood friend and greatest ally, now leader of the conspirators.As the people take to the streets of Rome, the Liberatores must face their fate. Some flee the city; others will not escape mob justice. Not a single one will die a natural death. And the reckoning will come for Brutus on the sweeping battlefield at Philippi.","409 pages, Hardcover",Historical Fiction,"5,342 follower",362 reviews,115,25 (<1%),149 (1%),"1,072 (13%)","3,070 (38%)","3,576 (45%)"
Hungry for You,Lynsay Sands,"14,495",ratings514,"November 30, 2010","This vampire has been alone for far too long . . .As one of the most ancient in the Argeneau clan, Cale Valens has given up on finding a life mate. His friends and family, however, have not. In fact, they believe they've finally found his perfect match. Getting them together, however, requires one little white lie . . .Alexandra Willan is in a panic. Her restaurant is due to open in two weeks, but her chef just walked out. Then a highly recommended replacement arrives, an impossibly handsome culinary genius who sends electric tingles racing through her body . . .Except he can't cook. In fact, Cale hasn't eaten real food in two thousand years. Yet he's determined to prove to Alex his prowess in the kitchen . . . and elsewhere. Because never has he hungered so for any mortal woman. And not just for a taste of her, but for the whole delicious feast!","384 pages, Mass Market Paperback",Paranormal Romance,11.6k follower,514 reviews,123,60 (<1%),348 (2%),"2,211 (15%)","4,960 (34%)","6,916 (47%)"
The Third Caliph,Alex Archer,253,ratings17,"March 2, 2013","A holy war. An ancient scroll lost in history…until now.During a dig in Morocco, archaeologist Annja Creed and her companions are nearly buried alive when the khettara ceiling collapses, revealing a 1,300-year-old corpse. But when Bedouin bandits raid the camp, Annja barely escapes with her life…and half of a scroll in ancient Kufic script. Her companions' survival now depends on her.The scroll dates back to 656 AD, when Muslim raised sword against Muslim and the assassination of the third caliph left no clear heir to Muhammad's teachings. It's a coveted find. Annja quickly finds herself caught between a devious terrorist whose family honor depends on destroying what she possesses and a ruthless CIA team. Both believe the end justifies the means. And that Annja cannot allow.","320 pages, Mass Market Paperback",Fantasy,226 follower,17 reviews,96,1 (<1%),15 (5%),77 (30%),86 (33%),74 (29%)
"Dreyfus: Politics, Emotion, and the Scandal of the Century",Ruth Harris,191,ratings30,"January 1, 2010","The definitive history of the infamous scandal that shook a nation and stunned the world In 1894, Alfred Dreyfus, a Jewish officer in the French army, was wrongfully convicted of being a spy for Germany and imprisoned on Devil's Island. Over the following years, attempts to correct this injustice tore France apart, inflicting wounds on the society which have never fully healed. But how did a fairly obscure miscarriage of justice come to break up families in bitterness, set off anti-Semitic riots across the French empire, and nearly trigger a coup d'état? How did a violently reactionary, obscurantist attitude become so powerful in a country that saw itself as the home of enlightenment? Why did the battle over a junior army officer occupy the foremost writers and philosophers of the age, from Émile Zola to Marcel Proust, Émile Durkheim, and many others? What drove the anti-Dreyfusards to persist in their efforts even after it became clear that much of the prosecution's evidence was faked? Drawing upon thousands of previously unread and unconsidered sources, prizewinning historian Ruth Harris goes beyond the conventional narrative of truth loving democrats uniting against proto-fascists. Instead, she offers the first in-depth history of both sides in the Affair, showing how complex interlocking influences—tensions within the military, the clashing demands of justice and nationalism, and a tangled web of friendships and family connections—shaped both the coalition working to free Dreyfus and the formidable alliances seeking to protect the reputation of the army that had convicted him. Sweeping and engaging, Dreyfus offers a new understanding of one of the most contested and significant moments in modern history.","560 pages, Hardcover",History,3 follower,30 reviews,53,1 (<1%),10 (5%),55 (28%),82 (42%),43 (22%)
"Chew, Vol. 5: Major League",John Layman,"9,405",ratings401,"April 18, 2012","Tony Chu - the cibopathic federal agent with the ability to get psychic impressions from what he eats - has been kidnapped! He was ambushed, knocked out, brought to a remote location, and bound securely. His captor intends to feed Tony from a menu of his choosing, to find out what Tony can see, in order to learn from him. His daughter, Olive, has been kidnapped for the exact same reason. Two kidnappers, two captives, and two very different outcomes. Presenting the fifth storyline of the New York Times bestselling, Harvey and multiple Eisner Award-winning series about cops, crooks, cooks, cannibals, clairvoyants - and kidnappers!Book Details: 
   Format: Paperback 
   Publication Date: 5/8/2012 
   Pages: 120","120 pages, Paperback",Graphic Novels,568 follower,401 reviews,666,208 (2%),332 (3%),"1,501 (15%)","3,446 (36%)","3,918 (41%)"
What If,Rebecca    Donovan,"8,248",ratings890,"September 16, 2014","What if you had a second chance to meet someone for the first time?Cal Logan is shocked to see Nicole Bentley sitting across from him at a coffee shop thousands of miles from their hometown. After all, no one has seen or heard from her since they graduated over a year ago.Except this girl isn't Nicole.She looks exactly like Cal's shy childhood crush, but her name is Nyelle Preston and she has no idea who he is. This girl is impulsive and daring, her passion for life infectious. The complete opposite of Nicole. Cal finds himself utterly fascinated-and falling hard. But Nyelle is also extremely secretive. And the closer he comes to finding out what she's hiding, the less he wants to know.When the secrets from the past and present collide, one thing becomes clear: Nothing is what it seems.","352 pages, ebook",Romance,"9,396 follower",890 reviews,17,181 (2%),498 (6%),"1,923 (23%)","3,045 (36%)","2,601 (31%)"
War Horse,Nick Stafford,"55,405","ratings5,601","June 3, 1982","I want you to do yourself proud, Joey. You go and drive those Germans back where they've come from, and then come home to me.At the outbreak of World War one, Joey, young Albert's beloved horse, is sold to the cavalry and shipped to France. Caught up in enemy fire, fate takes Joey on an extraordinary odyssey, serving on both sides before finding himself alone in no man's land. But Albert cannot forget Joey and, still not old enough to enlist, he embarks on a treacherous mission to find him and bring him home.Nick Stafford's adaptation for the stage of the celebrated novel by the Children's Laureate (2003-05) Michael Morpurgo leads us on a gripping journey through history. War Horse premiered at the National Theatre, London, in October 2007.","98 pages, Paperback",Historical Fiction,5 follower,"5,601 reviews",12,663 (1%),"1,882 (3%)","9,088 (16%)","20,468 (36%)","23,304 (42%)"
In Black and White : The Untold Story of Joe Louis and Jesse Owens,Donald McRae,125,ratings5,"October 21, 2002","WILLIAM HILL SPORTS BOOK OF THE YEAR, 2002 - the extraordinary biography of two of the world's greatest athletes, Jesse Owens and Joe Louis. Jesse Owens and Joe Louis have been hailed as American icons for the last sixty-five years, yet they were unfailingly human in everything they achieved and as vulnerable as they were courageous; as troubled as they were brilliant; as restless in themselves as they are now rooted in history. IN BLACK AND WHITE will tell, for the first time, the story of the shared political legacy, extraordinary personal links and enduring friendship between 4-times Olympic gold medallist Jesse Owens, and Heavyweight World Boxing Champion Joe Louis, black athletes born in an America demeaned by racism and poverty.","432 pages, Paperback",Nonfiction,36 follower,5 reviews,26,0 (0%),0 (0%),13 (10%),50 (40%),62 (49%)
The Adventures of Henry Thoreau: A Young Man's Unlikely Path to Walden Pond,Michael Sims,289,ratings46,"June 11, 2013","Henry David Thoreau has long been an intellectual icon and folk hero. In this strikingly original profile, Michael Sims reveals how the bookish, quirky young man who kept quitting jobs evolved into the patron saint of environmentalism and nonviolent activism.Working from nineteenth-century letters and diaries by Thoreau's family, friends, and students, Sims charts Henry's course from his time at Harvard through the years he spent living in a cabin beside Walden Pond in Concord, Massachusetts.Sims uncovers a previously hidden Thoreau-the rowdy boy reminiscent of Tom Sawyer, the sarcastic college iconoclast, the devoted son who kept imitating his beloved older brother's choices in life. Thoreau was deeply influenced by his parents-his father owned a pencil factory in Concord, his mother was an abolitionist and social activist-and by Ralph Waldo Emerson, his frequent mentor. Sims relates intimate, telling moments in Thoreau's daily life-in Emerson's library; teaching his neighbor and friend, Nathaniel Hawthorne, to row a boat; exploring the natural world and Native American culture; tutoring Emerson's nephew on Staten Island and walking the streets of New York in the hope of launching a writing career.Returned from New York, Thoreau approached Emerson to ask if he could build a cabin on his mentor's land on the shores of Walden Pond, anticipating the isolation would galvanize his thoughts and actions. That it did. While at the cabin, he wrote his first book, A Week on the Concord and Merrimack Rivers , and refined the journal entries that formed the core of Walden . Resisting what he felt were unfair taxes, he spent the night in jail that led to his celebrated essay “Civil Disobedience,” which would inspire the likes of Gandhi and Martin Luther King.Chronicling Thoreau's youthful transformation, Sims reveals how this decade would resonate over the rest of his life, and thereafter throughout American literature and history.","384 pages, Hardcover",Biography,63 follower,46 reviews,43,4 (1%),14 (4%),76 (26%),134 (46%),61 (21%)
Callsign: Queen (Zelda Baker),Jeremy Robinson,727,ratings43,"September 12, 2011","At the beginning of her search for Rook, a missing Chess Team member, Zelda Baker, Callsign: Queen, is redirected to Pripyat, Ukraine, a ghost town on the radioactive outskirts of Chernobyl. Intel indicates that splinter cell of Manifold Genetics—a ruthless corporation dismantled by Chess Team—may be operating in the area. Tasked with confirming the existence of a Manifold facility, Queen begins a recon sweep of the abandoned town in search of clues, but soon finds herself fighting for her life. Something sinister lurks beneath the decaying, surreal remnants of Pripyat’s never-used amusement park, and it rises up to greet Queen.In Pripyat, the streets are empty, the derelict buildings crumble, but the bodies…are fresh.THE CALLSIGN BOOKS: Callsign: Queen (30,000 words) is the second in a series of Chess Team novellas being released in 2011. Each of the six books follows a single member of the team and are titled for them; Callsign: Queen, Callsign: Knight, etc, and are co-authored by Jeremy Robinson and six other fantastic authors. The stories take place after the events of THRESHOLD, the third Jack Sigler thriller, but are designed to introduce readers to the series. If you haven't read the novels, no worries. Enjoy the ride!PRAISE FOR ROBINSON""Rocket-boosted action, brilliant speculation, and the recreation of a horror out of the mythologic past, all seamlessly blend into a rollercoaster ride of suspense and adventure."" -- James Rollins, New York Times bestselling author of JAKE RANSOM AND THE SKULL KING'S SHADOW""With THRESHOLD Jeremy Robinson goes pedal to the metal into very dark territory. Fast-paced, action-packed and wonderfully creepy! Highly recommended!"" --Jonathan Maberry, NY Times bestselling author of ROT & RUIN""Jeremy Robinson is the next James Rollins"" -- Chris Kuzneski, NY Times bestselling author of THE SECRET CROWN""If you like thrillers original, unpredictable and chock-full of action, you are going to love Jeremy Robinson...""-- Stephen Coonts, NY Times bestselling author of DEEP BLACK: ARCTIC GOLD""How do you find an original story idea in the crowded action-thriller genre? Two words: Jeremy Robinson."" -- Scott Sigler, NY Times Bestselling author of ANCESTOR""There's nothing timid about Robinson as he drops his readers off the cliff without a parachute and somehow manages to catch us an inch or two from doom."" -- Jeff Long, New York Times bestselling author of THE DESCENT""Jeremy Robinson's THRESHOLD is one hell of a thriller, wildly imaginative and diabolical, which combines ancient legends and modern science into a non-stop action ride that will keep you turning the pages until the wee hours. Relentlessly gripping from start to finish, don't turn your back on this book!"" -- Douglas Preston, NY Times bestselling author of IMPACT and BLASPHEMYPRAISE FOR WOOD""David Wood has done it again. Quest takes you on an expedition that leads down a trail of adventure and thrills. David Wood has honed his craft and Quest is proof of his efforts!"" David L. Golemon, Author of LEGACY, THE SUPERNATURALS, AND EVENT""Ancient cave paintings? Cities of gold? Secret scrolls? Sign me up! Cibola is a twisty tale of adventure and intrigue that never lets up and never lets go!"" --Robert Masello, author of BESTIARY and BLOOD AND ICE""Let there be no confusion: David Wood is the next Clive Cussler. From the accessible writing to the wide-ranging plot to the main characters who don't give up no matter how long the odds, Wood's latest book, Quest, is a tremendous classic adventure. Once you start reading, you won't be able to stop until the last mystery plays out in the final line."" Edward G. Talbot, author of 2010: THE FIFTH WORLD""Dane and Bones are back! Packed solid with action and witty dialogue, this rousing adventure takes a fresh look at one of the most enduring mysteries of the 20th century, David Wood delivers again with QUEST.""--Sean Ellis, author of INTO THE BLACK and DARK TRINITY: ASCENDANT",Nook,Thriller,"2,324 follower",43 reviews,132,2 (<1%),14 (1%),146 (20%),255 (35%),310 (42%)
The Unthinkable: Who Survives When Disaster Strikes - and Why,Amanda Ripley,"7,740","ratings1,157","June 10, 2008","It lurks in the corner of our imagination, almost beyond our ability to see the possibility that a tear in the fabric of life could open up without warning, upending a house, a skyscraper, or a civilization.Today, nine out of ten Americans live in places at significant risk of earthquakes, hurricanes, tornadoes, terrorism, or other disasters. Tomorrow, some of us will have to make split-second choices to save ourselves and our families. How will we react? What will it feel like? Will we be heroes or victims? Will our upbringing, our gender, our personality–anything we’ve ever learned, thought, or dreamed of–ultimately matter?    Amanda Ripley, an award-winning journalist for Time magazine who has covered some of the most devastating disasters of our age, set out to discover what lies beyond fear and speculation. In this magnificent work of investigative journalism, Ripley retraces the human response to some of history’s epic disasters, from the explosion of the Mont Blanc munitions ship in 1917–one of the biggest explosions before the invention of the atomic bomb–to a plane crash in England in 1985 that mystified investigators for years, to the journeys of the 15,000 people who found their way out of the World Trade Center on September 11, 2001. Then, to understand the science behind the stories, Ripley turns to leading brain scientists, trauma psychologists, and other disaster experts, formal and informal, from a Holocaust survivor who studies heroism to a master gunfighter who learned to overcome the effects of extreme fear.Finally, Ripley steps into the dark corners of her own imagination, having her brain examined by military researchers and experiencing through realistic simulations what it might be like to survive a plane crash into the ocean or to escape a raging fire.    Ripley comes back with precious wisdom about the surprising humanity of crowds, the elegance of the brain’s fear circuits, and the stunning inadequacy of many of our evolutionary responses. Most unexpectedly, she discovers the brain’s ability to do much, much better, with just a little help.The Unthinkable escorts us into the bleakest regions of our nightmares, flicks on a flashlight, and takes a steady look around. Then it leads us home, smarter and stronger than we were before.","266 pages, Hardcover",Nonfiction,332 follower,"1,157 reviews",16,41 (<1%),194 (2%),"1,251 (16%)","3,080 (39%)","3,174 (41%)"
