Title,Authors,Avg Ratings,Rating,first_published,Description,Total_Pages,Genre,author_followers,no_of_reviews,no_book_by_author,one_star_ratings,two_star_ratings,three_star_ratings,four_star_ratings,five_star_ratings
Lethal White,Robert Galbraith,"163,890","ratings12,872","September 18, 2018","“I seen a kid killed…He strangled it, up by the horse.”When Billy, a troubled young man, comes to private eye Cormoran Strike’s office to ask for his help investigating a crime he thinks he witnessed as a child, Strike is left deeply unsettled. While Billy is obviously mentally distressed, and cannot remember many concrete details, there is something sincere about him and his story. But before Strike can question him further, Billy bolts from his office in a panic.Trying to get to the bottom of Billy’s story, Strike and Robin Ellacott—once his assistant, now a partner in the agency—set off on a twisting trail that leads them through the backstreets of London, into a secretive inner sanctum within Parliament, and to a beautiful but sinister manor house deep in the countryside.And during this labyrinthine investigation, Strike’s own life is far from straightforward: his newfound fame as a private eye means he can no longer operate behind the scenes as he once did. Plus, his relationship with his former assistant is more fraught than it ever has been—Robin is now invaluable to Strike in the business, but their personal relationship is much, much trickier than that.","658 pages, Kindle Edition",Mystery,29.5k follower,"12,872 reviews",27,"1,191 (<1%)","3,147 (1%)","20,884 (12%)","68,238 (41%)","70,430 (42%)"
Dom Wars: Round Six,Lucian Bane,755,ratings131,"August 12, 2014","When Gladiator Inc, an adult toy company expands their market to familiarize the ‘vanilla’ world with the elements of BDSM, the result is a pay-per-view reality show with video feeds streamed live to subscribers. The show, Dom Wars, is a competition to determine the Top Dom that will become the spokesperson for the company.  The contestants all wear cameras to film every moment and angle of the competition, while they complete various challenges to determine who has ultimately Dominated various elements of themselves.  The hero and heroine of the series, Lucian Bane and Tara Reese, have barely made it into the Sixth and Final Round of Dom Wars. This week-long Survival Round will determine the Top Dom, once and for all.  The contestants are taken to an uninhabited island, where they will have to cross formidable jungle terrain. First Dom to reach the boat anchored on the other side of the island wins the million dollars and the title.  Seems simple. Except Lucian’s old adversary, the Sadist Jase Duff from Round One, has been tasked with making sure none of the five teams make it to the boat. If he is successful, he wins the prize, only it's not money that Jase Duff cares about, its revenge on Lucian and Tara. And his sadistic need to inflict pain makes it game on.","145 pages, Kindle Edition",wicked-reads,"2,906 follower",131 reviews,131,32 (4%),30 (3%),100 (13%),180 (23%),413 (54%)
The Gathering,Anne Enright,"23,684","ratings3,465","March 1, 2007","Anne Enright is a dazzling writer of international stature and one of Ireland’s most singular voices. Now she delivers The Gathering, a moving, evocative portrait of a large Irish family and a shot of fresh blood into the Irish literary tradition, combining the lyricism of the old with the shock of the new. The nine surviving children of the Hegarty clan are gathering in Dublin for the wake of their wayward brother, Liam, drowned in the sea. His sister, Veronica, collects the body and keeps the dead man company, guarding the secret she shares with him—something that happened in their grandmother’s house in the winter of 1968. As Enright traces the line of betrayal and redemption through three generations her distinctive intelligence twists the world a fraction and gives it back to us in a new and unforgettable light. The Gathering is a daring, witty, and insightful family epic, clarified through Anne Enright’s unblinking eye. It is a novel about love and disappointment, about how memories warp and secrets fester, and how fate is written in the body, not in the stars.","261 pages, Paperback",Fiction,"1,126 follower","3,465 reviews",40,"2,146 (9%)","4,645 (19%)","7,882 (33%)","6,169 (26%)","2,842 (11%)"
Unnaturals: The Battle Begins,Devon Hughes,326,ratings39,"October 6, 2015","Perfect for fans of the Animorphs and Warriors series, Devon Hughes's exhilarating debut is full of friendship, heroism, high stakes, and epic adventure.Castor has always been a stray, prowling with his pack in the back alleys of Lion's Head. That is, until the day that he's captured and taken to a dark laboratory full of terrifying creatures. They're called Unnaturals, and they're made to fight.Soon Castor is transformed from a mutt into a powerful beast with huge eagle wings—and he's thrust into the fighting ring. He knows he'll need all of his courage to survive. But it will take unexpected human and animal allies and something even more than courage for him to save the Unnaturals....","357 pages, Kindle Edition",Fantasy,26 follower,39 reviews,2,8 (2%),12 (3%),40 (12%),86 (26%),180 (55%)
Responsibility and Punishment,J. Angelo Corlett,3,ratings0,"January 1, 2002","This volume presents a clear-headed defense of retributivism against several long-standing criticisms. In the end, a viable version of retributivism emerges as one which withstands more criticism than competing theories of responsibility and punishment. Extending the problem of wrong doing to collectives and compensation, Corlett explores the matter of reparations for past wrongs in the case of the crimes committed against Native Americans by the United States Government. No other philosophical work on responsibility and punishment exhibits this breadth of scope, as it delves deeply into particular concerns with retributivism, responsibility, and certain areas of compensation. Academicians and professionals in ethics, moral, social, political, and legal philosophy are likely to benefit from this analytical treatment of responsibility and punishment.","224 pages, Hardcover",Philosophy,2 follower,0 reviews,11,0 (0%),1 (33%),0 (0%),0 (0%),2 (66%)
Being a Beast: Adventures Across the Species Divide,Charles Foster,"1,597",ratings317,"January 28, 2016","Charles Foster set out to know the ultimate other: the non-humans, the beasts. And to do that, he tried to be like them, choosing a badger, an otter, a fox, a deer, and a swift. He lived alongside badgers for weeks, sleeping in a sett in a Welsh hillside and eating earthworms, learning to sense the landscape through his nose rather than his eyes. He caught fish in his teeth while swimming like an otter; rooted through London garbage cans as an urban fox; was hunted by bloodhounds as a red deer, nearly dying in the snow. And he followed the swifts on their migration route over the Strait of Gibraltar, discovering himself to be strangely connected to the birds.","256 pages, Hardcover",Nonfiction,93 follower,317 reviews,131,154 (9%),289 (18%),489 (30%),410 (25%),255 (15%)
Perfectly Toxic,C.M. Owens,"5,158",ratings277,"July 26, 2016","BELLA New life. New job. New home. New goals... I vowed to make drastic changes and to never fall back into old habits. But then Ethan Noles showed up and blew all my good intentions to hell. I should have stayed away. I shouldn't have played his game. But I did. Now I just hope I don't regret it. ETHAN Bella is the type of girl you can't help but chase, because she doesn't want to be caught. I came back ready to live and enjoy life. Not to get tethered to a girl. But... shit happens. Bella happens. And everything I thought I wanted slowly changes. *Graphic language *Adult content *And yeah, there's sex. CAN BE READ AS A STAND-ALONE","597 pages, Kindle Edition",Romance,"7,426 follower",277 reviews,59,33 (<1%),99 (1%),471 (9%),"1,341 (25%)","3,214 (62%)"
Code Name: Butterfly,أحلام بشارات,166,ratings27,"January 1, 2009","Should you feel bad if your dad works for the Israeli occupiers? What if he loses his job? And how are you supposed to cope when someone close to you dies? Butterfly is smart. Some people even say she’s shrewd, but that doesn’t make life any less confusing. Every day throws up new questions and some are too big for her to handle alone. Squirrelling away the difficult ones in her treasure chest, Butterfly creates a place of strength in her imagination. While her classmates turn to protest and violence, Butterfly finds her own form of resilience, her own secret way to find peace in a world of conflict and uncertainty. Written with ironic humour and touching idealism, Butterfly looks back at a turbulent summer in her early teens, drawing us into her world of adult hypocrisy, sibling rivalries, power struggles with her school friends, unrequited love... and the daily tensions of Palestinian life under military occupation. A teenage perspective on one of the most protracted conflicts of our times, Code Name: Butterfly is a story for all teens grappling with friendship, family and the emotional storms ahead.","97 pages, Paperback",Fiction,51 follower,27 reviews,9,9 (5%),15 (9%),47 (28%),55 (33%),40 (24%)
Havboka,Morten A. Strøksnes,"4,945",ratings573,"October 28, 2015","Kunsten å fange en kjempehai fra en gummibåt på et stort hav gjennom fire årstider.To menn i en liten båt. Et monster i havdypet under dem. Det er er utgangspunktet for Havboka. Fra den lille øya Skrova utenfor Lofoten undersøkes havet gjennom historie, fortellinger, vitenskap, poesi og mytologi. Hav er opphav, og rommer de utroligste livsformer. For forfatteren blir havet en rik kile til forundringm nye innsikter og salte eventyr.","303 pages, Hardcover",Nonfiction,112 follower,573 reviews,13,45 (<1%),212 (4%),984 (19%),"2,062 (41%)","1,642 (33%)"
Fever Crumb,Philip Reeve,"9,209","ratings1,029","May 4, 2009","The author of the best-selling and critically beloved Mortal Engines quartet has written a stunning, stand-alone prequel. FEVER CRUMB is set many generations before the events of Mortal Engines, in whose brilliantly-imagined world massive, predatory Traction Cities chase and devour each other. Now London is a static, overcrowded, riot-torn powerhouse that hides an explosive secret. Is Fever, adopted daughter of Dr Crumb, the strange key that will unlock its dangerous mysteries?","336 pages, Paperback",Steampunk,"2,530 follower","1,029 reviews",209,217 (2%),750 (8%),"2,489 (27%)","3,521 (38%)","2,232 (24%)"
"The Devil's Chessboard: Allen Dulles, the CIA, and the Rise of America's Secret Government",David Talbot,"4,912",ratings633,"October 13, 2015","An explosive, headline-making portrait of Allen Dulles, the man who transformed the CIA into the most powerful—and secretive—colossus in Washington, from the founder of Salon.com and author of the New York Times bestseller BrothersAmerica’s greatest untold story: the United States’ rise to world dominance under the guile of Allen Welsh Dulles, the longest-serving director of the CIA. Drawing on revelatory new materials—including newly discovered U.S. government documents, U.S. and European intelligence sources, the personal correspondence and journals of Allen Dulles’s wife and mistress, and exclusive interviews with the children of prominent CIA officials—Talbot reveals the underside of one of America’s most powerful and influential figures.Dulles’s decade as the director of the CIA—which he used to further his public and private agendas—were dark times in American politics. Calling himself “the secretary of state of unfriendly countries,” Dulles saw himself as above the elected law, manipulating and subverting American presidents in the pursuit of his personal interests and those of the wealthy elite he counted as his friends and clients—colluding with Nazi-controlled cartels, German war criminals, and Mafiosi in the process. Targeting foreign leaders for assassination and overthrowing nationalist governments not in line with his political aims, Dulles employed those same tactics to further his goals at home, Talbot charges, offering shocking new evidence in the assassination of President John F. Kennedy.An exposé of American power that is as disturbing as it is timely, The Devil’s Chessboard is a provocative and gripping story of the rise of the national security state—and the battle for America’s soul.","704 pages, Hardcover",History,229 follower,633 reviews,53,57 (1%),112 (2%),525 (10%),"1,661 (33%)","2,557 (52%)"
The One and Only Bob,Katherine Applegate,"21,719","ratings2,660","May 5, 2020","Bob sets out on a dangerous journey in search of his long-lost sister with the help of his two best friends, Ivan and Ruby. As a hurricane approaches and time is running out, Bob finds courage he never knew he had and learns the true meaning of friendship and family.","342 pages, Hardcover",Middle Grade,"5,537 follower","2,660 reviews",281,125 (<1%),483 (2%),"3,333 (15%)","8,028 (36%)","9,750 (44%)"
When the Stars Go Dark,Paula McLain,"55,331","ratings6,295","April 13, 2021","Anna Hart is a missing persons detective in San Francisco. When tragedy strikes her personal life, Anna, desperate and numb, flees to the Northern California village of Mendocino to grieve. She lived there as a child with her beloved foster parents, and now she believes it might be the only place left for her. Yet the day she arrives, she learns a local teenage girl has gone missing. The crime feels frighteningly reminiscent of the most crucial time in Anna's childhood, when the unsolved murder of a young girl touched Mendocino and changed the community forever. As past and present collide, Anna realizes that she has been led to this moment. The most difficult lessons of her life have given her insight into how victims come into contact with violent predators. As Anna becomes obsessed with the missing girl, she must accept that true courage means getting out of her own way and learning to let others in.Weaving together actual cases of missing persons, trauma theory, and a hint of the metaphysical, this propulsive and deeply affecting novel tells a story of fate, necessary redemption, and what it takes, when the worst happens, to reclaim our lives--and our faith in one another.From the New York Times bestselling author of The Paris Wife comes a novel of intertwined destinies and heart-wrenching suspense: A detective hiding away from the world. A series of disappearances that reach into her past. Can solving them help her heal?","370 pages, Hardcover",Mystery,"5,668 follower","6,295 reviews",21,487 (<1%),"2,318 (4%)","14,158 (25%)","26,322 (47%)","12,046 (21%)"
Waiting for Eden,Elliot Ackerman,"4,019",ratings727,"September 1, 2018","Eden Malcom lies in a bed, unable to move or to speak, imprisoned in his own mind. His wife Mary spends every day on the sofa in his hospital room. He has never even met their young daughter. And he will never again see the friend and fellow soldier who didn't make it back home—and who narrates the novel. But on Christmas, the one day Mary is not at his bedside, Eden's re-ordered consciousness comes flickering alive. As he begins to find a way to communicate, some troubling truths about his marriage—and about his life before he went to war—come to the surface. Is Eden the same man he once was: a husband, a friend, a father-to-be? What makes a life worth living?","192 pages, Hardcover",Fiction,567 follower,727 reviews,14,64 (1%),247 (6%),972 (24%),"1,664 (41%)","1,072 (26%)"
One of Us Is Next,Karen M. McManus,"222,313","ratings20,577","January 7, 2020","Come on, Bayview, you know you've missed this.A ton of copycat gossip apps have popped up since Simon died, but in the year since the Bayview four were cleared of his shocking death, no one's been able to fill the gossip void quite like he could. The problem is no one has the facts.Until now. This time it's not an app, though—it's a game. Truth or Dare.Phoebe's the first target. If you choose not to play, it's a truth. And hers is dark. Then comes Maeve and she should know better—always choose the dare. But by the time Knox is about to be tagged, things have gotten dangerous. The dares have become deadly, and if Maeve learned anything from Bronwyn last year, it's that they can't count on the police for help. Or protection.Simon's gone, but someone's determined to keep his legacy at Bayview High alive. And this time, there's a whole new set of rules.The highly anticipated sequel to the New York Times bestselling thriller everyone is talking about, One of Us Is Lying! There's a new mystery to solve at Bayview High, and there's a whole new set of rules.","377 pages, Hardcover",Mystery,31.5k follower,"20,577 reviews",26,"1,851 (<1%)","9,421 (4%)","53,471 (24%)","97,331 (43%)","60,239 (27%)"
1089 and All That: A Journey into Mathematics,David Acheson,434,ratings40,"July 18, 2002","David Acheson's extraordinary little book makes mathematics accessible to everyone. From very simple beginnings he takes us on a thrilling journey to some deep mathematical ideas. On the way, via Kepler and Newton, he explains what calculus really means, gives a brief history of pi, and even takes us to chaos theory and imaginary numbers. Every short chapter is carefully crafted to ensure that no one will get lost on the journey. Packed with puzzles and illustrated by world famous cartoonists, this is one of the most readable and imaginative books on mathematics ever written.","178 pages, Paperback",Mathematics,21 follower,40 reviews,12,4 (<1%),25 (5%),97 (22%),161 (37%),147 (33%)
The Cry of the Icemark,Stuart Hill,"11,499",ratings655,"January 1, 2005","The Icemark is a kingdom in grave danger. Its king has been killed in battle, its enemy lies in wait, and its fate rests on the shoulders of one girl. Thirrin Freer Strong-in-the-Arm Lindenshield, a beautiful princess and an intrepid warrior, must find a way to protect her land from a terrible invasion. She will forge an extraordinary alliance of noble Snow Leopards, ancient Vampires, and ferocious Wolf-folk. She will find unexpected strength in her friendship with a young warlock. And she will lead her allies to victory with her fierce battle cry: ""Blood! Blast! And Fire!""","496 pages, Paperback",Fantasy,261 follower,655 reviews,40,210 (1%),555 (4%),"2,010 (17%)","3,640 (31%)","5,084 (44%)"
The Silent Corner,Dean Koontz,"34,852","ratings3,470","June 6, 2017","Meet Jane Hawk—a remarkable new heroine certain to become an icon of suspense, propelled by the singular narrative genius of #1 New York Times bestselling author Dean Koontz.“I very much need to be dead.” These are the chilling words left behind by a man who had everything to live for—but took his own life. In the aftermath, his widow, Jane Hawk, does what all her grief, fear, and fury demand: find the truth, no matter what. People of talent and accomplishment, people admired and happy and sound of mind, have been committing suicide in surprising numbers. When Jane seeks to learn why, she becomes the most-wanted fugitive in America. Her powerful enemies are protecting a secret so important—so terrifying—that they will exterminate anyone in their way. But all their power and viciousness may not be enough to stop a woman as clever as they are cold-blooded, as relentless as they are ruthless—and who is driven by a righteous rage they can never comprehend. Because it is born of love.","434 pages, Hardcover",Thriller,36.2k follower,"3,470 reviews",918,754 (2%),"1,950 (5%)","7,417 (21%)","13,520 (38%)","11,211 (32%)"
In the Shadow of the Eighth: My Forty Years Working for Women's Health in Ireland,Peter Boylan,111,ratings13,"November 14, 2019","In over forty years in medicine - seven of these as Master of the National Maternity Hospital - obstetrician Peter Boylan was at the births of more than 6,000 babies. He saw women and families at their most vulnerable, their most joyous, and sometimes their most heart-broken.In the Shadow of the Eighth is the story of how a young doctor without strong views on abortion became convinced that women should be trusted to make the right decisions for their lives - and how he then did everything in his power to bring about a situation where they could.More than that, it is an engaging account of working in one of medicine's most satisfying specialities, a revealing behind-the-scenes insight into what it's like trying to make change happen, and a fascinating portrait of a society in transition.Lively, gripping, sometimes enraging but always compassionate, Peter Boylan's story is vital and encouraging reading for these turbulent times.'A comprehensive, insightful and often shocking social history of the country' Irish Independent'A hero to many (including me)' @MarianKeyes'Both personal and political ... a very important history of recent events that have utterly changed Ireland's social and political landscapes' Irish Times'A fascinating story' Matt Cooper, Today FM'The book is fabulous' Pat Kenny, Newstalk","278 pages, Paperback",Nonfiction,7 book,13 reviews,7,0 (0%),6 (5%),16 (14%),52 (46%),37 (33%)
November 9,Colleen Hoover,"1,055,515","ratings84,305","November 10, 2015","Beloved #1 New York Times bestselling author Colleen Hoover returns with an unforgettable love story between a writer and his unexpected muse.Fallon meets Ben, an aspiring novelist, the day before her scheduled cross-country move. Their untimely attraction leads them to spend Fallon’s last day in L.A. together, and her eventful life becomes the creative inspiration Ben has always sought for his novel. Over time and amidst the various relationships and tribulations of their own separate lives, they continue to meet on the same date every year. Until one day Fallon becomes unsure if Ben has been telling her the truth or fabricating a perfect reality for the sake of the ultimate plot twist.Can Ben’s relationship with Fallon—and simultaneously his novel—be considered a love story if it ends in heartbreak?","310 pages, Paperback",Contemporary,703k follower,"84,305 reviews",80,"24,635 (2%)","46,689 (4%)","156,812 (14%)","348,077 (32%)","479,302 (45%)"
Paige Torn,Erynn Mangum,733,ratings86,"May 1, 2013","Everyone knows they can count on Paige Alder. But between volunteering at church, putting in overtime at work, and helping her best friend plan an anniversary party, she's lucky to grab a cheese stick for dinner. Paige can't even remember the last time she had a few minutes to relax or dig into God's Word. Then she meets laid-back Tyler, an attractive, Jesus-loving guy. Will he be able to help Paige get her priorities on track?","304 pages, Mass Market Paperback",Christian Fiction,589 follower,86 reviews,37,6 (<1%),22 (3%),130 (17%),255 (34%),320 (43%)
Behindlings,Nicola Barker,315,ratings43,"January 1, 2002","Wesley, spurting with kinetic energy, nasty wit, and kindness to animals, ought to be a star. Or so it seems to those who nip at his heels, turn up everywhere he goes, and lie in wait for him around every corner. They are his followers -- he calls them Behindlings. And they make quite an ensemble, with their own questionable intentions, irritating habits, and weird manners. But they bury all disagreement in the common pursuit of their prize, their Wesley. Then there are those who simply stay put. Catherine Turpin lies defiantly in the bed she makes for herself while, outside, her failings are broadcast widely, painted on walls, even. When one of Wesley's newest followers, Jo Bean, turns out to be more interested in confronting Catherine than sticking with the behindlings, plots that have been twisted up come undone. With Behindlings, the inimitable Nicola Barker takes a character who is perhaps her most compelling creation to date, and lets him run off with her readers.","544 pages, Hardcover",Fiction,288 follower,43 reviews,37,18 (5%),46 (14%),85 (26%),110 (34%),56 (17%)
Shakespeare the Thinker,A.D. Nuttall,177,ratings28,"April 23, 2007","A. D. Nuttall’s study of Shakespeare’s intellectual preoccupations is a literary tour de force and comes to crown the distinguished career of a Shakespeare scholar. Certain questions engross Shakespeare from his early plays to the late romances: the nature of motive, cause, personal identity and relation, the proper status of imagination, ethics and subjectivity, language and its capacity to occlude and to communicate. Yet Shakespeare’s thought, Nuttall demonstrates, is anything but static. The plays keep returning to, modifying, and complicating his creative preoccupations. Nuttall allows us to hear and appreciate the emergent cathedral choir of play speaking to play. By the later stages of Nuttall’s book this choir is nearly overwhelming in its power and dimensions. The author does not limit discussion to moments of crucial intellection but gives himself ample space in which to get at the distinctive essence of each work.Much recent historicist criticism has tended to “flatten” Shakespeare by confining him to the thought-clichés of his time, and this in its turn has led to an implicitly patronizing view of him as unthinkingly racist, sexist, and so on. Nuttall shows us that, on the contrary, Shakespeare proves again and again to be more intelligent and perceptive than his 21st-century readers. This book challenges us to reconsider the relation of great literature to its social and historical matrix. It is also, perhaps, the best guide to Shakespeare’s plays available in English.","448 pages, Hardcover",Biography,3 follower,28 reviews,22,0 (0%),7 (3%),30 (16%),74 (41%),66 (37%)
