Title,Authors,Avg Ratings,Rating,first_published,Description,Total_Pages,Genre,author_followers,no_of_reviews,no_book_by_author,one_star_ratings,two_star_ratings,three_star_ratings,four_star_ratings,five_star_ratings
The Vanishing Tribe,Alex Archer,255,ratings9,"May 2, 2013","A lost city. A missing tribe. And treasure beyond imagining…When archaeologist Annja Creed attends an auction in Botswana featuring personal effects of an infamous explorer, she purchases a small and seemingly unremarkable piece of art. It's not until the explorer's son makes a desperate attempt to steal it that Annja uncovers the secret of the painting…or rather, the secret map behind the painting.The map points to the Lost City of the San tribe, bushmen who had long ago disappeared off the face of the planet and whose city—so legend has it—was once littered with diamonds. But is the map an epic archaeological discovery or a fantastic work of fiction? Compelled to find out, Annja must face not only the perils of the African bush, but a treacherous son determined to take back his father's greatest legacy…...no matter what the cost.","320 pages, Mass Market Paperback",Fantasy,226 follower,9 reviews,96,2 (<1%),10 (3%),76 (29%),96 (37%),71 (27%)
35 kilos d'espoir,Anna Gavalda,"4,532",ratings345,"January 1, 2002","Grégoire est renvoyé de son collège, et son grand-père, qu'il adore, refuse de le consoler. ""D'accord, j'ai compris. Je ne suis pas complètement crétin, quand même. Je voudrais bien travailler ; mais l'ennui, c'est que je n'y arrive pas. Tout ce qui se passe à l'école, c'est comme si c'était du chinois pour moi. Ça rentre par une oreille et ça ressort de l'autre."" Grégoire déteste l'école si fort, qu'en sixième, il a déjà redoublé deux fois. Le seul endroit qu'il aime, son refuge, c'est le cabanon de son grand-père Léon, avec qui il passe des heures à bricoler. Quand Grégoire est renvoyé du collège, Léon est furieux, cette fois. Il renonce à consoler son petit-fils et lui refuse sa protection. Il est peut-être temps pour Grégoire d'accepter de grandir...","96 pages, Paperback",France,"1,658 follower",345 reviews,62,134 (2%),378 (8%),"1,124 (24%)","1,523 (33%)","1,373 (30%)"
Echo,Jack McDevitt,"3,226",ratings249,"November 1, 2010","A new novel of the fantastic unknown by the national bestselling author of Time Travelers Never Die .Eccentric Sunset Tuttle spent his life searching in vain for forms of alien life. Thirty years after his death, a stone tablet inscribed with cryptic, indecipherable symbols is found in the possession of Tuttle's onetime lover, and antiquities dealer Alex Benedict is anxious to discover what secret the tablet holds. It could be proof that Tuttle had found what he was looking for. To find out, Benedict and his assistant embark on their own voyage of discovery-one that will lead them directly into the path of a very determined assassin who doesn't want those secrets revealed.","371 pages, Hardcover",Science Fiction,"1,276 follower",249 reviews,171,15 (<1%),114 (3%),798 (24%),"1,482 (45%)",817 (25%)
Batwoman: Elegy,Greg Rucka,"13,179",ratings727,"June 14, 2011","A new era begins as Batwoman is unleashed on Gotham City! Marked by the blood-red bat emblem, Kate Kane is a soldier fighting her own private war - one that began years ago and haunts her every waking moment. In this first tale, Batwoman battles a madwoman known only as Alice, inspired by Alice in Wonderland, who sees her life as a fairy tale and everyone around her as expendable extras!  Batwoman must stop Alice from unleashing a toxic death cloud over all of Gotham City -- but Alice has more up her sleeve than just poison, and Batwoman's life will never ever be the same again.  Also, witness the origin of Batwoman in the shocking and tragic story ""Go,"" in which young Kate Kane and her family are kidnapped by terrorists, and Kate's life - and the lives of her family - will never be the same!  Detective Comics #854–860.","192 pages, Hardcover",Comics,"1,845 follower",727 reviews,"1,350",313 (2%),536 (4%),"2,007 (15%)","4,213 (31%)","6,110 (46%)"
The Lost Twin,Sophie Cleverly,"5,287",ratings507,"February 26, 2015","This is the story of how I became my sister…A spine-tingling mystery set in a creepily atmospheric boarding school. Ivy must uncover the secrets behind her twin sister Scarlet’s disappearance before it’s too late.When troublesome Scarlet mysteriously disappears from Rookwood School, terrifying Miss Fox invites her quiet twin sister Ivy to ‘take her place’.Ivy reluctantly agrees in the hopes of finding out what happened to her missing sister. For only at Rookwood will Ivy be able to unlock the secrets of Scarlet’s disappearance, through a scattered trail of diary pages carefully hidden all over the school.Can Ivy solve the mystery before Miss Fox suspects? Or before an even greater danger presents itself?","312 pages, Paperback",Mystery,444 follower,507 reviews,15,63 (1%),115 (2%),652 (12%),"1,543 (29%)","2,914 (55%)"
"Dearly, Beloved",Lia Habel,"2,320",ratings345,"September 25, 2012","Can the living coexist with the living dead?  That’s the question that has New Victorian society fiercely divided ever since the mysterious plague known as “The Laz” hit the city of New London and turned thousands into walking corpses. But while some of these zombies are mindless monsters, hungry for human flesh, others can still think, speak, reason, and control their ravenous new appetites. Just ask Nora Dearly, the young lady of means who was nearly kidnapped by a band of sinister zombies but valiantly rescued by a dashing young man . . . of the dead variety. Nora and her savior, the young zombie soldier Bram Griswold, fell hopelessly in love. But others feel only fear and loathing for the reanimated dead. Now, as tensions grow between pro- and anti-zombie factions, battle lines are being drawn in the streets. And though Bram is no longer in the New Victorian army, he and his ex-commando zombie comrades are determined to help keep the peace. That means taking a dangerous stand between The Changed, a radical group of sentient zombies fighting for survival, and The Murder, a masked squad of urban guerrillas hellbent on destroying the living dead. But zombies aren’t the only ones in danger: Their living allies are also in The Murder’s crosshairs, and for one vengeful zealot, Nora Dearly is the number one target. As paranoia, prejudice, and terrorist attacks threaten to plunge the city into full-scale war, Nora’s scientist father and his team continue their desperate race to unlock the secrets of “The Laz” and find a cure. But their efforts may be doomed when a mysterious zombie appears bearing an entirely new strain of the virus—and the nation of New Victoria braces for a new wave of the apocalypse. Lia Habel’s spellbinding, suspenseful sequel to Dearly, Departed takes her imaginative mash-up of period romance, futuristic thriller, and zombie drama to a whole new level of innovative and irresistible storytelling.","496 pages, Hardcover",Zombies,"1,044 follower",345 reviews,7,65 (2%),205 (8%),531 (22%),754 (32%),765 (32%)
The Last Summer of the World,Emily Mitchell,170,ratings39,"June 18, 2007","In the summer of 1918, with the Germans threatening Paris, Edward Steichen arrives in France to photograph the war for the American army. France is full of poignant memories: his early artistic successes, his marriage, the births of his two daughters. But as he takes up his first command, he learns that his wife Clara has filed suit against her friend, the painter Marion Beckett, charging that she was Steichen's lover in the summer before the war.Flying over the fields of France, Steichen struggles to understand what went wrong in his seemingly idyllic life. His search for answers takes him into his own complex past, toward a painful self-understanding and the discovery of new ways of seeing the world.Told with the elegance of Michael Cunningham's The Hours and the historical rendering of Colm Tóibín's The Master, The Last Summer of the World captures the life and heart of a great photographer and of a world beset by war.","390 pages, Hardcover",Historical Fiction,24 follower,39 reviews,61,4 (2%),8 (4%),35 (20%),74 (43%),49 (28%)
Dirty Love,Andre Dubus III,"3,774",ratings576,"October 7, 2013","In this heartbreakingly beautiful book of disillusioned intimacy and persistent yearning, beloved and celebrated author Andre Dubus III explores the bottomless needs and stubborn weaknesses of people seeking gratification in food and sex, work and love.In these linked novellas in which characters walk out the back door of one story and into the next, love is ""dirty""—tangled up with need, power, boredom, ego, fear, and fantasy. On the Massachusetts coast north of Boston, a controlling manager, Mark, discovers his wife's infidelity after twenty-five years of marriage. An overweight young woman, Marla, gains a romantic partner but loses her innocence. A philandering bartender/aspiring poet, Robert, betrays his pregnant wife. And in the stunning title novella, a teenage girl named Devon, fleeing a dirty image of her posted online, seeks respect in the eyes of her widowed great-uncle Francis and of an Iraq vet she’s met surfing the Web.Slivered by happiness and discontent, aging and death, but also persistent hope and forgiveness, these beautifully wrought narratives express extraordinary tenderness toward human beings, our vulnerable hearts and bodies, our fulfilling and unfulfilling lives alone and with others.","304 pages, Hardcover",Fiction,995 follower,576 reviews,37,131 (3%),425 (11%),"1,216 (32%)","1,326 (35%)",676 (17%)
Callsign: King,Jeremy Robinson,"1,092",ratings61,"June 1, 2011","The fabled Elephant Graveyard has been discovered. It contains enough ivory to make Ethiopia a wealthy nation. But the cave contains more than physical riches-it also holds the means to control the world. Fifteen scientists enter the cave. Only one leaves.Jack Sigler, Callsign: King (field leader of the covert, black ops Chess Team) receives a cryptic text from Sara Fogg, his girlfriend and CDC ""disease detective"". A catastrophic disease has been reported in Ethiopia's Great Rift Valley, but Fogg suspects something more is going on. Her suspicion is confirmed when King's arrival in Africa is met by a high speed assassination attempt.As King fights against two competing, high-tech mercenary forces, each struggling for control of the deadly discovery, Fogg disappears. Working with the surviving member of the science team that made the discovery, King begins a search for Fogg and the source of the potential plague that takes him back to the Great Rift Valley, back to the Elephant Graveyard, and brings him face-to-face with modern man's origins.","156 pages, Kindle Edition",Thriller,"2,324 follower",61 reviews,132,9 (<1%),32 (2%),214 (19%),400 (36%),437 (40%)
Havana Real: One Woman Fights to Tell the Truth about Cuba Today,Yoani Sánchez,386,ratings77,"January 1, 2011","She's been kidnapped and beaten, lives under surveillance, and can only get online—in disguise—at tourist hotspots. She's a blogger, she's a Cuban, and she's a worldwide sensation.Yoani Sánchez is an unusual no street protests, no attacks on big politicos, no calls for revolution. Rather, she produces a simple diary about what it means to live under the Castro the chronic hunger and the difficulty of shopping; the art of repairing ancient appliances; and the struggles of living under a propaganda machine that pushes deep into public and private life.For these simple acts of truth-telling her life is one of constant threat. But she continues on, refusing to be silenced—a living response to all who have ceased to believe in a future for Cuba.","256 pages, Paperback",Nonfiction,10 follower,77 reviews,8,8 (2%),11 (2%),109 (28%),134 (34%),124 (32%)
Hunting the Dark Knight: Twenty-First Century Batman,Will Brooker,73,ratings4,"May 31, 2012","Publishing on the eve of the world premiere of the third of Christopher Nolan’s Batman movies, The Dark Knight Rises in July 2012, Will Brooker’s new book explores Batman’s twenty-first century incarnations. Will Brooker’s in depth investigation into Batman Begins and The Dark Knight uncovers the complex relationship between popular films, audiences, and producers in our age of media  convergence. He addresses a myriad of questions raised by these films: did Batman Begins end when The Dark Knight began? Does its story include Burger King’s “Dark Whopper,” the Gotham Knight DVD, or the “Why So Serious” viral marketing campaign? Is it separate from the parallel narratives of the Arkham Asylum videogame, the monthly comic books, the animated series and the graphic novels? Can the brightly campy incarnations of the Batman ever be fully repressed by The Dark Knight, or are they an intrinsic part of the character? In other words, do all of these various manifestations feed into a single Batman metanarrative?","256 pages, Paperback",Nonfiction,11 follower,4 reviews,28,1 (1%),2 (2%),18 (24%),26 (35%),26 (35%)
"Science Fictions: A Scientific Mystery, a Massive Cover-up and the Dark Legacy of Robert Gallo",John Crewdson,39,ratings12,"January 1, 2002","A Pulitzer Prize-winning journalist describes the competition between scientists--including Robert Gallo of the National Cancer Institute--over credit for the discovery of the HIV virus in a study that offers a revealing look at how big scientific and research laboratories really work. Reprint. 20,000 first printing.","704 pages, Paperback",Science,4 book,12 reviews,4,0 (0%),0 (0%),7 (17%),10 (25%),22 (56%)
How to Spot a Liar: Why People Don't Tell the Truth And How You Can Catch Them,Gregory Hartley,343,ratings47,"September 1, 2005","A decorated military interrogator counsels readers on how to know when someone is lying in personal and professional scenarios, covering such topics as negotiating a worthwhile salary, moving a prospective client toward a desired outcome and ending a relationship.","264 pages, Paperback",Psychology,69 follower,47 reviews,28,14 (4%),50 (14%),104 (30%),83 (24%),92 (26%)
Branded,Keary Taylor,"16,845","ratings1,126","January 3, 2010","Alternate editions for this ISBN can be found here (ebook), here (pbk) and here (ebook)Jessica's had the nightmares for as long as she can remember. Nightmares of being judged for people who have died, of being branded by the angels. Her friends and family think she's a crazy because of it all. Yet she carries the mark of the condemned, seared into the back of her neck, and hides it and herself away from the world.But when two men she can't ignore enter her life everything changes, including the nightmares. The two of them couldn't be more different. She will do anything to be with one of them. Even tell him the truth about angels, why she never sleeps, and the scar on the back of her neck. But one of the two has set events into motion what will pull her toward her own judgment and turn her into the object of her greatest fear.","374 pages, Paperback",Angels,"2,025 follower","1,126 reviews",66,709 (4%),"1,706 (10%)","4,358 (25%)","5,012 (29%)","5,060 (30%)"
Sweet,Emmy Laybourne,"3,346",ratings762,"June 1, 2015","PEOPLE WOULD KILL TO BE THIN.Solu's luxurious celebrity-filled Cruise to Lose is billed as ""the best cruise since the Titanic,"" and if the new diet sweetener works as promised - dropping five percent of a person's body weight in just days - it really could be the answer to the world's obesity problem. But Laurel is starting to regret accepting her friend Viv’s invitation. She's already completely embarrassed herself in front of celebrity host Tom Forelli (otherwise known as the hottest guy ever!) and she's too sick to even try the sweetener. And that's before Viv and all the other passengers start acting really strange.BUT WILL THEY DIE FOR IT, TOO?Tom Forelli knows that he should be grateful for this job and the chance to shed his childhood ""Baby-Tom-Tom"" image. His publicists have even set up a ""romance"" with a sexy reality-TV star. But as things on the ship start to get a bit wild, he finds himself drawn to a different girl. And when his celebrity hosting gig turns into an expose on the shocking side effects of Solu, it's Laurel that he's determined to save.Emmy Laybourne, author of the Monument 14 trilogy, takes readers on a dream vacation that goes first comically, then tragically, then horrifyingly wrong.","272 pages, Hardcover",Young Adult,"1,223 follower",762 reviews,26,139 (4%),379 (11%),925 (27%),"1,057 (31%)",846 (25%)
Wicked Beyond Belief: The Hunt for the Yorkshire Ripper,Michael Bilton,"1,251",ratings134,"February 3, 2003","For over 20 years, the dark secrets of the biggest criminal manhunt in British history have remained a closed book?until now. Wicked Beyond Belief is a powerful indictment of the calamitous investigation that logged two million man-hours of police work. Its revelation of crucial new evidence relating to Sutcliffe's meticulously planned methods caused newspaper headlines, and it argues convincingly that his crimes were far more extensive than admitted. With exclusive access to the detectives involved, pathologist's archives, and top-secret reports, Michael Bilton's expose is as riveting as any thriller.","640 pages, Paperback",True Crime,10 follower,134 reviews,4,9 (<1%),28 (2%),150 (11%),457 (36%),607 (48%)
I'll Be Gone in the Dark: One Woman's Obsessive Search for the Golden State Killer,Michelle McNamara,"235,561","ratings19,644","February 27, 2018","A masterful true crime account of the Golden State Killer—the elusive serial rapist turned murderer who terrorized California for over a decade—from Michelle McNamara, the gifted journalist who died tragically while investigating the case.""You’ll be silent forever, and I’ll be gone in the dark.""For more than ten years, a mysterious and violent predator committed fifty sexual assaults in Northern California before moving south, where he perpetrated ten sadistic murders. Then he disappeared, eluding capture by multiple police forces and some of the best detectives in the area.Three decades later, Michelle McNamara, a true crime journalist who created the popular website TrueCrimeDiary.com, was determined to find the violent psychopath she called ""the Golden State Killer."" Michelle pored over police reports, interviewed victims, and embedded herself in the online communities that were as obsessed with the case as she was.At the time of the crimes, the Golden State Killer was between the ages of eighteen and thirty, Caucasian, and athletic—capable of vaulting tall fences. He always wore a mask. After choosing a victim—he favored suburban couples—he often entered their home when no one was there, studying family pictures, mastering the layout. He attacked while they slept, using a flashlight to awaken and blind them. Though they could not recognize him, his victims recalled his voice: a guttural whisper through clenched teeth, abrupt and threatening.I’ll Be Gone in the Dark—the masterpiece McNamara was writing at the time of her sudden death—offers an atmospheric snapshot of a moment in American history and a chilling account of a criminal mastermind and the wreckage he left behind. It is also a portrait of a woman’s obsession and her unflagging pursuit of the truth. Framed by an introduction by Gillian Flynn and an afterword by her husband, Patton Oswalt, the book was completed by Michelle’s lead researcher and a close colleague. Utterly original and compelling, it is destined to become a true crime classic—and may at last unmask the Golden State Killer.","352 pages, ebook",Nonfiction,816 follower,"19,644 reviews",2,"2,602 (1%)","7,772 (3%)","38,626 (16%)","95,469 (40%)","91,092 (38%)"
Future Days: Krautrock and the Building of Modern Germany,David  Stubbs,601,ratings65,"August 5, 2014","The definitive guide to Kosmische music, from one of Britain's most acclaimed writers.West Germany after the Second World War was a country in shock: estranged from its recent history, and adrift from the rest of Europe. But this orphaned landscape proved fertile ground for a generation of musicians who, from the 1960s onwards, would develop the experimental and various sounds that became known as Krautrock.Eschewing the Anglo-American jazz/blues tradition, they took their inspiration from elsewhere: the mysticism of the East; the fractured classicism of Stockhausen; the pneumatic repetition of industry, and the dense forests of the Rhineland; the endless winding of Autobahns.Faust, Neu!, Cluster, Ash Ra Tempel, Amon Dl II, Can, Kraftwerk - the influence of these groups' ruminative, expansive compositions upon Western popular music is incalculable. They were key to the development of movements ranging from postpunk to electronica and ambient, and have directly inspired artists as diverse as David Bowie, Talking Heads and Primal Scream.Future Days is an in-depth study of this meditative, sometimes abstract, often very beautiful music and the groups that made it, throwing light too on the social and political context that informed them. It's an indispensable book for those wanting to understand how much of today's music came about, and to discover a wealth of highly influential and pioneering artists.","495 pages, Paperback",Music,35 follower,65 reviews,16,1 (<1%),12 (1%),133 (22%),275 (45%),180 (29%)
Cross Justice,James Patterson,"30,025","ratings2,177","November 23, 2015","NOTE: The book is Large Print Hard Cover.The toughest cases hit closest to home.Alex Cross left his hometown, and some awful family tragedies, for a better life with Nana Mama in Washington, DC. He hasn't looked back.Now his cousin Stefan has been accused of a horrible, unthinkable murder, and Cross drives south with Bree, Nana Mama, Jannie, and Ali to Starksville, North Carolina, for the first time in thirty-five years. Back home, he discovers a once proud community down on its luck, and local residents who don't welcome him with open arms. As Cross steps into his family home, the horrors of his childhood flood back--and he learns that they're not really over. He brings all his skill to finding out the truth about his cousin's case. But truth is hard to come by in a town where no one feels safe to speak.Chasing his ghosts takes Cross all the way down to the sugarcane fields of Florida, where he gets pulled into a case that has local cops needing his kind of expertise: a string of socialite murders with ever more grisly settings. He's chasing too many loose ends--a brutal killer, the truth about his own past, and justice for his cousin--and any one of the answers might be fatal.In Cross Justice , Alex Cross confronts the deadliest--and most personal--case of his career. It's a propulsive, edge-of-your-seat thrill ride that proves you can go home again--but it just might kill you.","528 pages, Hardcover",Mystery,345k follower,"2,177 reviews","1,573",324 (1%),750 (2%),"3,937 (13%)","10,906 (36%)","14,108 (46%)"
Sharpe's Havoc,Bernard Cornwell,"10,964",ratings258,"April 1, 2003","A small British army is stranded when the French invade northern Portugal and Lieutenant Richard Sharpe meets the future Duke of Wellington.Sharpe is stranded behind enemy lines, but he has Patrick Harper, his riflemen and he has the assistance of a young, idealistic Portuguese officer.When he is joined by the future Duke of Wellington they immediately mount a counter-attack and Sharpe, having been the hunted, becomes the hunter once more. Amidst the wreckage of a defeated army, in the storm lashed hills of the Portuguese frontier, Sharpe takes his revenge.Soldier, hero, rogue – Sharpe is the man you always want on your side. Born in poverty, he joined the army to escape jail and climbed the ranks by sheer brutal courage. He knows no other family than the regiment of the 95th Rifles whose green jacket he proudly wears.","352 pages, Paperback",Historical Fiction,17.2k follower,258 reviews,429,31 (<1%),174 (1%),"1,902 (17%)","4,911 (44%)","3,946 (35%)"
The Road Back to You: An Enneagram Journey to Self-Discovery,Ian Morgan Cron,"50,754","ratings3,935","October 4, 2016","Ignorance is bliss except in self-awareness...What you don't know about yourself can hurt you and your relationships―and even keep you in the shallows with God. Do you want help figuring out who you are and why you're stuck in the same ruts? The Enneagram is an ancient personality typing system with an uncanny accuracy in describing how human beings are wired, both positively and negatively. In The Road Back to You Ian Morgan Cron and Suzanne Stabile forge a unique approach―a practical, comprehensive way of accessing Enneagram wisdom and exploring its connections with Christian spirituality for a deeper knowledge of ourselves, compassion for others, and love for God. Witty and filled with stories, this book allows you to peek inside each of the nine Enneagram types, keeping you turning the pages long after you have read the chapter about your own number. Not only will you learn more about yourself, but you will also start to see the world through other people's eyes, understanding how and why people think, feel, and act the way they do. Beginning with changes you can start making today, the wisdom of the Enneagram can help take you further along into who you really are―leading you into places of spiritual discovery you would never have found on your own, and paving the way to the wiser, more compassionate person you want to become.","238 pages, Hardcover",Nonfiction,508 follower,"3,935 reviews",15,787 (1%),"1,411 (2%)","6,759 (13%)","19,284 (37%)","22,513 (44%)"
