Title,Authors,Avg Ratings,Rating,first_published,Description,Total_Pages,Genre,author_followers,no_of_reviews,no_book_by_author,one_star_ratings,two_star_ratings,three_star_ratings,four_star_ratings,five_star_ratings
Bloodlines,Richelle Mead,"185,132","ratings8,917","First published August 23, 2011","I wasn't free of my past, not yet.Sydney's blood is special. That's because she's an alchemist - one of a group of humans who dabble in magic and serve to bridge the worlds of humans and vampires. They protect vampire secrets - and human lives. But the last encounter Sydney had with vampires got her in deep trouble with the other alchemists. And now with her allegiances in question, her future is on the line.When Sydney is torn from her bed in the middle of the night, at first she thinks she's still being punished for her complicated alliance with dhampir Rose Hathaway. But what unfolds is far worse. Jill Dragomir - the sister of Moroi Queen Lissa Dragomir - is in mortal danger, and the Moroi must send her into hiding. To avoid a civil war, Sydney is called upon to act as Jill's guardian and protector, posing as her roommate in the unlikeliest of places: a human boarding school in Palm Springs, California. The last thing Sydney wants is to be accused of sympathizing with vampires. And now she has to live with one.The Moroi court believe Jill and Sydney will be safe at Amberwood Prep, but threats, distractions, and forbidden romance lurk both outside - and within - the school grounds. Now that they're in hiding, the drama is only just beginning.","432 pages, Hardcover",Young Adult,68.1k followers,"8,917 reviews",102 books68.1k followers,"4,014 (2%)","6,558 (3%)","27,389 (14%)","57,635 (31%)","89,536 (48%)"
Sapiens: A Brief History of Humankind,Yuval Noah Harari,"1,011,898","ratings52,906","First published January 1, 2011","From a renowned historian comes a groundbreaking narrative of humanity’s creation and evolution—a #1 international bestseller—that explores the ways in which biology and history have defined us and enhanced our understanding of what it means to be “human.” One hundred thousand years ago, at least six different species of humans inhabited Earth. Yet today there is only one—homo sapiens. What happened to the others? And what may happen to us? Most books about the history of humanity pursue either a historical or a biological approach, but Dr. Yuval Noah Harari breaks the mold with this highly original book that begins about 70,000 years ago with the appearance of modern cognition. From examining the role evolving humans have played in the global ecosystem to charting the rise of empires, Sapiens integrates history and science to reconsider accepted narratives, connect past developments with contemporary concerns, and examine specific events within the context of larger ideas. Dr. Harari also compels us to look ahead, because over the last few decades humans have begun to bend laws of natural selection that have governed life for the past four billion years. We are acquiring the ability to design not only the world around us, but also ourselves. Where is this leading us, and what do we want to become? Featuring 27 photographs, 6 maps, and 25 illustrations/diagrams, this provocative and insightful work is sure to spark debate and is essential reading for aficionados of Jared Diamond, James Gleick, Matt Ridley, Robert Wright, and Sharon Moalem.","512 pages, Paperback",Nonfiction,33.9k followers,"52,906 reviews",60 books33.9k followers,"15,757 (1%)","26,073 (2%)","102,291 (10%)","296,738 (29%)","571,039 (56%)"
Between the World and Me,Ta-Nehisi Coates,"330,573","ratings29,511","First published July 14, 2015","“This is your country, this is your world, this is your body, and you must find some way to live within the all of it.” In a profound work that pivots from the biggest questions about American history and ideals to the most intimate concerns of a father for his son, Ta-Nehisi Coates offers a powerful new framework for understanding our nation’s history and current crisis. Americans have built an empire on the idea of “race,” a falsehood that damages us all but falls most heavily on the bodies of black women and men—bodies exploited through slavery and segregation, and, today, threatened, locked up, and murdered out of all proportion. What is it like to inhabit a black body and find a way to live within it? And how can we all honestly reckon with this fraught history and free ourselves from its burden?  Between the World and Me is Ta-Nehisi Coates’s attempt to answer these questions in a letter to his adolescent son. Coates shares with his son—and readers—the story of his awakening to the truth about his place in the world through a series of revelatory experiences, from Howard University to Civil War battlefields, from the South Side of Chicago to Paris, from his childhood home to the living rooms of mothers whose children’s lives were taken as American plunder. Beautifully woven from personal narrative, reimagined history, and fresh, emotionally charged reportage, Between the World and Me clearly illuminates the past, bracingly confronts our present, and offers a transcendent vision for a way forward.","152 pages, Hardcover",Nonfiction,14k followers,"29,511 reviews",270 books14k followers,"4,413 (1%)","7,639 (2%)","29,035 (8%)","98,139 (29%)","191,347 (57%)"
Dead and Gone,Charlaine Harris,"187,916","ratings4,800","First published May 5, 2009","The vamps have been out for years, and now the weres and shifters have decided to follow the lead of the undead and reveal their existence to the ordinary world. Sookie Stackhouse already knows about them, of course - her brother turns into a panther at the full moon, she's friend to the local were pack, and Sam, her boss at Merlotte's bar, is a shapeshifter.The great revelation goes well at first - then the horribly mutilated body of a were-panther is found in the parking lot of Merlotte's, and Sookie agrees to use her telepathic talent to track down the murderer. But there is a far greater danger than this killer threatening Bon Temps: a race of unhuman beings, older, more powerful, and far more secretive than the vampires or the werewolves, is preparing for war. And Sookie is an all-too-human pawn in their ages-old battle...","320 pages, Hardcover",Fantasy,35.8k followers,"4,800 reviews",278 books35.8k followers,"1,805 (<1%)","7,657 (4%)","41,996 (22%)","70,329 (37%)","66,129 (35%)"
Torment,Lauren Kate,"233,913","ratings8,520","First published September 28, 2010","Hell on earth.That’s what it’s like for Luce to be apart from her fallen angel boyfriend, Daniel. It took them an eternity to find one another, but now he has told her he must go away. Just long enough to hunt down the Outcasts—immortals who want to kill Luce. Daniel hides Luce at Shoreline, a school on the rocky California coast with unusually gifted students: Nephilim, the offspring of fallen angels and humans.At Shoreline, Luce learns what the Shadows are, and how she can use them as windows to her previous lives. Yet the more Luce learns, the more she suspects that Daniel hasn’t told her everything. He’s hiding something—something dangerous. What if Daniel’s version of the past isn’t actually true? What if Luce is really meant to be with someone else?","452 pages, Hardcover",Young Adult,25.9k followers,"8,520 reviews",45 books25.9k followers,"7,710 (3%)","19,764 (8%)","55,697 (23%)","68,454 (29%)","82,288 (35%)"
The Oldest Dance,Misba,"8,415","ratings1,174","First published September 19, 2021","As one of the war heroes searches the oldest language in the ancient art of dance, he might discover the Intuitionist's power of finding answers to any questions.Missing memories might pile up if you encounter the Mesmerizer who stopped World War III with a four-minute speech, especially if he asks you to forget. Even if it’s the one and only purpose you have, you will forget it. For he has the voice. Kusha forgot what she found on the night of the High Auction.But the laws of the universe are painfully fair sometimes. Purpose always calls you, either through your dreams, or daydreams, even in nightmares … perhaps, through intuition? So the Intuitionist, Kusha, runs through the questions the universe throws at her. Each question leads her to her purpose. Her life as an unevolved, Ungraded citizen seems rich compared to those of her friends outside the walls who aren't even citizens. She wants to help her friends, but her questions, her past, her missing memories lead her to myths she never should tangle with. Most importantly, she never should encounter the war heroes who seek the Source among the devil’s scriptures and an old form of dance. Not when the dance calls her in dreams after what happened on the night of the auction.Welcome to Episode 2 of Wisdom Revolution.",Hardcover,Fantasy,"1,466 followers","1,174 reviews","7 books1,466 followers",13 (<1%),35 (<1%),316 (3%),"2,793 (33%)","5,258 (62%)"
Betrayed,P.C. Cast,"266,055","ratings6,166","First published October 2, 2007","Also see: Alternate Cover Editions for this ISBN [ACE]  
ACE #1
Zoey, High Priestess in training, has managed to settle in at the House of Night and come to terms with the vast powers the Vampyre Goddess Nyx has given her. Just as she finally feels she belongs, the unthinkable happens: human teenagers are being killed, and all evidence points to the House of Night. While danger stalks the humans from Zoey’s old life, she begins to realize that the very powers that make her so unique might also threaten those she loves.","310 pages, Paperback",Young Adult,27.2k followers,"6,166 reviews",151 books27.2k followers,"8,257 (3%)","19,435 (7%)","58,892 (22%)","77,779 (29%)","101,692 (38%)"
Tiger's Voyage,Colleen Houck,"36,629","ratings2,343","First published November 1, 2011","With the head-to-head battle against the villainous Lokesh behind her, Kelsey confronts a new heartbreak: in the wake of his traumatic experience, her beloved Ren no longer remembers who she is. As the trio continues their quest by challenging five cunning and duplicitous dragons, Ren and Kishan once more vie for her affections--leaving Kelsey more confused than ever.","560 pages, Paperback",Fantasy,"9,072 followers","2,343 reviews","20 books9,072 followers",804 (2%),"1,502 (4%)","4,829 (13%)","9,387 (25%)","20,107 (54%)"
Why She Left Us,David Dennis,"2,165",ratings40,"First published November 28, 2012","It was the summer of 1985, and she was young and inexperienced, but longing to love and to be loved in return, when he entered her life.At the same time, while she was desperately seeking the love and approval of a mother who never wanted her in the first place, events totally beyond her control claimed her as their victim, leaving those she left behind unable to cope with the enormity of her absence. ""WHY SHE LEFT US” is written as a series of diary entries, the events seen through the eyes of several different people. But at its center is a love story chronicling a romance that transforms the lives of two people who, for too brief a period of time, experienced the greatest happiness they had ever known.","432 pages, Paperback",Suspense,7 followers,40 reviews,28 books7 followers,250 (11%),261 (12%),412 (19%),585 (27%),657 (30%)
"Fables, Vol. 1: Legends in Exile",Bill Willingham,"139,973","ratings3,821","First published January 1, 2002","When a savage creature known only as the Adversary conquered the fabled lands of legends and fairy tales, all of the infamous inhabitants of folklore were forced into exile. Disguised among the normal citizens of modern-day New York, these magical characters have created their own peaceful and secret society within an exclusive luxury apartment building called Fabletown. But when Snow White's party-girl sister, Rose Red, is apparently murdered, it is up to Fabletown's sheriff, a reformed and pardoned Big Bad Wolf (Bigby Wolf), to determine if the killer is Bluebeard, Rose's ex-lover and notorious wife killer, or Jack, her current live-in boyfriend and former beanstalk-climber.Collecting: Fables 1-5","128 pages, Paperback",Graphic Novels,"2,772 followers","3,821 reviews","1,058 books2,772 followers","6,643 (4%)","7,779 (5%)","24,362 (17%)","44,111 (31%)","57,078 (40%)"
The Cellist of Sarajevo,Steven Galloway,"40,790","ratings4,497","First published April 8, 2008","This brilliant novel with universal resonance, set during the 1990s Siege of Sarajevo, tells the story of three people trying to survive in a city rife with the extreme fear of desperate times, and of the sorrowing cellist who plays undaunted in their midst.One day a shell lands in a bread line and kills twenty-two people as the cellist watches from a window in his flat. He vows to sit in the hollow where the mortar fell and play Albinoni’s Adagio once a day for each of the twenty-two victims. The Adagio had been re-created from a fragment after the only extant score was firebombed in the Dresden Music Library, but the fact that it had been rebuilt by a different composer into something new and worthwhile gives the cellist hope. Meanwhile, Kenan steels himself for his weekly walk through the dangerous streets to collect water for his family on the other side of town, and Dragan, a man Kenan doesn’t know, tries to make his way towards the source of the free meal he knows is waiting. Both men are almost paralyzed with fear, uncertain when the next shot will land on the bridges or streets they must cross, unwilling to talk to their old friends of what life was once like before divisions were unleashed on their city. Then there is “Arrow,” the pseudonymous name of a gifted female sniper, who is asked to protect the cellist from a hidden shooter who is out to kill him as he plays his memorial to the victims. In this beautiful and unforgettable novel, Steven Galloway has taken an extraordinary, imaginative leap to create a story that speaks powerfully to the dignity and generosity of the human spirit under extraordinary duress.","235 pages, Hardcover",Historical Fiction,234 followers,"4,497 reviews",18 books234 followers,561 (1%),"1,713 (4%)","8,024 (19%)","17,345 (42%)","13,147 (32%)"
The Windup Girl,Paolo Bacigalupi,"74,587","ratings7,027","First published September 1, 2009","Anderson Lake is a company man, AgriGen's Calorie Man in Thailand. Under cover as a factory manager, Anderson combs Bangkok's street markets in search of foodstuffs thought to be extinct, hoping to reap the bounty of history's lost calories. There, he encounters Emiko... Emiko is the Windup Girl, a strange and beautiful creature. One of the New People, Emiko is not human; instead, she is an engineered being, creche-grown and programmed to satisfy the decadent whims of a Kyoto businessman, but now abandoned to the streets of Bangkok. Regarded as soulless beings by some, devils by others, New People are slaves, soldiers, and toys of the rich in a chilling near future in which calorie companies rule the world, the oil age has passed, and the side effects of bio-engineered plagues run rampant across the globe. What Happens when calories become currency? What happens when bio-terrorism becomes a tool for corporate profits, when said bio-terrorism's genetic drift forces mankind to the cusp of post-human evolution? Award-winning author Paolo Bacigalupi delivers one of the most highly acclaimed science fiction novels of the twenty-first century.","359 pages, Hardcover",Science Fiction,"4,595 followers","7,027 reviews","131 books4,595 followers","2,906 (3%)","6,270 (8%)","17,250 (23%)","28,363 (38%)","19,798 (26%)"
"Mountains Beyond Mountains: The Quest of Dr. Paul Farmer, a Man Who Would Cure the World",Tracy Kidder,"84,207","ratings5,541","First published January 1, 2003","At the center of Mountains Beyond Mountains stands Paul Farmer. Doctor, Harvard professor, renowned infectious-disease specialist, anthropologist, the recipient of a MacArthur ""genius"" grant, world-class Robin Hood, Farmer was brought up in a bus and on a boat, and in medical school found his life’s calling: to diagnose and cure infectious diseases and to bring the lifesaving tools of modern medicine to those who need them most.Mountains Beyond Mountains takes us from Harvard to Haiti, Peru, Cuba, and Russia as Farmer changes minds and practices through his dedication to the philosophy that ""the only real nation is humanity""—a philosophy that is embodied in the small public charity he founded, Partners in Health. He enlists the help of the Gates Foundation, George Soros, the U.N.’s World Health Organization, and others in his quest to cure the world. At the heart of this book is the example of a life based on hope, and on an understanding of the truth of the Haitian proverb ""Beyond mountains there are mountains"": as you solve one problem, another problem presents itself, and so you go on and try to solve that one too.","333 pages, Paperback",Nonfiction,"1,177 followers","5,541 reviews","40 books1,177 followers","1,533 (1%)","3,149 (3%)","11,964 (14%)","28,435 (33%)","39,126 (46%)"
"I'd Tell You I Love You, But Then I'd Have to Kill You",Ally Carter,"188,585","ratings8,391","First published April 25, 2006","Cammie Morgan is a student at the Gallagher Academy for Exceptional Young Women, a fairly typical all-girls school—that is, if every school taught advanced martial arts in PE and the latest in chemical warfare in science, and students received extra credit for breaking CIA codes in computer class. The Gallagher Academy might claim to be a school for geniuses, but it's really a school for spies. Even though Cammie is fluent in fourteen languages and capable of killing a man in seven different ways, she has no idea what to do when she meets an ordinary boy who thinks she's an ordinary girl. Sure, she can tap his phone, hack into his computer, or track him through town with the skill of a real ""pavement artist""—but can she maneuver a relationship with someone who can never know the truth about her? Cammie Morgan may be an elite spy-in-training, but in her sophomore year, she's on her most dangerous mission—falling in love.","284 pages, Hardcover",Young Adult,16k followers,"8,391 reviews",45 books16k followers,"7,286 (3%)","15,179 (8%)","44,316 (23%)","55,931 (29%)","65,873 (34%)"
We Were Liars,E. Lockhart,"1,131,866","ratings109,199","First published May 13, 2014","A beautiful and distinguished family.A private island.A brilliant, damaged girl; a passionate, political boy.A group of four friends—the Liars—whose friendship turns destructive.A revolution. An accident. A secret.Lies upon lies.True love.The truth. We Were Liars is a modern, sophisticated suspense novel from New York Times bestselling author, National Book Award finalist, and Printz Award honoree E. Lockhart. Read it.And if anyone asks you how it ends, just LIE.","242 pages, Kindle Edition",Young Adult,14.9k followers,"109,199 reviews",27 books14.9k followers,"47,803 (4%)","119,054 (10%)","294,984 (26%)","360,715 (31%)","309,310 (27%)"
Six of Crows,Leigh Bardugo,"929,762","ratings100,421","First published September 29, 2015",Alternate cover edition of ISBN 9781627792127 which can be found here:https://www.goodreads.com/book/show/7...Ketterdam: a bustling hub of international trade where anything can be had for the right price—and no one knows that better than criminal prodigy Kaz Brekker. Kaz is offered a chance at a deadly heist that could make him rich beyond his wildest dreams. But he can’t pull it off alone. . . .A convict with a thirst for revengeA sharpshooter who can’t walk away from a wagerA runaway with a privileged pastA spy known as the WraithA Heartrender using her magic to survive the slumsA thief with a gift for unlikely escapesSix dangerous outcasts. One impossible heist. Kaz’s crew is the only thing that might stand between the world and destruction—if they don’t kill each other first.,"465 pages, Hardcover",Fantasy,163k followers,"100,421 reviews",71 books163k followers,"6,973 (<1%)","15,193 (1%)","71,317 (7%)","259,306 (27%)","576,973 (62%)"
Fun Home: A Family Tragicomic,Alison Bechdel,"179,232","ratings12,778","First published June 8, 2006","In this graphic memoir, Alison Bechdel charts her fraught relationship with her late father.Distant and exacting, Bruce Bechdel was an English teacher and director of the town funeral home, which Alison and her family referred to as the Fun Home. It was not until college that Alison, who had recently come out as a lesbian, discovered that her father was also gay. A few weeks after this revelation, he was dead, leaving a legacy of mystery for his daughter to resolve.","232 pages, Paperback",Graphic Novels,"3,823 followers","12,778 reviews","53 books3,823 followers","5,165 (2%)","8,461 (4%)","28,469 (15%)","61,338 (34%)","75,799 (42%)"
Drop City,T. Coraghessan Boyle,"14,666","ratings1,090","First published February 24, 2003","It is 1970, and a down-at-the-heels California commune devoted to peace, free love, and the simple life has decided to relocate to the last frontier—the unforgiving landscape of interior Alaska—in the ultimate expression of going back to the land. Armed with the spirit of adventure and naïve optimism, the inhabitants of “Drop City” arrive in the wilderness of Alaska only to find their utopia already populated by other young homesteaders. When the two communities collide, unexpected friendships and dangerous enmities are born as everyone struggles with the bare essentials of life: love, nourishment, and a roof over one’s head. Rich, allusive, and unsentimental, T.C. Boyle’s ninth novel is a tour de force infused with the lyricism and take-no-prisoners storytelling for which he is justly famous.","497 pages, Paperback",Fiction,"2,772 followers","1,090 reviews","153 books2,772 followers",402 (2%),970 (6%),"3,424 (23%)","5,895 (40%)","3,975 (27%)"
The Underground Railroad,Colson Whitehead,"398,045","ratings31,636","First published August 2, 2016","Cora is a slave on a cotton plantation in Georgia. Life is hell for all the slaves, but especially bad for Cora; an outcast even among her fellow Africans, she is coming into womanhood--where even greater pain awaits. When Caesar, a recent arrival from Virginia, tells her about the Underground Railroad, they decide to take a terrifying risk and escape. Matters do not go as planned--Cora kills a young white boy who tries to capture her. Though they manage to find a station and head north, they are being hunted.In Whitehead's ingenious conception, the Underground Railroad is no mere metaphor--engineers and conductors operate a secret network of tracks and tunnels beneath the Southern soil. Cora and Caesar's first stop is South Carolina, in a city that initially seems like a haven. But the city's placid surface masks an insidious scheme designed for its black denizens. And even worse: Ridgeway, the relentless slave catcher, is close on their heels. Forced to flee again, Cora embarks on a harrowing flight, state by state, seeking true freedom.Like the protagonist of Gulliver's Travels, Cora encounters different worlds at each stage of her journey--hers is an odyssey through time as well as space. As Whitehead brilliantly re-creates the unique terrors for black people in the pre-Civil War era, his narrative seamlessly weaves the saga of America from the brutal importation of Africans to the unfulfilled promises of the present day. The Underground Railroad is at once a kinetic adventure tale of one woman's ferocious will to escape the horrors of bondage and a shattering, powerful meditation on the history we all share.","320 pages, Hardcover",Historical Fiction,16.6k followers,"31,636 reviews",34 books16.6k followers,"6,096 (1%)","16,479 (4%)","69,864 (17%)","162,013 (40%)","143,593 (36%)"
The High Auction,Misba,"9,502","ratings1,238","First published July 21, 2021","In the near future, a machinist, a monk, and a mesmerizer are looking for the Source of the universe, but among the ancient scriptures, they only find the devil …Few humans in the future find the secrets of what words and sounds can do, for the Apocalypse and war led them to evolve in mind and physique. Two of them end World War III with just a speech. Some say they did a mass-hypnosis. Others say it was their voice and will. Fifty years later in South-Asia, KUSHA, a twenty-three-year-old machine-geek with social awkwardness and amnesia, tries to get the Devil’s Book with secrets of voice. In a society that worships the evolved High-Grades with voice, how you speak and which words you talk with is important. As someone who finds all solutions in books, Kusha thinks the secrets in the three-foot-long, ancient book will teach her to speak mesmerizingly. She believes it will help her evolve. So, she decides to attend the auction where the book will be sold. But there's a problem. Her idol of voice and everyone's beloved war heroes, YUAN and RUEM, are also after it for power.","180 pages, Hardcover",Fantasy,"1,466 followers","1,238 reviews","7 books1,466 followers",26 (<1%),45 (<1%),335 (3%),"2,901 (30%)","6,195 (65%)"
