Title,Authors,Avg Ratings,Rating,first_published,Description,Total_Pages,Genre,author_followers,no_of_reviews,no_book_by_author,one_star_ratings,two_star_ratings,three_star_ratings,four_star_ratings,five_star_ratings
Burn,Patrick Ness,"9,377","ratings1,892","June 2, 2020","On a cold Sunday evening in early 1957, Sarah Dewhurst waited with her father in the parking lot of the Chevron gas station for the dragon he’d hired to help on the farm…Sarah Dewhurst and her father, outcasts in their little town of Frome, Washington, are forced to hire a dragon to work their farm, something only the poorest of the poor ever have to resort to.The dragon, Kazimir, has more to him than meets the eye, though. Sarah can’t help but be curious about him, an animal who supposedly doesn’t have a soul, but who is seemingly intent on keeping her safe.Because the dragon knows something she doesn’t. He has arrived at the farm with a prophecy on his mind. A prophecy that involves a deadly assassin, a cult of dragon worshippers, two FBI agents in hot pursuit—and somehow, Sarah Dewhurst herself.","371 pages, Hardcover",Fantasy,18.3k follower,"1,892 reviews",42,158 (1%),626 (6%),"2,611 (27%)","4,000 (42%)","1,982 (21%)"
Black Cloud Rising,David Wright Faladé,"1,053",ratings194,"February 8, 2022","Already excerpted in the New Yorker , Black Cloud Rising is a compelling and important historical novel that takes us back to an extraordinary moment when enslaved men and women were shedding their bonds and embracing freedom By fall of 1863, Union forces had taken control of Tidewater Virginia, and established a toehold in eastern North Carolina, including along the Outer Banks. Thousands of freed slaves and runaways flooded the Union lines, but Confederate irregulars still roamed the region. In December, the newly formed African Brigade, a unit of these former slaves led by General Edward Augustus Wild—a one-armed, impassioned Abolitionist—set out from Portsmouth to hunt down the rebel guerillas and extinguish the threat.From this little-known historical episode comes Black Cloud Rising , a dramatic, moving account of these soldiers—men who only weeks earlier had been enslaved, but were now Union infantrymen setting out to fight their former owners. At the heart of the narrative is Sergeant Richard Etheridge, the son of a slave and her master, raised with some privileges but constantly reminded of his place. Deeply conflicted about his past, Richard is eager to show himself to be a credit to his race. As the African Brigade conducts raids through the areas occupied by the Confederate Partisan Rangers, he and his comrades recognize that they are fighting for more than territory. Wild’s mission is to prove that his troops can be trusted as soldiers in combat. And because many of the men have fled from the very plantations in their path, each raid is also an opportunity to free loved ones left behind. For Richard, this means the possibility of reuniting with Fanny, the woman he hopes to marry one day.With powerful depictions of the bonds formed between fighting men and heartrending scenes of sacrifice and courage, Black Cloud Rising offers a compelling and nuanced portrait of enslaved men and women crossing the threshold to freedom.","293 pages, Kindle Edition",Historical Fiction,1 book59 follower,194 reviews,1,10 (<1%),73 (6%),294 (27%),435 (41%),241 (22%)
The Real Minerva,Mary Sharratt,651,ratings84,"January 1, 2004","Minerva, Minnesota, in 1923 is the picture of Willa Cather-like the Northern Pacific Railway runs through a town center dominated by church steeples and the Hamilton Creamery and Pop Factory. But Minerva is also a small town of limited opportunity, a place where the status quo is firmly entrenched and rigidly enforced. Against this tableau of midwestern placidity and calm, three Minerva women assert their dignity and independence against all odds.The troubled relationship between young Penny and her mother, Barbara, is getting worse. Disturbed by her mother's affair with the man they clean house for, Penny answers an ad to work for Cora Egan, a Chicago society woman who has fled a bad marriage and intends to raise her child alone on her grandfather's farm. Cora's situation shocks the town, but over time her presence opens a door in Penny's and Barbara's lives. Through these women, Mary Sharratt considers what it takes to reinvent the self, to claim one's true identity.Mary Sharratt's first novel, Summit Avenue, was hailed as a ""remarkablel debut . . . [that] weaves dark, evocative fairy tales and passionate longings into an incandescent coming-of-age story"" (Publishers Weekly, starred review). Readers interested in feminine archetypes and women in myth will be similarly drawn to Sharratt's newest novel. Exquisite historical detail and emotional resonance infuseThe Real Minerva,an old-fashioned story with a modern spirit.","259 pages, Paperback",Historical Fiction,472 follower,84 reviews,13,7 (1%),8 (1%),126 (19%),312 (47%),198 (30%)
Knees Up Mother Earth,Robert Rankin,842,ratings35,"January 1, 2004","Developers are planning to destroy Brentford's beloved football grounds. Something must be done, and the lads of The Flying Swan, Brentford’s celebrated drinking house, take up the challenge. Norman has recently discovered a Victorian computer that holds the secrets of the super-technology of a bygone age, and Archroy, Brentford’s lone explorer, has just returned from his seventh voyage, bringing with him the fabled Golden Fleece. Surely, with these stalwarts working for the cause, the field is as good as saved. But this is Brentford, and the ancient forces of evil—Old Testament horrors, beasties from the bottomless pit, that sort of evil—are stirring.","384 pages, Hardcover",Fantasy,828 follower,35 reviews,84,13 (1%),32 (3%),203 (24%),368 (43%),226 (26%)
"Detransition, Baby",Torrey Peters,"76,233","ratings9,421","January 12, 2021","A whipsmart debut about three very different women--transgender and cisgender--whose lives collide after an unexpected pregnancy forces them to confront their deepest desires around gender, motherhood, and sex
Reese almost had it all: a loving relationship with Amy, an apartment in New York City, a job she didn't hate. She had scraped together what previous generations of trans women could only dream of: a life of mundane, bourgeois comforts. The only thing missing was a child. But then her girlfriend, Amy, detransitioned and became Ames, and everything fell apart. Now Reese is caught in a self-destructive pattern: avoiding her loneliness by sleeping with married men. Ames isn't happy either. He thought detransitioning to live as a man would make life easier, but that decision cost him his relationship with Reese--and losing her meant losing his only family. Even though their romance is over, he longs to find a way back to her. When Ames's boss and lover, Katrina, reveals that she's pregnant with his baby--and that she's not sure whether she wants to keep it--Ames wonders if this is the chance he's been waiting for. Could the three of them form some kind of unconventional family--and raise the baby together? This provocative debut is about what happens at the emotional, messy, vulnerable corners of womanhood that platitudes and good intentions can't reach. Torrey Peters brilliantly and fearlessly navigates the most dangerous taboos around gender, sex, and relationships, gifting us a thrillingly original, witty, and deeply moving novel.","352 pages, Kindle Edition",Fiction,"1,333 follower","9,421 reviews",9,985 (1%),"3,685 (4%)","15,738 (20%)","33,484 (43%)","22,341 (29%)"
Marguerite's Fountain,Rachel Elliot,28,ratings2,"January 1, 2007","Marguerite is sparkling and beautiful as she dances around her fountain, but Benjamin is too shy to dance with her. Only when Randolph the Villain gets in the way does Benjamin realise how brave he really can be.","32 pages, Paperback",Picture Books,7 follower,2 reviews,201,1 (3%),1 (3%),9 (32%),12 (42%),5 (17%)
Did Ye Hear Mammy Died?,Séamas O'Reilly,"6,423",ratings772,"July 22, 2021","A heart-warming and hilarious family memoir of growing up as one of eleven children raised by a single dad in Northern Ireland at the end of the TroublesAfter the untimely death of his mother, five-year-old Séamas O'Reilly and his ten siblings were left to the care of their loving but understandably beleaguered father. In this thoroughly delightful memoir, we follow O'Reilly and the rest of his rowdy clan as they learn to cook, clean, do the laundry, and struggle (often hilariously) to keep the household running smoothly and turn into adults in the absence of the woman who had held them together. Along the way, we see O'Reilly through various adventures: There's the time the family's windows were blown out by an IRA bomb; the time a priest blessed their thirteen-seater caravan before they took off for a holiday on which they narrowly escaped death; the time O'Reilly worked as a guide in a leprechaun museum during the recession; and of course, the time he inadvertently found himself on ketamine while serving drinks to the president of Ireland. Through it all, the lovable, ginger-haired O'Reilly regales us with his combination of wit, absurdity, and tenderness, creating a charming and unforgettable portrait of an oddly gigantic family's search for some semblance of normalcy.","214 pages, Kindle Edition",Memoir,1 book106 follower,772 reviews,1,43 (<1%),206 (3%),"1,107 (17%)","2,563 (39%)","2,504 (38%)"
The Amphora Project,William Kotzwinkle,112,ratings16,"January 1, 2005","An enemy has come out of its deep dimensional cave. Infinitely older than humanity, it has crossed the barriers of our universe, and moves invisibly among us. It cares for nothing we might offer. It is beyond our science and religion. It has never enjoyed a sunrise, never tasted love. Because it isn't born of matter as we know it, it's a predator beyond our grasp.Our hope? Jockey Oldcastle, a fat, corrupt old star fighter with a chest full of medals purchased at an interplanetary pawnshop. But his navigator is Lizardo, from a race of highly intelligent reptiles, so hope is not entirely lost. Also in their ship is a shy, peace-loving entomologist who converses with butterflies and builds mechanical bees. This unlikely trio will grapple with the cosmic predator, assisted by a beautiful alien girl with vestigial wings and a birdlike voice that causes hallucinations. She's adored by a little robot named Upquark, who doubles as a suitcase and longs to experience romance.Along the way, they will explore the wonders of the Junk Moon, where old robots go to die, but not quietly. A gigantic rolling wheel of defective robots careens around the Junk Moon, crushing everything in its path. But the Junk Moon holds a secret at its core, and the old star fighter and his crew are there to crack it. Pursuing them is the Intelligence Agency, who are convinced they're guilty of crimes against society. Heading the Agency is a Vapor - a woman without a past, operating clandestinely, ruthlessly, and determined to brain-clean the old star fighter, turning him into a mindless shuffling cretin.Escape is required, to Alien City, marketplace of the planetary systems. Here traders from everywhere arrive, a writhing inhuman sea of creatures astonishing in their makeup and bizarre in their outlook. From their midst comes the Gamester, master of every known game in the universe and a formidable addition to the old star fighter's party. But whole cities are crystallizing, their inhabitants frozen in the streets, in their offices, and in restaurants. For this is how the extradimensional enemy kills, turning the human race into silent, staring statues highly polished and very dead.The Amphora Project is a ride through the future of the universe, featuring a fantastical cast of alien beings, quasi-human robots, intergalactic mercenaries, and two-thousand-year-old philosophers who have discovered the secret of eternal life. The Amphora Project combines elements of science fiction and fantasy and transcends the boundaries of both.","335 pages, Hardcover",Science Fiction,238 follower,16 reviews,93,11 (9%),25 (22%),40 (35%),25 (22%),11 (9%)
"Moon Witch, Spider King",Marlon James,"4,172",ratings639,"February 15, 2022","From Marlon James, author of the bestselling National Book Award finalist Black Leopard, Red Wolf, the second book in the Dark Star trilogy, his African Game of Thrones.In Black Leopard, Red Wolf, Sogolon the Moon Witch proved a worthy adversary to Tracker as they clashed across a mythical African landscape in search of a mysterious boy who disappeared. In Moon Witch, Spider King, Sogolon takes center stage and gives her own account of what happened to the boy, and how she plotted and fought, triumphed and failed as she looked for him. It’s also the story of a century-long feud—seen through the eyes of a 177-year-old witch—that Sogolon had with the Aesi, chancellor to the king. It is said that Aesi works so closely with the king that together they are like the eight limbs of one spider. Aesi’s power is considerable—and deadly. It takes brains and courage to challenge him, which Sogolon does for reasons of her own.Both a brilliant narrative device—seeing the story told in Black Leopard, Red Wolf from the perspective of an adversary and a woman—as well as a fascinating battle between different versions of empire, Moon Witch, Spider King delves into Sogolon’s world as she fights to tell her own story. Part adventure tale, part chronicle of an indomitable woman who bows to no man, it is a fascinating novel that explores power, personality, and the places where they overlap.","656 pages, Kindle Edition",Fantasy,"4,619 follower",639 reviews,34,51 (1%),144 (3%),623 (14%),"1,569 (37%)","1,785 (42%)"
Such a Fun Age,Kiley Reid,"515,503","ratings41,288","December 31, 2019","A striking and surprising debut novel from an exhilarating new voice, Such a Fun Age is a page-turning and big-hearted story about race and privilege, set around a young black babysitter, her well-intentioned employer, and a surprising connection that threatens to undo them both.Alix Chamberlain is a woman who gets what she wants and has made a living, with her confidence-driven brand, showing other women how to do the same. So she is shocked when her babysitter, Emira Tucker, is confronted while watching the Chamberlains' toddler one night, walking the aisles of their local high-end supermarket. The store's security guard, seeing a young black woman out late with a white child, accuses Emira of kidnapping two-year-old Briar. A small crowd gathers, a bystander films everything, and Emira is furious and humiliated. Alix resolves to make things right.But Emira herself is aimless, broke, and wary of Alix's desire to help. At twenty-five, she is about to lose her health insurance and has no idea what to do with her life. When the video of Emira unearths someone from Alix's past, both women find themselves on a crash course that will upend everything they think they know about themselves, and each other.With empathy and piercing social commentary, Such a Fun Age explores the stickiness of transactional relationships, what it means to make someone family, and the complicated reality of being a grown up. It is a searing debut for our times.","310 pages, Hardcover",Fiction,"4,535 follower","41,288 reviews",7,"5,615 (1%)","28,470 (5%)","141,739 (27%)","229,487 (44%)","110,192 (21%)"
Hunter,Mercedes Lackey,"9,196","ratings1,319","September 1, 2015","They came after the Diseray. Some were terrors ripped from our collective imaginations, remnants of every mythology across the world. And some were like nothing anyone had ever dreamed up, even in their worst nightmares.Monsters.Long ago, the barriers between our world and the Otherworld were ripped open, and it’s taken centuries to bring back civilization in the wake of the catastrophe. Now, the luckiest Cits live in enclosed communities, behind walls that keep them safe from the hideous creatures fighting to break through. Others are not so lucky.To Joyeaux Charmand, who has been a Hunter in her tight-knit mountain community since she was a child, every Cit without magic deserves her protection from dangerous Othersiders. Then she is called to Apex City, where the best Hunters are kept to protect the most important people.Joy soon realizes that the city’s powerful leaders care more about luring Cits into a false sense of security than protecting them. More and more monsters are getting through the barriers, and the close calls are becoming too frequent to ignore. Yet the Cits have no sense of how much danger they’re in—to them, Joy and her corps of fellow Hunters are just action stars they watch on TV.When an act of sabotage against Joy takes an unbearable toll, she uncovers a terrifying conspiracy in the city. There is something much worse than the usual monsters infiltrating Apex. And it may be too late to stop them…","374 pages, Hardcover",Fantasy,"8,722 follower","1,319 reviews",639,214 (2%),469 (5%),"1,784 (19%)","3,323 (36%)","3,406 (37%)"
Calico Joe,John Grisham,"46,412","ratings4,787","January 1, 2012","#1 NEW YORK TIMES BESTSELLER • A surprising and moving novel of fathers and sons, forgiveness and redemption, set in the world of Major League Baseball…“Grisham knocks it out of the park.”— The Washington PostIt’s the summer of 1973, and Joe Castle is the boy wonder of baseball, the greatest rookie anyone has ever seen. The kid from Calico Rock, Arkansas, dazzles Chicago Cubs fans as he hits home run after home run, politely tipping his hat to the crowd as he shatters all rookie records. Calico Joe quickly becomes the idol of every baseball fan in America, including Paul Tracey, the young son of a hard-partying and hard-throwing New York Mets pitcher. On the day that Warren Tracey finally faces Calico Joe, Paul is in the stands, rooting for his idol but also for his dad. Then Warren throws a fastball that will change their lives forever.Don’t miss John Grisham’s new book, THE AFTER THE FIRM, coming soon!","240 pages, Mass Market Paperback",Fiction,80.4k follower,"4,787 reviews",711,825 (1%),"2,574 (5%)","11,581 (24%)","18,246 (39%)","13,186 (28%)"
Argall: The True Story of Pocahontas and Captain John Smith,William T. Vollmann,290,ratings44,"January 1, 2001","From the National Book Award-winning author of Europe Central – a hugely original fictional history of Pocahontas, John Smith, and the Jamestown colony in VirginiaIn Argall , the third novel in his Seven Dreams series, William T. Vollmann alternates between extravagant Elizabethan language and gritty realism in an attempt to dig beneath the legend surrounding Pocahontas, John Smith, and the founding of the Jamestown colony in Virginia-as well as the betrayals, disappointments, and atrocities behind it. With the same panoramic vision, mythic sensibility, and stylistic daring that he brought to the previous novels in the Seven Dreams series--hailed upon its inception as ""the most important literary project of the '90s"" ( The Washington Post )--Vollmann continues his hugely original fictional history of the clash of Native Americans and Europeans in the New World. In reconstructing America's past as tragedy, nightmare, and bloody spectacle, Vollmann does nothing less than reinvent the American novel.","746 pages, Paperback",Fiction,"1,179 follower",44 reviews,88,4 (1%),10 (3%),50 (17%),105 (36%),121 (41%)
The Lake of Souls,Darren Shan,"24,281",ratings604,"January 1, 2002","It’s time for Harkat to learn the truth about who he used to be. He and Darren must give themselves to Mr. Tiny and leave the human world behind. Can they survive killer animals, monstrous mutants and fiery, winged beasts? A nightmarish fantasy and the beginning of the end of the final trilogy.","224 pages, Paperback",Fantasy,"7,759 follower",604 reviews,253,235 (<1%),"1,006 (4%)","4,198 (17%)","7,575 (31%)","11,267 (46%)"
Take What You Can Carry,Gian Sardar,"10,739",ratings873,"May 1, 2021","An aspiring photographer follows her dreams and faces her fears in a poignant novel about finding beauty, promise, and love amid the chaos of war-torn Kurdistan.It’s 1979. Olivia Murray, a secretary at a Los Angeles newspaper, is determined to become a photojournalist and make a difference with her work. When opportunity arrives, she seizes it, accompanying her Kurdish boyfriend, Delan, to northern Iraq for a family wedding, hoping to capture an image that lands her a job in the photo department. More important, though, the trip is a chance to understand Delan’s childhood and bridge the differences of their pasts. Yet when the return home proves less safe than Delan believed, Olivia is confronted with a reality she had not expected, and is awakened to the dangers of a town patrolled by Iraqi military under curfew and constant threat.But in this world torn apart by war, there are intoxicating sights and scents, Delan’s loving family, innocence not yet compromised, and small acts of kindness that flourish unexpectedly. All of it will be tested when Olivia captures a shattering, tragic moment on film, one that upends all their lives and proves that true bravery begins with an open heart.","337 pages, Kindle Edition",Historical Fiction,165 follower,873 reviews,5,131 (1%),258 (2%),"1,195 (11%)","3,318 (30%)","5,837 (54%)"
Lies of the Beholder,Brandon Sanderson,"7,021",ratings577,"September 20, 2018","The shocking conclusion to Brandon Sanderson's Legion novella series, on its own for the first time.Stephen Leeds is perfectly sane. It’s his hallucinations who are mad. A genius of unrivaled aptitude, Stephen can learn any new skill, vocation, or art in a matter of hours. However, to contain all of this, his mind creates hallucinatory people—Stephen calls them aspects—to hold and manifest the information. Wherever he goes, he is joined by a team of imaginary experts to give advice, interpretation, and explanation. He uses them to solve problems . . . for a price. When Stephen gets an unexpected cry for help from the woman who taught him how to control his aspects—right when one of his aspects suddenly and violently disappears—it will send him on a case the likes of which he could never have imagined.At the Publisher's request, this title is being sold without Digital Rights Management Software (DRM) applied.","113 pages, Kindle Edition",Fantasy,224k follower,577 reviews,401,27 (<1%),184 (2%),"1,294 (18%)","2,889 (41%)","2,627 (37%)"
The Leisure Seeker,Michael Zadoorian,"7,037","ratings1,274","January 27, 2009","The unforgettable cross country journey of a runaway couple in their twilight years determined to meet the end of all roads on their own terms—a major motion picture from Sony Pictures Classics starring Helen Mirren and Donald Sutherland.The Robinas have shared a wonderful life for more than sixty years. Now in their eighties, Ella suffers from cancer and John has Alzheimer's. Yearning for one last adventure, the self-proclaimed ""down-on-their-luck geezers"" kidnap themselves from the adult children and doctors who seem to run their lives and steal away from their home in suburban Detroit on a forbidden vacation of rediscovery.With Ella as his vigilant copilot, John steers their '78 Leisure Seeker RV along the forgotten roads of Route 66 toward Disneyland in search of a past they're having a damned hard time remembering. Yet Ella is determined to prove that, when it comes to life, you can go back for seconds—even when everyone says you can't.","272 pages, Hardcover",Fiction,238 follower,"1,274 reviews",9,96 (1%),348 (4%),"1,533 (21%)","2,983 (42%)","2,077 (29%)"
The Huckleberry Murders,Patrick F. McManus,695,ratings108,"October 21, 2010",The Huckleberry Murders: A Sheriff Bo Tully Mystery (Sheriff Bo Tully Mysteries),"272 pages, Hardcover",Mystery,386 follower,108 reviews,59,10 (1%),47 (6%),202 (29%),246 (35%),190 (27%)
The Blight Way,Patrick F. McManus,"1,470",ratings204,"January 1, 2006","Bo Tully, sheriff of Blight county, Idaho -- and a fellow who dropped twenty pounds on Atkins -- had been thinking about asking out Jan Whittle, his grade-school sweetheart. Problem is, he's already promised to celebrate his dad's seventy-fifth birthday with him. Thwarted romance proves to be the least of Bo's problems, however, when a dead body turns up on Batim Scragg's ranch. The baffling thing is that neither Batim nor his two wayward sons appear to be the culprits. Forced to put on his sleuthing hat, Bo finds himself faced with a whole slew of possible suspects. And what quickly becomes apparent is that, while the sheriff's investigative methods may not exactly be legal, they are, for better or worse, ""The Blight Way,"" A bestselling author with more than two million books in print, the curmudgeonly wit Patrick McManus delivers a page-turning mystery filled with mirth and misadventure set in hook-and-bullet territory.","272 pages, Hardcover",Mystery,386 follower,204 reviews,59,22 (1%),79 (5%),436 (29%),548 (37%),385 (26%)
