Title,Authors,Avg Ratings,Rating,first_published,Description,Total_Pages,Genre,author_followers,no_of_reviews,no_book_by_author,one_star_ratings,two_star_ratings,three_star_ratings,four_star_ratings,five_star_ratings
"Stand Up, Yumi Chung!",Jessica  Kim,"3,543",ratings656,"March 17, 2020","One lie snowballs into a full-blown double life in this irresistible story about an aspiring stand-up comedian.On the outside, Yumi Chung suffers from #shygirlproblems, a perm-gone-wrong, and kids calling her ""Yu-MEAT"" because she smells like her family's Korean barbecue restaurant. On the inside, Yumi is ready for her Netflix stand-up special. Her notebook is filled with mortifying memories that she's reworked into comedy gold. All she needs is a stage and courage.Instead of spending the summer studying her favorite YouTube comedians, Yumi is enrolled in test-prep tutoring to qualify for a private school scholarship, which will help in a time of hardship at the restaurant. One day after class, Yumi stumbles on an opportunity that will change her life: a comedy camp for kids taught by one of her favorite YouTube stars. The only problem is that the instructor and all the students think she's a girl named Kay Nakamura--and Yumi doesn't correct them.As this case of mistaken identity unravels, Yumi must decide to stand up and reveal the truth or risk losing her dreams and disappointing everyone she cares about.","320 pages, Hardcover",Middle Grade,60 follower,656 reviews,6,18 (<1%),61 (1%),585 (16%),"1,768 (49%)","1,111 (31%)"
All You Can Ever Know,Nicole Chung,"24,328","ratings3,013","October 2, 2018","What does it mean to lose your roots—within your culture, within your family—and what happens when you find them?Nicole Chung was born severely premature, placed for adoption by her Korean parents, and raised by a white family in a sheltered Oregon town. From early childhood, she heard the story of her adoption as a comforting, prepackaged myth. She believed that her biological parents had made the ultimate sacrifice in the hopes of giving her a better life; that forever feeling slightly out of place was simply her fate as a transracial adoptee. But as she grew up—facing prejudice her adoptive family couldn’t see, finding her identity as an Asian American and a writer, becoming ever more curious about where she came from—she wondered if the story she’d been told was the whole truth.With warmth, candor, and startling insight, Chung tells of her search for the people who gave her up, which coincided with the birth of her own child. All You Can Ever Know is a profound, moving chronicle of surprising connections and the repercussions of unearthing painful family secrets—vital reading for anyone who has ever struggled to figure out where they belong.Finalist, National Book Critics Circle Award for Autobiography / Longlisted for the PEN Open Book Award / Named a Best Book of the Year by The Washington Post, NPR, The Boston Globe, TIME, Newsday, Library Journal, BuzzFeed, Real Simple, Paste Magazine, Chicago Public Library, Seattle Public Library, Goodreads, Shelf Awareness, Electric Literature, and more","240 pages, Hardcover",Memoir,926 follower,"3,013 reviews",9,213 (<1%),"1,159 (4%)","6,447 (26%)","10,626 (43%)","5,883 (24%)"
The Divine Circle of Ladies Courting Trouble,Dolores Stewart Riccio,227,ratings14,"February 28, 2002","October in New England is a grand time—great for carving pumpkins, throwing Halloween parties, baking and eating brownies, and… dropping dead? When a helmlock-laced brownie at the church hospitality hour spells the end for an elderly townswoman, Cass Shipton and her circle of fabulous friends get to work using their very special brand of detective skills to ferret out the culprit. After all, their unorthodox recipe of magic, clairvoyance, and good old-fashioned common sense hasn't let them down yet…","308 pages, Trade Paperback",Mystery,66 follower,14 reviews,27,0 (0%),7 (3%),30 (13%),75 (33%),115 (50%)
The Minister's Daughter,Julie Hearn,"2,452",ratings268,"February 3, 2005","“Powers of the air, be here now. So mote it be.”Conceived on May Morning, Nell is claimed by the piskies and faeries as a merrybegot, one of their own. She is a wild child: herb gatherer and healer, spell-weaver and midwife . . . and, some say, a witch.Grace is everything Nell is not. She is the Puritan minister’s daughter: beautiful and refined, innocent and sweet-natured . . . to those who think they know her. But she is hiding a secret—a secret that will bring everlasting shame to her family should it ever come to light.A merrybegot and a minister’s daughter—two girls who could not have less in common. Yet their fates collide when Grace and her younger sister, Patience, are suddenly spitting pins, struck with fits, and speaking in fevered tongues. The minister is convinced his daughters are the victims of witchcraft. And all signs point to Nell as the source of the trouble. . . .Set during the tumultuous era of the English Civil War, The Minister’s Daughter captures the superstition, passion, madness, and magic of a vanished age.","272 pages, Paperback",Historical Fiction,88 follower,268 reviews,16,82 (3%),266 (10%),792 (32%),830 (33%),482 (19%)
Kiss of Snow,Nalini Singh,"31,717","ratings2,311","May 31, 2011","NYT bestselling author Nalini Singh’s exhilarating world of shapeshifters and psychics is “paranormal romance at its best” (Publishers Weekly). Now comes the story of an alpha wolf named Hawke used to getting exactly what he wants—and of the only woman who dares tangle with him.
Since the moment of her defection from the PsyNet and into the SnowDancer wolf pack, Sienna Lauren has had one weakness. Hawke. Alpha and dangerous, he compels her to madness.Hawke is used to walking alone, having lost the woman who would’ve been his mate long ago. But Sienna fascinates the primal heart of him, even as he tells himself she is far too young to handle the wild fury of the wolf.Then Sienna changes the rules and suddenly, there is no more distance, only the most intimate of battles between two people who were never meant to meet. Yet as they strip away each other’s secrets in a storm of raw emotion, they must also ready themselves for a far more vicious fight . . .A deadly enemy is out to destroy SnowDancer, striking at everything they hold dear, but it is Sienna’s darkest secret that may yet savage the pack that is her home . . . and the alpha who is its heartbeat . . .","432 pages, Paperback",Paranormal Romance,25.5k follower,"2,311 reviews",254,222 (<1%),577 (1%),"3,050 (9%)","8,901 (28%)","18,967 (59%)"
An Object of Beauty,Steve Martin,"101,319","ratings3,230","November 23, 2010","Lacey Yeager is young, captivating, and ambitious enough to take the NYC art world by storm. Groomed at Sotheby's and hungry to keep climbing the social and career ladders put before her, Lacey charms men and women, old and young, rich and even richer with her magnetic charisma and liveliness. Her ascension to the highest tiers of the city parallel the soaring heights--and, at times, the dark lows--of the art world and the country from the late 1990s through today.","292 pages, Hardcover",Fiction,"2,915 follower","3,230 reviews",213,"4,890 (4%)","8,975 (8%)","25,035 (24%)","27,072 (26%)","35,347 (34%)"
The Hunger Pains: A Parody,The Harvard Lampoon,"10,173",ratings819,"February 1, 2012","The hilarious instant New York Times bestseller, The Hunger Pains is a loving parody of the dystopian YA novel and film, The Hunger Games .Winning means wealth, fame, and a life of therapy losing means death, but also fame! This is The Hunger Pains .When Kantkiss Neverclean replaces her sister as a contestant on the Hunger Games —the second-highest-rated reality TV show in Peaceland, behind Extreme Home Makeover —she has no idea what to expect. Having lived her entire life in the telemarketing district’s worst neighborhood, the Crack, Kantkiss feels unprepared to fight to the death while simultaneously winking and looking adorable for the cameras. But when her survival rests on choosing between the dreamy hunk from home, Carol Handsomestein, or the doughy klutz, Pita Malarkey, Kantkiss discovers that the toughest conflicts may not be found on the battlefield but in her own heart . . . which is unfortunately on a battlefield.","157 pages, Paperback",Humor,179 follower,819 reviews,22,825 (8%),929 (9%),"1,700 (16%)","1,918 (18%)","4,801 (47%)"
Scored,Lauren McLaughlin,"2,267",ratings280,"October 25, 2011","Set in the future when teenagers are monitored via camera and their recorded actions and confessions plugged into a computer program that determines their ability to succeed. All kids given a ""score"" that determines their future potential. This score has the ability to get kids into colleges, grant scholarships, or destroy all hope for the above. Scored's reluctant heroine is Imani, a girl whose high score is brought down when her best friend's score plummets. Where do you draw the line between doing what feels morally right and what can mean your future? Friendship, romance, loyalty, family, human connection and human value: all are questioned in this fresh and compelling dystopian novel set in the scarily foreseeable future.","242 pages, Kindle Edition",Dystopia,90 follower,280 reviews,22,151 (6%),307 (13%),788 (34%),645 (28%),376 (16%)
Running Hot,Jayne Ann Krentz,"10,500",ratings441,"December 30, 2008","Ex-cop Luther Malone, lifelong member of the secretive paranormal organization known as the Arcane Society, is waiting to meet Grace Renquist. Hired as an aura-reading consultant in the quest for a murder suspect, she’s got zero field experience. She’s from tiny Eclipse Bay, Oregon. She’s a librarian, for heaven’s sake.As for Grace, she’s not expecting much either from Malone, who walks with a cane and isn’t so good with a gun. Nice résumé for a bodyguard . . .But even before they reach their hotel in Maui—where they’ll be posing as honeymooners—Grace and Luther feel the electric charge between them. Problem is, they need to remain vigilant day and night, because it soon becomes clear there’s more going on here. Rogue sensitives—operatives for the underground group Nightshade—are pouring into the luxury resort like there’s a convention. Grace recognizes those dark spikes in their auras. She saw the same pattern in someone else in another life—a life she hasn’t revealed to Luther or anyone else. And she understands how dangerous these people can be . . . especially with those para-hunters at their sides.While the pair’s employers at Jones & Jones scramble to get them backup, Luther and Grace have to think on their feet. The criminals in their midst aren’t just high-level sensitives: They’ve enhanced their talents with a potent—and unpredictable—drug. And as Grace knows all too well, if you don’t control your powers, your powers will control you. . . .","337 pages, Hardcover",Romance,"6,753 follower",441 reviews,414,74 (<1%),305 (2%),"2,068 (19%)","3,953 (37%)","4,100 (39%)"
Terminal World,Alastair Reynolds,"8,057",ratings643,"March 15, 2010","Spearpoint, the last human city, is an atmosphere-piercing spire of vast size. Clinging to its skin are the zones, a series of semi-autonomous city-states, each of which enjoys a different—and rigidly enforced—level of technology. Horsetown is pre-industrial; in Neon Heights they have television and electric trains . . .Following an infiltration mission that went tragically wrong, Quillon has been living incognito, working as a pathologist in the district morgue. But when a near-dead angel drops onto his dissecting table, Quillon's world is wrenched apart one more time, for the angel is a winged posthuman from Spearpoint's Celestial Levels—and with the dying body comes bad news.If Quillon is to save his life, he must leave his home and journey into the cold and hostile lands beyond Spearpoint's base, starting an exile that will take him further than he could ever imagine. But there is far more at stake than just Quillon's own survival, for the limiting technologies of the zones are determined not by governments or police, but by the very nature of reality—and reality itself is showing worrying signs of instability . . .Terminal World is a snarling, drooling, crazy-eyed mongrel of a book: equal parts steampunk, western, planetary romance, and far-future SF.","490 pages, Paperback",Science Fiction,"8,281 follower",643 reviews,273,134 (1%),604 (7%),"2,233 (27%)","3,131 (38%)","1,955 (24%)"
Shine,Jeri Smith-Ready,"3,775",ratings478,"May 1, 2012","In this dramatic conclusion to the Shade trilogy, Aura and Zachary’s relationship sizzles as the secrets of the Shift are revealed.Life can change in an instant, and no one understands that better than Aura. It’s been almost a year since her boyfriend tragically died. She’s finally letting go of Logan’s violet-hued ghost, but not her search to uncover the truth about her past.As the first in a generation that can see ghosts, Aura is convinced she has a connection to the Shift. She’s trusted Zachary, ever patient and ever by her side, with all that she knows. But when the government threatens his life in an attempt to learn Aura’s secrets, she will stop at nothing to protect herself and the one she loves...even if that means betraying her own heart.","399 pages, Hardcover",Paranormal Romance,"1,599 follower",478 reviews,28,47 (1%),169 (4%),697 (18%),"1,173 (31%)","1,689 (44%)"
Doctor Who: Bang-Bang-a-Boom!,Gareth Roberts,316,ratings40,"December 19, 2002","Dark Space 8 - an advanced monitoring station floating serenely among the stars. Its crew - a dedicated and highly-skilled group of professionals, calmy going about their vital work. Its mission - to boldy host the Intergalactic Song Contest.With representatives from myriad worlds competing, the eyes of the universe are on the station. But dark deeds are afoot aboard Dark Space 8... and people are starting to die.The haughty Queen Angvia, the gaseous gestalt Gholos, disposable pop idol Nicky Neumann, erratic Professor Fassbinder and the icily-efficient Dr Helena Harcourt ­ all are suspects. Could old political rivalries be manifesting themselves among the contestants? Is this the work of a breakaway terrorist faction? Or has someone just got it in for singer-songwriters?With peace in the galaxy hanging by a thread, it's vital that the mystery is solved ­ and fast! Can Dark Space 8's unconventional new commander, with the help of his personal pilot, Mel, find the murderer in time to prevent a major intergalactic war?Or will it be nul points for the entire universe...?Chronological PlacementThis story takes place between the television adventures Paradise Towers and Delta and the Bannermen.",Audio Play,Doctor Who,96 follower,40 reviews,72,12 (3%),30 (9%),99 (31%),118 (37%),57 (18%)
"Ms. Marvel, Vol. 4: Last Days",G. Willow Wilson,"16,201","ratings1,347","December 1, 2015","From the moment Kamala put on her costume, she's been challenged. But nothing has prepared her for this: the last days of the Marvel Universe. Lucky she's got the help of Carol ""Captain Marvel"" Danvers! Between teaming up with her personal hero to rescue her brother and trying to keep her city from falling into an all-out frenzy, Kamala has barely had time to come to terms with the fact that the world is literally collapsing around her. But the truth will catch up to her, and soon. When the world is about to end, do you still keep fighting? Kamala knows the answer. Let's do this, Jersey City.Collecting: Ms. Marvel (2014) #16-19, written by G. Willow Wilson and illustrated by Adrian Alphona, plus material from Amazing Spider-Man (2014) #7-8.","120 pages, Paperback",Comics,"3,196 follower","1,347 reviews",502,237 (1%),383 (2%),"2,275 (14%)","5,994 (36%)","7,312 (45%)"
The Horse Dancer,Jojo Moyes,"28,689","ratings2,212","January 1, 2009","In a hidden corner of London, Henri Lachapelle is teaching his granddaughter and her horse to defy gravity, just as he had done in France, fifty years previously. But when disaster strikes, fourteen-year-old Sarah is left to fend for herself. Forced to share a house with her charismatic ex-husband, her professional judgement called into question, lawyer Natasha Macauley's life seems to have gone awry. When her path crosses that of Sarah, she sees a chance to put things right. But she doesn't know that Sarah is keeping a secret... one that will chance all of their lives.","518 pages, Paperback",Fiction,61.5k follower,"2,212 reviews",115,400 (1%),"1,291 (4%)","6,331 (22%)","10,834 (37%)","9,833 (34%)"
Jackie as Editor: The Literary Life of Jacqueline Kennedy Onassis,Greg   Lawrence,523,ratings67,"December 17, 2010","An absorbing chronicle of a much overlooked chapter in Jacqueline Kennedy Onassis’s life—her nineteen-year editorial career History remembers Jacqueline Kennedy Onassis as the consummate first lady, the nation’s tragic widow, the millionaire’s wife, and, of course, the quintessential embodiment of elegance. Her biographers, however, skip over an equally important stage in her her nearly twenty year long career as a book editor. Jackie as Editor is the first book to focus exclusively on this remarkable woman’s editorial career. At the age of forty-six, one of the most famous women in the world went to work for the first time in twenty-two years. Greg Lawrence, who had three of his books edited by Jackie, draws from interviews with more than 125 of her former collaborators and acquaintances in the publishing world to examine one of the twentieth century's most enduring subjects of fascination through a new her previously untouted skill in the career she chose. Over the last third of her life, Jackie would master a new industry, weather a very public professional scandal, and shepherd more than a hundred books through the increasingly corporate halls of Viking and Doubleday, publishing authors as diverse as Diana Vreeland, Louis Auchincloss, George Plimpton, Bill Moyers, Dorothy West, Naguib Mahfouz, and even Michael Jackson.  Jackie as Editor gives intimate new insights into the life of a complex and enigmatic woman who found fulfillment through her creative career during book publishing’s legendary Golden Age, and, away from the public eye, quietly defined life on her own terms.","336 pages, Hardcover",Biography,7 book,67 reviews,7,10 (1%),44 (8%),180 (34%),163 (31%),126 (24%)
Damaged,Cathy Glass,"17,903","ratings1,144","February 5, 2007","Although Jodie is only eight years old, she is violent, aggressive, and has already been through numerous foster families. Her last hope is Cathy Glass. At the Social Services office, Cathy (an experienced foster carer) is pressured into taking Jodie as a new placement. Jodie's challenging behaviour has seen off five carers in four months. Despite her reservations, Cathy decides to accept Jodie to protect her from being placed in an institution. Jodie arrives, and her first act is to soil herself, and then wipe it on her face, grinning wickedly. Jodie meets Cathy's teenage children, and greets them with a sharp kick to the shins. That night, Cathy finds Jodie covered in blood, having cut her own wrist, and smeared the blood over her face. As Jodie begins to trust Cathy her behaviour improves. Over time, with childish honesty, she reveals details of her abuse at the hands of her parents and others. It becomes clear that Jodie's parents were involved in a sickening paedophile ring, with neighbours and Social Services not seeing what should have been obvious signs. Unfortunately Jodie becomes increasingly withdrawn, and it's clear she needs psychiatric therapy. Cathy urges the Social Services to provide funding, but instead they decide to take Jodie away from her, and place her in a residential unit. Although the paedophile ring is investigated and brought to justice, Jodie's future is still up in the air. Cathy promises that she will stand by her no matter what -- her love for the abandoned Jodie is unbreakable.","339 pages, Hardcover",Nonfiction,"1,953 follower","1,144 reviews",145,172 (<1%),484 (2%),"2,687 (15%)","5,614 (31%)","8,946 (49%)"
The Tudor Secret,C.W. Gortner,"4,127",ratings486,"January 1, 2011","The era of the Tudors was one of danger, intrigue, conspiracy, and, above all, spies.
Summer 1553: A time of danger and deceit. Brendan Prescott, an orphan, is reared in the household of the powerful Dudley family. Brought to court, Prescott finds himself sent on an illicit mission to the king’s brilliant but enigmatic sister, Princess Elizabeth. But Brendan is soon compelled to work as a double agent by Elizabeth’s protector, William Cecil, who promises in exchange to help him unravel the secret of his own mysterious past. 
A dark plot swirls around Elizabeth’s quest to unravel the truth about the ominous disappearance of her seriously ill brother, King Edward VI. With only a bold stable boy and an audacious lady-in-waiting at his side, Brendan plunges into a ruthless gambit of half-truths, lies, and murder. Filled with the intrigue and pageantry of Tudor England, The Tudor Secret is the first book in The Elizabeth I Spymaster Chronicles.","327 pages, Paperback",Historical Fiction,"2,368 follower",486 reviews,18,112 (2%),335 (8%),"1,251 (30%)","1,528 (37%)",901 (21%)
The Bible Unearthed: Archaeology's New Vision of Ancient Israel and the Origin of Its Sacred Texts,Israel Finkelstein,"3,091",ratings245,"January 10, 2001","In this groundbreaking work that sets apart fact and legend, authors Finkelstein and Silberman use significant archeological discoveries to provide historical information about biblical Israel and its neighbors.In this iconoclastic and provocative work, leading scholars Israel Finkelstein and Neil Asher Silberman draw on recent archaeological research to present a dramatically revised portrait of ancient Israel and its neighbors. They argue that crucial evidence (or a telling lack of evidence) at digs in Israel, Egypt, Jordan, and Lebanon suggests that many of the most famous stories in the Bible—the wanderings of the patriarchs, the Exodus from Egypt, Joshua’s conquest of Canaan, and David and Solomon’s vast empire—reflect the world of the later authors rather than actual historical facts. Challenging the fundamentalist readings of the scriptures and marshaling the latest archaeological evidence to support its new vision of ancient Israel, The Bible Unearthed offers a fascinating and controversial perspective on when and why the Bible was written and why it possesses such great spiritual and emotional power today.","385 pages, Paperback",History,90 follower,245 reviews,28,70 (2%),118 (3%),482 (15%),"1,084 (35%)","1,337 (43%)"
America for Americans: A History of Xenophobia in the United States,Erika  Lee,967,ratings177,"November 26, 2019","This definitive history of American xenophobia is ""essential reading for anyone who wants to build a more inclusive society."" (Ibram X. Kendi, New York Times -bestselling author of How to Be an Antiracist ).The United States is known as a nation of immigrants. But it is also a nation of xenophobia. In America for Americans , Erika Lee shows that an irrational fear, hatred, and hostility toward immigrants has been a defining feature of our nation from the colonial era to the Trump era. Benjamin Franklin ridiculed Germans for their ""strange and foreign ways."" Americans' anxiety over Irish Catholics turned xenophobia into a national political movement. Chinese immigrants were excluded, Japanese incarcerated, and Mexicans deported.Today, Americans fear Muslims, Latinos, and the so-called browning of America. Forcing us to confront this history, Lee explains how xenophobia works, why it has endured, and how it threatens America. Now updated with an afterword reflecting on how the coronavirus pandemic turbocharged xenophobia, America for Americans is an urgent spur to action for any concerned citizen.","432 pages, Hardcover",History,220 follower,177 reviews,7,3 (<1%),15 (1%),97 (10%),381 (39%),471 (48%)
How the Lady Was Won,Shana Galen,764,ratings102,"February 11, 2020","When a master of disguise marries a woman who sees right through him…Lady Daphne, daughter of the Duke of Warcliffe, is one of the Three Suns. Society revolves around her. But there’s one person who doesn’t seem to know she’s alive—her own husband. Lady Daphne was thrilled to marry Colin FitzRoy, the son of her mother’s dear friend, seven years before. But then he left for the army, and their marriage never really had a chance. Now she’s in trouble, and Colin has reentered her life. She’s determined to refuse his help, especially after the way he’s treated her, but Colin can be persuasive…especially when he has her alone.Baring it all is part of the seduction.Colin FitzRoy was known as The Pretender during the war. He’s an expert in the art of disguise, but even when he takes off the mask, he hides who he really is. Colin pretends he doesn’t have feelings, but when he’s thrust together with his estranged wife, his buried emotions resurface. Before long, Colin is juggling an elderly pug, a wife-hunting Scotsman, and a duplicitous street urchin in an effort to keep Daphne safe. But his greatest challenge is not only to seduce her but to win her heart.","424 pages, Kindle Edition",Historical Romance,"1,494 follower",102 reviews,82,16 (2%),40 (5%),207 (27%),278 (36%),223 (29%)
