Title,Authors,Avg Ratings,Rating,first_published,Description,Total_Pages,Genre,author_followers,no_of_reviews,no_book_by_author,one_star_ratings,two_star_ratings,three_star_ratings,four_star_ratings,five_star_ratings
Norse Mythology,Neil Gaiman,"316,481","ratings27,881","First published February 7, 2017","This is an alternate cover edition for ISBN 9780393356182Neil Gaiman, long inspired by ancient mythology in creating the fantastical realms of his fiction, presents a bravura rendition of the Norse gods and their world from their origin though their upheaval in Ragnarok. In Norse Mythology, Gaiman stays true to the myths in envisioning the major Norse pantheon: Odin, the highest of the high, wise, daring, and cunning; Thor, Odin’s son, incredibly strong yet not the wisest of gods; and Loki—son of a giant—blood brother to Odin and a trickster and unsurpassable manipulator.Gaiman fashions these primeval stories into a novelistic arc that begins with the genesis of the legendary nine worlds and delves into the exploits of deities, dwarfs, and giants. Through Gaiman’s deft and witty prose, these gods emerge with their fiercely competitive natures, their susceptibility to being duped and to duping others, and their tendency to let passion ignite their actions, making these long-ago myths breathe pungent life again.","301 pages, Paperback",Fantasy,313k followers,"27,881 reviews","1,401 books313k followers","2,930 (<1%)","8,598 (2%)","54,946 (17%)","135,717 (42%)","114,290 (36%)"
Skyward,Brandon Sanderson,"134,677","ratings17,389","First published November 6, 2018","Defeated, crushed, and driven almost to extinction, the remnants of the human race are trapped on a planet that is constantly attacked by mysterious alien starfighters. Spensa, a teenage girl living among them, longs to be a pilot. When she discovers the wreckage of an ancient ship, she realizes this dream might be possible—assuming she can repair the ship, navigate flight school, and (perhaps most importantly) persuade the strange machine to help her. Because this ship, uniquely, appears to have a soul.","513 pages, Hardcover",Science Fiction,223k followers,"17,389 reviews",402 books223k followers,632 (<1%),"1,508 (1%)","9,520 (7%)","43,367 (32%)","79,650 (59%)"
"The Eighty-Dollar Champion: Snowman, the Horse That Inspired a Nation",Elizabeth Letts,"13,511","ratings1,855","First published August 23, 2011","#1 NEW YORK TIMES BESTSELLERNovember 1958: the National Horse Show at Madison Square Garden in New York City. Into the rarefied atmosphere of wealth and tradition comes the most unlikely of horses—a drab white former plow horse named Snowman—and his rider, Harry de Leyer. They were the longest of all longshots—and their win was the stuff of legend. Harry de Leyer first saw the horse he would name Snowman on a bleak winter afternoon between the slats of a rickety truck bound for the slaughterhouse. He recognized the spark in the eye of the beaten-up horse and bought him for eighty dollars. On Harry’s modest farm on Long Island, the horse thrived. But the recent Dutch immigrant and his growing family needed money, and Harry was always on the lookout for the perfect thoroughbred to train for the show-jumping circuit—so he reluctantly sold Snowman to a farm a few miles down the road. But Snowman had other ideas about what Harry needed. When he turned up back at Harry’s barn, dragging an old tire and a broken fence board, Harry knew that he had misjudged the horse. And so he set about teaching this shaggy, easygoing horse how to fly. One show at a time, against extraordinary odds and some of the most expensive thoroughbreds alive, the pair climbed to the very top of the sport of show jumping. Here is the dramatic and inspiring rise to stardom of an unlikely duo, based on the insight and recollections of “the Flying Dutchman” himself. Their story captured the heart of Cold War–era America—a story of unstoppable hope, inconceivable dreams, and the chance to have it all. Elizabeth Letts’s message is Never give up, even when the obstacles seem sky-high. There is something extraordinary in all of us.","329 pages, Hardcover",Nonfiction,939 followers,"1,855 reviews",17 books939 followers,144 (1%),434 (3%),"2,125 (15%)","4,399 (32%)","6,409 (47%)"
"The Last Mughal: The Fall of a Dynasty: Delhi, 1857",William Dalrymple,"7,873",ratings677,"First published January 1, 2006","On a hazy November afternoon in Rangoon, 1862, a shrouded corpse was escorted by a small group of British soldiers to an anonymous grave in a prison enclosure. As the British Commissioner in charge insisted, “No vestige will remain to distinguish where the last of the Great Moghuls rests.”Bahadur Shah Zafar II, the last Mughal Emperor, was a mystic, an accomplished poet and a skilled calligrapher. But while his Mughal ancestors had controlled most of India, the aged Zafar was king in name only. Deprived of real political power by the East India Company, he nevertheless succeeded in creating a court of great brilliance, and presided over one of the great cultural renaissances of Indian history.Then, in 1857, Zafar gave his blessing to a rebellion among the Company’s own Indian troops, thereby transforming an army mutiny into the largest uprising any empire had to face in the entire course of the nineteenth century. The Siege of Delhi was the Raj’s one of the most horrific events in the history of Empire, in which thousands on both sides died. And when the British took the city—securing their hold on the subcontinent for the next ninety years—tens of thousands more Indians were executed, including all but two of Zafar’s sixteen sons. By the end of the four-month siege, Delhi was reduced to a battered, empty ruin, and Zafar was sentenced to exile in Burma. There he died, the last Mughal ruler in a line that stretched back to the sixteenth century.Award-winning historian and travel writer William Dalrymple shapes his powerful retelling of this fateful course of events from groundbreaking previously unexamined Urdu and Persian manuscripts that include Indian eyewitness accounts and records of the Delhi courts, police and administration during the siege. The Last Mughal is a revelatory work—the first to present the Indian perspective on the fall of Delhi—and has as its heart both the dazzling capital personified by Zafar and the stories of the individuals tragically caught up in one of the bloodiest upheavals in history.","534 pages, Hardcover",History,"2,836 followers",677 reviews,"75 books2,836 followers",96 (1%),192 (2%),"1,171 (14%)","3,146 (39%)","3,268 (41%)"
Angel,James Patterson,"51,894","ratings2,042","First published February 14, 2011","In the seventh book in the bestselling series, evil scientists are still trying to convince Max that she needs to save the world, this time by providing the genetic link in speeding up the pace of evolution. Worse, they're trying to convince her that her perfect mate is Dylan, the newest addition to the flock. The problem is that, despite herself, Max is starting to believe it. Fang travels the country collecting his own gang of evolved humans, but the two separate flocks must unite to defeat a frightening doomsday cult whose motto is Save the Planet: Kill the Humans. And this time, the true heroine, for once, might just be little Angel.","298 pages, Paperback",Young Adult,345k followers,"2,042 reviews","1,589 books345k followers","1,547 (2%)","3,525 (6%)","10,091 (19%)","14,885 (28%)","21,846 (42%)"
Moon Over Manifest,Clare Vanderpool,"34,311","ratings5,037","First published October 12, 2010","The movement of the train rocked me like a lullaby. I closed my eyes to the dusty countryside and imagined the sign I’d seen only in Gideon’s stories: Manifest—A Town with a rich past and a bright future.Abilene Tucker feels abandoned. Her father has put her on a train, sending her off to live with an old friend for the summer while he works a railroad job. Armed only with a few possessions and her list of universals, Abilene jumps off the train in Manifest, Kansas, aiming to learn about the boy her father once was.Having heard stories about Manifest, Abilene is disappointed to find that it’s just a dried-up, worn-out old town. But her disappointment quickly turns to excitement when she discovers a hidden cigar box full of mementos, including some old letters that mention a spy known as the Rattler. These mysterious letters send Abilene and her new friends, Lettie and Ruthanne, on an honest-to-goodness spy hunt, even though they are warned to “Leave Well Enough Alone.”Abilene throws all caution aside when she heads down the mysterious Path to Perdition to pay a debt to the reclusive Miss Sadie, a diviner who only tells stories from the past. It seems that Manifest’s history is full of colorful and shadowy characters—and long-held secrets. The more Abilene hears, the more determined she is to learn just what role her father played in that history. And as Manifest’s secrets are laid bare one by one, Abilene begins to weave her own story into the fabric of the town.","368 pages, Library Binding",Historical Fiction,515 followers,"5,037 reviews",10 books515 followers,738 (2%),"1,503 (4%)","6,085 (17%)","13,359 (38%)","12,626 (36%)"
Why Does the World Exist?: An Existential Detective Story,Jim Holt,"6,581",ratings742,"First published February 1, 2011","""Why is there a world rather than nothing at all?"" remains the darkest and most enduring of all metaphysical mysteries. Following in the footsteps of Christopher Hitchens, Roger Penrose, and even Stephen Hawking, Jim Holt now enters this fractious debate with his lively and deeply informed narrative that traces the latest efforts to grasp the origins of the universe. The slyly humorous Holt takes on the role of cosmological detective, suggesting that we might have been too narrow in limiting our suspects to Yahweh vs. the Big Bang. Tracking down an eccentric Oxford philosopher, a Physics Nobel Laureate, a French Buddhist monk who lived with the Dalai Lama, and John Updike just before he died, Holt pursues unexplored angles to this cosmic puzzle. As he pieces together a solution--one that sheds new light on the question of God and the meaning of existence--he offers brisk philosophical asides on time and eternity, consciousness, and the arithmetic of nothingness.“The pleasure of this book is watching the match: the staggeringly inventive human mind slamming its fantastic conjectures over the net, the universe coolly returning every serve.... Holt traffics in wonder, a word whose dual meanings—the absence of answers; the experience of awe—strike me as profoundly related. His book is not utilitarian. You can’t profit from it, at least not in the narrow sense.... And yet it does what real science writing should: It helps us feel the fullness of the problem.” (Kathryn Schulz, New York Magazine)"" Jim Holt leaves us with the question Stephen Hawking once asked but couldn't answer, ‘Why does the universe go through all the bother of existing?’” (Ron Rosenbaum, Slate )","279 pages, Hardcover",Philosophy,169 followers,742 reviews,24 books169 followers,166 (2%),513 (7%),"1,575 (23%)","2,496 (37%)","1,831 (27%)"
The 19th Wife,David Ebershoff,"59,474","ratings6,745","First published August 5, 2008","Faith, I tell them, is a mystery, elusive to many, and never easy to explain.
Sweeping and lyrical, spellbinding and unforgettable, David Ebershoff’s The 19th Wife combines epic historical fiction with a modern murder mystery to create a brilliant novel of literary suspense. It is 1875, and Ann Eliza Young has recently separated from her powerful husband, Brigham Young, prophet and leader of the Mormon Church. Expelled and an outcast, Ann Eliza embarks on a crusade to end polygamy in the United States. A rich account of a family’s polygamous history is revealed, including how a young woman became a plural wife.Soon after Ann Eliza’s story begins, a second exquisite narrative unfolds–a tale of murder involving a polygamist family in present-day Utah. Jordan Scott, a young man who was thrown out of his fundamentalist sect years earlier, must reenter the world that cast him aside in order to discover the truth behind his father’s death.And as Ann Eliza’s narrative intertwines with that of Jordan’s search, readers are pulled deeper into the mysteries of love and faith.","514 pages, Hardcover",Historical Fiction,693 followers,"6,745 reviews",13 books693 followers,"1,174 (1%)","4,470 (7%)","18,710 (31%)","24,903 (41%)","10,217 (17%)"
The Hakawati,Rabih Alameddine,"4,319",ratings626,"First published January 1, 2008","An inventive, exuberant novel that takes us from the shimmering dunes of ancient Egypt to the war-torn streets of twenty-first-century Lebanon.In 2003, Osama al-Kharrat returns to Beirut after many years in America to stand vigil at his father’s deathbed. The city is a shell of the Beirut Osama remembers, but he and his friends and family take solace in the things that have always sustained them: gossip, laughter, and, above all, stories. Osama’s grandfather was a hakawati, or storyteller, and his bewitching stories—of his arrival in Lebanon, an orphan of the Turkish wars, and of how he earned the name al-Kharrat, the fibster—are interwoven with classic tales of the Middle East, stunningly reimagined. Here are Abraham and Isaac; Ishmael, father of the Arab tribes; the ancient, fabled Fatima; and Baybars, the slave prince who vanquished the Crusaders. Here, too, are contemporary Lebanese whose stories tell a larger, heartbreaking tale of seemingly endless war—and of survival. Like a true hakawati, Rabih Alameddine has given us an Arabian Nights for this century—a funny, captivating novel that enchants and dazzles from its very first lines: “Listen. Let me take you on a journey beyond imagining. Let me tell you a story.”","528 pages, Hardcover",Fiction,785 followers,626 reviews,21 books785 followers,112 (2%),256 (5%),886 (20%),"1,545 (35%)","1,520 (35%)"
Styxx,Sherrilyn Kenyon,"22,320","ratings2,613","First published January 1, 2013","Just when you thought doomsday was over...Centuries ago Acheron saved the human race by imprisoning an ancient evil bent on absolute destruction. Now that evil has been unleashed and it is out for revenge.As the twin to Acheron, Styxx hasn’t always been on his brother’s side. They’ve spent more centuries going at each other’s throats than protecting their backs. Now Styxx has a chance to prove his loyalty to his brother, but only if he’s willing to trade his life and future for Acheron’s.The Atlantean goddess of Wrath and Misery, Bethany was born to right wrongs. But it was never a task she relished. Until now. She owes Acheron a debt that she vows to repay, no matter what it takes. He will join their fellow gods in hell and nothing is going to stop her.But things are never what they seem, and Acheron is no longer the last of his line. Styxx and Acheron must put aside their past and learn to trust each other or more will suffer.Yet it’s hard to risk your own life for someone who once tried to take yours, even when it's your own twin, and when loyalties are skewed and no one can be trusted, not even yourself, how do you find a way back from the darkness that wants to consume the entire world? One that wants to start by devouring your very soul?","836 pages, Hardcover",Paranormal,29k followers,"2,613 reviews",236 books29k followers,340 (1%),404 (1%),"1,392 (6%)","4,063 (18%)","16,121 (72%)"
A Paradise Built in Hell: The Extraordinary Communities That Arise in Disaster,Rebecca Solnit,"3,316",ratings605,"First published August 20, 2009","A startling investigation of what people do in disasters and why it matters Why is it that in the aftermath of a disaster--whether manmade or natural--people suddenly become altruistic, resourceful, and brave? What makes the newfound communities and purpose many find in the ruins and crises after disaster so joyous? And what does this joy reveal about ordinarily unmet social desires and possibilities? In A Paradise Built in Hell, award-winning author Rebecca Solnit explores these phenomena, looking at major calamities from the 1906 earthquake in San Francisco through the 1917 explosion that tore up Halifax, Nova Scotia, the 1985 Mexico City earthquake, 9/11, and Hurricane Katrina in New Orleans. She examines how disaster throws people into a temporary utopia of changed states of mind and social possibilities, as well as looking at the cost of the widespread myths and rarer real cases of social deterioration during crisis. This is a timely and important book from an acclaimed author whose work consistently locates unseen patterns and meanings in broad cultural histories.","353 pages, Hardcover",Nonfiction,"7,102 followers",605 reviews,"108 books7,102 followers",69 (2%),190 (5%),676 (20%),"1,303 (39%)","1,078 (32%)"
When Will Jesus Bring the Pork Chops?,George Carlin,"12,269",ratings630,"First published October 12, 2004","Now in paperback, the New York Times bestseller that takes readers on a riotous journey through the mind of one of America's premier comics George Carlin's legendary irreverence and iconoclasm are on full display in When Will Jesus Bring the Pork Chops? as he vainly scours the American landscape for signs of intelligence in his third national bestseller. Ranging from his absurdist side (Message from a Cockroach; TV News: The Death of Humpty Dumpty; Tips for Serial Killers) to his unerring ear for American speech (Politician Talk; Societal Clichs; Euphemisms: 13 sections) to his unsparing views on America and its values (War, God, Stuff Like That; Zero Tolerance; Tired of the Handi-crap), Carlin delivers everything that his fans expect, and then adds a few surprises. Carlin on the battle of the sexes: Here's all you have to know about men and women: Women are crazy, men are stupid. And the main reason women are crazy is that men are stupid.","295 pages, Paperback",Humor,"2,844 followers",630 reviews,"59 books2,844 followers",445 (3%),969 (7%),"2,919 (23%)","3,984 (32%)","3,952 (32%)"
Magic Hour,Kristin Hannah,"127,777","ratings8,646","First published January 1, 2006","Dr. Julia Cates was one of the country's preeminent child psychiatrists until a shocking tragedy ruined her career. Retreating to her small western Washington hometown, Julia meets an extraordinary six-year-old girl who has inexplicably emerged from the deep woods nearby—a child locked in a world of unimaginable fear and isolation. To Julia, nothing is more important than saving the girl she now calls Alice. But Julia will need help from others, including the sister she barely knows and a handsome doctor with secrets of his own. What follows will test the limits of Julia's faith and strength, as she struggles to find a home for Alice... and for herself.","451 pages, Mass Market Paperback",Fiction,217k followers,"8,646 reviews",127 books217k followers,915 (<1%),"3,746 (2%)","21,070 (16%)","50,327 (39%)","51,719 (40%)"
Ink Exchange,Melissa Marr,"62,231","ratings3,159","First published April 24, 2008","Unbeknownst to mortals, a power struggle is unfolding in a world of shadows and danger. After centuries of stability, the balance among the Faery Courts has altered, and Irial, ruler of the Dark Court, is battling to hold his rebellious and newly vulnerable fey together. If he fails, bloodshed and brutality will follow.Seventeen-year-old Leslie knows nothing of faeries or their intrigues. When she is attracted to an eerily beautiful tattoo of eyes and wings, all she knows is that she has to have it, convinced it is a tangible symbol of changes she desperately craves for her own life.The tattoo does bring changes, but not the kind Leslie has dreamed of, but sinister, compelling changes that are more than symbolic. Those changes will bind Leslie and Irial together, drawing Leslie deeper and deeper into the faery world, unable to resist its allures, and helpless to withstand its perils. . .","325 pages, Hardcover",Fantasy,12.9k followers,"3,159 reviews",105 books12.9k followers,"2,111 (3%)","6,450 (10%)","17,298 (27%)","18,957 (30%)","17,415 (27%)"
Dark Currents,Lindsay Buroker,"8,178",ratings491,"First published June 8, 2011","It's been three months since former enforcer Amaranthe Lokdon and the notorious assassin Sicarius thwarted kidnappers and saved the emperor's life. The problem? Nobody knows they were responsible for this good deed. Worse, they're being blamed for the entire scheme. With enforcers and bounty hunters stalking them, and the emperor nursing a personal hatred for Sicarius, it's going to be hard to earn exoneration. When Amaranthe's team discovers mutilated bodies in the city aqueducts and a mysterious illness incapacitates thousands of citizens, she and Sicarius see an opportunity to solve the mystery and prove their loyalty. But they'll have to defeat vengeful shamans, man-eating predators, and deadly mechanical constructs, all while dodging imperial soldiers who would rather kill them than accept their help. Nobody said exoneration would be easy.","320 pages, Kindle Edition",Fantasy,"5,431 followers",491 reviews,"180 books5,431 followers",21 (<1%),161 (1%),"1,180 (14%)","3,312 (40%)","3,504 (42%)"
The Last Runaway,Tracy Chevalier,"36,700","ratings4,389","First published January 3, 2013","New York Times bestselling author of Girl With a Pearl Earring Tracy Chevalier makes her first fictional foray into the American past in The Last Runaway, bringing to life the Underground Railroad and illuminating the principles, passions and realities that fueled this extraordinary freedom movement. In New York Times bestselling author Tracy Chevalier’s newest historical saga, she introduces Honor Bright, a modest English Quaker who moves to Ohio in 1850, only to find herself alienated and alone in a strange land. Sick from the moment she leaves England, and fleeing personal disappointment, she is forced by family tragedy to rely on strangers in a harsh, unfamiliar landscape. Nineteenth-century America is practical, precarious, and unsentimental, and scarred by the continuing injustice of slavery. In her new home Honor discovers that principles count for little, even within a religious community meant to be committed to human equality. However, drawn into the clandestine activities of the Underground Railroad, a network helping runaway slaves escape to freedom, Honor befriends two surprising women who embody the remarkable power of defiance. Eventually she must decide if she too can act on what she believes in, whatever the personal costs. A powerful journey brimming with color and drama, The Last Runaway is Tracy Chevalier’s vivid engagement with an iconic part of American history.","305 pages, Hardcover",Historical Fiction,10k followers,"4,389 reviews",64 books10k followers,454 (1%),"1,849 (5%)","9,401 (25%)","16,219 (44%)","8,777 (23%)"
The Confessor,Daniel Silva,"32,708","ratings1,422","First published February 24, 2003","Dark secrets are revealed in Vatican City in this Gabriel Allon thriller from #1 New York Times bestselling author Daniel Silva.In Munich, a Jewish scholar is assassinated. In Venice, Mossad agent and art restorer Gabriel Allon receives the news, puts down his brushes, and leaves immediately. And at the Vatican, the new pope vows to uncover the truth about the church's response to the Holocaust-while a powerful cardinal plots his next move.Now, as Allon follows a trail of secrets and unthinkable deeds, the lives of millions are changed forever-and the life of one man becomes expendable...","416 pages, Paperback",Fiction,"8,364 followers","1,422 reviews","90 books8,364 followers",211 (<1%),539 (1%),"4,838 (14%)","14,034 (42%)","13,086 (40%)"
Indignation,Philip Roth,"17,144","ratings1,766","First published September 5, 2008","Against the backdrop of the Korean War, a young man faces life’s unimagined chances and terrifying consequences.It is 1951 in America, the second year of the Korean War. A studious, law-abiding, intense youngster from Newark, New Jersey, Marcus Messner, is beginning his sophomore year on the pastoral, conservative campus of Ohio’s Winesburg College. And why is he there and not at the local college in Newark where he originally enrolled? Because his father, the sturdy, hard-working neighborhood butcher, seems to have gone mad -- mad with fear and apprehension of the dangers of adult life, the dangers of the world, the dangers he sees in every corner for his beloved boy.As the long-suffering, desperately harassed mother tells her son, the father’s fear arises from love and pride. Perhaps, but it produces too much anger in Marcus for him to endure living with his parents any longer. He leaves them and, far from Newark, in the midwestern college, has to find his way amid the customs and constrictions of another American world.Indignation, Philip Roth’s twenty-ninth book, is a story of inexperience, foolishness, intellectual resistance, sexual discovery, courage, and error. It is a story told with all the inventive energy and wit Roth has at his command, at once a startling departure from the haunted narratives of old age and experience in his recent books and a powerful addition to his investigations of the impact of American history on the life of the vulnerable individual.","235 pages, Hardcover",Fiction,"6,691 followers","1,766 reviews","258 books6,691 followers",237 (1%),"1,110 (6%)","4,741 (27%)","7,401 (43%)","3,655 (21%)"
