Title,Authors,Avg Ratings,Rating,first_published,Description,Total_Pages,Genre,author_followers,no_of_reviews,no_book_by_author,one_star_ratings,two_star_ratings,three_star_ratings,four_star_ratings,five_star_ratings
The Unlikely Pilgrimage of Harold Fry,Rachel Joyce,"179,940","ratings20,471","First published March 15, 2012","Meet Harold Fry, recently retired. He lives in a small English village with his wife, Maureen, who seems irritated by almost everything he does, even down to how he butters his toast. Little differentiates one day from the next. Then one morning the mail arrives, and within the stack of quotidian minutiae is a letter addressed to Harold in a shaky scrawl from a woman he hasn't seen or heard from in twenty years. Queenie Hennessy is in hospice and is writing to say goodbye. Harold pens a quick reply and, leaving Maureen to her chores, heads to the corner mailbox. But then, as happens in the very best works of fiction, Harold has a chance encounter, one that convinces him that he absolutely must deliver his message to Queenie in person. And thus begins the unlikely pilgrimage. Harold Fry is determined to walk six hundred miles from Kingsbridge to the hospice in Berwick-upon-Tweed because, he believes, as long as he walks, Queenie Hennessey will live. Still in his yachting shoes and light coat, Harold embarks on his urgent quest across the countryside. Along the way he meets one character after another, each of whom unlocks his long-dormant spirit and sense of promise. Memories of his first dance with Maureen, his wedding day, his joy in fatherhood, come rushing back to him - allowing him to also reconcile the losses and the regrets. As for Maureen, she finds herself missing Harold for the first time in years. And then there is the unfinished business with Queenie Hennessy.","320 pages, Hardcover",Fiction,"2,969 followers","20,471 reviews","37 books2,969 followers","2,663 (1%)","8,437 (4%)","39,463 (21%)","76,735 (42%)","52,642 (29%)"
Lips of a Mastodon,Ted Bernal Guevara,"2,910",ratings24,"First published September 30, 2015","(BACK COVER)Why does Ted Bernal Guevara keep putting out these James Dean conceptual novels? In plain truth, Guevara says, “He’s like a kid (James Dean) I went to class with, rode the bus with, and slid down an awesome snow-packed hill with.” And after high school, he goes on to Hollywood fame and immortality while Guevara from his modest bookish world is left to wonder about the iconic image, giving it a stark, poignant voice sixty years later. Guevara grew up in Marion, Indiana, where the actor was born. In 1954, Dean met perhaps the one real romance in his brief life. Italian actress Pier Angeli was barely 22 when her movie The Silver Chalice coincided with Dean’s East of Eden at Warner Brothers. She’d sneak over to watch him perform, and he would do the same. When they finally interact, Pier’s mother disapproves of Dean’s behavior, attire, and not being Catholic.Some say it was all for the limelight and publicity. Guevara’s gripping and frank story vies otherwise, excavating the actor’s true passion for the lovely but quaint Ms. Angeli.Guevara is also the author of True Feel, A Circle with Two Corners, and Days of Slint, the first James Dean conceptual novel.","226 pages, Paperback",Fiction,349 followers,24 reviews,12 books349 followers,331 (11%),330 (11%),516 (17%),837 (28%),896 (30%)
The Sisters Brothers,Patrick deWitt,"96,794","ratings9,883","First published April 26, 2011","Hermann Kermit Warm is going to die. The enigmatic and powerful man known only as the Commodore has ordered it, and his henchmen, Eli and Charlie Sisters, will make sure of it. Though Eli doesn't share his brother's appetite for whiskey and killing, he's never known anything else. But their prey isn't an easy mark, and on the road from Oregon City to Warm's gold-mining claim outside Sacramento, Eli begins to question what he does for a living - and whom he does it for.With The Sisters Brothers, Patrick deWitt pays homage to the classic Western, transforming it into an unforgettable comic tour de force. Filled with a remarkable cast of characters - losers, cheaters, and ne'er-do-wells from all stripes of life - and told by a complex and compelling narrator, it is a violent, lustful odyssey through the underworld of the 1850s frontier that beautifully captures the humor, melancholy, and grit of the Old West, and two brothers bound by blood, violence, and love.","328 pages, Hardcover",Fiction,"2,345 followers","9,883 reviews","20 books2,345 followers","1,889 (1%)","5,516 (5%)","22,460 (23%)","42,407 (43%)","24,522 (25%)"
The Past,Kenneth   Thomas,753,ratings210,"Published May 1, 2020","The Past is the first book in the VanWest series, about an Enforcer who lives in a dystopian Earth of the year 3000 and works for an authoritarian ruler called the Universal Council. Tasked with travelling through time to stop a renegade sect, that seeks to change Earth’s past, he comes to learn about his dark origins and his unique ability.Falling in love with the daughter of its leader, he returns to the present to face a difficult choice, whether or not to save her. And be part of the New Beginning.","195 pages, Paperback",Science Fiction,112 followers,210 reviews,2 books112 followers,98 (13%),51 (6%),102 (13%),100 (13%),402 (53%)
Blood & Spirits,Dennis Sharpe,"2,133",ratings50,"First published April 1, 2011","Small-town life can be hard for a dead girl...For Veronica Fischer the night to night life of a bloodsucking madam in Middle America is tough enough before she adopts Rachel Gregory, an eight year old ghost. After her house is set on fire, and Rachel disappears, all signs point to foul play. When she finds herself with a hit out on her unlife, and warrants for her arrest, it becomes clear she's going to need help.Now she has to contend with horny zombies, violent spirits, and murderous grave robbers if she's ever going to find Rachel and discover the awful truth of the coming storm.A raucous ride through the dangerous lives of the lecherous undead.","310 pages, Paperback",Urban Fantasy,151 followers,50 reviews,20 books151 followers,218 (10%),251 (11%),399 (18%),608 (28%),657 (30%)
The Casual Vacancy,J.K. Rowling,"328,102","ratings32,544","First published September 27, 2012","A BIG NOVEL ABOUT A SMALL TOWN ...When Barry Fairbrother dies unexpectedly in his early forties, the little town of Pagford is left in shock. Pagford is, seemingly, an English idyll, with a cobbled market square and an ancient abbey, but what lies behind the pretty façade is a town at war. Rich at war with poor, teenagers at war with their parents, wives at war with their husbands, teachers at war with their pupils…. Pagford is not what it first seems. And the empty seat left by Barry on the town’s council soon becomes the catalyst for the biggest war the town has yet seen. Who will triumph in an election fraught with passion, duplicity and unexpected revelations?Blackly comic, thought-provoking and constantly surprising, The Casual Vacancy is J.K. Rowling’s first novel for adults.","503 pages, Hardcover",Fiction,225k followers,"32,544 reviews",528 books225k followers,"29,964 (9%)","48,543 (14%)","97,012 (29%)","97,113 (29%)","55,470 (16%)"
Dreamcatcher,Stephen King,"174,678","ratings3,513","First published February 20, 2001","In Derry, Maine, four young boys once stood together and did a brave thing. Something that changed them in ways they hardly understand.A quarter of a century later, the boys are men who have gone their separate ways. Though they still get together once a year, to go hunting in the north woods of Maine. But this time is different. This time a man comes stumbling into their camp, lost, disoriented and muttering about lights in the sky.Before long, these old friends will be plunged into the most remarkable events of their lives as they struggle with a terrible creature from another world. Their only chance of survival is locked in their shared past - and in the Dreamcatcher.","688 pages, Paperback",Horror,841k followers,"3,513 reviews","2,523 books841k followers","6,769 (3%)","18,320 (10%)","50,226 (28%)","52,752 (30%)","46,611 (26%)"
Living Dead in Dallas,Charlaine Harris,"251,954","ratings7,581","First published March 26, 2002","Cocktail waitress Sookie Stackhouse is having a streak of bad luck. First her co-worker is killed, and no one seems to care. Then she comes face to-face with a beastly creature that gives her a painful and poisonous lashing. Enter the vampires, who graciously suck the poison from her veins (like they didn't enjoy it).The point is: they saved her life. So when one of the bloodsuckers asks for a favor, she obliges - and soon Sookie's in Dallas, using her telepathic skills to search for a missing vampire. She's supposed to interview certain humans involved, but she makes one condition: the vampires must promise to behave and let the humans go unharmed. But that's easier said than done, and all it takes is one delicious blonde and one small mistake for things to turn deadly....","291 pages, Mass Market Paperback",Fantasy,35.8k followers,"7,581 reviews",278 books35.8k followers,"2,673 (1%)","10,945 (4%)","60,161 (23%)","97,124 (38%)","81,051 (32%)"
"Julie and Julia: 365 Days, 524 Recipes, 1 Tiny Apartment Kitchen",Julie Powell,"159,323","ratings8,284","First published September 1, 2005","With the humor of Bridget Jones and the vitality of Augusten Burroughs, Julie Powell recounts how she conquered every recipe in Julia Child's Mastering the Art of French Cooking and saved her soul!Julie Powell is 30-years-old, living in a rundown apartment in Queens and working at a soul-sucking secretarial job that’s going nowhere. She needs something to break the monotony of her life, and she invents a deranged assignment. She will take her mother's dog-eared copy of Julia Child's 1961 classic Mastering the Art of French Cooking, and she will cook all 524 recipes. In the span of one year. At first she thinks it will be easy. But as she moves from the simple Potage Parmentier (potato soup) into the more complicated realm of aspics and crépes, she realizes there’s more to Mastering the Art of French Cooking than meets the eye. With Julia’s stern warble always in her ear, Julie haunts the local butcher, buying kidneys and sweetbreads. She sends her husband on late-night runs for yet more butter and rarely serves dinner before midnight. She discovers how to mold the perfect Orange Bavarian, the trick to extracting marrow from bone, and the intense pleasure of eating liver. And somewhere along the line she realizes she has turned her kitchen into a miracle of creation and cuisine. She has eclipsed her life’s ordinariness through spectacular humor, hysteria, and perseverance.","310 pages, Hardcover",Nonfiction,329 followers,"8,284 reviews",8 books329 followers,"5,407 (3%)","13,842 (8%)","43,646 (27%)","54,814 (34%)","41,614 (26%)"
Fantastic Beasts and Where to Find Them,J.K. Rowling,"398,800","ratings12,609","First published March 1, 2001","A copy of Fantastic Beasts and Where to Find Them resides on almost every wizarding household in the country. Now, for a limited period only, Muggles too have the chance to discover where the Quintaped lives, what the Puffskein eats, and why it is best not to leave milk out for a Knarl. Proceeds from the sale of this book will go to improving and saving the lives of children around the world, which means that the dollars and Galleons you exchange for it will do magic beyond the powers of any wizard. If you feel that this is insufficient reason to part with your money, I can only hope most sincerel that passing wizards feel more charitable if they ever see you being attacked by a Manticore. 

-Albus Dumbledore","128 pages, Hardcover",Fantasy,225k followers,"12,609 reviews",528 books225k followers,"7,069 (1%)","24,828 (6%)","95,701 (23%)","121,020 (30%)","150,182 (37%)"
Club Dead,Charlaine Harris,"235,424","ratings6,036","First published April 29, 2003","Things between cocktail waitress Sookie and her vampire boyfriend Bill seem to be going excellently (apart from the small matter of him being undead) until he leaves town for a while. A long while. Bill's sinister boss Eric has an idea of where to find him, whisking her off to Jackson, Mississippi to mingle with the under-underworld at Club Dead. When she finally catches up with the errant vampire, he is in big trouble and caught in an act of serious betrayal. This raises serious doubts as to whether she should save him or start sharpening a few stakes of her own ..","274 pages, Mass Market Paperback",Fantasy,35.8k followers,"6,036 reviews",278 books35.8k followers,"2,239 (<1%)","8,359 (3%)","52,598 (22%)","92,342 (39%)","79,886 (33%)"
Moon Called,Patricia Briggs,"205,216","ratings10,095","First published January 31, 2006","Mercedes Thompson, aka Mercy, is a talented Volkswagen mechanic living in the Tri-Cities area of Washington. She also happens to be a walker, a magical being with the power to shift into a coyote at will. Mercy's next-door neighbor is a werewolf. Her former boss is a gremlin. And she's fixing a bus for a vampire. This is the world of Mercy Thompson, one that looks a lot like ours but is populated by those things that go bump in the night. And Mercy's connection to those things is about to get her into some serious hot water...","289 pages, Mass Market Paperback",Urban Fantasy,28.5k followers,"10,095 reviews",140 books28.5k followers,"4,689 (2%)","8,033 (3%)","32,282 (15%)","67,442 (32%)","92,770 (45%)"
Carnal: Somewhere Over 40 Winks,Rom LcO'Feer,"1,998",ratings13,"First published January 1, 2009","Have you heard of a place called Mong where the dream world intersects with the real world? At Mong, rules are easily bent and intuition often overwhelms logic. Desires go out of control and wishes come true in wrong ways. Once captured, monsters and villains from Mong are sent to the prison of Nightmare. A hideous serial killer manages to break out of the jail into the real world, terrifying the earthlings. A reporter from an obscure magazine company hunts the killer doggedly. Or is it the other way around? He has to find the clues about the killer before his girlfriend becomes the next victim. Time is dashing forward. In desperation, the reporter decides to cross the border of no return and climbs down into Mong. Little did he know what's waiting for him at that murky place.","222 pages, Paperback",Psychology,281 followers,13 reviews,5 books281 followers,217 (10%),229 (11%),389 (19%),587 (29%),576 (28%)
Possession of My Heart,Kia Carrington-Russell,"1,992",ratings24,"First published October 10, 2014","After the great fight between Tyran and Misfeata, Karla’s body is recovering. Misfeata has manipulated and possessed her body — now, she lies dormant. But for how long? Paul and Karla continue to venture into the unknown. Karla is in pursuit of her parents, as well as a cure for her body in which Shielder blood now resides. She must find a cure for herself both physically and mentally as she struggles with the morals of this very different world. As Karla tries to avoid the war, she inevitably drags Paul into dangerous circumstances. A rare Elemental Breather is after Karla and out for war, but why? Now, not only combating the Starkorfs, Karla must contend with the Elemental Breathers and her own fighting spirit. In this time of hardship, Lucas comes back into her life. He is also targeted by the strange Elemental Breather, Taskatae, who calls herself ‘Mother.’ After his betrayal, Karla must learn to trust him again as he reminds her who she truly is now. Can she survive the constant battles from not only the physical world but from within? For a while Misfeata is dormant; Karla must try to keep hidden her true feelings. Karla is in turmoil as she faces who may truly possess her heart.","258 pages, Paperback",author-review,538 followers,24 reviews,41 books538 followers,224 (11%),223 (11%),377 (18%),559 (28%),609 (30%)
Fall of Giants,Ken Follett,"321,397","ratings16,061","First published September 28, 2010","This is an epic of love, hatred, war and revolution. This is a huge novel that follows five families through the world-shaking dramas of the First World War, the Russian Revolution, and the struggle for votes for women.
It is 1911. The Coronation Day of King George V. The Williams, a Welsh coal-mining family is linked by romance and enmity to the Fitzherberts, aristocratic coal-mine owners. Lady Maud Fitzherbert falls in love with Walter von Ulrich, a spy at the German Embassy in London. Their destiny is entangled with that of an ambitious young aide to U.S. President Woodrow Wilson and to two orphaned Russian brothers, whose plans to emigrate to America fall foul of war, conscription and revolution. In a plot of unfolding drama and intriguing complexity, ""Fall Of Giants"" moves seamlessly from Washington to St Petersburg, from the dirt and danger of a coal mine to the glittering chandeliers of a palace, from the corridors of power to the bedrooms of the mighty.","985 pages, Hardcover",Historical Fiction,53.7k followers,"16,061 reviews",439 books53.7k followers,"3,644 (1%)","7,909 (2%)","36,755 (11%)","108,780 (33%)","164,309 (51%)"
Houdini Heart,Ki Longfellow,"5,470",ratings228,"First published April 25, 2011","HOUDINI HEART harkens back to the masters of suspenseful supernatural Poe, Lovecraft, Shirley Jackson, but speaks with a wholly fresh voice. Once caught in its pages, there's no escaping Longfellow's terrible tale. Weeks ago, she was one of Hollywood's biggest writers, wed to one of its greatest stars. The doting mother of their golden child. But now? She's alone, tortured by a horrifying secret no woman could bear. Pursued by those she can't outrun, anguished by a guilt she can't endure, and driven close to madness, she flees to the one place she's ever called a small town in Vermont where River House still stands. To a child, the splendid hotel was mysterious and magical and all its glamorous guests knew delicious secrets.Cocooned in its walls, she will write one last book. Her atonement? Or her suicide note? But life is never as you dream it, and River House isn't what she'd always imagined it was. Intense, literary, and harrowing, Houdini Heart is a tale of bone-chilling horror, emotional torment, and psychological terror. Gripped by River House, trapped in an aging hotel of mirrors only Houdini could escape, how much can haunt a mind before it too is only a thing once imagined? ""A haunting and disturbing journey through the psyche.""—Erika Mailman, Author of ""The Witch's Trinity""","254 pages, Paperback",Horror,"1,214 followers",228 reviews,"17 books1,214 followers",455 (8%),459 (8%),776 (14%),"1,613 (29%)","2,167 (39%)"
Fragile Things: Short Fictions and Wonders,Neil Gaiman,"69,500","ratings4,549","First published September 25, 2006","A mysterious circus terrifies an audience for one extraordinary performance before disappearing into the night, taking one of the spectators along with it . . . In a novella set two years after the events of American Gods, Shadow pays a visit to an ancient Scottish mansion, and finds himself trapped in a game of murder and monsters . . . In a Hugo Award-winning short story set in a strangely altered Victorian England, the great detective Sherlock Holmes must solve a most unsettling royal murder . . . Two teenage boys crash a party and meet the girls of their dreams—and nightmares . . . In a Locus Award-winning tale, the members of an exclusive epicurean club lament that they've eaten everything that can be eaten, with the exception of a legendary, rare, and exceedingly dangerous Egyptian bird . . . Such marvelous creations and more—including a short story set in the world of The Matrix, and others set in the worlds of gothic fiction and children's fiction—can be found in this extraordinary collection, which showcases Gaiman's storytelling brilliance as well as his terrifyingly entertaining dark sense of humor. By turns delightful, disturbing, and diverting, Fragile Things is a gift of literary enchantment from one of the most unique writers of our time.","360 pages, Hardcover",Fantasy,313k followers,"4,549 reviews","2,139 books313k followers","1,106 (1%)","3,151 (4%)","14,610 (21%)","29,221 (42%)","21,412 (30%)"
The Tiger's Wife,Téa Obreht,"99,283","ratings11,384","First published March 8, 2011","Weaving a brilliant latticework of family legend, loss, and love, Téa Obreht, the youngest of The New Yorker’s twenty best American fiction writers under forty, has spun a timeless novel that will establish her as one of the most vibrant, original authors of her generation.In a Balkan country mending from years of conflict, Natalia, a young doctor, arrives on a mission of mercy at an orphanage by the sea. By the time she and her lifelong friend Zóra begin to inoculate the children there, she feels age-old superstitions and secrets gathering everywhere around her. Secrets her outwardly cheerful hosts have chosen not to tell her. Secrets involving the strange family digging for something in the surrounding vineyards. Secrets hidden in the landscape itself.But Natalia is also confronting a private, hurtful mystery of her own: the inexplicable circumstances surrounding her beloved grandfather’s recent death. After telling her grandmother that he was on his way to meet Natalia, he instead set off for a ramshackle settlement none of their family had ever heard of and died there alone. A famed physician, her grandfather must have known that he was too ill to travel. Why he left home becomes a riddle Natalia is compelled to unravel. Grief struck and searching for clues to her grandfather’s final state of mind, she turns to the stories he told her when she was a child. On their weeklytrips to the zoo he would read to her from a worn copy of Rudyard Kipling’s The Jungle Book, which he carried with him everywhere; later, he told her stories of his own encounters over many years with “the deathless man,” a vagabond who claimed to be immortal and appeared never to age. But the most extraordinary story of all is the one her grandfather never told her, the one Natalia must discover for herself. One winter during the Second World War, his childhood village was snowbound, cut off even from the encroaching German invaders but haunted by another, fierce presence: a tiger who comes ever closer under cover of darkness. “These stories,” Natalia comes to understand, “run like secret rivers through all the other stories” of her grandfather’s life. And it is ultimately within these rich, luminous narratives that she will find the answer she is looking for.","338 pages, Hardcover",Fiction,"1,448 followers","11,384 reviews","13 books1,448 followers","5,154 (5%)","13,600 (13%)","31,764 (31%)","32,195 (32%)","16,570 (16%)"
Suzanne's Diary for Nicholas,James Patterson,"149,949","ratings5,358","First published January 1, 2001","Beautifully captures the joys of a new family as it builds to an overwhelmingly moving climax. This is an unforgettable love story, at once heartbreaking and full of hope.James Patterson has written a love story!--a powerfully moving and suspenseful novel about families, loss, new love, and hope. Katie Wilkinson has found her perfect man at last. He's a writer, a house painter, an original thinker--everything she's imagined she wanted in a partner. But one day, without explanation, he disappears from her life, leaving behind only a diary for her to read. This diary is a love letter written by a new mother named Suzanne for her baby son, Nicholas. In it she pours out her heart about how she and the boy's father met, about her hopes for marriage and family, and about the unparalleled joy that having a baby has brought into her life. As Katie reads this touching document, it becomes clear that the lover who has just left her is the husband and father in this young family. She reads on, filled with terror and hope, as she struggles to understand what has happened--and whether her new love has a prayer of surviving. Written with James Patterson's perfect pitch for emotion and suspense, Suzanne's Diary for Nicholas captures beautifully the joys of a new family as it builds to an overwhelmingly moving climax. This is an unforgettable love story, at once heartbreaking and full of hope.","289 pages, Mass Market Paperback",Romance,345k followers,"5,358 reviews","1,591 books345k followers","2,690 (1%)","6,407 (4%)","24,643 (16%)","45,515 (30%)","70,694 (47%)"
