Title,Authors,Avg Ratings,Rating,first_published,Description,Total_Pages,Genre,author_followers,no_of_reviews,no_book_by_author,one_star_ratings,two_star_ratings,three_star_ratings,four_star_ratings,five_star_ratings
Aristotle and Dante Discover the Secrets of the Universe,Benjamin Alire Sáenz,"593,322","ratings71,730","First published February 21, 2012","Dante can swim. Ari can't. Dante is articulate and self-assured. Ari has a hard time with words and suffers from self-doubt. Dante gets lost in poetry and art. Ari gets lost in thoughts of his older brother who is in prison. Dante is fair skinned. Ari's features are much darker. It seems that a boy like Dante, with his open and unique perspective on life, would be the last person to break down the walls that Ari has built around himself.But against all odds, when Ari and Dante meet, they develop a special bond that will teach them the most important truths of their lives, and help define the people they want to be. But there are big hurdles in their way, and only by believing in each other―and the power of their friendship―can Ari and Dante emerge stronger on the other side.","390 pages, Hardcover",Young Adult,14.9k followers,"71,730 reviews",39 books14.9k followers,"8,564 (1%)","17,677 (2%)","70,383 (11%)","177,620 (29%)","319,078 (53%)"
The Art of Fielding,Chad Harbach,"112,808","ratings10,746","First published September 7, 2011","At Westish College, a small school on the shore of Lake Michigan, baseball star Henry Skrimshander seems destined for big league stardom. But when a routine throw goes disastrously off course, the fates of five people are upended. Henry's fight against self-doubt threatens to ruin his future. College president Guert Affenlight, a longtime bachelor, has fallen unexpectedly and helplessly in love. Owen Dunne, Henry's gay roommate and teammate, becomes caught up in a dangerous affair. Mike Schwartz, the Harpooners' team captain and Henry's best friend, realizes he has guided Henry's career at the expense of his own. And Pella Affenlight, Guert's daughter, returns to Westish after escaping an ill-fated marriage, determined to start a new life. As the season counts down to its climactic final game, these five are forced to confront their deepest hopes, anxieties, and secrets. In the process they forge new bonds, and help one another find their true paths. Written with boundless intelligence and filled with the tenderness of youth, The Art of Fielding is an expansive, warmhearted novel about ambition and its limits, about family and friendship and love, and about commitment - to oneself and to others.","512 pages, Hardcover",Fiction,860 followers,"10,746 reviews",13 books860 followers,"2,328 (2%)","5,316 (4%)","21,024 (18%)","46,964 (41%)","37,176 (32%)"
Eleanor Oliphant Is Completely Fine,Gail Honeyman,"1,210,810","ratings96,262","First published May 9, 2017","No one’s ever told Eleanor that life should be better than fineMeet Eleanor Oliphant: she struggles with appropriate social skills and tends to say exactly what she’s thinking. Nothing is missing in her carefully timetabled life of avoiding unnecessary human contact, where weekends are punctuated by frozen pizza, vodka, and phone chats with Mummy. But everything changes when Eleanor meets Raymond, the bumbling and deeply unhygienic IT guy from her office. When she and Raymond together save Sammy, an elderly gentleman who has fallen, the three rescue one another from the lives of isolation that they had been living. Ultimately, it is Raymond’s big heart that will help Eleanor find the way to repair her own profoundly damaged one. If she does, she'll learn that she, too, is capable of finding friendship—and even love—after all.Smart, warm, uplifting, Eleanor Oliphant Is Completely Fine is the story of an out-of-the-ordinary heroine whose deadpan weirdness and unconscious wit make for an irresistible journey as she realizes. . .  the only way to survive is to open your heart.","336 pages, Hardcover",Fiction,12.2k followers,"96,262 reviews",7 books12.2k followers,"13,169 (1%)","33,951 (2%)","156,236 (12%)","453,205 (37%)","554,249 (45%)"
Girl in Translation,Jean Kwok,"56,063","ratings6,401","First published April 29, 2010","Introducing a fresh, exciting Chinese-American voice, an inspiring debut about an immigrant girl forced to choose between two worlds and two futures.When Kimberly Chang and her mother emigrate from Hong Kong to Brooklyn squalor, she quickly begins a secret double life: exceptional schoolgirl during the day, Chinatown sweatshop worker in the evenings. Disguising the more difficult truths of her life like the staggering degree of her poverty, the weight of her family’s future resting on her shoulders, or her secret love for a factory boy who shares none of her talent or ambition. Kimberly learns to constantly translate not just her language but herself back and forth between the worlds she straddles.Through Kimberly’s story, author Jean Kwok, who also emigrated from Hong Kong as a young girl, brings to the page the lives of countless immigrants who are caught between the pressure to succeed in America, their duty to their family, and their own personal desires, exposing a world that we rarely hear about. Written in an indelible voice that dramatizes the tensions of an immigrant girl growing up between two cultures, surrounded by a language and world only half understood, Girl in Translation is an unforgettable and classic novel of an American immigrant--a moving tale of hardship and triumph, heartbreak and love, and all that gets lost in translation.","305 pages, Hardcover",Fiction,"2,142 followers","6,401 reviews","12 books2,142 followers",589 (1%),"1,957 (3%)","11,426 (20%)","25,688 (45%)","16,403 (29%)"
Percy Jackson and the Olympians,Rick Riordan,"44,714",ratings674,"First published September 16, 2008","Humans and half-bloods agree—Percy Jackson and the Olympians is a series fit for heroes! Relive the adventure from the beginning with this boxed set of the first three books with glorious new cover art by John Rocco.
The Lightning Thief
Percy Jackson is a good kid, but he can't seem to focus on his schoolwork or control his temper. When his mom tells him the truth about where he came from, she takes him to the one place he'll be safe—Camp Half-Blood, a summer camp for demigods (on Long Island). There, Percy learns that the father he never knew is actually Poseidon, God of the Sea. Soon Percy finds himself caught up in a mystery that could lead to disastrous consequences. Together with his friends—a satyr and another the demigod daughter of Athena—Percy sets out on a quest to reach the gates of the Underworld (located in a recording studio in Hollywood) and prevent a catastrophic war between the gods.
The Sea of Monsters
After a summer spent trying to prevent a catastrophic war among the Greek gods, Percy Jackson finds his seventh-grade school year unnervingly calm. But things don't stay quiet for long. Percy soon discovers there is trouble at Camp Half-Blood: the magical borders which protect Half-Blood Hill have been poisoned by a mysterious enemy, and the only safe haven for demigods is on the verge of being overrun by mythological monsters. To save the camp, Percy needs the help of his best friend, Grover, who has been taken prisoner by the Cyclops Polyphemus on an island somewhere in the Sea of Monsters—the dangerous waters Greek heroes have sailed for millennia—only today, the Sea of Monsters goes by a new name: the Bermuda Triangle. Now Percy and his friends must retrieve the Golden Fleece from the Island of the Cyclops by the end of the summer or Camp Half-Blood will be destroyed. But first, Percy will learn a stunning new secret about his family—one that makes him question whether being claimed as Poseidon's son is an honor or simply a cruel joke…
The Titan's Curse
When Percy Jackson receives a distress call from his friend Grover, he immediately prepares for battle. He knows he'll need his powerful demigod allies, Annabeth and Thalia, at his side; his trusty bronze sword Riptide; and…a ride from his mom. The demigods race to the rescue, to find that Grover has made an important discovery: two new powerful half-bloods whose parentage is unknown. But that's not all that awaits them. The Titan lord, Kronos, has set up his most devious trap yet, and the young heroes have unwittingly fallen prey. Hilarious and action-packed, this third adventure in the series finds Percy faced with his most dangerous challenge so far: the chilling prophecy of the Titan's curse.","1032 pages, Paperback",Fantasy,423k followers,674 reviews,241 books423k followers,590 (1%),754 (1%),"3,339 (7%)","9,106 (20%)","30,925 (69%)"
"Full Dark, No Stars",Stephen King,"109,067","ratings7,682","First published January 1, 2011","""I believe there is another man inside every man, a stranger..."" writes Wilfred Leland James in the early pages of the riveting confession that makes up ""1922."" the first in this pitch-black quartet of mesmerizing tales from Stephen King. For James, that stranger is awakened when his wife, Arlette, proposes selling off the family homestead and moving to Omaha, setting in motion a gruesome train of murder and madness. In ""Big Driver,"" a cozy-mystery writer named Tess encounters the stranger along a back road in Massachusetts when she takes a shortcut home after a book-club engagement. Violated and left for dead, Tess plots a revenge that will bring her face-to-face with another stranger: the one inside herself. ""Fair Extension,"" the shortest of these tales, is perhaps the nastiest and certainly the funniest. Making a deal with the devil not only saves Dave Streeter from a fatal cancer but provides rich recompense for a lifetime of resentment. When her husband of more than twenty years is away on one of his business trips, Darcy Anderson looks for batteries in the garage. Her toe knocks up against a box under a worktable and she discovers the stranger inside her husband. It's a horrifying discovery, rendered with bristling intensity, and it definitely ends a good marriage. Like Different Seasons and Four Past Midnight, which generated such enduring films as The Shawshank Redemption and Stand By Me, Full Dark, No Stars proves Stephen King a master of the long story form.(front flap)Contains:1922Big DriverA Fair ExtensionA Good Marriage","368 pages, Hardcover",Horror,841k followers,"7,682 reviews","2,523 books841k followers","1,235 (1%)","3,564 (3%)","19,929 (18%)","45,058 (41%)","39,281 (36%)"
Case Histories,Kate Atkinson,"106,891","ratings7,977","First published September 1, 2004","In #1 of series, Jackson Brodie PI follows three 30-years cold, unconnected Cambridge family cases:  1 A little girl disappears in the night.  2 A beautiful young office worker falls to a maniac's attack. 3 A new mother is overwhelmed by demands from her baby and husband - until a fit of rage creates a grisly, bloody escape.Result : Startling connections and discoveries emerge. . . .","389 pages, Paperback",Mystery,10.8k followers,"7,977 reviews",56 books10.8k followers,"2,599 (2%)","6,921 (6%)","26,285 (24%)","43,878 (41%)","27,208 (25%)"
The Storied Life of A.J. Fikry,Gabrielle Zevin,"292,474","ratings37,920","First published April 1, 2014","On the faded Island Books sign hanging over the porch of the Victorian cottage is the motto “No Man Is an Island; Every Book Is a World.” A. J. Fikry, the irascible owner, is about to discover just what that truly means.A. J. Fikry’s life is not at all what he expected it to be. His wife has died, his bookstore is experiencing the worst sales in its history, and now his prized possession, a rare collection of Poe poems, has been stolen. Slowly but surely, he is isolating himself from all the people of Alice Island—from Lambiase, the well-intentioned police officer who’s always felt kindly toward Fikry; from Ismay, his sister-in-law who is hell-bent on saving him from his dreary self; from Amelia, the lovely and idealistic (if eccentric) Knightley Press sales rep who keeps on taking the ferry over to Alice Island, refusing to be deterred by A.J.’s bad attitude. Even the books in his store have stopped holding pleasure for him. These days, A.J. can only see them as a sign of a world that is changing too rapidly.And then a mysterious package appears at the bookstore. It’s a small package, but large in weight. It’s that unexpected arrival that gives A. J. Fikry the opportunity to make his life over, the ability to see everything anew. It doesn’t take long for the locals to notice the change overcoming A.J.; or for that determined sales rep, Amelia, to see her curmudgeonly client in a new light; or for the wisdom of all those books to become again the lifeblood of A.J.’s world; or for everything to twist again into a version of his life that he didn’t see coming. As surprising as it is moving, The Storied Life of A. J. Fikry is an unforgettable tale of transformation and second chances, an irresistible affirmation of why we read, and why we love.","260 pages, Hardcover",Fiction,14.1k followers,"37,920 reviews",16 books14.1k followers,"3,784 (1%)","10,128 (3%)","54,642 (18%)","128,943 (44%)","94,977 (32%)"
I am Charlotte Simmons,Tom Wolfe,"27,647","ratings2,132","First published December 9, 2004","Tom Wolfe, the master social novelist of our time, the spot-on chronicler of all things contemporary and cultural, presents a sensational new novel about life, love, and learning--or the lack of it--amid today's American colleges.Our story unfolds at fictional Dupont University: those Olympian halls of scholarship housing the cream of America's youth, the roseate Gothic spires and manicured lawns suffused with tradition . . . Or so it appears to beautiful, brilliant Charlotte Simmons, a sheltered freshman from North Carolina. But Charlotte soon learns, to her mounting dismay, that for the upper-crust coeds of Dupont, sex, cool, and kegs trump academic achievement every time.As Charlotte encounters the paragons of Dupont's privileged elite--her roommate, Beverly, a Groton-educated Brahmin in lusty pursuit of lacrosse players; Jojo Johanssen, the only white starting player on Dupont's godlike basketball team, whose position is threatened by a hotshot black freshman from the projects; the Young Turk of Saint Ray fraternity, Hoyt Thorpe, whose heady sense of entitlement and social domination is clinched by his accidental brawl with a bodyguard for the governor of California; and Adam Geller, one of the Millennial Mutants who run the university's ""independent"" newspaper and who consider themselves the last bastion of intellectual endeavor on the sex-crazed, jock-obsessed campus--she is seduced by the heady glamour of acceptance, betraying both her values and upbringing before she grasps the power of being different--and the exotic allure of her own innocence.With his trademark satirical wit and famously sharp eye for telling detail, Wolfe's I Am Charlotte Simmons draws on extensive observations at campuses across the country to immortalize the early-21st-century college-going experience.","738 pages, Paperback",Fiction,"2,730 followers","2,132 reviews","165 books2,730 followers","1,857 (6%)","3,536 (12%)","8,011 (28%)","8,857 (32%)","5,386 (19%)"
The Raven Boys,Maggie Stiefvater,"364,703","ratings41,511","First published September 18, 2012","“There are only two reasons a non-seer would see a spirit on St. Mark’s Eve,” Neeve said. “Either you’re his true love . . . or you killed him.”It is freezing in the churchyard, even before the dead arrive.Every year, Blue Sargent stands next to her clairvoyant mother as the soon-to-be dead walk past. Blue herself never sees them—not until this year, when a boy emerges from the dark and speaks directly to her.His name is Gansey, and Blue soon discovers that he is a rich student at Aglionby, the local private school. Blue has a policy of staying away from Aglionby boys. Known as Raven Boys, they can only mean trouble.But Blue is drawn to Gansey, in a way she can’t entirely explain. He has it all—family money, good looks, devoted friends—but he’s looking for much more than that. He is on a quest that has encompassed three other Raven Boys: Adam, the scholarship student who resents all the privilege around him; Ronan, the fierce soul who ranges from anger to despair; and Noah, the taciturn watcher of the four, who notices many things but says very little.For as long as she can remember, Blue has been warned that she will cause her true love to die. She never thought this would be a problem. But now, as her life becomes caught up in the strange and sinister world of the Raven Boys, she’s not so sure anymore.","409 pages, Hardcover",Fantasy,169k followers,"41,511 reviews",63 books169k followers,"9,025 (2%)","17,689 (4%)","62,595 (17%)","131,853 (36%)","143,541 (39%)"
The Woods,Harlan Coben,"99,343","ratings5,879","First published January 1, 2007","Twenty years ago, four teenagers disappeared in the woods at summer camp. Two decades later, everything changes...Paul Copeland's sister was one of the missing teenagers. Now raising a daughter alone after the death of his wife, he balances family life with a career as a prosecutor. But when a body is found, the well-buried secrets of the past threaten everything.Could the victim be one of the missing teenagers? Could his sister be alive? Copeland has to confront so much he left behind that summer twenty years ago: his first love, Lucy; his mother, who abandoned the family; and the secrets that his parents have been hiding ...","404 pages, Hardcover",Mystery,35.7k followers,"5,879 reviews",222 books35.7k followers,"1,062 (1%)","3,167 (3%)","18,637 (18%)","42,812 (43%)","33,665 (33%)"
Beautiful Disaster,Jamie McGuire,"678,921","ratings34,269","First published May 26, 2011","The new Abby Abernathy is a good girl. She doesn’t drink or swear, and she has the appropriate number of cardigans in her wardrobe. Abby believes she has enough distance from the darkness of her past, but when she arrives at college with her best friend, her path to a new beginning is quickly challenged by Eastern University's Walking One-Night Stand. Travis Maddox, lean, cut, and covered in tattoos, is exactly what Abby needs—and wants—to avoid. He spends his nights winning money in a floating fight ring, and his days as the ultimate college campus charmer. Intrigued by Abby’s resistance to his appeal, Travis tricks her into his daily life with a simple bet. If he loses, he must remain abstinent for a month. If Abby loses, she must live in Travis’s apartment for the same amount of time. Either way, Travis has no idea that he has met his match.","432 pages, Kindle Edition",Romance,42.3k followers,"34,269 reviews",45 books42.3k followers,"35,284 (5%)","45,341 (6%)","108,649 (16%)","174,790 (25%)","314,857 (46%)"
Beautiful Ruins,Jess Walter,"176,792","ratings16,864","First published June 12, 2012","""The best novel of the year."" — Maureen Corrigan, NPR's Fresh AirA #1 New York Times bestseller, this “absolute masterpiece” (Richard Russo) is the story of an almost-love affair that begins on the Italian coast in 1962 and resurfaces fifty years later in Hollywood. From the lavish set of Cleopatra to the shabby revelry of the Edinburgh Fringe Festival to the back lots of contemporary Hollywood, this is a dazzling, yet deeply human roller coaster of a novel.The acclaimed author of the national bestseller The Financial Lives of the Poets returns with his funniest, most romantic, and most purely enjoyable novel yet. Hailed by critics and loved by readers of literary and historical fiction, Beautiful Ruins is gloriously inventive and constantly surprising—a story of flawed yet fascinating people navigating the rocky shores of their lives while clinging to their improbable dreams.","337 pages, Hardcover",Fiction,"2,205 followers","16,864 reviews","42 books2,205 followers","4,106 (2%)","14,447 (8%)","52,410 (29%)","69,082 (39%)","36,747 (20%)"
Big Little Lies,Liane Moriarty,"997,764","ratings54,344","First published December 25, 2014","Sometimes it’s the little lies that turn out to be the most lethal...A murder . . . a tragic accident . . . or just parents behaving badly? What’s indisputable is that someone is dead. But who did what?Big Little Lies follows three women, each at a crossroads: Madeline is a force to be reckoned with. She’s funny and biting, passionate, she remembers everything and forgives no one. Her ex-husband and his yogi new wife have moved into her beloved beachside community, and their daughter is in the same kindergarten class as Madeline’s youngest (how is this possible?). And to top it all off, Madeline’s teenage daughter seems to be choosing Madeline’s ex-husband over her. (How. Is. This. Possible?).Celeste is the kind of beautiful woman who makes the world stop and stare. While she may seem a bit flustered at times, who wouldn’t be, with those rambunctious twin boys? Now that the boys are starting school, Celeste and her husband look set to become the king and queen of the school parent body. But royalty often comes at a price, and Celeste is grappling with how much more she is willing to pay. New to town, single mom Jane is so young that another mother mistakes her for the nanny. Jane is sad beyond her years and harbors secret doubts about her son. But why? While Madeline and Celeste soon take Jane under their wing, none of them realizes how the arrival of Jane and her inscrutable little boy will affect them all.Big Little Lies is a brilliant take on ex-husbands and second wives, mothers and daughters, schoolyard scandal, and the dangerous little lies we tell ourselves just to survive.","458 pages, Hardcover",Fiction,64.6k followers,"54,344 reviews",38 books64.6k followers,"8,726 (<1%)","17,930 (1%)","109,091 (10%)","382,498 (38%)","479,519 (48%)"
For One More Day,Mitch Albom,"147,198","ratings9,668","First published September 26, 2006","""Every family is a ghost story...""Mitch Albom mesmerized readers around the world with his number one 
New York Times
 bestsellers, The Five People You Meet in Heaven and Tuesdays with Morrie. Now he returns with a beautiful, haunting novel about the family we love and the chances we miss.For One More Day is the story of a mother and a son, and a relationship that covers a lifetime and beyond. It explores the question: What would you do if you could spend one more day with a lost loved one? As a child, Charley ""Chick"" Benetto was told by his father, ""You can be a mama's boy or a daddy's boy, but you can't be both."" So he chooses his father, only to see the man disappear when Charley is on the verge of adolescence. Decades later, Charley is a broken man. His life has been crumbled by alcohol and regret. He loses his job. He leaves his family. He hits bottom after discovering his only daughter has shut him out of her wedding. And he decides to take his own life.He makes a midnight ride to his small hometown, with plans to do himself in. But upon failing even to do that, he staggers back to his old house, only to make an astonishing discovery. His mother, who died eight years earlier, is still living there, and welcomes him home as if nothing ever happened..What follows is the one ""ordinary"" day so many of us yearn for, a chance to make good with a lost parent, to explain the family secrets, and to seek forgiveness. Somewhere between this life and the next, Charley learns the astonishing things he never knew about his mother and her sacrifices. And he tries, with her tender guidance, to put the crumbled pieces of his life back together.Through Albom's inspiring characters and masterful storytelling, readers will newly appreciate those whom they love and may have thought they'd lost in their own lives. For One More Day is a book for anyone in a family, and will be cherished by Albom's millions of fans worldwide.","208 pages, Hardcover",Fiction,110k followers,"9,668 reviews",86 books110k followers,"1,562 (1%)","5,409 (3%)","26,962 (18%)","53,518 (36%)","59,747 (40%)"
The Miraculous Journey of Edward Tulane,Kate DiCamillo,"108,249","ratings12,713","First published February 14, 2006","A timeless tale by the incomparable Kate DiCamillo, complete with stunning full-color plates by Bagram Ibatoulline, honors the enduring power of love.Once, in a house on Egypt Street, there lived a china rabbit named Edward Tulane. The rabbit was very pleased with himself, and for good he was owned by a girl named Abilene, who treated him with the utmost care and adored him completely.And then, one day, he was lost.Kate DiCamillo takes us on an extraordinary journey, from the depths of the ocean to the net of a fisherman, from the top of a garbage heap to the fireside of a hoboes' camp, from the bedside of an ailing child to the bustling streets of Memphis. And along the way, we are shown a true miracle — that even a heart of the most breakable kind can learn to love, to lose, and to love again.","228 pages, Hardcover",Fantasy,"9,577 followers","12,713 reviews","117 books9,577 followers","1,181 (1%)","2,599 (2%)","11,816 (10%)","30,922 (28%)","61,731 (57%)"
