Title,Authors,Avg Ratings,Rating,first_published,Description,Total_Pages,Genre,author_followers,no_of_reviews,no_book_by_author,one_star_ratings,two_star_ratings,three_star_ratings,four_star_ratings,five_star_ratings
Girls of Storm and Shadow,Natasha Ngan,"13,979","ratings2,179","November 5, 2019","In this mesmerizing sequel to the New York Times bestselling Girls of Paper and Fire, Lei and Wren have escaped their oppressive lives in the Hidden Palace, but soon learn that freedom comes with a terrible cost.Lei, the naive country girl who became a royal courtesan, is now known as the Moonchosen, the commoner who managed to do what no one else could. But slaying the cruel Demon King wasn't the end of the plan---it's just the beginning. Now Lei and her warrior love Wren must travel the kingdom to gain support from the far-flung rebel clans. The journey is made even more treacherous thanks to a heavy bounty on Lei's head, as well as insidious doubts that threaten to tear Lei and Wren apart from within.Meanwhile, an evil plot to eliminate the rebel uprising is taking shape, fueled by dark magic and vengeance. Will Lei succeed in her quest to overthrow the monarchy and protect her love for Wren, or will she fall victim to the sinister magic that seeks to destroy her?","403 pages, Hardcover",Fantasy,"3,453 follower","2,179 reviews",7,197 (1%),998 (7%),"4,010 (28%)","5,444 (38%)","3,330 (23%)"
Ο επίμονος κηπουρός,John le Carré,"28,184","ratings1,734","January 4, 2001","Ένα επίκαιρο και συνταρακτικά αληθινό μυθιστόρημα από τον αξεπέραστο συγγραφέα του Κατασκόπου που Γύρισε από το Κρύο.Η νεαρή και όμορφη Τέσα Κουέιλ βρίσκεται άγρια δολοφονημένη σε ένα ερημικό σημείο της λίμνης Τουρκάνα, στη Βόρεια Κένυα. Ο συνοδός της, ένας Αφρικανός γιατρός, έχει εξαφανιστεί. Όλοι μοιάζουν να πιστεύουν πως πρόκειται για έγκλημα πάθους. Όλοι εκτός από έναν...Ο άντρας της Τέσα, ο Τζάστιν, διπλωμάτης καριέρας και μανιώδης ερασιτέχνης κηπουρός, που υπηρετεί στη Βρετανική Αρμοστεία του Ναϊρόμπι, ξεκινά μια προσωπική οδύσσεια για να ανακαλύψει τους δολοφόνους της γυναίκας του. Κυνηγώντας την αλήθεια θα ταξιδέψει σε δύο ηπείρους, για να επιστρέψει πάλι στην Αφρική, στα βάθη του Νότιου Σουδάν και, τελικά, πίσω στην Κένυα, εκεί ακριβώς που πέθανε η Τέσα. Στην πορεία του θα βρει τον τρόμο, τη βία, τη διαφθορά, και μια απάνθρωπη συνωμοσία ασύλληπτων διαστάσεων. Αλλά η μεγαλύτερη αποκάλυψη θα είναι η ίδια η γυναίκα που μαζί της μοιραζόταν τη ζωή του.Ο Επίμονος Κηπουρός είναι η βαθιά συγκινητική ιστορία ενός άντρα που εξυψώνεται μέσα από την τραγωδία και ταυτόχρονα μια συγκλονιστική καταγγελία της στυγνής εκμετάλλευσης του Τρίτου Κόσμου από τη Δύση. Ένα ατμοσφαιρικό, έξοχα ζυγισμένο έργο -χωρίς αμφιβολία, ένα από τα καλύτερα που έγραψε ποτέ ο Le Carré.","528 pages, Paperback",Fiction,"8,516 follower","1,734 reviews",175,565 (2%),"1,810 (6%)","6,973 (24%)","11,554 (40%)","7,282 (25%)"
The Miscalculations of Lightning Girl,Stacy McAnulty,"15,622","ratings2,044","May 1, 2018","A lightning strike gave her a super power... but even a super genius can't solve the problem of middle school. This smart and funny novel is perfect for fans of The Fourteenth Goldfish, Rain Reign, and Counting by Sevens.Lucy Callahan was struck by lightning. She doesn't remember it, but it changed her life forever. The zap gave her genius-level math skills, and ever since, Lucy has been homeschooled. Now, at 12 years old, she's technically ready for college. She just has to pass 1 more test--middle school!Lucy's grandma insists: Go to middle school for 1 year. Make 1 friend. Join 1 activity. And read 1 book (that's not a math textbook!). Lucy's not sure what a girl who does calculus homework for fun can possibly learn in 7th grade. She has everything she needs at home, where nobody can make fun of her rigid routines or her superpowered brain. The equation of Lucy's life has already been solved. Unless there's been a miscalculation?A celebration of friendship, Stacy McAnulty's smart and thoughtful middle-grade debut reminds us all to get out of our comfort zones and embrace what makes us different.""An engaging story, full of heart and hope. Readers of all ages will root for Lucy, aka Lightning Girl. No miscalculations here!"" --Kate Beasley, author of Gertie's Leap to Greatness","294 pages, Hardcover",Middle Grade,508 follower,"2,044 reviews",47,130 (<1%),298 (1%),"1,852 (11%)","5,970 (38%)","7,372 (47%)"
Memoriile unui motan călător,Hiro Arikawa,"71,204","ratings12,888","November 1, 2012","Nana este un motan, dar nu unul oarecare. Are blana albă și coada în formă de șapte, îi plac fâșiile de carne din piept de pui și fructele de mare, are ghearele ascuțite și privirea ageră, ba chiar înțelege graiul oamenilor și comentează despre tot ce se întâmplă în jurul său. Nana este motanul vagabond care dormea pe capota unei dubițe argintii, până când un tânăr înalt s-a apropiat de el și i-a zâmbit fermecător. După cinci ani lipsiți de griji, Satoru și Nana, omul și motanul, se văd nevoiți să pornească într-o călătorie în căutarea unui alt stăpân. Cu această ocazie Nana își începe cronica de călătorie unde își va nota, cu tandrețe și umor, impresiile și emoțiile, construind o tulburătoare poveste despre prietenie, familie și memorie.","256 pages, Paperback",Fiction,995 follower,"12,888 reviews",71,335 (<1%),"1,575 (2%)","8,766 (12%)","23,634 (33%)","36,894 (51%)"
A Night Divided,Jennifer A. Nielsen,"39,805","ratings4,761","August 25, 2015","With the rise of the Berlin Wall, twelve-year-old Gerta finds her family suddenly divided. She, her mother, and her brother Fritz live on the eastern side, controlled by the Soviets. Her father and middle brother, who had gone west in search of work, cannot return home. Gerta knows it is dangerous to watch the wall, to think forbidden thoughts of freedom, yet she can't help herself. She sees the East German soldiers with their guns trained on their own citizens; she, her family, her neighbors and friends are prisoners in their own city.But one day, while on her way to school, Gerta spots her father on a viewing platform on the western side, pantomiming a peculiar dance. Then, when she receives a mysterious drawing, Gerta puts two and two together and concludes that her father wants Gerta and Fritz to tunnel beneath the wall, out of East Berlin. However, if they are caught, the consequences will be deadly. No one can be trusted. Will Gerta and her family find their way to freedom?","357 pages, Kindle Edition",Historical Fiction,"8,084 follower","4,761 reviews",44,223 (<1%),624 (1%),"4,390 (11%)","14,811 (37%)","19,757 (49%)"
France,John Julius Norwich,"1,820",ratings221,"January 1, 2018","'For his final book, the late Norwich tackled the dauntingly vast subject of two millennia of French history with admirable lightness and urbanity . . . his comic footnotes deserve a review of their own' DAILY TELEGRAPH I can still feel, as if it were yesterday, the excitement of my first Channel crossing (as a child of nearly 7) in September 1936; the regiment of porters, smelling asphyxiatingly of garlic in their blue-green blousons; the raucous sound all around me of spoken French; the immense fields of Normandy strangely devoid of hedges; then the Gare du Nord at twilight, the policemen with their kepis and their little snow-white batons; and my first sight of the Eiffel Tower . . . This book is written in the belief that the average English-speaking man or woman has remarkably little knowledge of French history. We may know a bit about Napoleon or Joan of Arc or Louis XIV, but for most of us that's about it. In my own three schools we were taught only about the battles we Crecy and Poitiers, Agincourt and Waterloo. The rest was silence. So here is my attempt to fill in the blanks . . . John Julius Norwich's last book is the book he always wanted to the extremely colourful story of the country he loves best. From frowning Roman generals and belligerent Gallic chieftains, to Charlemagne (hated by generations of French children taught that he invented schools) through Marie Antoinette and the storming of the Bastille to Vichy, the Resistance and beyond, FRANCE is packed with heroes and villains, adventures and battles, romance and revolution. Full of memorable stories and racy anecdotes, this is the perfect introduction to the country that has inspired the rest of the world to live, dress, eat -- and love better.","400 pages, Paperback",History,587 follower,221 reviews,116,16 (<1%),58 (3%),398 (21%),851 (46%),497 (27%)
Ghouls Gone Wild,Victoria Laurie,"4,853",ratings249,"March 2, 2010","New in the national bestselling series Psychic M.J. Holliday finds herself in a witchy situation...   When M.J. and her friends travel to a small town near Edinburgh, Scotland, to film the first installment of their new cable TV show Ghoul Getters, they find plenty of spooky action in a series of supposedly haunted caverns. But when they discover the body of a maintenance worker, the cause of death is reminiscent of an old legend involving a witch's wrath...","314 pages, Mass Market Paperback",Mystery,"3,016 follower",249 reviews,65,39 (<1%),169 (3%),926 (19%),"1,913 (39%)","1,806 (37%)"
Ending Your Day Right: Devotions for Every Evening of the Year,Joyce Meyer,728,ratings42,"October 1, 2004","Many people start their day off with a few minutes of prayer and Bible study, often with a devotion. But how many of them take the time at night to spend a moment with God after their hurried bedtime prayers. This companion to 'Starting Your Day Right' asks for God's continued care throughout the night.","384 pages, Hardcover",Christian,"3,469 follower",42 reviews,"1,662",5 (<1%),13 (1%),57 (7%),155 (21%),498 (68%)
Flash Gold,Lindsay Buroker,"3,055",ratings273,"March 27, 2011","Eighteen-year-old Kali McAlister enters her steam-powered ""dogless sled"" in a race, intending to win the thousand-dollar prize and escape remote Moose Hollow forever. The problem? Fortune seekers and airship pirates are after her for the secret to flash gold, her late father's alchemical masterpiece. With her modified rifle and a pocketful of home-made smoke bombs, Kali wouldn't normally hide from a confrontation, but taking on a whole airship single-handedly is a daunting task. Unfortunately, the other racers won't assist her--they're too busy scheming ways to sabotage her unorthodox sled.When a sword-slinging stranger shows up, wanting to hire on as her protector, she's sure he has ulterior motives, but he's the only one interested in helping her. The question is...why?Details: an 18,000-word (75 page) steampunk novella set in the Yukon during the gold rush era.","42 pages, Nook",Steampunk,"5,434 follower",273 reviews,178,49 (1%),140 (4%),719 (23%),"1,207 (39%)",940 (30%)
Dust and Shadow: An Account of the Ripper Killings by Dr. John H. Watson,Lyndsay Faye,"8,339","ratings1,078","April 2, 2015","In Dust and Shadow, Sherlock Holmes hunts down Jack the Ripper with impeccably accurate historical detail, rooting the Whitechapel investigation in the fledgling days of tabloid journalism and clinical psychology. This astonishing debut explores the terrifying prospect of hunting down one of the world's first serial killers without the advantage of modern forensics or profiling. Sherlock's desire to stop the killer who is terrifying the East End of London is unwavering from the start, and in an effort to do so he hires an ""unfortuate"" known as Mary Ann Monk, the friend of a fellow streetwalker who was one of the Ripper's earliest victims. However, when Holmes himself is wounded in Whitechapel attempting to catch the villain, and a series of articles in the popular press question his role in the crimes, he must use all his resources in a desperate race to find the man known as ""The Knife"" before it is too late. Penned as a pastiche by the loyal and courageous Dr. Watson, Dust and Shadow recalls the ideals evinced by Sir Arthur Conan Doyle's most beloved and world-renowned characters, while testing the limits of their strength in a fight to protect the women of London, Scotland Yard, and the peace of the city itself.","336 pages, Hardcover",Mystery,"1,957 follower","1,078 reviews",29,100 (1%),348 (4%),"1,753 (21%)","3,484 (41%)","2,654 (31%)"
Blood Lines,Eileen Wilks,"6,268",ratings242,"January 1, 2007","Touch-sensitive FBI agent Lily Yu and her werewolf bond-mate are recruited by the Secret Service to help identify elected officials who have accepted demonic pacts. But Lily must turn to fellow agent Cynna Weaver for help when Cynna's former teacher, a demon master, emerges as the main suspect behind the pacts.After a demon commits a gruesome murder, sorcerer Cullen Seabourne joins the team racing the clock to find the apprentice of evil who uses demons to kill. Cynna and Cullen must work together- a challenge indeed when each has good reason to ignore the desire simmering between them. But passion and events both spiral out of control as an ancient prophecy is fulfilled- and the lupi's greatest enemy sets her sights on total devastation.","338 pages, Mass Market Paperback",Urban Fantasy,"1,497 follower",242 reviews,121,47 (<1%),194 (3%),"1,374 (21%)","2,546 (40%)","2,107 (33%)"
A Beautiful Friendship,David Weber,"5,056",ratings379,"October 4, 2011","Stephanie Harrington always expected to be a forest ranger on her homeworld of Meyerdahl . . . until her parents relocated to the frontier planet of Sphinx in the far distant Star Kingdom of Manticore. It should have been the perfect new home --- a virgin wilderness full of new species of every sort, just waiting to be discovered. But Sphinx is a far more dangerous place than ultra-civilized Meyerdahl, and Stephanie’s explorations come to a sudden halt when her parents lay down the law: no trips into the bush without adult supervision!Yet Stephanie is a young woman determined to make discoveries, and the biggest one of all awaits her: an intelligent alien species.The forest-dwelling treecats are small, cute, smart, and have a pronounced taste for celery. And they are also very, very deadly when they or their friends are threatened . . . as Stephanie discovers when she comes face-to-face with Sphinx's most lethal predator after a hang-gliding accident.But her discoveries are only beginning, for the treecats are also telepathic and able to bond with certain humans, and Stephanie’s find --- and her first-of-its kind bond with the treecat Climbs Quickly --- land both of them in a fresh torrent of danger. Galactic-sized wealth is at stake, and Stephanie and the treecats are squarely in the path of highly-placed enemies determined to make sure the planet Sphinx remains entirely in human hands, even if that means the extermination of another thinking species.Unfortunately for those enemies, the treecats have saved Stephanie Harrington’s life. She owes them . . . and Stephanie is a young woman who stands by her friends.Which means things are about to get very interesting on Sphinx.","361 pages, Hardcover",Science Fiction,"4,327 follower",379 reviews,407,56 (1%),190 (3%),"1,037 (20%)","1,943 (38%)","1,830 (36%)"
Through the Killing Glass,Mainak Dhar,948,ratings60,"March 18, 2012","The explosive sequel to the Amazon.com Bestseller, Alice in Deadland More than two years have passed since Alice followed a Biter with bunny ears down a hole, triggering events that forever changed her life and that of everyone in the Deadland. The Red Guards have been fought to a standstill; Alice has restored some measure of peace between humans and Biters; and under Alice, humans have laid the foundations of the first large, organized community since The Rising- a city called Wonderland. That peace is shattered in a series of vicious Biter attacks and Alice finds herself shunned by the very people she helped liberate. Now she must re-enter the Deadland to unravel this new conspiracy that threatens Wonderland. Doing so will mean coming face to face with her most deadly adversary ever- the Red Queen.","184 pages, Paperback",Horror,270 follower,60 reviews,55,15 (1%),81 (8%),259 (27%),337 (35%),256 (27%)
The Outcast,Sadie Jones,"9,728",ratings892,"March 1, 2008","A mesmerizing portrait of 1950s hypocrisy and unexpected love, from a powerful new voice.It is 1957, and Lewis Aldridge, straight out of prison, is journeying back to his home in Waterford, a suburban town outside London. He is nineteen years old, and his return will have dramatic consequences not just for his family, but for the whole community. A decade earlier, his father's homecoming has a very different effect. The war is over and Gilbert has been demobilized. He reverts easily to suburban life—cocktails at six-thirty, church on Sundays—but his wife and young son resist the stuffy routine. Lewis and his mother escape to the woods for picnics, just as they did in wartime days. Nobody is surprised that Gilbert's wife counters convention, but they are all shocked when, after one of their jaunts, Lewis comes back without her. Not far away, Kit Carmichael keeps watch. She has always understood more than most, not least from what she is dealt by her own father's hand. Lewis's grief and burgeoning rage are all too plain, and Kit makes a private vow to help. But in her attempts to set them both free, she fails to foresee the painful and horrifying secrets that must first be forced into the open. In this brilliant debut, Sadie Jones tells the story of a boy who refuses to accept the polite lies of a tightly knit community that rejects love in favor of appearances. Written with nail-biting suspense and cinematic pacing, The Outcast is an emotionally powerful evocation of postwar provincial English society and a remarkably uplifting testament to the redemptive powers of love and understanding.","352 pages, Hardcover",Fiction,363 follower,892 reviews,11,272 (2%),896 (9%),"2,923 (30%)","3,626 (37%)","2,011 (20%)"
The Dragonfly Pool,Eva Ibbotson,"5,147",ratings521,"April 23, 2008","Tally Hamilton is furious to hear she is being sent from London to a horrid, stuffy boarding school in the countryside. And all because of the stupid war. But Delderton Hall is a far more"" ""unusual and "" interesting"" place than Tally ever imagined, and she soon falls in love with its eccentric staff and pupils. Now she's even organizing an exciting school trip to the kingdom of Bergania . . . although Tally never expected to meet the ""prince.""Prince Karil hates his life at the palace and he is only truly happy when he escapes to the dragonfly pool, a remote spot in the forests of Bergania. Then Karil meets a feisty English girl who brings the promise of adventure. But his country is under threat, and the prince soon looks to his new friend Tally for survival as well as friendship . . .","377 pages, Hardcover",Historical Fiction,"2,261 follower",521 reviews,57,57 (1%),195 (3%),"1,060 (20%)","1,965 (38%)","1,870 (36%)"
Slumberland,Paul Beatty,"1,753",ratings224,"June 10, 2008","The breakout novel from a literary virtuoso about a disaffected Los Angeles DJ who travels to post-Wall Berlin in search of his transatlantic doppelganger.Hailed by the New York Times and the Los Angeles Times as one of the best writers of his generation, Paul Beatty turns his incisive eye to man’s search for meaning and identity in an increasingly chaotic world. After creating the perfect beat, DJ Darky goes in search of Charles Stone, a little-known avant-garde jazzman, to play over his sonic masterpiece. His quest brings him to a recently unified Berlin, where he stumbles through the city’s dreamy streets ruminating about race, sex, love, Teutonic gods, the prevent defense, and Wynton Marsalis in search of his artistic—and spiritual—other. Ferocious, bombastic, and laugh-out-loud funny, Slumberland is vintage Paul Beatty and belongs on the shelf next to Jonathan Lethem, Colson Whitehead, and Junot Diaz.","243 pages, Hardcover",Fiction,"1,444 follower",224 reviews,19,29 (1%),102 (5%),454 (25%),698 (39%),470 (26%)
Anger Antidotes: How Not to Lose Your S#&!,Ian Brennan,18,ratings3,"April 25, 2011","Strategies for living a crisis-free life in an imperfect world. Anger is at the root of most of the personal dilemmas we face. Frank, personal, and pithy, this book engages readers in a no-nonsense exploration of how we can effectively reach beyond ourselves to maintain calm in the face of crisis. The objective is to distill down to fundamental aspects the universal structures that form the basis of most human problems. It is usually our emotions that interfere with making sound choices. Thus, even the most learned individuals, who “know better,” are capable of making colossally stupid errors in judgment and conduct.Presenting a range of deescalation techniques, each chapter has been concentrated into “mini- manuals” that in their totality contain a library’s worth of material. The left side of each two-page spread describes the anger trigger and the right side of the page spread contains the anger antidote. Topics covered include emotional immaturity, the absence of thought, extremes, inertia, reactor bait, and argument traps.","184 pages, Paperback",Psychology,9 follower,3 reviews,13,3 (16%),3 (16%),4 (22%),2 (11%),6 (33%)
Slated,Teri Terry,"31,428","ratings3,198","May 3, 2012","A riveting psychological thrillerKYLA HAS BEEN SLATED - her memory erased, her personality wiped blank. This is the government's way of dealing with teen terrorists: give them a fresh start as a new person. They teach Kyla how to walk and talk again, give her a new identity and a new family, and tell her to be grateful for this second chance.It's also her last chance, and to ensure that she plays by their rules, Kyla is fitted with a Levo, a bracelet that monitors her mood and will stun - or even kill - her if her levels of anger or violence rise too high.As she adjusts to her new life, Kyla can see she is different from the other Slateds. She asks too many questions and is plagued by nightmares that feel like memories - even though she shouldn't have memories. Who is she, really? Has her Slating gone wrong? And if only criminals are Slated, why are innocent people disappearing? Torn between the need to understand more and her instinct for self-peservation, Kyla knows a dangerous game is being played with her life, and she's determined not to let anyone see her make the wrong move...Debut author Teri Terry has written a brilliantly original, thought-provoking novel about an uncomfortably plausible future.","346 pages, Hardcover",Young Adult,"2,098 follower","3,198 reviews",22,419 (1%),"1,375 (4%)","5,912 (18%)","11,694 (37%)","12,028 (38%)"
Conqueror,Conn Iggulden,"12,024",ratings579,"December 27, 2011","From a young scholar to one of history's most powerful warriors, this novel tells the story of Kublai Khan - an extraordinary man who should be remembered alongside Julius Caesar, Alexander the Great and Napoleon Bonaparte as one of the greatest conquerors the world has ever known.","546 pages, Paperback",Historical Fiction,"5,342 follower",579 reviews,115,26 (<1%),108 (<1%),980 (8%),"4,226 (35%)","6,684 (55%)"
The Arrangement,Mary Balogh,"11,732","ratings1,375","February 17, 2013","Desperate to escape his mother’s matchmaking, Vincent Hunt, Viscount Darleigh, flees to a remote country village. But even there, another marital trap is sprung. So when Miss Sophia Fry’s intervention on his behalf finds her unceremoniously booted from her guardian’s home, Vincent is compelled to act. He may have been blinded in battle, but he can see a solution to both their problems: marriage.   At first, quiet, unassuming Sophia rejects Vincent’s proposal. But when such a gloriously handsome man persuades her that he needs a wife of his own choosing as much as she needs protection from destitution, she agrees. Her alternative is too dreadful to contemplate. But how can an all-consuming fire burn from such a cold arrangement? As friendship and camaraderie lead to sweet seduction and erotic pleasure, dare they believe a bargain born of desperation might lead them both to a love destined to be?","366 pages, Mass Market Paperback",Romance,"5,838 follower","1,375 reviews",241,157 (1%),576 (4%),"3,008 (25%)","4,584 (39%)","3,407 (29%)"
