Title,Authors,Avg Ratings,Rating,first_published,Description,Total_Pages,Genre,author_followers,no_of_reviews,no_book_by_author,one_star_ratings,two_star_ratings,three_star_ratings,four_star_ratings,five_star_ratings
Mr. Penumbra's 24-Hour Bookstore,Robin Sloan,"205,102","ratings28,908","First published September 26, 2012","Global conspiracy, complex code-breaking, high-tech data visualization, young love, the secret to eternal life. Mostly in a hole-in-the-wall San Francisco bookstore. Clay Jannon tells how serendipity, sheer curiosity, and the ability to climb a ladder like a monkey has sent him from Web Drone to night shift at Mr. Penumbra’s 24-Hour Bookstore. After just a few days on the job, Clay realizes just how curious this store is. A few customers come in repeatedly without buying anything. Instead they “check out” obscure volumes from strange corners of the store. All runs according to some elaborate, long-standing arrangement with the gnomic Mr. Penumbra. The store must be a front for something larger, Clay concludes.He embarks on a complex analysis of the customers’ behavior and ropes in friends to help. Once they bring their findings to Mr. Penumbra, it turns out the secrets extend far outside the walls of the bookstore. A quest to New York City dips in a world conspiracy for eternal life. The current of romance pulls Clay onward.","288 pages, Hardcover",Fiction,30.2k followers,"28,908 reviews",28 books30.2k followers,"4,344 (2%)","16,324 (7%)","57,399 (27%)","80,185 (39%)","46,850 (22%)"
Matterhorn,Karl Marlantes,"43,305","ratings3,596","First published March 23, 2010","A big, powerful saga of men in combat, written over the course of thirty-five years by a highly decorated Vietnam veteran.Intense, powerful, and compelling, Matterhorn is an epic war novel in the tradition of Norman Mailer's The Naked and the Dead and James Jones's The Thin Red Line. It is the timeless story of a young Marine lieutenant, Waino Mellas, and his comrades in Bravo Company, who are dropped into the mountain jungle of Vietnam as boys and forced to fight their way into manhood. Standing in their way are not merely the North Vietnamese but also monsoon rain and mud, leeches and tigers, disease and malnutrition. Almost as daunting, it turns out, are the obstacles they discover between each other: racial tension, competing ambitions, and duplicitous superior officers. But when the company finds itself surrounded and outnumbered by a massive enemy regiment, the Marines are thrust into the raw and all-consuming terror of combat. The experience will change them forever.Written over the course of thirty years by a highly decorated Vietnam veteran, Matterhorn is a visceral and spellbinding novel about what it is like to be a young man at war. It is an unforgettable novel that transforms the tragedy of Vietnam into a powerful and universal story of courage, camaraderie, and sacrifice: a parable not only of the war in Vietnam but of all war, and a testament to the redemptive power of literature.A graduate of Yale University and a Rhodes Scholar at Oxford University, Karl Marlantes served as a Marine in Vietnam, where he was awarded the Navy Cross, the Bronze Star, two Navy Commendation Medals for valor, two Purple Hearts, and ten air medals. This is his first novel. He lives in rural Washington State.","663 pages, Paperback",Fiction,654 followers,"3,596 reviews",9 books654 followers,954 (2%),"1,632 (3%)","5,016 (11%)","13,581 (31%)","22,122 (51%)"
Dead in the Family,Charlaine Harris,"163,112","ratings5,765","First published May 4, 2010","It's all about family ...Sookie Stackhouse is dealing with a whole host of family problems, ranging from her own kin (a non-human fairy and a telepathic second cousin) demanding a place in her life, to her lover Eric's vampire sire, an ancient being who arrives with Eric's 'brother' in tow at a most inopportune moment. And Sookie's tracking down a distant relation of her ailing neighbour (and ex), Vampire Bill Compton.In addition to the multitude of family issues complicating her life, the werewolf pack of Shreveport has asked Sookie for a special favour, and since Sookie is an obliging young woman, she agrees. But this favour for the wolves has dire results for Sookie, who is still recovering from the trauma of her abduction during the Fairy War.","320 pages, Hardcover",Fantasy,35.8k followers,"5,765 reviews",278 books35.8k followers,"2,047 (1%)","9,622 (5%)","42,634 (26%)","57,204 (35%)","51,605 (31%)"
Explosion in Paris,Linda Masemore Pirrung,"2,360",ratings98,"First published April 9, 2009","Explosion in Paris is the story of one woman's determination to better her life because she has finally found the man of her dreams! By refusing to accept her husband's death sentence assessment of her soul, Angela Briann Scott is challenging herself to reach beyond her limits. This is especially true since her accidental meeting with the devastatingly handsome Ross Leigh Stafford. He's a man of high principles, irreproachable character, unsinkable spirit, and unwavering compassion, all the qualities that her husband, Mitch, is seriously lacking. Angie's adopted country of France glows with charm and beauty through her eyes. By reinventing herself to save her life, she discovers her true essence and she develops a strong sense of self-worth. Her impressive success and enduring strength tell a story that will keep readers engrossed to the very end!","408 pages, Paperback",Romance,11 followers,98 reviews,3 books11 followers,273 (11%),284 (12%),398 (16%),603 (25%),802 (33%)
The Book of Occult,Simon W. Clark,"3,494",ratings94,"First published November 5, 2013","****THIS BOOK IS OUT OF PRINT******PLEASE SEE LINK FOR LATEST SPY THRILLER CALLED THE RUSSIAN INK: https://www.goodreads.com/book/show/6...""One man's search for a mystery author catapults him into a dangerous race to unlock esoteric wisdom that has been hidden and disputed for thousands of years"" Peter Ashton has a dark past. In a teenage prank he uses an old book to perform an occult ritual. The experiment goes awry and his best friend is killed in the act. Two decades later Peter travels to Europe to discover the secrets of the book and its mystery author. Plagued by curiosity and guilt he meets a Professor and an English Auctioneer who try to help him verify its authenticity and origins. The result is far beyond what he imagined. It is the last unpublished secret work by 19th century French occultist Eliphas Levi. The book’s meaning is shrouded in mystical conspiracy like its author. Peter soon finds it brings unwanted attention. Bonnet was once a dedicated American government agent but is descending on a dark mystical path. He uses an occult tool to enhance his abilities but at a grave personal cost. He desires occult power and is killing everyone that stands in the way. Will he catch Peter and his priceless book? From Paris to Los Angeles Peter races against time and powerful enemies. A cult leader opens his eyes to the extent of underground mysticism and tempts him with money and power. With limited options Peter is attacked by extremists desperate to get hold of the book. A beautiful gypsy woman gives him hope and insight. The final clue leads him to a Spanish mansion with more revelations than he dreamed possible. Can Peter unlock the secret wisdom before it is too late? Or will he be seduced by the deadly forces that tempted him 20 years ago….","328 pages, Paperback",Fiction,399 followers,94 reviews,5 books399 followers,369 (10%),351 (10%),570 (16%),"1,087 (31%)","1,117 (31%)"
City of Heavenly Fire,Cassandra Clare,"380,999","ratings28,010","First published May 27, 2014","In this dazzling and long-awaited conclusion to the acclaimed Mortal Instruments series, Clary and her friends fight the greatest evil they have ever faced: Clary's own brother.Sebastian Morgenstern is on the move, systematically turning Shadowhunter against Shadowhunter. Bearing the Infernal Cup, he transforms Shadowhunters into creatures out of nightmare, tearing apart families and lovers as the ranks of his Endarkened army swell.The embattled Shadowhunters withdraw to Idris - but not even the famed demon towers of Alicante can keep Sebastian at bay. And with the Nephilim trapped in Idris, who will guard the world against demons?When one of the greatest betrayals the Nephilim have ever known is revealed, Clary, Jace, Isabelle, Simon, and Alec must flee - even if their journey takes them deep into the demon realms, where no Shadowhunter has set foot before, and from which no human being has ever returned...Love will be sacrificed and lives lost in the terrible battle for the fate of the word in the thrilling final installment of the classic urban fantasy series The Mortal Instruments!","725 pages, Hardcover",Fantasy,269k followers,"28,010 reviews",186 books269k followers,"4,042 (1%)","9,706 (2%)","40,833 (10%)","104,587 (27%)","221,831 (58%)"
Fifty Shades Freed,E.L. James,"850,474","ratings27,727","First published April 17, 2012","When unworldly student Anastasia Steele first encountered the driven and dazzling young entrepreneur Christian Grey it sparked a sensual affair that changed both of their lives irrevocably. Shocked, intrigued, and, ultimately, repelled by Christian’s singular erotic tastes, Ana demands a deeper commitment. Determined to keep her, Christian agrees.Now, Ana and Christian have it all—love, passion, intimacy, wealth, and a world of possibilities for their future. But Ana knows that loving her Fifty Shades will not be easy, and that being together will pose challenges that neither of them would anticipate. Ana must somehow learn to share Christian’s opulent lifestyle without sacrificing her own identity. And Christian must overcome his compulsion to control as he wrestles with the demons of a tormented past.Just when it seems that their strength together will eclipse any obstacle, misfortune, malice, and fate conspire to make Ana’s deepest fears turn to reality.This book is intended for mature audiences.","579 pages, Paperback",Romance,56.9k followers,"27,727 reviews",54 books56.9k followers,"56,495 (6%)","80,315 (9%)","164,055 (19%)","197,053 (23%)","352,556 (41%)"
The Sea,John Banville,"31,564","ratings3,258","First published May 17, 2005","The author of The Untouchable (“contemporary fiction gets no better than this”—Patrick McGrath, The New York Times Book Review) now gives us a luminous novel about love, loss, and the unpredictable power of memory. The narrator is Max Morden, a middle-aged Irishman who, soon after his wife’s death, has gone back to the seaside town where he spent his summer holidays as a child—a retreat from the grief, anger, and numbness of his life without her. But it is also a return to the place where he met the Graces, the well-heeled vacationing family with whom he experienced the strange suddenness of both love and death for the first time. The seductive mother; the imperious father; the twins—Chloe, fiery and forthright, and Myles, silent and expressionless—in whose mysterious connection Max became profoundly entangled, each of them a part of the “barely bearable raw immediacy” of his childhood memories. Interwoven with this story are Morden’s memories of his wife, Anna—of their life together, of her death—and the moments, both significant and mundane, that make up his life now: his relationship with his grown daughter, Claire, desperate to pull him from his grief; and with the other boarders at the house where he is staying, where the past beats inside him “like a second heart.” What Max comes to understand about the past, and about its indelible effects on him, is at the center of this elegiac, vividly dramatic, beautifully written novel—among the finest we have had from this extraordinary writer","195 pages, Paperback",Fiction,"1,919 followers","3,258 reviews","118 books1,919 followers","1,522 (4%)","3,751 (11%)","9,122 (28%)","10,334 (32%)","6,835 (21%)"
The Snow Child,Eowyn Ivey,"147,445","ratings18,336","First published February 1, 2012","Alaska, 1920: a brutal place to homestead, and especially tough for recent arrivals Jack and Mabel. Childless, they are drifting apart - he breaking under the weight of the work of the farm; she crumbling from loneliness and despair. In a moment of levity during the season's first snowfall, they build a child out of snow. The next morning the snow child is gone - but they glimpse a young, blonde-haired girl running through the trees. This little girl, who calls herself Faina, seems to be a child of the woods. She hunts with a red fox at her side, skims lightly across the snow, and somehow survives alone in the Alaskan wilderness. As Jack and Mabel struggle to understand this child who could have stepped from the pages of a fairy tale, they come to love her as their own daughter. But in this beautiful, violent place, things are rarely as they appear, and what they eventually learn about Faina will transform all of them.","386 pages, Hardcover",Fiction,"3,397 followers","18,336 reviews","7 books3,397 followers","1,937 (1%)","5,946 (4%)","29,464 (19%)","62,885 (42%)","47,213 (32%)"
JPod,Douglas Coupland,"19,845","ratings1,027","First published January 1, 2006","JPod, Douglas Coupland's most acclaimed novel to date, is a lethal joyride into today's new breed of tech worker. Ethan Jarlewski and five co-workers whose surnames begin with ""J"" are bureaucratically marooned in jPod, a no-escape architectural limbo on the fringes of a massive Vancouver game design company. The jPodders wage daily battle against the demands of a boneheaded marketing staff, who daily torture employees with idiotic changes to already idiotic games. Meanwhile, Ethan's personal life is shaped (or twisted) by phenomena as disparate as Hollywood, marijuana grow-ops, people-smuggling, ballroom dancing, and the rise of China. JPod's universe is amoral, shameless, and dizzyingly fast-paced like our own. Praise for JPod: ""JPod is a sleek and necessary device: the finely tuned output of an author whose obsolescence is thankfully years away.""-New York Times Book Review""It's to [Coupland's] credit that in JPod he's still nimble enough to take the post-modern man-too young for Boomer nostalgia and too old for youthful idealism-and drown his sorrows in a willful, joyful satire that revels in the same cultural conventions that it sends up.""-Rocky Mountain News ""It's time to admire [Coupland's] virtuoso tone and how he has refined it over 11 novels. The master ironist just might redefine E. M. Forster's famous dictate 'Only connect' for the Google age.""-USA Today ""Zeitgeist surfer Douglas Coupland downloads his brain into JPod.""-Vanity Fair","464 pages, Paperback",Fiction,"4,491 followers","1,027 reviews","90 books4,491 followers",672 (3%),"1,707 (8%)","5,290 (26%)","7,323 (36%)","4,853 (24%)"
From Dead to Worse,Charlaine Harris,"187,928","ratings4,036","First published May 6, 2008","After the natural disaster of Hurricane Katrina and the manmade explosion at the vampire summit, everyone human and otherwise is stressed, including Louisiana cocktail waitress Sookie Stackhouse, who is trying to cope with the fact that her boyfriend Quinn has gone missing. It's clear that things are changing whether the weres and vamps of her corner of Louisiana like it or not. And Sookie, Friend to the Pack and blood-bonded to Eric Northman, leader of the local vampire community is caught up in the changes. In the ensuing battles, Sookie faces danger, death, and once more, betrayal by someone she loves. And when the fur has finished flying and the cold blood finished flowing, her world will be forever altered.","368 pages, Hardcover",Fantasy,35.8k followers,"4,036 reviews",278 books35.8k followers,"1,493 (<1%)","7,027 (3%)","43,154 (22%)","72,359 (38%)","63,895 (33%)"
Evermore,Alyson Noel,"289,554","ratings10,491","First published February 3, 2009","The first book in Alyson Noël's extraordinary new Immortals series. Enter an enchanting new world, where true love never dies...After a horrible accident claims the lives of her family, sixteen-year-old Ever Bloom can see people's auras, hear their thoughts, and know someone's entire life story by touching them. Going out of her way to avoid human contact to suppress her abilities, she has been branded a freak at her new high school—but everything changes when she meets Damen Auguste.Damen is gorgeous, exotic and wealthy. He's the only one who can silence the noise and random energy in her head—wielding a magic so intense, it's as though he can peer straight into her soul. As Ever is drawn deeper into his enticing world of secrets and mystery, she's left with more questions than answers. And she has no idea just who he really is—or what he is. The only thing she knows to be true is that she's falling deeply and helplessly in love with him.","301 pages, Paperback",Young Adult,15.5k followers,"10,491 reviews",55 books15.5k followers,"20,572 (7%)","35,683 (12%)","72,890 (25%)","72,604 (25%)","87,805 (30%)"
The Wedding,Nicholas Sparks,"159,951","ratings7,057","First published September 1, 2003","After thirty years of marriage, Wilson Lewis, son-in-law of Allie and Noah Calhoun (of The Notebook), is forced to admit that the romance has gone out of his marriage. Desperate to win back his wife, Jane's, heart, he must figure out how to make her fall in love with him... again. Despite the shining example of Allie and Noah's marriage, Wilson is himself a man unable to easily express his emotions. A successful estate attorney, he has provided well for his family, but now, with his daughter's upcoming wedding, he is forced to face the fact that he and Jane have grown apart and he wonders if she even loves him anymore. Wilson is sure of one thing--his love for his wife has only deepened and intensified over the years. Now, with the memories of his in-laws' magnificent fifty-year love affair as his guide, Wilson struggles to find his way back into the heart of the woman he adores.Did You Know?The Wedding is a follow-up to The Notebook?The Wedding was inspired by a few unnamed couples that Nicholas knows well?The novel is set in the North Carolina town in which Nicholas now lives?","276 pages, Mass Market Paperback",Romance,228k followers,"7,057 reviews",405 books228k followers,"2,786 (1%)","9,506 (5%)","35,378 (22%)","50,710 (31%)","61,571 (38%)"
"Mayflower: A Story of Courage, Community, and War",Nathaniel Philbrick,"43,475","ratings3,171","First published May 9, 2006","HOW DID AMERICA BEGIN?This simple question launches acclaimed author Nathaniel Philbrick on an extraordinary journey to understand the truth behind our most sacred national myth: the voyage of the Mayflower and the settlement of Plymouth Colony. As Philbrick reveals in this electrifying new book, the story of the Pilgrims does not end with the First Thanksgiving; instead, it is a fifty-five-year epic that is at once tragic and heroic, and still carries meaning for us today.","461 pages, Hardcover",History,"3,177 followers","3,171 reviews","41 books3,177 followers","1,135 (2%)","2,519 (5%)","9,827 (22%)","17,061 (39%)","12,933 (29%)"
Magical Thinking: True Stories,Augusten Burroughs,"56,627","ratings1,710","First published January 1, 2004","From the #1 bestselling author of Running with Scissors and Dry--a contagiously funny, heartwarming, shocking, twisted, and absolutely magical collection. True stories that give voice to the thoughts we all have but dare not mention. It begins with a Tang Instant Breakfast Drink television commercial when Augusten was seven. Then there is the contest of wills with the deranged cleaning lady. The execution of a rodent carried out with military precision and utter horror. Telemarketing revenge. Dating an undertaker and much more. A collection of true stories that are universal in their appeal yet unabashedly intimate and very funny.","304 pages, Paperback",Memoir,"8,740 followers","1,710 reviews","23 books8,740 followers",998 (1%),"2,659 (4%)","12,838 (22%)","21,399 (37%)","18,733 (33%)"
The Reluctant Fundamentalist,Mohsin Hamid,"77,465","ratings7,575","First published April 3, 2007","At a café table in Lahore, a bearded Pakistani man converses with an uneasy American stranger. As dusk deepens to night, he begins the tale that has brought them to this fateful encounter…Changez is living an immigrant's dream of America. At the top of his class at Princeton, he is snapped up by an elite valuation firm. He thrives on the energy of New York, and his budding romance with elegant, beautiful Erica promises entry into Manhattan society at the same exalted level once occupied by his own family back in Lahore.But in the wake of September 11, Changez finds his position in his adopted city suddenly overturned, and his relationship with Erica shifting. And Changez's own identity is in seismic shift as well, unearthing allegiances more fundamental than money, power, and maybe even love. ""Extreme times call for extreme reactions, extreme writing. Hamid has done something extraordinary with this novel."" —Washington Post""One of those achingly assured novels that makes you happy to be a reader."" —Junot Diaz ""Brief, charming, and quietly furious . . . a resounding success."" —Village Voice A Washington Post and San Francisco Chronicle Best Book of the Year A New York Times Notable Book","184 pages, Hardcover",Fiction,"3,872 followers","7,575 reviews","24 books3,872 followers","1,627 (2%)","5,739 (7%)","21,196 (27%)","32,117 (41%)","16,786 (21%)"
The Lies of Locke Lamora,Scott Lynch,"292,949","ratings20,364","First published June 1, 2006","In this stunning debut, author Scott Lynch delivers the wonderfully thrilling tale of an audacious criminal and his band of confidence tricksters. Set in a fantastic city pulsing with the lives of decadent nobles and daring thieves, here is a story of adventure, loyalty, and survival that is one part ""Robin Hood"", one part Ocean's Eleven, and entirely enthralling... An orphan's life is harsh — and often short — in the island city of Camorr, built on the ruins of a mysterious alien race. But born with a quick wit and a gift for thieving, Locke Lamora has dodged both death and slavery, only to fall into the hands of an eyeless priest known as Chains — a man who is neither blind nor a priest.A con artist of extraordinary talent, Chains passes his skills on to his carefully selected ""family"" of orphans — a group known as the Gentlemen Bastards. Under his tutelage, Locke grows to lead the Bastards, delightedly pulling off one outrageous confidence game after another. Soon he is infamous as the Thorn of Camorr, and no wealthy noble is safe from his sting.Passing themselves off as petty thieves, the brilliant Locke and his tightly knit band of light-fingered brothers have fooled even the criminal underworld's most feared ruler, Capa Barsavi. But there is someone in the shadows more powerful — and more ambitious — than Locke has yet imagined. Known as the Gray King, he is slowly killing Capa Barsavi's most trusted men — and using Locke as a pawn in his plot to take control of Camorr's underworld. With a bloody coup under way threatening to destroy everyone and everything that holds meaning in his mercenary life, Locke vows to beat the Gray King at his own brutal game — or die trying...","499 pages, Hardcover",Fantasy,24.9k followers,"20,364 reviews",68 books24.9k followers,"5,333 (1%)","9,423 (3%)","31,072 (10%)","92,341 (31%)","154,780 (52%)"
The Kindly Ones,Jonathan Littell,"13,487","ratings1,386","First published August 21, 2006","Named one of the ""100 Best Books of the Decade"" by The Times of London   ""Oh my human brothers, let me tell you how it happened.""    A former Nazi officer, Dr. Maximilien Aue has reinvented himself, many years after the war, as a middle-class family man and factory owner in France. An intellectual steeped in philosophy, literature, and classical music, he is also a cold-blooded assassin and the consummate bureaucrat. Through the eyes of this cultivated yet monstrous man we experience in disturbingly precise detail the horrors of the Second World War and the Nazi genocide of the Jews. Eichmann, Himmler, Göring, Speer, Heydrich, Höss—even Hitler himself—play a role in Max's story. An intense and hallucinatory historical epic, The Kindly Ones is also a morally challenging read. It holds a mirror up to humanity—and the reader cannot look away.","984 pages, Hardcover",Fiction,353 followers,"1,386 reviews",27 books353 followers,676 (5%),823 (6%),"2,038 (15%)","4,215 (31%)","5,735 (42%)"
Falling Man,Don DeLillo,"16,352","ratings1,521","First published January 1, 2007","There is September 11 and then there are the days after, and finally the years.Falling Man is a magnificent, essential novel about the event that defines turn-of-the-century America. It begins in the smoke and ash of the burning towers and tracks the aftermath of this global tremor in the intimate lives of a few people.First there is Keith, walking out of the rubble into a life that he'd always imagined belonged to everyone but him. Then Lianne, his estranged wife, memory-haunted, trying to reconcile two versions of the same shadowy man. And their small son Justin, standing at the window, scanning the sky for more planes.These are lives choreographed by loss, grief and the enormous force of history.","246 pages, Hardcover",Fiction,"5,883 followers","1,521 reviews","93 books5,883 followers","1,065 (6%)","2,601 (15%)","5,794 (35%)","4,817 (29%)","2,075 (12%)"
