Title,Authors,Avg Ratings,Rating,first_published,Description,Total_Pages,Genre,author_followers,no_of_reviews,no_book_by_author,one_star_ratings,two_star_ratings,three_star_ratings,four_star_ratings,five_star_ratings
This Side of the Grave,Jeaniene Frost,"62,968","ratings2,610","First published February 1, 2011","Danger waits on both sides of the grave.Half-vampire Cat Crawfield and her vampire husband Bones have fought for their lives, as well as for their relationship. But just when they've triumphed over the latest battle, Cat's new and unexpected abilities threaten to upset a long-standing balance . . .With the mysterious disappearance of vampires, rumors abound that a species war is brewing. A zealot is inciting tensions between the vampires and ghouls, and if these two powerful groups clash, innocent mortals could become collateral damage. Now Cat and Bones are forced to seek help from a dangerous ""ally""—the ghoul queen of New Orleans herself. But the price of her assistance may prove more treacherous than even the threat of a supernatural war . . . to say nothing of the repercussions Cat never imagined.","357 pages, Mass Market Paperback",Vampires,26.6k followers,"2,610 reviews",70 books26.6k followers,463 (<1%),"1,455 (2%)","9,172 (14%)","21,747 (34%)","30,131 (47%)"
A Good Hard Look,Ann Napolitano,"4,250",ratings527,"First published January 1, 2011","Heartbreakingly beautiful and inescapably human, ordinary and extraordinary people chart their own courses in life. In the aftermath of one tragic afternoon, they are all forced to look at themselves and face up to the observation that the truth does not change according to our ability to stomach it.Crippled by lupus at twenty-five, celebrated author Flannery O'Connor was forced to leave New York City and return home to Andalusia, her family farm in Milledgeville, Georgia. Years later, as Flannery is finishing a novel and tending to her menagerie of peacocks, her mother drags her to the wedding of a family friend. Cookie Himmel embodies every facet of Southern womanhood that Flannery lacks: she is revered for her beauty and grace; she is at the helm of every ladies' organization in town; and she has returned from her time in Manhattan with a rich fiancé, Melvin Whiteson. Melvin has come to Milledgeville to begin a new chapter in his life, but it is not until he meets Flannery that he starts to take a good hard look at the choices he has made. Despite the limitations of her disease, Flannery seems to be more alive than other people, and Melvin is drawn to her like a moth to a candle flame. Melvin is not the only person in Milledgeville who starts to feel that life is passing him by. Lona Waters, the dutiful wife of a local policeman, is hired by Cookie to help create a perfect home. As Lona spends her days sewing curtains, she is given an opportunity to remember what it feels like to be truly alive, and she seizes it with both hands. Heartbreakingly beautiful and inescapably human, these ordinary and extraordinary people chart their own courses through life. In the aftermath of one tragic afternoon, they are all forced to look at themselves and face up to Flannery's observation that ""the truth does not change according to our ability to stomach it.""","326 pages, Hardcover",Fiction,"4,554 followers",527 reviews,"5 books4,554 followers",61 (1%),171 (4%),812 (19%),"1,735 (40%)","1,471 (34%)"
Tinker,Wen Spencer,"5,671",ratings421,"First published October 1, 2003","Inventor, girl genius Tinker lives in a near-future Pittsburgh which now exists mostly in the land of the elves. She runs her salvage business, pays her taxes, and tries to keep the local ambient level of magic down with gadgets of her own design. When a pack of wargs chase an Elven noble into her scrap yard, life as she knows it takes a serious detour. Tinker finds herself taking on the Elven court, the NSA, the Elven Interdimensional Agency, technology smugglers and a college-minded Xenobiologist as she tries to stay focused on what's really important — her first date. Armed with an intelligence the size of a planet, steel-toed boots, and a junkyard dog attitude, Tinker is ready to kick butt to get her first kiss.","448 pages, Mass Market Paperback",Fantasy,862 followers,421 reviews,47 books862 followers,133 (2%),301 (5%),971 (17%),"1,834 (32%)","2,432 (42%)"
Stolen Voices,Ellen Dee Davidson,160,ratings21,"First published January 1, 2005","Life in Noveskina is designed to be harmonious and conflict-free. But 15-year-old Miri, daughter of two of the city's Important Officials, faces a shameful dilemma. She has matured with no clear Talent and thus faces life among the lower classes. As Miri is confronted with the dark secrets of Noveskina, the quiet peace of this once-perfect world reveals itself as something infinitely more sinister. In a city ruled by silence, can one voice make a difference?","188 pages, Paperback",Dystopia,58 followers,21 reviews,7 books58 followers,6 (3%),21 (13%),53 (33%),43 (26%),37 (23%)
Charming the Highlander,Janet Chapman,"7,961",ratings301,"First published January 28, 2003","A feisty beauty tempted by a bold highlander's touch... When a plane crash strands brilliant scientist Grace Sutter on an icy mountaintop in Maine, she finds herself alone in the wilderness with the only other surviving passenger -- Greylen MacKeage, a sexy, medieval warrior who's been tossed through time to find the woman he's destined to love. Forced together to survive the harsh, wintry landscape, neither expects the fierce passion that flares between them. But Grace is not used to letting her heart take control, and Greylen will settle for nothing less than her heart's surrender....","400 pages, Mass Market Paperback",Romance,"1,086 followers",301 reviews,"43 books1,086 followers",145 (1%),372 (4%),"1,485 (18%)","2,608 (32%)","3,351 (42%)"
The Wandering Falcon,Jamil Ahmad,"3,026",ratings497,"First published January 1, 2011","A haunting literary debut set in the forbidding remote tribal areas of Pakistan and Afghanistan.Traditions that have lasted for centuries, both brutal and beautiful, create a rigid structure for life in the wild, astonishing place where Iran, Pakistan, and Afghanistan meet—the Federally Administered Tribal Lands (FATA). It is a formidable world and the people who live there are constantly subjected to extremes—both of geography and of culture.The Wandering Falcon begins with a young couple, refugees from their tribe, who have traveled to the middle of nowhere to escape the cruel punishments meted upon those who transgress the boundaries of marriage and family. Their son, Tor Baz, descended from both chiefs and outlaws, becomes “The Wandering Falcon,” a character who travels throughout the tribes, over the mountains and the plains, in the towns and tents that comprise the homes of the tribal people. The media today speak about this unimaginably remote region, a geopolitical hotbed of conspiracies, drone attacks, and conflict—now, told in the rich, dramatic tones of a master storyteller, this stunning, honor-bound culture is revealed from the inside.Jamil Ahmad has written an unforgettable portrait of a world of custom and compassion, of love and cruelty, of hardship and survival, a place fragile, unknown, and unforgiving.","256 pages, Hardcover",Fiction,53 followers,497 reviews,9 books53 followers,85 (2%),316 (10%),"1,042 (34%)","1,084 (35%)",499 (16%)
The Art of Hearing Heartbeats,Jan-Philipp Sendker,"81,782","ratings7,864","First published January 1, 2002","The first book in the Art of Hearing Heartbeats series, this is a passionate love story, a haunting fable, and an enchanting mystery set in Burma.When a successful New York lawyer suddenly disappears without a trace, neither his wife nor his daughter Julia has any idea where he might be…until they find a love letter he wrote many years ago, to a Burmese woman they have never heard of. Intent on solving the mystery and coming to terms with her father’s past, Julia decides to travel to the village where the woman lived. There she uncovers a tale of unimaginable hardship, resilience, and passion that will reaffirm the reader’s belief in the power of love to move mountains.","325 pages, Paperback",Fiction,933 followers,"7,864 reviews",18 books933 followers,"1,103 (1%)","4,094 (5%)","16,122 (19%)","30,868 (37%)","29,595 (36%)"
Retribution,Steven Savile,197,ratings17,"First published March 27, 2007","With Vlad and Konrad defeated, now is the time for the most dangerous vampire count of them all to take centre stage. Strong, cunning and resourceful, Mannfred von Carstein assembles his undead army and prepares to strike at the heart of the Empire. The men of the Empire and their allies the dwarfs have one last chance to stop their undead foe - Hel Fenn.","416 pages, Paperback",Fantasy,246 followers,17 reviews,215 books246 followers,6 (3%),13 (6%),59 (29%),76 (38%),43 (21%)
Robopocalypse,Daniel H. Wilson,"39,534","ratings4,473","First published June 7, 2011","In the near future, at a moment no one will notice, all the dazzling technology that runs our world will unite and turn against us. Taking on the persona of a shy human boy, a childlike but massively powerful artificial intelligence known as Archos comes online and assumes control over the global network of machines that regulate everything from transportation to utilities, defense and communication.In the months leading up to this, sporadic glitches are noticed by a handful of unconnected humans—a single mother disconcerted by her daughter's menacing ""smart"" toys, a lonely Japanese bachelor who is victimized by his domestic robot companion, an isolated U.S. soldier who witnesses a ""pacification unit"" go haywire—but most are unaware of the growing rebellion until it is too late.When the Robot War ignites—at a moment known later as Zero Hour—humankind will be both decimated and, possibly, for the first time in history, united. Robopocalypse is a brilliantly conceived action-filled epic, a terrifying story with heart-stopping implications for the real technology all around us ... and an entertaining and engaging thriller unlike anything else written in years.","368 pages, Hardcover",Science Fiction,"1,909 followers","4,473 reviews","112 books1,909 followers","1,213 (3%)","3,431 (8%)","10,604 (26%)","14,947 (37%)","9,339 (23%)"
When the Soul Mends,Cindy Woodsmall,"3,804",ratings329,"First published January 1, 2008","Returning to the home she fled in disgrace, will Hannah find healing for the wounds of the past?After receiving a desperate and confusing call from her sister, Hannah Lapp reluctantly returns to the Old Order Amish community of her Pennsylvania childhood.Having fled in disgrace more than two years earlier, she finally has settled into a satisfying role in the Englischer world. She also has found love and a new family with the wealthy Martin Palmer and the children she is helping him raise. But almost immediately after her arrival in Owl’s Perch, the disapproval of those who ostracized her, including her headstrong father, reopens old wounds.As Hannah is thrown together with former fiancé Paul Waddell to work for her sister Sarah’s mental health, hidden truths surface about events during Hannah’s absence, and she faces an agonizing decision. Will she choose the Englischer world and the man who restored her hope, or will she heed the call to return to the Plain Life–and perhaps to her first love?When the Soul Mends is the third and final book in the Sisters of the Quilt series.","354 pages, Paperback",Amish,"1,085 followers",329 reviews,"46 books1,085 followers",17 (<1%),61 (1%),454 (11%),"1,244 (32%)","2,028 (53%)"
The Quest,Wilbur Smith,"10,902",ratings473,"First published January 1, 2007","Wilbur Smith returns with the eagerly awaited sequel to his thrilling Egyptian series. Following on from River God, The Seventh Scroll and Warlock. The Quest continues the story of the Warlock, Taita, wise in the lore of the ancient Gods and a master of magic and the supernatural.Egypt is struck by a series of terrible plagues that cripple the Kingdom, and then the ultimate disaster follows. The Nile fails. The waters that nourish and sustain the land dry up. Something catastrophic is taking place in the distant and totally unexplored depths of Africa from where the mighty river springs. In desperation Pharoah sends for Taita, the only man who might be able to win through to the source of the Nile and discover the cause of all their woes. None of them can have any idea of what a terrible enemy lies in ambush for The Warlock in those mysterious lands at the end of their world.","718 pages, Hardcover",Historical Fiction,"4,006 followers",473 reviews,"462 books4,006 followers",435 (3%),756 (6%),"2,401 (22%)","3,546 (32%)","3,764 (34%)"
Truth,Julia Karr,"1,657",ratings182,"First published January 19, 2012","An exciting dystopian thriller, and sequel to XVI Nina Oberon's life has changed enormously in the last few months. When her mother was killed, Nina discovered the truth about her father, the leader of the Resistance. And now she sports the same Governing Council–ordered tattoo of XVI on her wrist that all sixteen-year-old girls have. The one that announces to the world that she is easy prey to predators. But Nina won't be anyone's stereotype. And when she joins an organization of girls working within the Resistance, she knows that they can put an end to one of the most terrifying secret programs the GC has ever conceived. Because the truth always comes out . . . and the consequences can be deadly.","299 pages, Paperback",Dystopia,380 followers,182 reviews,6 books380 followers,51 (3%),158 (9%),447 (26%),549 (33%),452 (27%)
White Lies,Jayne Ann Krentz,"10,760",ratings527,"First published January 25, 2007","Relationships are challenging enough for most single over-thirty women. For level-ten parasensitive Clare Lancaster, they're a minefield. The elite few who know her secret call her a human lie detector, and any falsehood, no matter how subtle or well hidden, sets her blood racing. Over the years, Clare has come to accept that someone with her extraordinary talents is unlikely to find a suitable mate. And she's even resigned herself to the fact that everyone, to one degree or another, hides behind a facade.Including her recently deceased brother-in-law. When Clare finds the body of Brad McAllister, the golden child of Stone Canyon, Arizona, the posh residents turn a suspicious eye in her direction. As Archer Glazebrook's daughter, Clare is shielded from the law, but not the gossip. It seems that meeting the half sister and family whom she did not know until seven months ago was a mistake. Now her father summons her from California to play a role in his business empire, and Clare doesn't intend on making the same mistake twice.But after meeting Jake Salter, Archer Lancaster’s “business consultant,” she is convinced that things aren’t what they seem. Salter’s careful conversation walks a delicate line between truth and deception, revealing and resisting. Something sparks and sizzles between them—something more than the usual electricity between a man and a woman.Caught in a dizzying storm of secrets, lies, and half-truths, Jake and Clare will plunge into an investigation that demands every bit of their special gifts. Together, they must overcome their mutual distrust in order to unravel a web of conspiracy and murder.","371 pages, Hardcover",Romance,"6,750 followers",527 reviews,"414 books6,750 followers",83 (<1%),344 (3%),"2,265 (21%)","4,195 (38%)","3,873 (35%)"
"Becoming the Gospel: Paul, Participation, and Mission (The Gospel and Our Culture Series",Michael J. Gorman,135,ratings13,"First published May 6, 2015","The first detailed exegetical treatment of Paul’s letters from the emerging discipline of missional hermeneutics, Michael Gorman’s Becoming the Gospel argues that Paul’s letters invite Christian communities both then and now to not merely believe the gospel but to become the gospel and, in doing so, to participate in the life and mission of God.Showing that Pauline churches were active public participants in and witnesses to the gospel, Gorman reveals the missional significance of various themes in Paul’s letters. He also identifies select contemporary examples of mission in the spirit of Paul, inviting all Christians to practice Paul-inspired imagination in their own contexts.","351 pages, Paperback",Theology,69 followers,13 reviews,39 books69 followers,1 (<1%),5 (3%),17 (12%),45 (33%),67 (49%)
Ohio,Stephen Markley,"13,160","ratings2,224","First published August 21, 2018","“Extraordinary...beautifully precise...[an] earnestly ambitious debut.” —The New York Times Book Review “A wild, angry, and devastating masterpiece of a book.” —NPR “[A] descendent of the Dickensian ‘social novel’ by way of Jonathan epic fiction that lays bare contemporary culture clashes, showing us who we are and how we got here.” —O, The Oprah Magazine “A book that has stayed with me ever since I put it down.” —Seth Meyers, host of Late Night with Seth MeyersOne sweltering night in 2013, four former high school classmates converge on their hometown in northeastern Ohio. There’s Bill Ashcraft, a passionate, drug-abusing young activist whose flailing ambitions have taken him from Cambodia to Zuccotti Park to post-BP New Orleans, and now back home with a mysterious package strapped to the undercarriage of his truck; Stacey Moore, a doctoral candidate reluctantly confronting her family and the mother of her best friend and first love, whose disappearance spurs the mystery at the heart of the novel; Dan Eaton, a shy veteran of three tours in Iraq, home for a dinner date with the high school sweetheart he’s tried desperately to forget; and the beautiful, fragile Tina Ross, whose rendezvous with the washed-up captain of the football team triggers the novel’s shocking climax. Set over the course of a single evening, Ohio toggles between the perspectives of these unforgettable characters as they unearth dark secrets, revisit old regrets and uncover—and compound—bitter betrayals. Before the evening is through, these narratives converge masterfully to reveal a mystery so dark and shocking it will take your breath away.","514 pages, Kindle Edition",Fiction,846 followers,"2,224 reviews",6 books846 followers,456 (3%),950 (7%),"2,596 (19%)","5,028 (38%)","4,130 (31%)"
Ban This Book,Alan Gratz,"12,616","ratings2,201","First published August 29, 2017","-Readers, librarians, and all those books that have drawn a challenge have a brand new hero.... Stand up and cheer, book lovers. This one's for you.- --Kathi Appelt, author of the Newbery Honor-winning The UnderneathAn inspiring tale of a fourth-grader who fights back when her favorite book is banned from the school library--by starting her own illegal locker library!It all started the day Amy Anne Ollinger tried to check out her favorite book in the whole world, From the Mixed-Up Files of Mrs. Basil E. Frankweiler, from the school library. That's when Mrs. Jones, the librarian, told her the bad news: her favorite book was banned! All because a classmate's mom thought the book wasn't appropriate for kids to read.Amy Anne decides to fight back by starting a secret banned books library out of her locker. Soon, she finds herself on the front line of an unexpected battle over book banning, censorship, and who has the right to decide what she and her fellow students can read.Reminiscent of the classic novel Frindle by Andrew Clements for its inspiring message, Ban This Book is a love letter to the written word and its power to give kids a voice.-Ban This Book is absolutely brilliant and belongs on the shelves of every library in the multiverse.---Lauren Myracle, author of the bestselling Internet Girls series, the most challenged books of 2009 and 2011","256 pages, Hardcover",Middle Grade,"3,664 followers","2,201 reviews","32 books3,664 followers",64 (<1%),173 (1%),"1,116 (8%)","4,480 (35%)","6,783 (53%)"
A Good Marriage,Kimberly McCreight,"55,360","ratings5,800","First published May 5, 2020","Lizzie Kitsakis is working late when she gets the call. Grueling hours are standard at elite law firms like Young & Crane, but they’d be easier to swallow if Lizzie was there voluntarily. Until recently, she’d been a happily underpaid federal prosecutor. That job and her brilliant, devoted husband Sam—she had everything she’d ever wanted. And then, suddenly, it all fell apart. No. That’s a lie. It wasn’t sudden, was it? Long ago the cracks in Lizzie’s marriage had started to show. She was just good at averting her eyes. The last thing Lizzie needs right now is a call from an inmate at Rikers asking for help—even if Zach Grayson is an old friend. But Zach is desperate: his wife, Amanda, has been found dead at the bottom of the stairs in their Brooklyn brownstone. And Zach’s the primary suspect. As Lizzie is drawn into the dark heart of idyllic Park Slope, she learns that Zach and Amanda weren’t what they seemed—and that their friends, a close-knit group of fellow parents at the exclusive Brooklyn Country Day school, might be protecting troubling secrets of their own. In the end, she’s left wondering not only whether her own marriage can be saved, but what it means to have a good marriage in the first place.Big Little Lies meets Presumed Innocent in this riveting novel from the New York Times bestselling author of Reconstructing Amelia, in which a woman’s brutal murder reveals the perilous compromises some couples make—and the secrets they keep—in order to stay together.","410 pages, Hardcover",Thriller,"4,138 followers","5,800 reviews","15 books4,138 followers",356 (<1%),"1,880 (3%)","12,728 (22%)","27,860 (50%)","12,536 (22%)"
The Dry,Jane Harper,"236,672","ratings19,454","First published November 8, 2016","A small town hides big secrets in this atmospheric, page-turning debut mystery by award-winning author Jane Harper.In the grip of the worst drought in a century, the farming community of Kiewarra is facing life and death choices daily when three members of a local family are found brutally slain.Federal Police investigator Aaron Falk reluctantly returns to his hometown for the funeral of his childhood friend, loath to face the townsfolk who turned their backs on him twenty years earlier. But as questions mount, Falk is forced to probe deeper into the deaths of the Hadler family. Because Falk and Luke Hadler shared a secret. A secret Falk thought was long buried. A secret Luke's death now threatens to bring to the surface in this small Australian town, as old wounds in bleed into new ones.","331 pages, Paperback",Mystery,12.8k followers,"19,454 reviews",18 books12.8k followers,"2,789 (1%)","6,715 (2%)","41,079 (17%)","108,890 (46%)","77,199 (32%)"
Beastly,Alex Flinn,"176,161","ratings9,343","First published October 2, 2007","I am a beast.A beast. Not quite wolf or bear, gorilla or dog but a horrible new creature who walks upright—a creature with fangs and claws and hair springing from every pore. I am a monster.You think I'm talking fairy tales? No way. The place is New York City. The time is now. It's no deformity, no disease. And I'll stay this way forever—ruined—unless I can break the spell.Yes, the spell, the one the witch in my English class cast on me. Why did she turn me into a beast who hides by day and prowls by night? I'll tell you. I'll tell you how I used to be Kyle Kingsbury, the guy you wished you were, with money, perfect looks, and the perfect life. And then, I'll tell you how I became perfectly . . . beastly.","336 pages, Hardcover",Fantasy,"5,626 followers","9,343 reviews","30 books5,626 followers","4,928 (2%)","14,783 (8%)","44,878 (25%)","53,685 (30%)","57,887 (32%)"
