Title,Authors,Avg Ratings,Rating,first_published,Description,Total_Pages,Genre,author_followers,no_of_reviews,no_book_by_author,one_star_ratings,two_star_ratings,three_star_ratings,four_star_ratings,five_star_ratings
Claimed by Shadow,Karen Chance,"22,854",ratings740,"First published April 3, 2007","Clairvoyant Cassie Palmer has inherited new magical powers-including the ability to travel through time. But it's a whole lot of responsibility she'd rather not have. Now she's the most popular girl in town, as an assortment of vamps, fey, and mages try to convince, force, or seduce her—and her magic—over to their side. But one particular master vampire didn't ask what Cassie wanted before putting a claim on her. He had a spell cast that binds her to him, and now she doesn't know if what she feels for him is real—or imagined…","374 pages, Mass Market Paperback",Urban Fantasy,"5,177 followers",740 reviews,"55 books5,177 followers",331 (1%),"1,098 (4%)","5,289 (23%)","8,274 (36%)","7,862 (34%)"
"The Flavor Bible: The Essential Guide to Culinary Creativity, Based on the Wisdom of America's Most Imaginative Chefs",Andrew Dornenburg,"21,530",ratings309,"First published January 1, 2008","Winner of the 2009 James Beard Book Award for Best Book: Reference and ScholarshipGreat cooking goes beyond following a recipe--it's knowing how to season ingredients to coax the greatest possible flavor from them. Drawing on dozens of leading chefs' combined experience in top restaurants across the country, Karen Page and Andrew Dornenburg present the definitive guide to creating ""deliciousness"" in any dish. Thousands of ingredient entries, organized alphabetically and cross-referenced, provide a treasure trove of spectacular flavor combinations. Readers will learn to work more intuitively and effectively with ingredients; experiment with temperature and texture; excite the nose and palate with herbs, spices, and other seasonings; and balance the sensual, emotional, and spiritual elements of an extraordinary meal.Seasoned with tips, anecdotes, and signature dishes from America's most imaginative chefs, THE FLAVOR BIBLE is an essential reference for every kitchen.","380 pages, Hardcover",Cookbooks,23 followers,309 reviews,11 books23 followers,"1,232 (5%)","1,523 (7%)","2,991 (13%)","5,090 (23%)","10,694 (49%)"
The Story of Beautiful Girl,Rachel Simon,"26,805","ratings3,928","First published May 2, 2011","It is 1968. Lynnie, a young white woman with a developmental disability, and Homan, an African American deaf man, are locked away in an institution, the School for the Incurable and Feebleminded, and have been left to languish, forgotten. Deeply in love, they escape, and find refuge in the farmhouse of Martha, a retired schoolteacher and widow. But the couple is not alone-Lynnie has just given birth to a baby girl. When the authorities catch up to them that same night, Homan escapes into the darkness, and Lynnie is caught. But before she is forced back into the institution, she whispers two words to Martha: ""Hide her."" And so begins the 40-year epic journey of Lynnie, Homan, Martha, and baby Julia-lives divided by seemingly insurmountable obstacles, yet drawn together by a secret pact and extraordinary love.","346 pages, Hardcover",Fiction,335 followers,"3,928 reviews",22 books335 followers,320 (1%),"1,291 (4%)","6,049 (22%)","11,371 (42%)","7,774 (29%)"
Heaven,Randy Alcorn,"13,170","ratings1,063","First published January 1, 2004","What is Heaven really going to be like? What will we look like? What will we do? Won't Heaven get boring after a while?We all have questions about what Heaven will be like, and after 25 years of extensive research, Dr. Randy Alcorn has the answers.In the most comprehensive and definitive book on Heaven to date, Randy invites you to picture Heaven the way Scripture describes it-- a bright, vibrant, and physical New Earth, free from sin, suffering, and death, and brimming with Christ's presence, wondrous natural beauty, and the richness of human culture as God intended it. God has put eternity in our hearts. Now, Randy Alcorn brings eternity to light in a way that will surprise you, spark your imagination, and change how you live life today. If you've always thought of Heaven as a realm of disembodied spirits, clouds, and eternal harp strumming, you're in for a wonderful surprise. This is a book about real people with real bodies enjoying close relationships with God and each other, eating, drinking, working, playing, traveling, worshiping, and discovering on a New Earth. Earth as God created it. Earth as he intended it to be. And the next time you hear someone say, ""We cant begin to imagine what Heaven will be like,"" you'll be able to tell them, ""I can.""","533 pages, Hardcover",Christian,"1,419 followers","1,063 reviews","231 books1,419 followers",239 (1%),472 (3%),"1,714 (13%)","3,715 (28%)","7,030 (53%)"
Peace,Richard Bausch,"1,037",ratings201,"First published April 15, 2008","From the prize-winning novelist and world-renowned short story writer, recipient of the PEN/Malamud Award and the Academy Award from the Academy of Arts and Letters, a powerful novel about war, trust, and salvation that begs to be read in a single sitting.Italy, near Cassino. The terrible winter of 1944. A dismal icy rain, continuing unabated for days. Guided by a seventy-year-old Italian man in rope-soled shoes, three American soldiers are sent on a reconnaissance mission up the side of a steep hill that they discover, before very long, to be a mountain. And the old man’s indeterminate loyalties only add to the terror and confusion that engulf them on that mountain, where they are confronted with the horror of their own time—and then set upon by a sniper.Taut and propulsive—with its spare language, its punishing landscape, and the keenly drawn portraits of the three young soldiers at its center— Peace is a feat of economy, compression, and imagination, a brutal and unmistakably contemporary meditation on the corrosiveness of violence, the human cost of war, and the redemptive power of mercy.","171 pages, Hardcover",Fiction,185 followers,201 reviews,81 books185 followers,23 (2%),69 (6%),239 (23%),434 (41%),272 (26%)
The Unwanteds,Lisa McMann,"40,663","ratings3,676","First published August 30, 2011","Every year in Quill, thirteen-year-olds are sorted into categories: the strong, intelligent Wanteds go to university, and the artistic Unwanteds are sent to their deaths.Thirteen-year-old Alex tries his hardest to be stoic when his fate is announced as Unwanted, even while leaving behind his twin, Aaron, a Wanted. Upon arrival at the destination where he expected to be eliminated, however, Alex discovers a stunning secret--behind the mirage of the ""death farm"" there is instead a place called Artime.In Artime, each child is taught to cultivate their creative abilities and learn how to use them magically, weaving spells through paintbrushes and musical instruments. Everything Alex has ever known changes before his eyes, and it's a wondrous transformation.But it's a rare, unique occurence for twins to be separated between Wanted and Unwanted, and as Alex and Aaron's bond stretches across their separation, a threat arises for the survival of Artime that will pit brother against brother in an ultimate, magical battle.","390 pages, Hardcover",Fantasy,"6,811 followers","3,676 reviews","56 books6,811 followers",754 (1%),"2,008 (4%)","7,110 (17%)","12,517 (30%)","18,274 (44%)"
Sh*t My Dad Says,Justin Halpern,"156,176","ratings8,878","First published May 4, 2010","After being dumped by his longtime girlfriend, twenty-eight-year-old Justin Halpern found himself living at home with his seventy-three-year-old dad. Sam Halpern, who is ""like Socrates, but angrier, and with worse hair,"" has never minced words, and when Justin moved back home, he began to record all the ridiculous things his dad said to him:""That woman was sexy. . . . Out of your league? Son, let women figure out why they won't screw you. Don't do it for them.""""Do people your age know how to comb their hair? It looks like two squirrels crawled on their heads and started fucking.""""The worst thing you can be is a liar. . . . Okay, fine, yes, the worst thing you can be is a Nazi, but then number two is liar. Nazi one, liar two.""More than a million people now follow Mr. Halpern's philosophical musings on Twitter, and in this book, his son weaves a brilliantly funny, touching coming-of-age memoir around the best of his quotes. An all-American story that unfolds on the Little League field, in Denny's, during excruciating family road trips, and, most frequently, in the Halperns' kitchen over bowls of Grape-Nuts, Sh*t My Dad Says is a chaotic, hilarious, true portrait of a father-son relationship from a major new comic voice.","159 pages, Hardcover",Humor,864 followers,"8,878 reviews",12 books864 followers,"3,708 (2%)","8,500 (5%)","32,549 (20%)","53,577 (34%)","57,842 (37%)"
Upheaval: Turning Points for Nations in Crisis,Jared Diamond,"10,017","ratings1,225","First published May 7, 2019","In his international bestsellers Guns, Germs and Steel and Collapse, Jared Diamond transformed our understanding of what makes civilizations rise and fall. Now, in his third book in this monumental trilogy, he reveals how successful nations recover from crises while adopting selective changes -- a coping mechanism more commonly associated with individuals recovering from personal crises.Diamond compares how six countries have survived recent upheavals -- ranging from the forced opening of Japan by U.S. Commodore Perry's fleet, to the Soviet Union's attack on Finland, to a murderous coup or countercoup in Chile and Indonesia, to the transformations of Germany and Australia after World War Two. Because Diamond has lived and spoken the language in five of these six countries, he can present gut-wrenching histories experienced firsthand. These nations coped, to varying degrees, through mechanisms such as acknowledgment of responsibility, painfully honest self-appraisal, and learning from models of other nations. Looking to the future, Diamond examines whether the United States, Japan, and the whole world are successfully coping with the grave crises they currently face. Can we learn from lessons of the past? Adding a psychological dimension to the in-depth history, geography, biology, and anthropology that mark all of Diamond's books, Upheaval reveals factors influencing how both whole nations and individual people can respond to big challenges. The result is a book epic in scope, but also his most personal book yet.","512 pages, Hardcover",History,"7,226 followers","1,225 reviews","45 books7,226 followers",148 (1%),532 (5%),"2,257 (22%)","4,344 (43%)","2,736 (27%)"
The Book of Delights: Essays,Ross Gay,"15,362","ratings2,708","First published February 12, 2019","Ross Gay’s The Book of Delights is a genre-defying book of essays—some as short as a paragraph; some as long as five pages—that record the small joys that occurred in one year, from birthday to birthday, and that we often overlook in our busy lives. His is a meditation on delight that takes a clear-eyed view of the complexities, even the terrors, in his life, including living in America as a black man; the ecological and psychic violence of our consumer culture; the loss of those he loves. Among Gay’s funny, poetic, philosophical delights: the way Botan Rice Candy wrappers melt in your mouth, the volunteer crossing guard with a pronounced tremor whom he imagines as a kind of boat-woman escorting pedestrians across the River Styx, a friend’s unabashed use of air quotes, pickup basketball games, the silent nod of acknowledgment between black people. And more than any other subject, Gay celebrates the beauty of the natural world—his garden, the flowers in the sidewalk, the birds, the bees, the mushrooms, the trees.This is not a book of how-to or inspiration, though it could be read that way. Fans of Roxane Gay, Maggie Nelson, and Kiese Laymon will revel in Gay’s voice, and his insights. The Book of Delights is about our connection to the world, to each other, and the rewards that come from a life closely observed. Gay’s pieces serve as a powerful and necessary reminder that we can, and should, stake out a space in our lives for delight. Preface1. My Birthday, Kinda2. Inefficiency3. Flower in the Curb4. Blowing It Off5. Hole in the Head6. Remission Still7. Praying Mantis8. The Negreeting9. The High-Five from Strangers, Etc10. Writing by Hand11. Transplanting12. Nicknames13. But, Maybe ..14. ""Joy Is Such a Human Madness15. House Party16. Hummingbird17. Just a Dream18. ""That's Some Bambi Shit"" ..19. The Irrepressible: The Gratitudes20. Tap Tap21. Coffee without the Saucer22. Lily on the Pants23. Sharing a Bag 24. Umbrella in the Café25. Beast Mode26. Airplane Rituals27. Weirdly Untitled28. Pecans29. The Do-Over30. Infinity31. Ghost32. Nota Bene33. ""Love Me in a Special Way""34. ""Stay,"" by Lisa Loeb35. Stacking Delights36. Donny Hathaway on Pandora37. ""To Spread the Sweetness of Love""38. Baby, Baby, Baby39. ""REPENT OR BURN""40. Giving My Body to the Cause41. Among the Rewards of My Sloth . .42. Not Grumpy Cat43. Some Stupid Shit44. Not Only . .45. Microgentrification: WE BUY GOLD46. Reading Palms47. The Sanctity of Trains48. Bird Feeding49. Kombucha in a Mid-century Glass50. Hickories51. Annoyed No More52. Toto53. Church Poets54. Public Lying Down55. Babies. Seriously56. ""My Life, My Life, My Life, My Life in the Sunshine57. Incorporation58. Botan Rice Candy59. Understory60. ""Joy Is Such a Human Madness"": The Duff Between Us61. ""It's Just the Day I'm Having"" ..62. The Purple Cornets of Spring63. The Volunteer64. Fishing an Eyelash: Two or Three Cents on the Virtues of the Poetry Reading65. Found Things66. Found Things (2)67. Cuplicking68. Bobblehead69. The Jenky 70. The Crow's Ablutions71. Flowers in the Hands of Statues72. An Abundance of Public Toilets73. The Wave of Unfamiliars74. Not for Nothing75. Bindweed ... Delight?76. Dickhead77. Ambiguous Signage Sometimes78. Heart to Heart79. Caution: Bees on Bridge80. Tomato on Board81. Purple-Handed82. Name: Kayte Young; Phone Number: 555-867-530983. Still Processing84. Fireflies85. My Scythe Jack86. Pawpaw Grove87. Loitering88. Touched89. Scat90. Get Thee to the Nutrient Cycle!91. Pulling Carrots92. Filling the Frame93. Reckless Air Quotes 94. Judith Irene Gay, Aged Seventy-six Today!95. Rothko Backboard96. The Marfa Lights97. The Carport98. My Garden (Book):99. Black Bumblebees!100. Grown101. Coco-baby102. My Birthday","274 pages, Hardcover",Essays,"1,187 followers","2,708 reviews","32 books1,187 followers",191 (1%),637 (4%),"2,407 (15%)","5,308 (34%)","6,819 (44%)"
"The Body Keeps the Score: Brain, Mind, and Body in the Healing of Trauma",Bessel van der Kolk,"176,178","ratings14,435","First published June 12, 2014","A pioneering researcher transforms our understanding of trauma and offers a bold new paradigm for healing. Trauma is a fact of life. Veterans and their families deal with the painful aftermath of combat; one in five Americans has been molested; one in four grew up with alcoholics; one in three couples have engaged in physical violence. Dr. Bessel van der Kolk, one of the world's foremost experts on trauma, has spent over three decades working with survivors. In The Body Keeps the Score, he uses recent scientific advances to show how trauma literally reshapes both body and brain, compromising sufferers' capacities for pleasure, engagement, self-control, and trust. He explores innovative treatments—from neurofeedback and meditation to sports, drama, and yoga—that offer new paths to recovery by activating the brain's natural neuroplasticity. Based on Dr. van der Kolk's own research and that of other leading specialists, The Body Keeps the Score exposes the tremendous power of our relationships both to hurt and to heal—and offers new hope for reclaiming lives.","464 pages, Hardcover",Nonfiction,"2,287 followers","14,435 reviews","34 books2,287 followers","1,726 (<1%)","3,658 (2%)","16,986 (9%)","52,656 (29%)","101,152 (57%)"
The Spook's Sacrifice,Joseph  Delaney,"15,341",ratings531,"First published June 4, 2008","As the Spook's apprentice Tom's first duty is to protect the County from the dark. But now Mam needs his help in her homeland of Greece. One of the most dangerous of the old gods, the Ordeen, is about to return there, bringing slaughter and devastation. Meanwhile, the Devil himself is still loose and if he and the Ordeen join forces, a new age of darkness will descend.Mam has summoned a powerful group to her side but among them are Tom's old enemy, the Pendle witches, including the assassin Grimalkin, and the cunning clan leader Mab Moldheel. Can Tom go against all the Spook has taught him and ally himself to the witches? What is the secret that Mam is keeping from him? And what sacrifices must be made in the battle against the dark?","384 pages, Hardcover",Fantasy,"3,845 followers",531 reviews,"59 books3,845 followers",75 (<1%),359 (2%),"2,510 (16%)","5,829 (37%)","6,568 (42%)"
The Master Butchers Singing Club,Louise Erdrich,"24,966","ratings2,143","First published January 1, 2003","What happens when a trained killer discovers, in the aftermath of war, that his true vocation is love? Having survived the killing fields of World War I, Fidelis Waldvogel returns home to his quiet German village and marries the pregnant widow of his best friend, killed in action.With a suitcase full of sausages and a master butcher's precious set of knives, Fidelis sets out for America, getting as far as Argus, North Dakota, where he settles, building a business and a home for his family, which now includes Eva and four sons, and a singing club consisting of the best voices in town.What happens when the Old World meets the New, in the person of Delphine Watzka, becomes one of the great adventures of Fidelis's life. Delphine meets Eva and is enchanted. She meets Fidelis, and the ground trembles. These momentous encounters will determine the course of Delphine's life, and the trajectory of this brilliant new novel in which Louise Erdrich creates a world filled with memorable characters who grapple with the worst and best of human nature.","389 pages, Paperback",Fiction,10.5k followers,"2,143 reviews",125 books10.5k followers,280 (1%),913 (3%),"4,642 (18%)","10,304 (41%)","8,827 (35%)"
Color: A Natural History of the Palette,Victoria Finlay,"68,418",ratings807,"First published January 1, 2003","In this vivid and captivating journey through the colors of an artist’s palette, Victoria Finlay takes us on an enthralling adventure around the world and through the ages, illuminating how the colors we choose to value have determined the history of culture itself.How did the most precious color blue travel all the way from remote lapis mines in Afghanistan to Michelangelo’s brush? What is the connection between brown paint and ancient Egyptian mummies? Why did Robin Hood wear Lincoln green? In Color , Finlay explores the physical materials that color our world, such as precious minerals and insect blood, as well as the social and political meanings that color has carried through time.Roman emperors used to wear togas dyed with a purple color that was made from an odorous Lebanese shellfish–which probably meant their scent preceded them. In the eighteenth century, black dye was called logwood and grew along the Spanish Main. Some of the first indigo plantations were started in America, amazingly enough, by a seventeen-year-old girl named Eliza. And the popular van Gogh painting White Roses at Washington’s National Gallery had to be renamed after a researcher discovered that the flowers were originally done in a pink paint that had faded nearly a century ago. Color is full of extraordinary people, events, and anecdotes–painted all the more dazzling by Finlay’s engaging style.Embark upon a thrilling adventure with this intrepid journalist as she travels on a donkey along ancient silk trade routes; with the Phoenicians sailing the Mediterranean in search of a special purple shell that garners wealth, sustenance, and prestige; with modern Chilean farmers breeding and bleeding insects for their viscous red blood. The colors that craft our world have never looked so bright.","448 pages, Paperback",Nonfiction,229 followers,807 reviews,9 books229 followers,"5,000 (7%)","5,627 (8%)","13,996 (20%)","16,549 (24%)","27,246 (39%)"
Broken,Kelley Armstrong,"31,482",ratings863,"First published April 25, 2006","In this thrilling new novel from the author of Industrial Magic, a pregnant werewolf may have unwittingly unleashed Jack the Ripper on the twenty-first century — and become his next target…Ever since she discovered she’s pregnant, Elena Michaels has been on edge. After all, she’s never heard of another living female werewolf, let alone one who’s given birth. But thankfully, her expertise is needed to retrieve a stolen letter allegedly written by Jack the Ripper. As a distraction, the job seems simple enough — only the letter contains a portal to Victorian London’s underworld, which Elena inadvertently triggers — unleashing a vicious killer and a pair of zombie thugs.Now Elena must find a way to seal the portal before the unwelcome visitors get what they’re looking for — which, for some unknown reason, is Elena…From the Paperback edition.","460 pages, Mass Market Paperback",Urban Fantasy,31.4k followers,863 reviews,265 books31.4k followers,232 (<1%),852 (2%),"5,362 (17%)","11,630 (36%)","13,406 (42%)"
Physik,Angie Sage,"54,243","ratings1,414","First published March 27, 2007","The third book in the internationally bestselling Septimus Heap series by Angie Sage, featuring the funny and fantastic adventures of a wizard apprentice and his quest to become an ExtraOrdinary Wizard.New York Times Bestselling Series""Few fans of the best-selling Septimus Heap series will be disappointed."" --ALA Booklist""Readers will be indubitably hooked--worrying, laughing, and gasping over the nonstop adventures of this engaging troupe."" --VOYA (Starred Review)When Silas Heap unSeals a forgotten room in the Palace, he releases the ghost of a Queen who lived five hundred years earlier. Queen Etheldredda is as awful in death as she was in life, and she's still up to no good. Her diabolical plan to give herself everlasting life requires Jenna's compliance, Septimus's disappearance, and the talents of her son, Marcellus Pye, a famous Alchemist and Physician. And if Queen Etheldredda's plot involves Jenna and Septimus, then it will surely involve Nicko, Alther Mella, Marcia Overstrand, Beetle, Stanley, Sarah, Silas, Spit Fyre, Aunt Zelda, and all of the other wacky, wonderful characters that made Magyk and Flyte so memorable.With heart-stopping action and a dash of humor, Angie Sage continues the fantastical journey of Septimus Heap.","545 pages, Hardcover",Fantasy,"3,179 followers","1,414 reviews","181 books3,179 followers",659 (1%),"2,402 (4%)","12,034 (22%)","19,486 (35%)","19,662 (36%)"
Doctor Who: Night of the Humans,David Llewellyn,"1,492",ratings122,"First published April 10, 2010","'This is the Gyre - the most hostile environment in the galaxy...' 250,000 years' worth of junk floating in deep space, home to the shipwrecked Sittuun, the carnivorous Sollogs, and worst of all - the Humans. The Doctor and Amy arrive on this terrifying world in the middle of an all-out frontier war between Sittuun and Humans, and the countdown has already started. There's a comet in the sky, and it's on a collision course with the Gyre...When the Doctor is kidnapped, it's up to Amy and ""galaxy-famous swashbuckler"" Dirk Slipstream to save the day. But who is Slipstream, exactly? And what is he really doing here? This is a thrilling, all new adventure featuring the Doctor and Amy, as played by Matt Smith and Karen Gillan in the spectacular hit series from BBC Television.","247 pages, Hardcover",Doctor Who,28 followers,122 reviews,97 books28 followers,29 (1%),113 (7%),497 (33%),478 (32%),375 (25%)
