Title,Authors,Avg Ratings,Rating,first_published,Description,Total_Pages,Genre,author_followers,no_of_reviews,no_book_by_author,one_star_ratings,two_star_ratings,three_star_ratings,four_star_ratings,five_star_ratings
Technomancer,B.V. Larson,"2,236",ratings159,"March 21, 2012","A new kind of alien invasion…When Quentin Draith wakes up in a private sanatorium, he has no memory of who he is or how he received the injuries riddling his body. All he knows is that he has to get out, away from the drugs being pumped into him and back to the real world to search for answers. His first question: How did his friend Tony’s internal organs fill with sand, killing him in a Las Vegas car crash?After a narrow escape, he tracks down the basic facts: he is an investigator and blogger specializing in the supernatural—which is a good thing, because Quentin’s life is getting stranger by the minute. It seems he is one of a special breed, a person with unusual powers. He’s also the prime suspect in a string of murders linked by a series of seemingly mundane objects. The deeper he digs and the harder he works to clear his name, the more Quentin realizes that some truths are better off staying buried…","370 pages, Paperback",Fantasy,"1,445 follower",159 reviews,111,104 (4%),262 (11%),774 (34%),758 (33%),338 (15%)
Vampire Most Wanted,Lynsay Sands,"8,450",ratings570,"February 18, 2014","For Basha Argeneau, anything is better than facing her estranged family. Even hiding out in sweltering southern California. But when a sexy immortal in black shows up determined to bring her back to the clan, she'll do anything to keep far, far away from the past she can't outrun.Marcus Notte isn't here to play games—especially not with someone as crazy as the infamous blonde. Asked by Lucian Argeneau to bring her back for questioning, Marcus is determined to carry out Lucian's request—no matter how the seductive little mind-reading vamp feels about it.Basha doesn't mind fighting fire with fire, especially with a hot immortal involved. But if he wants to take her away, he'll have to catch her first . . .","358 pages, Mass Market Paperback",Romance,11.6k follower,570 reviews,123,75 (<1%),309 (3%),"1,439 (17%)","2,913 (34%)","3,714 (43%)"
De hängdas evangelium,Robert Karjel,35,ratings3,"January 1, 2005","Journalisten Henry Müller blir ombedd att skriva en nekrolog över en gammal skolkamrat som tagit livet av sig. Dessutom får veta att den avlidne har adresserat ett självmordsbrev till honom. Problemet är bara att Henry inte alls kan minnas kamraten. Snart hör polisen av sig. Den döde mannen hade tydligen haft kontakt med en katolsk munk, som nu också hittats död, hängande i sin egen takkrona. När Müller en kväll blir överfallen och misshandlad förstår han att han dragits in i ett farligt spel. Det verkar ha att göra med de tvåtusen år gamla brev som återfunnits i Paris. I breven beskrivs ett antal skrifter författade av en hittills okänd följeslagare till Jesus - ett femte evangelium ...","286 pages, Paperback",Swedish Literature,55 follower,3 reviews,11,3 (8%),11 (31%),16 (45%),4 (11%),1 (2%)
The First Billion,Christopher Reich,"2,072",ratings86,"August 20, 2002","Christopher Reich electrified readers with Numbered Account and The Runner , his first two international thrillers. Now the New York Times bestselling author whose work has been called “gripping” ( Chicago Tribune ), “chilling” ( The Denver Post ), “wonderful” ( The New York Times Book Review ), ratchets up the stakes in an ingeniously plotted story of nerve-jangling intrigue and hot-wired suspense. Using today’s cutthroat global economy as a backdrop, The First Billion explodes into a breakneck tale of betrayal, revenge, and redemption...John “Jett” Gavallan is a former fighter pilot, now the high-flying CEO of Black Jet Securities, an investment firm that earned its first billion before the techno dream crashed and burned. Poised for an offering crucial to his company’s survival, Gavallan is banking on the riskiest gamble of his dazzling career. In exactly six days, he will take Mercury Broadband, Russia’s leading media company, public on the New York Stock Exchange. But rumors of fraud have suddenly surfaced that could send the deal south. Gavallan makes a preemptive strike by dispatching his number-two man--fellow Desert Storm fighter pilot Grafton Byrnes--to Moscow to penetrate the shadowy Russian multinational. When Byrnes fails to return, Gavallan fears the worst. Butthe truth is even more diabolical than he can imagine.Plunging into a desperate search for his best friend, the renegade top gun is suddenly fighting a different kind of war, where there is no safe harbor and no one he can trust. Not Konstantin Kirov, the elusive head of Mercury Broadband who may not be what he seems. Not the bankers and traders Gavallan does business with every day. Not the exotic beauty who has told him all her deepest secrets--except one. Suddenly Jett finds himself trapped in a conspiracy that could shatter the delicate balance between nations--and plunge the global economy into chaos. Hunted by the F.B.I. and a band of elite killers, Jett races from Palm Beach to Zurich to Moscow in a desperate search for answers. But for this brave ex-commando haunted by visions of war, the truth comes at a terrible price. With Mercury rising and the hours ticking down, he is moving closer to a place where murder and revenge are the currency of choice...and where the first billion is the ultimate insider secret--and the deadliest obsession of all.With breakneck plotting, stunning realism, and a sense of danger that keeps the heart racing, The First Billion is a knockout of a novel that will linger long after the final shocking twist is revealed.","608 pages, Mass Market Paperback",Fiction,578 follower,86 reviews,51,38 (1%),98 (4%),515 (24%),855 (41%),566 (27%)
The All-Girl Filling Station's Last Reunion,Fannie Flagg,"52,574","ratings7,159","November 5, 2013","The one and only Fannie Flagg, beloved author of ""Fried Green Tomatoes at the Whistle Stop Cafe, Can't Wait to Get to Heaven, ""and"" I Still Dream About You, "" is at her hilarious and superb best in this new comic mystery novel about two women who are forced to reimagine who they are. Mrs. Sookie Poole of Point Clear, Alabama, has just married off the last of her daughters and is looking forward to relaxing and perhaps traveling with her husband, Earle. The only thing left to contend with is her mother, the formidable Lenore Simmons Krackenberry. Lenore may be a lot of fun for other people, but is, for the most part, an overbearing presence for her daughter. Then one day, quite by accident, Sookie discovers a secret about her mother's past that knocks her for a loop and suddenly calls into question everything she ever thought she knew about herself, her family, and her future. Sookie begins a search for answers that takes her to California, the Midwest, and back in time, to the 1940s, when an irrepressible woman named Fritzi takes on the job of running her family's filling station. Soon truck drivers are changing their routes to fill up at the All-Girl Filling Station. Then, Fritzi sees an opportunity for an even more groundbreaking adventure. As Sookie learns about the adventures of the girls at the All-Girl Filling Station, she finds herself with new inspiration for her own life. Fabulous, fun-filled, spanning decades and generations, and centered on a little-known aspect of America's twentieth-century story, ""The All-Girl Filling Station's Last Reunion"" is another irresistible novel by the remarkable Fannie Flagg.","347 pages, Hardcover",Fiction,"4,413 follower","7,159 reviews",62,658 (1%),"1,872 (3%)","10,314 (19%)","22,401 (42%)","17,329 (32%)"
Crossing California,Adam Langer,"2,043",ratings254,"January 1, 2004","Three close families living in the middle-class and upper-middle-class areas of Chicago's West Rogers Park neighborhood find their lives and friendships impacted by world events from 1979 to 1981, including the Iran hostage crisis, Reagan's election, and the deaths of famous musicians. 50,000 first printing.","448 pages, Hardcover",Fiction,93 follower,254 reviews,13,50 (2%),157 (7%),568 (27%),820 (40%),448 (21%)
Sacred Ground,Alex Archer,397,ratings18,"March 1, 2010","In a land of subzero temperatures and snow-covered vistas, survival is a challenge. But for the Araktak--an isolated and mysterious Inuit people--this harsh tundra is their heritage. Until now. A large mining company has purchased the land, and the sacred Araktak burial site with it. But more than diamond deposits await them under the dark, icy earth....Contracted by the mining company, archaeologist Annja Creed is to oversee the proper relocation of the burial site. Her job is to ensure that each ancient relic and all human remains are carefully removed. But the sacred ground harbors a terrible secret. One that a powerful group of men intend to unleash on an unsuspecting world--unless Annja can find a way to stop them.","317 pages, Mass Market Paperback",Fantasy,226 follower,18 reviews,96,10 (2%),17 (4%),117 (29%),135 (34%),118 (29%)
Night School,C.J. Daugherty,"25,823","ratings2,206","December 9, 2012","Allie Sheridan’s world is falling apart. Her brother’s run away from home. Her parents ignore her. And she’s just been arrested.Again.This time her parents have had enough. They cut her off from her friends and send her away to boarding school, far from her London friends.But at Cimmeria Academy, Allie is soon caught up in the strange activities of a secret group of elite students.When she’s attacked late one night the incident sets off a chain of increasingly violent events. As the school begins to seem like a very dangerous place, she finds out that nothing at Cimmeria is what it seems to be.And that she is not who she thought she was.","454 pages, Paperback",Young Adult,"2,065 follower","2,206 reviews",19,483 (1%),"1,329 (5%)","4,682 (18%)","8,745 (33%)","10,584 (40%)"
The Unit,Ninni Holmqvist,"10,143","ratings1,424","August 29, 2006","One day in early spring, Dorrit Weger is checked into the Second Reserve Bank Unit for biological material. She is promised a nicely furnished apartment inside the Unit, where she will make new friends, enjoy the state of the art recreation facilities, and live the few remaining days of her life in comfort with people who are just like her. Here, women over the age of fifty and men over sixty-single, childless, and without jobs in progressive industries--are sequestered for their final few years; they are considered outsiders.In the Unit they are expected to contribute themselves for drug and psychological testing, and ultimately donate their organs, little by little, until the final donation. Despite the ruthless nature of this practice, the ethos of this near-future society and the Unit is to take care of others, and Dorrit finds herself living under very pleasant conditions: well-housed, well-fed, and well-attended. She is resigned to her fate and discovers her days there to be rather consoling and peaceful.But when she meets a man inside the Unit and falls in love, the extraordinary becomes a reality and life suddenly turns unbearable. Dorrit is faced with compliance or escape, and...well, then what?","268 pages, Trade Paper",Fiction,99 follower,"1,424 reviews",53,223 (2%),800 (7%),"2,662 (26%)","4,050 (39%)","2,408 (23%)"
Wahhabi Islam: From Revival and Reform to Global Jihad,Natana J. Delong-Bas,58,ratings13,"January 1, 2004","Before 9/11, few Westerners had heard of Wahhabism. Today, it is a household word. Frequently mentioned in association with Osama bin Laden, Wahhabism is portrayed by the media and public officials as an intolerant, puritanical, militant interpretation of Islam that calls for the wholesale destruction of the West in a jihad of global proportions. In the first study ever undertaken of the writings of Wahhabism's founder, Muhammad Ibn Abd al-Wahhab (1702-1791), Natana DeLong-Bas shatters these stereotypes and misconceptions. Her reading of Ibn Abd al-Wahhab's works produces a revisionist thesis: Ibn Abd al-Wahhab was not the godfather of contemporary terrorist movements. Rather, he was a voice of reform, reflecting mainstream 18th-century Islamic thought. His vision of Islamic society was based upon a monotheism in which Muslims, Christians and Jews were to enjoy peaceful co-existence and cooperative commercial and treaty relations. Eschewing medieval interpretations of the Quranand hadith (sayings and deeds of the prophet Muhammad), Ibn Abd al-Wahhab called for direct, historically contextualized interpretation of scripture by both women and men. His understanding of theology and Islamic law was rooted in Quranic values, rather than literal interpretations. A strong proponent of women's rights, he called for a balance of rights between women and men both within marriage and in access to education and public space. In the most comprehensive study of Ibn Abd al-Wahhab's interpretation of jihad ever written, DeLong-Bas details a vision in which jihad is strictly limited to the self-defense of the Muslim community against military aggression. Contemporary extremists like Osama bin Laden do not have their origins in Wahhabism, she shows. The hallmark jihadi focus on a cult of martyrdom, the strict division of the world into two necessarily opposing spheres, the wholescale destruction of both civilian life and property, and the call for global jihad are entirelyabsent from Ibn Abd al-Wahhab's writings. Instead, the militant stance of contemporary jihadism lies in adherence to the writings of the medieval scholar, Ibn Taymiyya, and the 20th century Egyptian radical, Sayyid Qutb. This pathbreaking book fills an enormous gap in the literature about Wahhabism by returning to the original writings of its founder. Bound to be controversial, it will be impossible to ignore.","384 pages, Hardcover",Islam,5 follower,13 reviews,15,9 (15%),2 (3%),16 (27%),23 (39%),8 (13%)
The Fort,Bernard Cornwell,"6,394",ratings573,"September 30, 2010","Summer 1779: a British force of fewer than 1,000 Scottish infantry were sent to build a garrison in the state of Maine. But Massachusetts was determined to expel the British, and they sent a fleet to 'captivate, kill and destroy' the enemy. Told from both sides of the battle, this story features real figures from history.","480 pages, Hardcover",Historical Fiction,17.2k follower,573 reviews,429,139 (2%),573 (8%),"2,025 (31%)","2,290 (35%)","1,367 (21%)"
The Big Book of Baseball Brainteasers,Dom Forker,24,ratings4,"March 23, 2004","Here’s one big baseball book for big fans of the game. They’ll find plenty to enjoy and challenge fun facts, questions and answers, cool quotations from the greats, and amusing line drawings. And the trivia covers all the bases, focusing on bats, the pitcher’s mound, the infield, base runners, and the dugout; and even taking a look off the field and into the press box. What does an umpire do when a blackout occurs midway through a game? What team had one of the most potent lineups of all time, with an incredible five men who had more than 100 runs in a season and three eventual Hall of Famers? Perfect for those with baseball on the brain.","288 pages, Hardcover",Baseball,29 book,4 reviews,29,1 (4%),1 (4%),13 (54%),5 (20%),4 (16%)
Oath Breaker,Michelle Paver,"10,454",ratings273,"January 1, 2008","A thrilling story about friendship, loyalty, and revengeWhen he was outcast, Torak was the hunted one. Nine moons later he becomes the hunter when he vows to avenge the killing of one of his closest friends. Racked by guilt and grief, he follows the killer into the Deep Forest, where the World Spirit stalks the hidden valleys as a tall man with the antlers of a stag. But there is a rottenness at the heart of the Forest, for its clans have succumbed to the lies of the Soul-Eaters. Here, Torak must face fire, war, and overwhelming evil. Oath Breaker is a story about keeping promises and the true cost of vengeance.","224 pages, Hardcover",Fantasy,"2,104 follower",273 reviews,55,29 (<1%),154 (1%),"1,354 (12%)","3,590 (34%)","5,327 (50%)"
Book of Heroes,Simon Barnes,19,ratings3,"September 1, 2010","In this gripping new book, Simon Barnes brings together his 50 sporting heroes of the last 50 years and looks at what it is that elevates them to a state of grace and greatness.","320 pages, Hardcover",2021,121 follower,3 reviews,60,0 (0%),2 (10%),5 (26%),9 (47%),3 (15%)
Ask the Passengers,A.S. King,"24,951","ratings2,735","October 23, 2012","Astrid Jones desperately wants to confide in someone, but her mother's pushiness and her father's lack of interest tell her they're the last people she can trust. Instead, Astrid spends hours lying on the backyard picnic table watching airplanes fly overhead. She doesn't know the passengers inside, but they're the only people who won't judge her when she asks them her most personal questions--like what it means that she's falling in love with a girl.As her secret relationship becomes more intense and her friends demand answers, Astrid has nowhere left to turn. She can't share the truth with anyone except the people at thirty thousand feet, and they don't even know she's there. But little does Astrid know just how much even the tiniest connection will affect these strangers' lives--and her own--for the better.In this truly original portrayal of a girl struggling to break free of society's definitions, Printz Honor author A.S. King asks readers to question everything--and offers hope to those who will never stop seeking real love.","304 pages, Hardcover",Young Adult,"3,647 follower","2,735 reviews",24,791 (3%),"1,690 (6%)","5,797 (23%)","9,004 (36%)","7,669 (30%)"
"To End All Wars: A Story of Loyalty and Rebellion, 1914-1918",Adam Hochschild,"8,839",ratings726,"April 11, 2011","World War I stands as one of history's most senseless spasms of carnage, defying rational explanation. In a riveting, suspenseful narrative with haunting echoes for our own time, Adam Hochschild brings it to life as never before. He focuses on the long-ignored moral drama of the war's critics, alongside its generals and heroes. Thrown in jail for their opposition to the war were Britain's leading investigative journalist, a future winner of the Nobel Prize for Literature, and an editor who, behind bars, published a newspaper for his fellow inmates on toilet paper. These critics were sometimes intimately connected to their enemy hawks: one of Britain's most prominent women pacifist campaigners had a brother who was commander in chief on the Western Front. Two well-known sisters split so bitterly over the war that they ended up publishing newspapers that attacked each other. Today, hundreds of military cemeteries spread across the fields of northern France and Belgium contain the bodies of millions of men who died in the war to end all wars. Can we ever avoid repeating history?","448 pages, Hardcover",History,"1,039 follower",726 reviews,28,167 (1%),336 (3%),"1,350 (15%)","3,249 (36%)","3,737 (42%)"
If Nobody Speaks of Remarkable Things,Jon McGregor,"10,249","ratings1,055","January 1, 2002","On a street in a town in the North of England, perfectly ordinary people are doing totally normal things - children play cricket, window frames are painted, a couple argues, students pack up their belongings, and nameless people pass each other like every other day, interweaving yet never connecting. But a terrible event shatters the quiet of the summer evening and no one who witnesses it will ever be the same again.","278 pages, Paperback",Fiction,767 follower,"1,055 reviews",30,312 (3%),694 (6%),"2,226 (21%)","3,609 (35%)","3,408 (33%)"
The God of Animals,Aryn Kyle,"6,117","ratings1,068","January 1, 2007","When her older sister runs away to marry a rodeo cowboy, Alice Winston is left to bear the brunt of her family's troubles -- a depressed, bedridden mother; a reticent, overworked father; and a run-down horse ranch. As the hottest summer in fifteen years unfolds and bills pile up, Alice is torn between dreams of escaping the loneliness of her duty-filled life and a longing to help her father mend their family and the ranch.To make ends meet, the Winstons board the pampered horses of rich neighbors, and for the first time Alice confronts the power and security that class and wealth provide. As her family and their well-being become intertwined with the lives of their clients, Alice is drawn into an adult world of secrets and hard truths, and soon discovers that people -- including herself -- can be cruel, can lie and cheat, and every once in a while, can do something heartbreaking and selfless. Ultimately, Alice and her family must weather a devastating betrayal and a shocking, violent series of events that will test their love and prove the power of forgiveness.A wise and astonishing novel about the different guises of love and the often steep tolls on the road to adulthood, The God of Animals is a haunting, unforgettable debut.","320 pages, Hardcover",Fiction,153 follower,"1,068 reviews",5,122 (1%),445 (7%),"1,661 (27%)","2,432 (39%)","1,457 (23%)"
Deep Fathom,James Rollins,"18,760",ratings558,"January 1, 2001","Ex-Navy SEAL Jack Kirkland surfaces from an aborted underwater salvage mission to find Earth burning. Solar flares have triggered a series of gargantuan natural disasters. Earth-quakes and hellfire rock the globe. Air Force One has vanished from the skies with America's president on board.Now, with the United States on the narrow brink of a nuclear apocalypse, Kirkland must pilot his oceangoing exploration ship, Deep Fathom, on a desperate mission miles below the ocean's surface. There, devastating secrets await him--and a power an ancient civilization could not contain that has been cast out into modern day, where it will forever alter a world that's already racing toward its own destruction.","450 pages, Mass Market Paperback",Thriller,13.3k follower,558 reviews,176,156 (<1%),626 (3%),"3,750 (19%)","7,029 (37%)","7,199 (38%)"
Angelmaker,Nick Harkaway,"10,304","ratings1,451","February 2, 2012","From the acclaimed author of The Gone-Away World, blistering gangster noir meets howling absurdist comedy as the forces of good square off against the forces of evil, and only an unassuming clockwork repairman and an octogenarian former superspy can save the world from total destruction.Joe Spork spends his days fixing antique clocks. The son of infamous London criminal Mathew “Tommy Gun” Spork, he has turned his back on his family’s mobster history and aims to live a quiet life. That orderly existence is suddenly upended when Joe activates a particularly unusual clockwork mechanism. His client, Edie Banister, is more than the kindly old lady she appears to be—she’s a retired international secret agent. And the device? It’s a 1950s doomsday machine. Having triggered it, Joe now faces the wrath of both the British government and a diabolical South Asian dictator who is also Edie’s old arch-nemesis. On the upside, Joe’s got a girl: a bold receptionist named Polly whose smarts, savvy and sex appeal may be just what he needs. With Joe’s once-quiet world suddenly overrun by mad monks, psychopathic serial killers, scientific geniuses and threats to the future of conscious life in the universe, he realizes that the only way to survive is to muster the courage to fight, help Edie complete a mission she abandoned years ago and pick up his father’s old gun...","478 pages, Hardcover",Fiction,53.4k follower,"1,451 reviews",28,257 (2%),646 (6%),"2,013 (19%)","4,058 (39%)","3,330 (32%)"
The Draining Lake,Arnaldur Indriðason,"13,038",ratings857,"January 1, 2004","In the wake of an earthquake, the water level of an Icelandic lake drops suddenly, revealing the skeleton of a man half-buried in its sandy bed. It is clear immediately that it has been there for many years. There is a large hole in the skull. Yet more mysteriously, a heavy communication device is attached to it, possibly some sort of radio transmitter, bearing inscriptions in Russian.The police are called in and Erlendur, Elinborg and Sigurdur Oli begin their investigation, which gradually leads them back to the time of the Cold War when bright, left-wing students would be sent from Iceland to study in the ?heavenly State? of Communist East Germany.","304 pages, Mass Market Paperback",Mystery,"3,047 follower",857 reviews,45,132 (1%),579 (4%),"3,182 (24%)","5,790 (44%)","3,355 (25%)"
Art & Max,David Wiesner,"7,150",ratings641,"October 4, 2010","Max and Arthur are friends who share an interest in painting. Arthur is an accomplished painter; Max is a beginner. Max's first attempt at using a paintbrush sends the two friends on a whirlwind trip through various artistic media, which turn out to have unexpected pitfalls. Although Max is inexperienced, he's courageous and a quick learner. His energy and enthusiasm bring the adventure to its triumphant conclusion. Beginners everywhere will take heart.","40 pages, Hardcover",Picture Books,595 follower,641 reviews,56,163 (2%),370 (5%),"1,312 (18%)","2,296 (32%)","3,009 (42%)"
